Country / Territory,Year,Event Name,Date of event (start),Disaster Internal Displacements,Hazard Type
Abyei Area,2018,Abyie: Flood - 01/07/2018,2018-07-01T00:00:00Z,2,Flood
Abyei Area,2019,Abyei: Flood - southern parts - 01/06/2019,2019-06-01T00:00:00Z,40000,Flood
Afghanistan,2008,,2008-04-17T00:00:00Z,3300,Earthquake
Afghanistan,2008,,2008-08-01T00:00:00Z,180,Flood
Afghanistan,2009,2009-000080,2009-01-01T00:00:00Z,25000,Flood
Afghanistan,2009,,2009-01-01T00:00:00Z,3300,Earthquake
Afghanistan,2010,2010-000077,2010-01-01T00:00:00Z,70000,Flood
Afghanistan,2010,,2010-01-01T00:00:00Z,1000,Earthquake
Afghanistan,2011,FL-2011-000022-AFG,2011-01-01T00:00:00Z,3000,Flood
Afghanistan,2012,,2012-01-01T00:00:00Z,240,Wet Mass Movement
Afghanistan,2012,,2012-01-01T00:00:00Z,1500,Flood
Afghanistan,2012,,2012-01-01T00:00:00Z,1900,Flood
Afghanistan,2012,,2012-01-01T00:00:00Z,13000,Flood
Afghanistan,2012,,2012-01-01T00:00:00Z,710,Extreme temperature
Afghanistan,2012,,2012-01-01T00:00:00Z,5100,Earthquake
Afghanistan,2012,,2012-01-01T00:00:00Z,640,Extreme temperature
Afghanistan,2012,,2012-01-01T00:00:00Z,550,Wet Mass Movement
Afghanistan,2012,,2012-01-01T00:00:00Z,1700,Extreme temperature
Afghanistan,2012,,2012-01-01T00:00:00Z,4700,Flood
Afghanistan,2013,August Flash Flood,2013-08-03T00:00:00Z,4900,Flood
Afghanistan,2013,"Ghor, Badakhastan, Hiratn, Kundus, Parwan floods and landslides",2013-02-01T00:00:00Z,8900,Flood
Afghanistan,2013,Afghanistan November Heavy Raining,2013-11-24T00:00:00Z,390,Wet Mass Movement
Afghanistan,2013,March Floods and Landslides,2013-03-01T00:00:00Z,750,Flood
Afghanistan,2013,April Flash Flood,2013-04-15T00:00:00Z,270,Flood
Afghanistan,2014,"Waris, Yakawlang, Shibar districts and Bamyan City landslides and snow avalanches",2014-04-20T00:00:00Z,240,Wet Mass Movement
Afghanistan,2014,Rustaq landslide,2014-04-12T00:00:00Z,740,Wet Mass Movement
Afghanistan,2014,Guzargah-e-Nur flash floods,2014-06-06T00:00:00Z,5800,Flood
Afghanistan,2014,Badakhshan landslide,2014-05-02T00:00:00Z,6400,Wet Mass Movement
Afghanistan,2015,Baghlan-i-Markhazi district flash flood,2015-05-08T00:00:00Z,3700,Flood
Afghanistan,2015,Yakawlang district landslide,2015-08-10T00:00:00Z,230,Wet Mass Movement
Afghanistan,2015,Badakhshan avalanche,2015-02-26T00:00:00Z,260,Wet Mass Movement
Afghanistan,2015,Zebak district riverbank subsidence,2015-07-03T00:00:00Z,300,Wet Mass Movement
Afghanistan,2015,Kahmard district landslide,2015-03-03T00:00:00Z,120,Wet Mass Movement
Afghanistan,2015,Shahada district riverbank subsidence,2015-07-07T00:00:00Z,2000,Wet Mass Movement
Afghanistan,2015,Kofab district flash flood,2015-07-25T00:00:00Z,890,Flood
Afghanistan,2015,Shighnan district flood,2015-07-13T00:00:00Z,1200,Flood
Afghanistan,2015,Warduj and Darwazba district floods,2015-07-20T00:00:00Z,580,Flood
Afghanistan,2015,Jawzjan province flood,2015-07-18T00:00:00Z,3200,Flood
Afghanistan,2015,Northern Afghanistan earthquake,2015-10-26T00:00:00Z,55000,Earthquake
Afghanistan,2015,Badakhshan earthquake (Dec),2015-12-25T00:00:00Z,44,Earthquake
Afghanistan,2015,Khwahan district landslide,2015-04-23T00:00:00Z,1500,Wet Mass Movement
Afghanistan,2015,Baghlan province flood,2015-04-01T00:00:00Z,2400,Flood
Afghanistan,2016,Badakhshan landslide,2016-06-10T00:00:00Z,410,Dry mass movement
Afghanistan,2016,North-eastern earthquake,2016-04-10T00:00:00Z,1900,Earthquake
Afghanistan,2016,Country-wide floods,2016-04-15T00:00:00Z,1500,Flood
Afghanistan,2016,Jawzjan province floods,2016-04-04T00:00:00Z,630,Flood
Afghanistan,2016,Badakhshan floods,2016-05-09T00:00:00Z,1200,Flood
Afghanistan,2016,Central Highland storms,2016-04-02T00:00:00Z,230,Storm
Afghanistan,2016,Sari Pul province floods,2016-05-18T00:00:00Z,1500,Flood
Afghanistan,2017,Afghanistan: heavy rainfall and flood - Bamyan - 20/03/2017,2017-03-20T00:00:00Z,81,Flood
Afghanistan,2017,Afghanistan: heavy rainfall and flood - Badghis - 10/02/2017,2017-02-10T00:00:00Z,130,Flood
Afghanistan,2017,Afghanistan: severe winter conditions - Paktya - 03/02/2017,2017-02-03T00:00:00Z,15,Extreme temperature
Afghanistan,2017,Afghanistan: severe winter conditions- Ghazni - 03/02/2017,2017-02-03T00:00:00Z,7,Extreme temperature
Afghanistan,2017,Afghanistan: extreme winter conditions - Zabul - 23/01/2017,2017-01-23T00:00:00Z,240,Extreme temperature
Afghanistan,2017,Afghanistan: landslide - Bamyan - 29/03/2017,2018-03-29T00:00:00Z,22,Wet Mass Movement
Afghanistan,2017,Afghanistan: heavy rainfall and flood - Zabul - 19/02/2017,2017-02-19T00:00:00Z,22,Storm
Afghanistan,2017,Afghanistan: severe winter conditions - Ghor - 03/02/2017,2017-02-03T00:00:00Z,37,Extreme temperature
Afghanistan,2017,Afghanistan: heavy rainfall and floods - Kunar; Laghman; Nangarhar - 16/11/2017,2017-11-16T00:00:00Z,74,Flood
Afghanistan,2017,Afghanistan: floods - Kunar; Nuristan - 04/09/2017,2017-09-04T00:00:00Z,130,Flood
Afghanistan,2017,Afghanistan: Nangarhar; Laghman; Kunar - 11/08/2017,2017-08-11T00:00:00Z,160,Flood
Afghanistan,2017,Afghanistan: heavy rainfall and flood - Kapisa; Parwan - 18/02/2017,2017-01-18T00:00:00Z,250,Flood
Afghanistan,2017,Afghanistan: heavy rainfall and floods - Kunar; Laghman; Nangarhar - 04/02/2017 ,2017-02-04T00:00:00Z,240,Flood
Afghanistan,2017,Afghanistan: heavy rainfall and flood - Bamyan - 03/02/2017 ,2017-02-03T00:00:00Z,160,Flood
Afghanistan,2017,Afghanistan: heavy rainfall and flood - Badakhshan; Baghlan; Takhar - 10/04/2017,2017-04-10T00:00:00Z,4400,Flood
Afghanistan,2017,Afghanistan: landslide - Badakhshan - 18/04/2017,2017-04-18T00:00:00Z,89,Wet Mass Movement
Afghanistan,2017,Afghanistan: heavy rainfall and flood - Bamyan - 20/04/2017,2017-04-20T00:00:00Z,37,Flood
Afghanistan,2017,Afghanistan: heavy rainfall and flood - Bamyan - 10/04/2017,2017-04-10T00:00:00Z,15,Flood
Afghanistan,2017,Afghanistan: landslide - Daykundi - 05/04/017,2017-04-05T00:00:00Z,22,Wet Mass Movement
Afghanistan,2017,Afghanistan: flood - Badakshan - 08/07/2017,2017-07-08T00:00:00Z,140,Flood
Afghanistan,2017,Afghanistan: heavy rains and flood - Balkh - 30/01/2017,2017-01-30T00:00:00Z,7,Flood
Afghanistan,2017,Afghanistan: flood - Kandahar - 15/01/2017,2017-01-15T00:00:00Z,15,Flood
Afghanistan,2017,Afghanistan: heavy rains and flood - Kandahar - 23/01/2017,2017-01-23T00:00:00Z,96,Flood
Afghanistan,2017,Afghanistan: heavy rains and floods - Kunar - 04/01/2017,2017-01-04T00:00:00Z,22,Flood
Afghanistan,2017,Afghanistan: avalanche - Bamyan - 03/02/2017,2017-02-03T00:00:00Z,74,Wet Mass Movement
Afghanistan,2017,Afghanistan: heavy rainfall and floods - Khost; Ghazni - 15/11/2017,2017-11-15T00:00:00Z,190,Flood
Afghanistan,2017,Afghanistan: flood - Ghazni; Paktya - 14/07/2017,2017-07-14T00:00:00Z,120,Flood
Afghanistan,2017,Afghanistan: floods - Herat - 18/02/2017,2017-02-18T00:00:00Z,2400,Flood
Afghanistan,2017,Afghanistan: floods - Herat; Ghor - 07/05/2017,2017-05-07T00:00:00Z,1400,Flood
Afghanistan,2017,Afghanistan: heavy rainfall and flood - Daykundi - 18/02/2017,2017-02-18T00:00:00Z,89,Flood
Afghanistan,2017,Afghanistan: floods - Nimroz - 01/02/2017,2017-02-01T00:00:00Z,3000,Flood
Afghanistan,2017,Afghanistan: avalanche - Badakhshan - 03/02/2017,2017-02-03T00:00:00Z,600,Wet Mass Movement
Afghanistan,2017,Afghanistan: heavy rainfall and flood - Herat - 23/01/2017,2017-01-23T00:00:00Z,7,Flood
Afghanistan,2017,Afghanistan: heavy rainfall and floods - Laghman; Kunar - 14/12/2017,2017-12-14T00:00:00Z,30,Flood
Afghanistan,2017,Afghanistan: flood - Nangarhar - 14/07/2017,2017-07-14T00:00:00Z,59,Flood
Afghanistan,2017,Afghanistan: flood - Kabul - 16/07/2017,2017-07-16T00:00:00Z,59,Flood
Afghanistan,2017,Afghanistan: floods - Khost; Paktika - 29/06/2017,2017-06-29T00:00:00Z,160,Flood
Afghanistan,2017,Afghanistan: landslide - Badakhshan - 08/04/2017,2017-04-08T00:00:00Z,160,Wet Mass Movement
Afghanistan,2017,Afghanistan: heavy rainfall and flood - Ghor - 26/03/2017,2017-03-26T00:00:00Z,140,Flood
Afghanistan,2017,Afghanistan: flood - Nimroz - 23/03/2017,2017-03-23T00:00:00Z,540,Flood
Afghanistan,2017,Afghanistan: heavy rainfall and flood - Badakhshan - 27/03/2017,2017-03-27T00:00:00Z,110,Flood
Afghanistan,2017,Afghanistan: landslide - Ghazni - 04/03/2017,2017-03-04T00:00:00Z,7,Wet Mass Movement
Afghanistan,2017,Afghanistan: avalanche - Bamyan - 23/02/2017,2017-03-23T00:00:00Z,7,Flood
Afghanistan,2017,Afghanistan: avalanche - Daykundi - 03/02/2017,2017-02-03T00:00:00Z,220,Wet Mass Movement
Afghanistan,2017,Afghanistan: flood - Paktya - 15/05/2017,2017-05-15T00:00:00Z,81,Flood
Afghanistan,2017,Afghanistan: severe winter conditions - Kapisa; Parwan; Kabul - 03/02/2017,2017-02-03T00:00:00Z,770,Extreme temperature
Afghanistan,2017,Afghanistan: avalanche - Nuristan  - 05/02/2017,2017-02-05T00:00:00Z,640,Wet Mass Movement
Afghanistan,2017,Afghanistan: flood - Samangan - 06/05/2017,2017-05-06T00:00:00Z,140,Flood
Afghanistan,2017,Afghanistan: heavy rainfall - Herat - 03/02/2017,2017-02-03T00:00:00Z,81,Flood
Afghanistan,2017,Afghanistan: flood - Badakhshan; Baghlan; Takhar - 07/05/2017,2017-05-07T00:00:00Z,2500,Flood
Afghanistan,2017,Afghanistan: avalanche - Daykundi - 03/02/2017,2017-02-03T00:00:00Z,15,Wet Mass Movement
Afghanistan,2017,Afghanistan: floods - Kandahar; Hilmand - 03/02/2017,2017-02-03T00:00:00Z,450,Flood
Afghanistan,2017,Afghanistan - flood - Bamyan - 12/05/2017,2017-05-12T00:00:00Z,960,Flood
Afghanistan,2017,Afghanistan: flood - Balkh; Samangan - 06/04/2017,2017-04-06T00:00:00Z,59,Flood
Afghanistan,2017,Afghanistan: severe winter conditions - northern region - 03/02/2017,2017-02-03T00:00:00Z,270,Extreme temperature
Afghanistan,2017,Afghanistan: flood - Herat - 21/03/2017,2017-03-21T00:00:00Z,5100,Flood
Afghanistan,2018,Afghanistan: Landslide - Bamyan - 26/07/2018,2018-07-26T00:00:00Z,52,Wet Mass Movement
Afghanistan,2018,Afghanistan: Storm - Paktya - 16/07/2018,2018-07-16T00:00:00Z,22,Storm
Afghanistan,2018,Afghanistan: Flash flood - Khost - 05/07/2018,2018-07-05T00:00:00Z,22,Flood
Afghanistan,2018,Afghanistan: Flash flood - Parwan - 15/04/2018 (OCHA event),2018-04-15T00:00:00Z,7,Flood
Afghanistan,2018,Afghanistan: Riverine flood - Kunduz - 19/08/2018,2018-08-19T00:00:00Z,37,Flood
Afghanistan,2018,Afghanistan: Flash flood - Nuristan - 08/07/2018,2018-07-08T00:00:00Z,130,Wet Mass Movement
Afghanistan,2018,Afghanistan: Flash flood - Bamyan - 29/04/2018 (IOM event),2018-04-29T00:00:00Z,7,Flood
Afghanistan,2018,Afghanistan: Flash flood - Laghman - 09/04/2018 (OCHA event),2018-04-09T00:00:00Z,44,Flood
Afghanistan,2018,Afghanistan: Drought - 20 provinces - 01/01/2018,2018-01-01T00:00:00Z,371000,Drought
Afghanistan,2018,Afghanistan: Flash flood - Laghman - 20/04/2018 (IOM; OCHA event),2018-04-20T00:00:00Z,160,Flood
Afghanistan,2018,Afghanistan: Flash flood - Bamyan - 25/03/2018 (OCHA; IOM event),2018-03-25T00:00:00Z,15,Flood
Afghanistan,2018,"Afghanistan: Extreme temperature, Severe winter conditions / Cold Wave - Parwan - 14/02/2018 (OCHA event)",2018-02-14T00:00:00Z,15,Extreme temperature
Afghanistan,2018,Afghanistan: Flood - Paktika - 22/03/2018 (IOM event),2018-03-22T00:00:00Z,59,Flood
Afghanistan,2018,Afghanistan: Dam release flood - Panjshir province - 11/07/2018,2018-07-11T00:00:00Z,2000,Flood
Afghanistan,2018,Afghanistan: Riverbank erosion - Chawki; Kunar - 07/06/2018 (IOM event),2018-06-07T00:00:00Z,110,Wet Mass Movement
Afghanistan,2018,Afghanistan: Thunderstom - Paktika - 21/03/2018 (IOM event),2018-03-21T00:00:00Z,15,Storm
Afghanistan,2018,Afghanistan: Flood - Wardak - 19/07/2018,2018-07-19T00:00:00Z,100,Flood
Afghanistan,2018,Afghanistan: Flood - Ghazni - 19/03/2018 (IOM event),2018-03-19T00:00:00Z,30,Flood
Afghanistan,2018,Afghanistan: Flood - Kunar - 24/08/2018,2018-08-24T00:00:00Z,22,Flood
Afghanistan,2018,Afghanistan: Avalanche - Bamyan - 19/05/2018 (IOM event),2018-05-19T00:00:00Z,210,Wet Mass Movement
Afghanistan,2018,Afghanistan: Flood - Sayeed Abad - 19/07/2018,2018-07-19T00:00:00Z,260,Flood
Afghanistan,2018,Afghanistan: Flood - Bamyan; Laghman; Kunar - 01/11/2018,2018-11-01T00:00:00Z,130,Flood
Afghanistan,2018,Afghanistan: Flash flood - Takhar - 15/02/2018 (OCHA; IOM event),2018-02-15T00:00:00Z,190,Flood
Afghanistan,2018,Afghanistan: Riverbank erosion - Imam Sahib; Kunduz - September 2018,2018-09-01T00:00:00Z,290,Wet Mass Movement
Afghanistan,2018,Afghanistan: Flood - Balkh - 15/02/2018 (IOM event),2018-02-15T00:00:00Z,140,Flood
Afghanistan,2018,Afghanistan: Flash flood - Kunar - 07/09/2018,2018-09-07T00:00:00Z,7,Flood
Afghanistan,2018,Afghanistan: Flash flood - Kunar - 24/08/2018,2018-08-24T00:00:00Z,48,Flood
Afghanistan,2018,Afghanistan: Flood - Kunar; Nangarhar - 15/09/2018,2018-09-15T00:00:00Z,22,Flood
Afghanistan,2018,Afghanistan: Flood - Nangarhar - 08/10/2018,2018-10-08T00:00:00Z,15,Flood
Afghanistan,2018,Afghanistan: Landslide - Takhar - 17/05/2018 (OCHA; IOM; media event),2018-05-17T00:00:00Z,190,Wet Mass Movement
Afghanistan,2018,Afghanistan: Flash flood - Farah - 01/03/2018 (IOM; OCHA event),2018-03-01T00:00:00Z,59,Flood
Afghanistan,2018,Afghanistan: Landslide - Takhar - 12/05/2018 (IOM event),2018-05-12T00:00:00Z,530,Wet Mass Movement
Afghanistan,2018,Afghanistan: Riverbank erosion - Kama; Nangarhar - 06/06/2018 (IOM event),2018-06-06T00:00:00Z,2100,Wet Mass Movement
Afghanistan,2018,Afghanistan: Flash flood - Kunar - 03/03/2018 (IOM; OCHA event),2018-03-03T00:00:00Z,15,Flood
Afghanistan,2018,Afghanistan: Flood - Ghor - 05/03/2018 (IOM; OCHA event),2018-03-05T00:00:00Z,15,Flood
Afghanistan,2018,Afghanistan: Flash flood - Kunar - 10/03/2018 (OCHA; IOM event),2018-03-10T00:00:00Z,7,Flood
Afghanistan,2018,Afghanistan: Flood - Hirat - 26/02/2018 (OCHA; IOM event),2018-02-26T00:00:00Z,190,Flood
Afghanistan,2018,Afghanistan: Floods - May 2018,2018-05-01T00:00:00Z,46000,Flood
Afghanistan,2018,Afghanistan: Flood - Kunar - 27/07/2018,2018-07-27T00:00:00Z,52,Flood
Afghanistan,2018,Afghanistan: Earthquake - Badakhshan; Takhar - 09/05/2018 (IOM; OCHA event),2018-05-09T00:00:00Z,7600,Earthquake
Afghanistan,2018,Afghanistan: Flood - Ghazni - 25/03/2018 (IOM event),2018-03-25T00:00:00Z,59,Flood
Afghanistan,2018,Afghanistan: Flash flood - Kunar - 08/04/2018 (IOM; OCHA event),2018-04-08T00:00:00Z,44,Flood
Afghanistan,2018,Afghanistan: Flood - Laghman - 08/04/2018 (IOM event),2018-04-08T00:00:00Z,44,Flood
Afghanistan,2018,Afghanistan: Flood - Kandahar - 26/02/2018 (IOM event),2018-02-26T00:00:00Z,530,Flood
Afghanistan,2018,Afghanistan: Riverine flood - Balkh - 28/11/2018,2018-11-28T00:00:00Z,7,Flood
Afghanistan,2018,Afghanistan: Flood - Kunar - 17/06/2018,2018-06-17T00:00:00Z,15,Flood
Afghanistan,2018,Afghanistan: Flash flood - Badakhshan - 30/04/2018 (IOM event),2018-04-30T00:00:00Z,500,Flood
Afghanistan,2018,Afghanistan: Flash flood - Badakhshan - 08/04/2018 (IOM; OCHA event),2018-04-08T00:00:00Z,37,Flood
Afghanistan,2018,Afghanistan: Flood - Takhar - 25/04/2018 (IOM; OCHA event),2018-04-20T00:00:00Z,580,Flood
Afghanistan,2018,Afghanistan: Flood - Baghlan - 09/04/2018 (IOM event),2018-04-09T00:00:00Z,81,Flood
Afghanistan,2018,Afghanistan: Flood - Parwan - 09/04/2018 (IOM event),2018-04-09T00:00:00Z,30,Flood
Afghanistan,2018,Afghanistan: Flash flood - Kapisa - 09/04/2018 (OCHA; IOM event),2018-04-09T00:00:00Z,15,Flood
Afghanistan,2018,Afghanistan: Flood - Parwan - 10/04/2018 (IOM event),2018-04-10T00:00:00Z,15,Flood
Afghanistan,2018,Afghanistan: Flood - Kunar - 01/07/2018,2018-07-01T00:00:00Z,89,Flood
Afghanistan,2018,Afghanistan: Earthquake - Pul-e-Khumri; Baghlan - 30/11/2018,2018-11-30T00:00:00Z,780,Earthquake
Afghanistan,2018,Afghanistan: Flood - Kunar - 19/04/2018 (IOM; OCHA event),2018-04-19T00:00:00Z,37,Flood
Afghanistan,2019,Afghanistan: Landslide - Chahar Kint; Balkh - 24/05/2019,2019-05-24T00:00:00Z,44,Wet Mass Movement
Afghanistan,2019,Afghanistan: Landslide - Chahar Kint; Balkh - 09/04/2019,2019-04-09T00:00:00Z,130,Wet Mass Movement
Afghanistan,2019,Afghanistan: Flash flood - Bamyan; Bamyan - 29/04/2019,2019-04-29T00:00:00Z,30,Flood
Afghanistan,2019,Afghanistan: Flood - 11 provinces - 10/04/2019,2019-04-10T00:00:00Z,3200,Flood
Afghanistan,2019,Afghanistan: Flood - Herat; Farah - 12/02/2019,2019-02-12T00:00:00Z,3600,Flood
Afghanistan,2019,Afghanistan: Flash flood - Kabul; Kabul - 13/04/2019,2019-04-13T00:00:00Z,150,Flood
Afghanistan,2019,Afghanistan: Flood - Hirat (Injil) - 03/11/2019,2019-11-03T00:00:00Z,15,Flood
Afghanistan,2019,Afghanistan: Flash flood - Balkh; Bamyan; Kunar - 24/05/2019,2019-05-24T00:00:00Z,29,Flood
Afghanistan,2019,Afghanistan: Flood - Samangan (Aybak) - 01/11/2019,2019-11-01T00:00:00Z,370,Flood
Afghanistan,2019,Afghanistan: Extreme winter conditions - Daykundi; Badakhshan; Kabul; Nuristan - 14/02/2019,2019-02-14T00:00:00Z,15,Extreme temperature
Afghanistan,2019,Afghanistan: Flood - Ghor (Chagcharan) - 30/10/2019,2019-10-30T00:00:00Z,22,Flood
Afghanistan,2019,Afghanistan: Riverine flood - Baghlan (Baghlani Jadid) - 24/06/2019,2019-06-24T00:00:00Z,230,Flood
Afghanistan,2019,"Afghanistan: Flood - Nangarhar, Parwan - 03/10/2019",2019-10-03T00:00:00Z,42,Flood
Afghanistan,2019,Afghanistan: Flood - Kunar - 22/07/2019,2019-07-22T00:00:00Z,35,Flood
Afghanistan,2019,Afghanistan: Flood - Paktya - 29/07/2019,2019-07-29T00:00:00Z,67,Flood
Afghanistan,2019,"Afghanistan: Flood - Kabul, Khost - 16/08/2019",2019-08-16T00:00:00Z,18,Flood
Afghanistan,2019,Afghanistan: Floods - Kapisa; Baghlan; Paktya; Hirat; Daykundi; Bamyan; Kabul; Badakhshan; Balkh; Jawzjan; Samangan - May 2019,2019-05-16T00:00:00Z,13000,Flood
Afghanistan,2019,Afghanistan: Flash flood - Hisa-i-Duwumi Kohistan; Kapisa - 16/05/2019,2019-05-16T00:00:00Z,30,Flood
Afghanistan,2019,Afghanistan: Storm - Chapa Dara; Kunar - 05/04/2019,2019-04-05T00:00:00Z,7,Storm
Afghanistan,2019,Afghanistan: Flash flood - Laghman - 16/04/2019,2019-04-16T00:00:00Z,130,Flood
Afghanistan,2019,Afghanistan: Extreme winter conditions - Ghazni; Kapisa; Paktya; Parwan - 20/02/2019,2019-02-20T00:00:00Z,160,Extreme temperature
Afghanistan,2019,Afghanistan: Flash flood - Ghor - 17/04/2019,2019-04-17T00:00:00Z,110,Flood
Afghanistan,2019,Afghanistan: Landslide - Dara-I-Pech; Kunar - 22/03/2019,2019-03-31T00:00:00Z,220,Wet Mass Movement
Afghanistan,2019,Afghanistan: Flash flood - Kunar - 17/08/2019,2019-08-17T00:00:00Z,28,Flood
Afghanistan,2019,Afghanistan: Hailstorm - Laghman (Alishing) - 05/10/2019,2019-10-05T00:00:00Z,8,Storm
Afghanistan,2019,Afghanistan: Extreme winter conditions - Logar; Ghazni - March 2019,2019-03-02T00:00:00Z,160,Extreme temperature
Afghanistan,2019,Afghanistan: Extreme winter conditions - Bamyan center; Bamyan province - 05/02/2019,2019-02-05T00:00:00Z,7,Extreme temperature
Afghanistan,2019,Afghanistan: Landslide - Asadabad; Kunar - 22/03/2019,2019-03-22T00:00:00Z,7,Wet Mass Movement
Afghanistan,2019,Afghanistan: Flood - Faryab; Kapisa; Hirat - 24/04/2019,2019-04-24T00:00:00Z,1500,Flood
Afghanistan,2019,Afghanistan: Landslide - Marawara; Kunar - 13/03/2019,2019-03-13T00:00:00Z,7,Wet Mass Movement
Afghanistan,2019,Afghanistan: Avalanche - Daykundi - 04/03/2019,2019-03-04T00:00:00Z,37,Wet Mass Movement
Afghanistan,2019,Afghanistan: Flood - Takhar; Balkh; Samangan; Badghis; Badahshan; Bahjlan; Kunar; Kunduz - 04/04/2019,2019-04-04T00:00:00Z,11000,Flood
Afghanistan,2019,Afghanistan: Flash flood - Kunar - 10/04/2019,2019-04-10T00:00:00Z,7,Flood
Afghanistan,2019,Afghanistan: Riverbank erosion - Kunar (Sirkanay) - 17/07/2019,2019-07-17T00:00:00Z,28,Wet Mass Movement
Afghanistan,2019,Afghanistan: Flash flood - Paktya; Daykundi - 15/04/2019,2019-04-15T00:00:00Z,810,Flood
Afghanistan,2019,Afghanistan: Heavy snowfall - Lal Wa Sarjangal; Ghor - 17/04/2019,2019-04-17T00:00:00Z,7,Extreme temperature
Afghanistan,2019,Afghanistan: Flash flood - Badghis; Balkh; Faryab; Jowzjan; Herat; Sar-e-Pul; Kunar - 28/03/2019,2019-03-28T00:00:00Z,39000,Flood
Afghanistan,2019,Afghanistan: Flash floods - 01/03/2019,2019-03-01T00:00:00Z,34000,Flood
Afghanistan,2019,Afghanistan: Flash flood - Fayzabad; Badakhshan - 07/05/2019,2019-05-07T00:00:00Z,52,Flood
Afghanistan,2019,Afghanistan: Flash flood - Nangarhar - 25/02/2019,2019-02-25T00:00:00Z,7,Flood
Afghanistan,2019,Afghanistan: Severe winter conditions - Badakhshan - 03/01/2019 ,2019-01-03T00:00:00Z,100,Extreme temperature
Afghanistan,2019,Afghanistan: Flash flood - Laghman; Kunar; Hilmand - 14/02/2019,2019-02-14T00:00:00Z,230,Flood
Afghanistan,2019,Afghanistan: Flash flood - Herat; Kunar - 04/02/2019,2019-02-04T00:00:00Z,42,Flood
Afghanistan,2019,Afghanistan: Flood - 7 districts; Herat - 18/03/2019,2019-03-18T00:00:00Z,3400,Flood
Afghanistan,2019,Afghanistan: Drought - 01/01/2019,2019-01-01T00:00:00Z,4200,Drought
Afghanistan,2020,Afghanistan: Floods - Kunar - 20/11/2020,2020-11-20T00:00:00Z,15,Flood
Afghanistan,2020,Afghanistan: Floods - Baghlan - 17/05/2020,2020-05-17T00:00:00Z,96,Flood
Afghanistan,2020,Afghanistan: Floods - 6 provinces - 25/08/2020,2020-08-25T00:00:00Z,14000,Flood
Afghanistan,2020,Afghanistan: Floods (Matun) - Khost - 08/07/2020,2020-07-10T00:00:00Z,52,Flood
Afghanistan,2020,Afghanstan: Heavy rainfall - Badakhshan (Fayzabad) - 10/05/2020,2020-05-10T00:00:00Z,130,Flood
Afghanistan,2020,Afghanistan: Avalanches - Daykundi - 12/02/2020,2020-02-12T00:00:00Z,1500,Wet Mass Movement
Afghanistan,2020,Afghanistan: Dam release flood - Herat (Obe) - 01/07/2020,2020-07-01T00:00:00Z,74,Flood
Afghanistan,2020,Afghanistan: Heavy snowfall - Bamyan - 12/02/2020,2020-02-12T00:00:00Z,15,Extreme temperature
Afghanistan,2020,Afghanistan: Heavy snowfall - Ghazni - 13/02/2020,2020-02-13T00:00:00Z,22,Extreme temperature
Afghanistan,2020,Afghanistan: Extreme Winter conditions - 11 provinces -  13/01/2020,2020-01-13T00:00:00Z,3000,Extreme temperature
Afghanistan,2020,Afghanistan: Floods - Faryab - 03/05/2020,2020-05-03T00:00:00Z,1500,Wet Mass Movement
Afghanistan,2020,Afghanistan: Avalanche - Panjsher - 14/04/2020,2020-04-14T00:00:00Z,81,Wet Mass Movement
Afghanistan,2020,Afghanistan: Landslide - Bamyan (Yakawlang) - 16/04/2020,2020-04-16T00:00:00Z,22,Wet Mass Movement
Afghanistan,2020,Afghanistan: Floods - Khost - 01/06/2020,2020-06-01T00:00:00Z,15,Flood
Afghanistan,2020,Afghanistan: Wind storm - Nangarhar (Jalalabad) - 18/05/2020,2020-05-18T00:00:00Z,7,Storm
Afghanistan,2020,"Afghanistan: Flood - Ghor (Feroz Koh, Dawlat Yar) - 03/05/2020",2020-05-03T00:00:00Z,160,Flood
Afghanistan,2020,Afghanistan: Landslide - Samangan - 08/01/2020,2020-01-08T00:00:00Z,350,Wet Mass Movement
Afghanistan,2020,Afghanistan: Severe winter conditions - Kabul (Kabul) - 10/12/2020,2020-12-10T00:00:00Z,44,Extreme temperature
Afghanistan,2020,"Afghanistan: Flash floods - Nangharar (Kuz Kunar), Parwan (Charikar) - 01/08/2020",2020-08-01T00:00:00Z,1000,Flood
Afghanistan,2020,Afghanistan: Severe winter conditions - Logar (Puli Alam) - 29/11/2020,2020-11-29T00:00:00Z,220,Extreme temperature
Afghanistan,2020,Afghanistan: Severe winter conditions - Badghis (Bala Murghab) - 01/12/2020,2020-12-01T00:00:00Z,74,Extreme temperature
Afghanistan,2020,Afghanistan: Heavy rainfall - Zabul - 13/02/2020,2020-02-13T00:00:00Z,52,Flood
Afghanistan,2020,Afghanistan: Hail storm - Khost - 28/03/2020,2020-03-28T00:00:00Z,15,Storm
Afghanistan,2020,Afghanistan: Heavy rainfall - Paktya - 31/05/2020,2020-05-31T00:00:00Z,59,Flood
Afghanistan,2020,Afghanistan: Wet mass movement - Kabul (Kabul) - 24/04/2020,2020-04-24T00:00:00Z,74,Wet Mass Movement
Afghanistan,2020,Afghanistan: Flood - Takhar (Taluqan) - 02/05/2020,2020-05-02T00:00:00Z,560,Flood
Afghanistan,2020,"Afghanistan: Flood - Takhar (Taluqan, Farkhar) - 09/05/2020",2020-05-09T00:00:00Z,130,Flood
Afghanistan,2020,"Afghanistan: Heavy rainfall - Baghis (Qadis, Muqur) - 02/05/2020",2020-05-02T00:00:00Z,240,Flood
Afghanistan,2020,Afghanistan: Heavy rainfall - Paktya (Gardiz) - 12/05/2020,2020-05-12T00:00:00Z,15,Flood
Afghanistan,2020,Afghanistan: Heavy snowfall - Paktya - 12/05/2020,2020-05-12T00:00:00Z,37,Storm
Afghanistan,2020,Afghanistan: Floods - Badakhshan (Fayzabad) - 28/06/2020,2020-06-28T00:00:00Z,7,Flood
Afghanistan,2020,"Afghanistan: Floods - Parwan, Khost - 30/06/2020",2020-06-30T00:00:00Z,140,Flood
Afghanistan,2020,"Afghanistan: Heavy rainfall - Paktya, Kunar, Laghman, Nangharar, Ghazni, Takhar - 29/02/2020",2020-02-29T00:00:00Z,190,Flood
Afghanistan,2020,"Afghanistan: Floods - Panshjer, Parwan - 13/07/2020",2020-07-13T00:00:00Z,22,Flood
Afghanistan,2020,Afghanistan: Floods - Kunduz - 09/05/2020,2020-05-09T00:00:00Z,110,Flood
Afghanistan,2020,Afghanistan: Floods - Nuristan - 17/05/2020,2020-05-17T00:00:00Z,30,Flood
Afghanistan,2020,Afghanistan: Stream Water Overflow - Kunduz (Imam Sahib) - 05/10/2020,2020-10-05T00:00:00Z,81,Flood
Afghanistan,2020,Afghanistan: Floods - Paktya - 08/08/2020,2020-08-08T00:00:00Z,7,Flood
Afghanistan,2020,Afghanistan: Floods - Nangharar (Shinwar) - 14/04/2020,2020-04-14T00:00:00Z,1100,Flood
Afghanistan,2020,Afghanistan: Flash floods - Countrywide - 21/03/2020,2020-03-21T00:00:00Z,10000,Flood
Afghanistan,2020,"Afghanistan: Flash floods - Baghlan, Samangan, Bamyan (Panjab) - 01/05/2020",2020-05-01T00:00:00Z,9600,Flood
Afghanistan,2020,Afghanistan: Flash floods - Badakhshan (Fayzabad) - 19/07/2020,2020-07-19T00:00:00Z,110,Flood
Afghanistan,2020,Afghanistan: Flash floods - Kunduz (Imam Sahib) - 12/10/2020,2020-10-12T00:00:00Z,150,Flood
Afghanistan,2020,"Afghanstan: Floods - Badakhshan (Argo, Baharak) - 28/05/2020",2020-05-28T00:00:00Z,370,Flood
Afghanistan,2020,Afghanstan: Heavy rainfall - Badakhshan (Tashkan) - 02/05/2020,2020-05-02T00:00:00Z,89,Flood
Afghanistan,2020,Afghanistan: Floods - Kunar - 04/05/2020,2020-05-04T00:00:00Z,230,Flood
Afghanistan,2020,Afghanistan: Floods - Kunar (Asadabad) - 06/09/2020,2020-09-06T00:00:00Z,37,Flood
Afghanistan,2021,Afghanistan: Floods - Bamyan (Bamyan) - 28/03/2021,2021-03-28T00:00:00Z,30,Flood
Afghanistan,2021,Afghanistan: Flood - Badakhshan (Arghanj Khaw) - 05/04/2021,2021-04-05T00:00:00Z,250,Flood
Afghanistan,2021,Afghanistan: Landslide - Badakhshan (Fayzabad) - 03/09/2021,2021-09-03T00:00:00Z,22,Wet Mass Movement
Afghanistan,2021,Afghanistan: Floods - 14 Provinces - 02/05/2021,2021-05-02T00:00:00Z,44,Flood
Afghanistan,2021,Afghanistan: Floods - 14 Provinces - 02/05/2021,2021-05-02T00:00:00Z,760,Flood
Afghanistan,2021,Afghanistan: Floods - 14 Provinces - 02/05/2021,2021-05-02T00:00:00Z,190,Flood
Afghanistan,2021,Afghanistan: Flood - Badakhshan (Arghanj Khaw) - 05/04/2021,2021-04-05T00:00:00Z,74,Flood
Afghanistan,2021,Afghanistan: Flood - Nangarhar (Bihsud) - 30/08/2021,2021-08-30T00:00:00Z,67,Flood
Afghanistan,2021,Afghanistan: Landslide - Balkh (Kishindih / Tonje Ha) - 21/03/2021,2021-03-21T00:00:00Z,170,Dry mass movement
Afghanistan,2021,Afghanistan: Rock Slide - Takhar (Warsaj/Kemyan) - 04/04/2021,2021-04-04T00:00:00Z,15,Dry mass movement
Afghanistan,2021,Afghanistan: Floods - Nangarhar (6 Districts) - 23/03/2021,2021-03-23T00:00:00Z,220,Flood
Afghanistan,2021,Afghanistan: Floods - Kabul (Surobi / Naghlo) - 27/03/2021,2021-03-27T00:00:00Z,37,Flood
Afghanistan,2021,Afghanistan: Floods - Kabul (Kabul / Karti Etifaq) - 28/03/2021,2021-03-28T00:00:00Z,22,Flood
Afghanistan,2021,"Afghanistan: Floods - Khost (Mando Zayi, Matun) - 23/03/2021",2021-03-23T00:00:00Z,7,Flood
Afghanistan,2021,"Afghanistan: Floods - Khost (Mando Zayi, Matun) - 23/03/2021",2021-03-23T00:00:00Z,15,Flood
Afghanistan,2021,Afghanistan: Floods - Badakhshan (Fayzabad / Fayzabad City) - 15/03/2021,2021-03-15T00:00:00Z,67,Flood
Afghanistan,2021,Afghanistan: Drought - Badghis (Jawand) and Ghor (Chaghcharan) - 08/11/2021,2021-11-08T00:00:00Z,980,Drought
Afghanistan,2021,Afghanistan: Floods - Takhar (Taluqan/Zargari) - 22/03/2021,2021-03-22T00:00:00Z,7,Flood
Afghanistan,2021,Afghanistan: Floods - Badakhshan (Khash) - 22/04/2021,2021-04-22T00:00:00Z,74,Flood
Afghanistan,2021,Afghanistan: Floods - Balkh (Mazari Sharif / Faqir Abad) - 29/03/2021,2021-03-29T00:00:00Z,37,Flood
Afghanistan,2021,Afghanistan: Floods - Laghman (5 Districts) - 23/03/2021,2021-03-23T00:00:00Z,350,Flood
Afghanistan,2021,Afghanistan: Drought - Ghazni (Gelan) - 15/07/2021,2021-07-15T00:00:00Z,340,Drought
Afghanistan,2021,Afghanistan: Floods - Nangarhar (Pachier Agam/Zabar Hulya) - 14/03/2021,2021-03-14T00:00:00Z,7,Flood
Afghanistan,2021,Afghanistan: Floods - Takhar (Farkhar / Pair Farkhar) - 29/03/2021,2021-03-29T00:00:00Z,27,Flood
Afghanistan,2021,Afghanistan: Floods - Takhar (Farkhar/Chashim Garmak) - 07/04/2021,2021-04-07T00:00:00Z,7,Flood
Afghanistan,2021,"Afghanistan: Floods - Badakhshan (Shahri Buzurg/Khasar, Angariyan) - 29/03/2021",2021-03-29T00:00:00Z,52,Flood
Afghanistan,2021,"Afghanistan: Floods - Baghlan (Khinjan, Puli Khumri) - 16/04/2021",2021-04-16T00:00:00Z,30,Flood
Afghanistan,2021,Afghanistan: Floods - Paktya (Laja Ahmad Khail/ Shaiko Kalay) - 07/04/2021,2021-04-07T00:00:00Z,7,Flood
Afghanistan,2021,Afghanistan: Floods - 14 Provinces - 02/05/2021,2021-05-02T00:00:00Z,480,Flood
Afghanistan,2021,Afghanistan: Floods - Bamyan (Bamyan) - 28/03/2021,2021-03-28T00:00:00Z,22,Flood
Afghanistan,2021,Afghanistan: Floods - Bamyan (Bamyan) - 28/03/2021,2021-03-28T00:00:00Z,44,Flood
Afghanistan,2021,"Afghanistan: Drought - Helmand (Naw Zad, Musa Qala) - 26/11/2021",2021-11-26T00:00:00Z,1700,Drought
Afghanistan,2021,Afghanistan: Floods - 14 Provinces - 02/05/2021,2021-05-02T00:00:00Z,130,Flood
Afghanistan,2021,Afghanistan: Floods - 14 Provinces - 02/05/2021,2021-05-02T00:00:00Z,440,Flood
Afghanistan,2021,Afghanistan: Floods - 14 Provinces - 02/05/2021,2021-05-02T00:00:00Z,5500,Flood
Afghanistan,2021,Afghanistan: Floods - 14 Provinces - 02/05/2021,2021-05-02T00:00:00Z,6200,Flood
Afghanistan,2021,Afghanistan: Floods - 14 Provinces - 02/05/2021,2021-05-02T00:00:00Z,530,Flood
Afghanistan,2021,Afghanistan: Floods - Nuristan (Kamdesh) - 28/07/2021,2021-07-28T00:00:00Z,1300,Flood
Afghanistan,2021,Afghanistan: Flood - Panjsher (Khenj) - 02/07/2021,2021-07-02T00:00:00Z,170,Flood
Afghanistan,2021,"Afghanistan: Flood - Nangarhar (Kot, Rodat, Bati Kot) - 20/07/2021",2021-07-20T00:00:00Z,290,Flood
Afghanistan,2021,"Afghanistan: Flood - Khost (Khost Matun, Mando Zayi) - 19/07/2021",2021-07-19T00:00:00Z,30,Flood
Afghanistan,2021,Afghanistan: Storm - Baghlan (Pul Khumri) - 16/04/2021,2021-04-16T00:00:00Z,8,Storm
Afghanistan,2021,Afghanistan: Storm - Kabul (Surobi) - 26/09/2021,2021-09-26T00:00:00Z,30,Storm
Afghanistan,2021,"Afghanistan: Flood - Maidan Wardak (Day Mirdad, Maydan Shahr) - 18/07/2021",2021-07-18T00:00:00Z,160,Flood
Afghanistan,2021,Afghanistan: Flood - Badghis (Jawand) - 23/05/2021,2021-05-23T00:00:00Z,2300,Flood
Afghanistan,2021,Afghanistan: Floods - 14 Provinces - 02/05/2021,2021-05-02T00:00:00Z,1300,Flood
Afghanistan,2021,Afghanistan: Floods - 14 Provinces - 02/05/2021,2021-05-02T00:00:00Z,120,Flood
Afghanistan,2021,Afghanistan: Flash floods - Ghor (Feroz Koh/Chaghcharan) - 27/02/2021,2021-02-27T00:00:00Z,30,Flood
Afghanistan,2021,Afghanistan: Floods - 14 Provinces - 02/05/2021,2021-05-02T00:00:00Z,7,Flood
Afghanistan,2021,Afghanistan: Floods - 14 Provinces - 02/05/2021,2021-05-02T00:00:00Z,350,Flood
Afghanistan,2021,Afghanistan: Floods - 14 Provinces - 02/05/2021,2021-05-02T00:00:00Z,15,Flood
Angola,2009,2009-000063,2009-01-01T00:00:00Z,81000,Flood
Angola,2009,,2009-01-01T00:00:00Z,4700,Flood
Angola,2009,,2009-01-01T00:00:00Z,420,Flood
Angola,2010,,2010-01-01T00:00:00Z,3900,Flood
Angola,2010,2010-000182,2010-01-01T00:00:00Z,75000,Flood
Angola,2011,,2011-01-01T00:00:00Z,22000,Flood
Angola,2011,,2011-01-01T00:00:00Z,1500,Flood
Angola,2011,,2011-01-01T00:00:00Z,204000,Flood
Angola,2012,,2012-01-01T00:00:00Z,80,Flood
Angola,2012,,2012-01-01T00:00:00Z,6300,Flood
Angola,2013,Luanda floods,2013-03-20T00:00:00Z,2500,Flood
Angola,2015,Cuanza Sul flood,2015-03-28T00:00:00Z,480,Flood
Angola,2015,Lobito flash flood,2015-03-11T00:00:00Z,1200,Flood
Angola,2015,Luanda flash floods,2015-03-09T00:00:00Z,3900,Flood
Angola,2016,Rainy season floods,2016-01-01T00:00:00Z,19000,Flood
Angola,2017,Angola: Flood - Uige - 01/01/2017,2017-01-01T00:00:00Z,1400,Flood
Angola,2017,Angola: Storms - Huambo - 17/09/2017,2017-09-17T00:00:00Z,5,Storm
Angola,2017,Angola: Flood - Cuanza Norte - 15/03/2017,2017-03-15T00:00:00Z,1400,Flood
Angola,2017,Angola: Flood - Luanda - 21/03/2017,2017-03-21T00:00:00Z,3400,Flood
Angola,2017,Angola: Storms - Malanje - 27/09/2017,2017-09-27T00:00:00Z,540,Storm
Angola,2017,Angola: Storm - Zaire - 05/11/2017,2017-11-05T00:00:00Z,25,Storm
Angola,2017,Angola: Flood - Cunene - 14/03/2017,2017-03-14T00:00:00Z,1300,Flood
Angola,2017,Angola: Flood - Luanda - 01/11/2017,2017-11-01T00:00:00Z,44,Flood
Angola,2017,Angola: Flood - Moxico - 20/01/2017,2017-01-20T00:00:00Z,5900,Flood
Angola,2018,Angola: Storm - Cuando Cubango - 26/02/2018,2018-02-26T00:00:00Z,960,Storm
Angola,2018,Angola: Flood - Cuanza Norte - 10/04/2018,2018-04-10T00:00:00Z,1100,Flood
Angola,2018,Angola- Flash Flood- Zaire- 30/10/2018,2018-09-30T00:00:00Z,250,Flood
Angola,2018,Angola: Storms - Uige - 01/01/2018,2018-01-01T00:00:00Z,1600,Storm
Angola,2018,Angola: Floods- Malanje- 15/10/2018,2018-10-15T00:00:00Z,310,Flood
Angola,2018,Angola: Flood - Zaire - 24/04/2018,2018-04-24T00:00:00Z,150,Flood
Angola,2018,Angola: Flood - Bie - 01/04/2018,2018-04-01T00:00:00Z,2700,Flood
Angola,2018,Angola: Flood - Huila - 18/03/2018,2018-03-18T00:00:00Z,490,Flood
Angola,2018,Angola: Flash flood - Benguela - 20/03/2018,2018-03-20T00:00:00Z,100,Flood
Angola,2018,Angola: Storm - Cuanza Norte - 22/02/2018,2018-02-22T00:00:00Z,490,Storm
Angola,2018,Angola: Storm - Cuando Cubango - 24/01/2018,2018-01-24T00:00:00Z,18,Storm
Angola,2018,Angola: Flood - Luanda - 21/02/2018,2018-02-21T00:00:00Z,2700,Flood
Angola,2018,Angola: Flash flood - Uige - 05/03/2018,2018-03-05T00:00:00Z,290,Flood
Angola,2019,Angola: Floods - Zaire - 18/03/2019,2019-03-19T00:00:00Z,130,Flood
Angola,2019,Angola: Floods - Benguela - 16/03/2019,2019-03-16T00:00:00Z,150,Flood
Angola,2019,Angola: Flash floods- Cunene- (Ondija)- 03/12/2019,2019-12-03T00:00:00Z,34,Flood
Angola,2019,Angola: Flash floods- Kwanza Norte- (Dondo)- 19/11/2019,2019-11-19T00:00:00Z,500,Flood
Angola,2019,Angola: Flash flooding- Luanda- 21/02/2019,2019-02-21T00:00:00Z,200,Flood
Angola,2019,Angola: Flash flood- Malanje- 15/02/2019,2019-02-15T00:00:00Z,770,Flood
Angola,2019,Angola: Flash flood- Malanje- 25/02/2019,2019-02-25T00:00:00Z,4900,Flood
Angola,2020,Angola: Flash flooding- Cuanza Sul province (Quilenda)- 13/03/2020,2020-03-13T00:00:00Z,1300,Flood
Angola,2020,Angola: Flash flooding- Kwanza Norte- 01/01/2020,2020-01-01T00:00:00Z,93,Flood
Angola,2020,Angola: Flash flooding- Huila (Lubango)- 14/03/2020,2020-03-14T00:00:00Z,240,Flood
Angola,2020,Angola: Riverine floods- Luanda province (Talatona)- 18/04/2020,2020-04-18T00:00:00Z,550,Flood
Angola,2020,Angola: Riverine floods- Cuanza Sul province (Libolo)- 20/04/2020,2020-04-20T00:00:00Z,89,Flood
Angola,2020,Angola: Floods- Lunda Sul province (Saurimo)- 01/01/2020,2020-01-01T00:00:00Z,11000,Flood
Angola,2020,Angola: Flash flooding- Uíge- 10/01/2020,2020-01-10T00:00:00Z,200,Flood
Angola,2020,Angola: Flash flooding- Luanda- 04/01/2020,2020-01-04T00:00:00Z,1200,Flood
Angola,2021,Angola: Storm  - Luanda - 20/04/2021,2021-04-20T00:00:00Z,11000,Storm
Angola,2021,Angola: Storm - Uige - 21/02/2021,2021-02-21T00:00:00Z,85,Storm
Angola,2021,Angola: Floods - Luanda - 16/03/2021,2021-03-16T00:00:00Z,2800,Flood
Angola,2021,Angola: Drought - 2021 ,2021-01-01T00:00:00Z,7400,Drought
Anguilla,2017,15 countries - Hurricane Irma - 27/08/2017,2017-08-27T00:00:00Z,500,Storm
Albania,2009,,2009-01-01T00:00:00Z,150,Earthquake
Albania,2013,Shalë flood,2013-09-30T00:00:00Z,2,Flood
Albania,2013,Kolsh flood,2013-01-19T00:00:00Z,10,Flood
Albania,2013,Fier flood,2013-02-06T00:00:00Z,9,Flood
Albania,2013,Berat flood,2013-01-18T00:00:00Z,240,Flood
Albania,2013,Shëngjin flood,2013-01-17T00:00:00Z,6,Flood
Albania,2013,Vlorë flood,2013-03-14T00:00:00Z,130,Flood
Albania,2013,Shkodrë flood,2013-03-14T00:00:00Z,52,Flood
Albania,2013,Korçë landslide,2013-01-22T00:00:00Z,3,Wet Mass Movement
Albania,2014,Flooding in the North-West,2014-11-15T00:00:00Z,24,Flood
Albania,2015,Floods across Southern and South-west Albania,2015-01-31T00:00:00Z,4200,Flood
Albania,2016,Western Albania floods,2016-01-05T00:00:00Z,2500,Flood
Albania,2016,Gegharqunik and Shirak region mudslide,2016-06-24T00:00:00Z,580,Wet Mass Movement
Albania,2016,"North, West and Central counties floods",2016-10-10T00:00:00Z,49,Flood
Albania,2017,"Albania: flood -  Fushë-Kruja; Tirana; Durres; Shijak; Kavaja; Berat; Gjirokastra; Vlora; Fier; Elbasan; Korçë; Dibra - 30/11/2017			",2017-11-30T00:00:00Z,3500,Flood
Albania,2018,Albania: Flood - Tirana; Novosele; Shkodra; Vlora; Lushnja - 04/02/2018 ,2018-02-04T00:00:00Z,83,Flood
Albania,2018,Albania: Flood - Shkodra - 02/03/2018,2018-03-02T00:00:00Z,25,Flood
Albania,2019,Albania: Earthquake - Tirana - 22/09/2019,2019-09-22T00:00:00Z,500,Earthquake
Albania,2019,Albania: Earthquake - Central Albania - 26/11/2019,2019-11-29T00:00:00Z,32000,Earthquake
Albania,2019,Albania: Earthquake - Korçë - 01/06/2019,2019-06-01T00:00:00Z,250,Earthquake
Albania,2021,"Albania: Flood - Lezhë, Durrës, Shkodër - 06/01/2021",2021-01-06T00:00:00Z,250,Flood
United Arab Emirates,2017,Oman; UAE: flash floods - 16/12/2017,2017-12-16T00:00:00Z,850,Flood
United Arab Emirates,2019,United Arab Emirates: flash floods - Ras al-Khaimah - 13/04/2019,2019-04-13T00:00:00Z,100,Flood
United Arab Emirates,2019,"Pakistan, UAE, Oman: Cyclone Kyarr  - 27/10/2019",2019-10-27T00:00:00Z,100,Storm
United Arab Emirates,2019,"UAE: Torrential Rains - Sharjah, Ajman - 20/11/2019",2019-11-20T00:00:00Z,20,Storm
United Arab Emirates,2020,UAE: Rainy season - countrywide - 09/01/2020,2020-01-09T00:00:00Z,610,Flood
United Arab Emirates,2021,"Iran, UAE: Earthquake - Hormozgan Province, Dubai - 14/11/2021",2021-11-14T00:00:00Z,40,Earthquake
Argentina,2008,,2008-01-28T00:00:00Z,640,Flood
Argentina,2012,,2012-01-01T00:00:00Z,2000,Storm
Argentina,2013,Copahue volcano (volcano located in Chile),2013-05-24T00:00:00Z,600,Volcanic eruption
Argentina,2013,Local floods,2013-04-01T00:00:00Z,300,Flood
Argentina,2013,Argentina flash flood,2013-04-02T00:00:00Z,3000,Flood
Argentina,2013,Rise in the level of Parana and Iguazu rivers due to heavy rains,2013-06-26T00:00:00Z,3000,Flood
Argentina,2014,San Pedro floods after storm,2014-02-01T00:00:00Z,300,Flood
Argentina,2014,River Paranà flood/North-eastern Argentina flood,2014-06-11T00:00:00Z,14000,Flood
Argentina,2014,Flooding in the central and southern provinces,2014-03-01T00:00:00Z,2600,Flood
Argentina,2014,Buenos Aires flood,2014-10-30T00:00:00Z,6300,Flood
Argentina,2014,El Rodeo landlslide,2014-01-25T00:00:00Z,200,Wet Mass Movement
Argentina,2014,Lujan flood caused by storms,2014-01-01T00:00:00Z,200,Flood
Argentina,2014,San Juan floods,2014-02-13T00:00:00Z,6300,Storm
Argentina,2014,Floods in Entre Rios province,2014-06-01T00:00:00Z,2200,Flood
Argentina,2015,Cordoba storm,2015-02-15T00:00:00Z,400,Storm
Argentina,2015,Flooding in Buenos Aires Province,2015-08-04T00:00:00Z,11000,Flood
Argentina,2015,Flooding in North-East Argentina,2015-12-01T00:00:00Z,20000,Flood
Argentina,2015,Salta earthquake,2015-10-17T00:00:00Z,48,Earthquake
Argentina,2015,Tucuman flood,2015-04-15T00:00:00Z,220,Flood
Argentina,2015,Flooding in Northwestern Argentina,2015-03-01T00:00:00Z,4400,Flood
Argentina,2016,Northern and central provinces floods (2nd wave),2016-03-10T00:00:00Z,11000,Flood
Argentina,2016,Jujuy province landslide,2016-02-08T00:00:00Z,600,Wet Mass Movement
Argentina,2016,Buenos Aires province floods,2016-12-26T00:00:00Z,550,Flood
Argentina,2016,Buenos Aires and Neuquen provinces floods,2016-10-23T00:00:00Z,390,Flood
Argentina,2017,Argentina: Country-wide floods - April 2017,2017-03-27T00:00:00Z,17000,Flood
Argentina,2017,Jujuy  landslide ,2017-01-10T00:00:00Z,1400,Wet Mass Movement
Argentina,2017,Argentina: Floods- Buenos Aires (province)- (08/09/2017),2017-09-08T00:00:00Z,570,Flood
Argentina,2017,Uruguay and Aguapey Rivers floods (Argentina),2017-05-27T00:00:00Z,6600,Flood
Argentina,2017,Paraguay: riverine flood -  Puerto Pilcomayo; Formosa - 11/06/2017,2017-06-11T00:00:00Z,38,Flood
Argentina,2017,Northern Corrientes floods,2017-05-05T00:00:00Z,700,Flood
Argentina,2017,Argentina: Wildfire - Córdoba - 18/08/2017,2017-08-18T00:00:00Z,150,Wildfire
Argentina,2018,Argentina: Flood - Buenos Aires Province - 10/11/2018,2018-11-10T00:00:00Z,2400,Flood
Argentina,2018,Argentina: Flash flooding- Santa Cruz (03/04/2018),2018-04-03T00:00:00Z,50,Flood
Argentina,2018,Argentina: Flooding- 4 provinces- 03/05/2018,2018-05-03T00:00:00Z,300,Flood
Argentina,2018,Argentina: Flash Flooding- Mar del Plata (09/04/2018),2018-04-09T00:00:00Z,22,Storm
Argentina,2018,Argentina: Pilcomayo river flood- Salta (31/01/2018),2018-01-31T00:00:00Z,9900,Flood
Argentina,2018,Argentina: Flooding- Chaco - (20/01/2018) ,2018-01-20T00:00:00Z,1100,Flood
Argentina,2018,Argentina: Storm- Buenos Aires province (28/04/2018),2018-04-28T00:00:00Z,1200,Flood
Argentina,2018,Argentina: Flood - Misiones 9/10/2018,2018-10-09T00:00:00Z,700,Flood
Argentina,2018,Argentina: Wildfire - Córdoba - 24/08/2018,2018-08-24T00:00:00Z,50,Wildfire
Argentina,2018,Argentina: Río de la Plata - Buenos Aires province - 01/09/2018,2018-09-01T00:00:00Z,50,Flood
Argentina,2019,Argentina: Tornado - Santiago del Estero (La Banda) - 26/11/2019,2019-11-26T00:00:00Z,150,Storm
Argentina,2019,"Argentina: Floods - Santa Fe, Chaco, Corrientes y Santiago del Estero, Litoral, Entre Ríos- 20/01/2019",2019-01-20T00:00:00Z,11000,Flood
Argentina,2019,Argentina: Floods - Mar del Plata - 17/06/2019,2019-06-17T00:00:00Z,18,Flood
Argentina,2019,Argentina : Wildfire - Cordoba (La Cumbre) - 27/09/2019,2019-09-27T00:00:00Z,100,Wildfire
Argentina,2019,Argentina: Floods - Entre Rios - 17/06/2019,2019-06-17T00:00:00Z,250,Flood
Argentina,2019,Argentina: Flood - Buenos Aires (Matanza) - 12/10/2019,2019-10-12T00:00:00Z,5300,Flood
Argentina,2019,Argentina: Floods - Las Breñas (Chaco Province)  - 23/04/2019,2019-04-23T00:00:00Z,1800,Flood
Argentina,2019,"Argentina: Floods - General Taboada, Juan Felipe Ibarra and Belgrano  - 20/05/2019",2019-05-20T00:00:00Z,700,Flood
Argentina,2019,Argentina: Floods Clorinda (Formosa Province) - 17/04/2019,2019-06-17T00:00:00Z,2000,Flood
Argentina,2019,Argentina: floods - Santiago del Estero - 09/05/2019,2019-05-09T00:00:00Z,700,Flood
Argentina,2019,"Argentina: Floods - Cordoba, Chaco, Tucuman, La Rioja - 01/04/2019",2019-04-01T00:00:00Z,600,Flood
Argentina,2020,Argentina: Floods - Santa Fe (San Lorenzo) - 02/04/2020,2020-04-02T00:00:00Z,6,Flood
Argentina,2020,Argentina: Floods - Salta (San Antonio de los Cobres) - 19/02/2020,2020-02-19T00:00:00Z,32,Flood
Argentina,2020,Argentina: Floods - Santa Cruz (Río Gallegos) - 15/01/2020,2020-01-15T00:00:00Z,6,Flood
Argentina,2020,Argentina: Floods - Salta - 02/04/2020,2020-03-02T00:00:00Z,14,Flood
Argentina,2020,Argentina: Floods -  Entre Rios (Paraná) - 28/04/2020,2020-04-28T00:00:00Z,160,Flood
Argentina,2020,Argentina: Floods - Corrientes (Esquina) - 21/02/2020,2020-02-21T00:00:00Z,70,Flood
Argentina,2020,Argentina: Floods - Buenos Aires (Arrecifes) - 18/03/2020,2020-03-17T00:00:00Z,67,Flood
Argentina,2020,Argentina: Flood - Buenos Aires (Belgrano) - 20/01/2020,2020-01-20T00:00:00Z,6,Flood
Argentina,2020,Argentina: Wildfires - Cordoba  (Valle de Punilla) - 27/09/2020,2020-09-27T00:00:00Z,64,Wildfire
Argentina,2020,Argentina: Floods - Cordoba - 05/02/2020,2020-02-05T00:00:00Z,36,Flood
Argentina,2020,Argentina: Wildfire - Cordoba(San Javier) - 12/10/2020,2020-10-12T00:00:00Z,50,Wildfire
Argentina,2020,Argentina: Landslides - Sauce Viejo - 01/07/2020,2020-07-01T00:00:00Z,35,Flood
Argentina,2020,Argentina: Floods - Santa Cruz - 04/08/2020,2020-08-04T00:00:00Z,64,Flood
Argentina,2020,Argentina: Floods - El Chaco - 19/02/2020,2020-02-19T00:00:00Z,200,Flood
Argentina,2020,"Argentina: Floods - Salta, Tucuman and El Chaco - 11/02/2020",2020-02-11T00:00:00Z,800,Flood
Argentina,2020,Argentina: Wildfire- Chubut (Esquel) - 04/03/2020,2020-03-04T00:00:00Z,64,Wildfire
Argentina,2020,"Argentina: Wildfires - Cordoba (San José de La Quintana, Salsipuedes, Copina and Ambul)- 02/08/2020",2020-08-02T00:00:00Z,16,Wildfire
Argentina,2020,Argentina: Floods - Buenos Aires - 01/04/2020,2020-04-01T00:00:00Z,14,Flood
Argentina,2020,Argentina: Floods - Tucuman - 16/01/2020,2020-01-16T00:00:00Z,640,Flood
Argentina,2020,Argentina: Floods  - Cordoba (Mina Clavero) - 05/02/2020,2020-02-05T00:00:00Z,100,Flood
Argentina,2020,Argentina: Wildfire - Cordoba -  04/07/2020,2020-07-04T00:00:00Z,4,Wildfire
Argentina,2020,Argentina: Storm - San Juan (Pocito) - 01/01/2020,2020-01-01T00:00:00Z,16,Storm
Argentina,2020,Argentina: Floods - Jujuy (Abra Pampa) - 15/01/2020,2020-01-15T00:00:00Z,6,Flood
Argentina,2020,Argentina: Floods  - Corrientes - 18/02/2020,2020-02-18T00:00:00Z,130,Flood
Argentina,2020,Argentina: Wildfire - Cordoba (Villa Carlos Paz) - 22/09/2020,2020-09-22T00:00:00Z,26,Wildfire
Argentina,2020,Argentina: Floods - Salta - 05/04/2020,2020-04-05T00:00:00Z,6,Flood
Argentina,2020,Argentina: Floods  - Jujuy  (Yuto) - 14/01/2020,2020-01-15T00:00:00Z,48,Flood
Argentina,2020,Argentina: Floods - Rio Negro (Cipolletti) - 22/07/2020,2020-07-22T00:00:00Z,16,Flood
Argentina,2020,Argentina: Wildfires - Cordoba (Alta Gracia) - 30/09/2020,2020-09-30T00:00:00Z,6,Wildfire
Argentina,2020,Argentina: Wildfires - Cordoba - 10/08/2020,2020-08-10T00:00:00Z,9,Wildfire
Argentina,2020,Argentina: Floods - Cipolletti - 21/07/2020,2020-07-21T00:00:00Z,10,Flood
Argentina,2020,Argentina: Floods - Jujuy - 02/04/2020,2020-04-02T00:00:00Z,6,Flood
Argentina,2020,Argentina: Wildfires - Cordoba - 23/08/2020,2020-08-23T00:00:00Z,150,Wildfire
Argentina,2020,Argentina: Floods - Buenos Aires (Mar del Plata) - 23/07/2020,2020-07-23T00:00:00Z,64,Flood
Argentina,2020,Argentina: Floods - Salta (Anta) - 11/02/2020,2020-02-02T00:00:00Z,100,Flood
Argentina,2020,"Argentina: Floods - Jujuy (Chijra, Chingo and Palpalá) - 02/04/2020",2020-04-02T00:00:00Z,290,Flood
Argentina,2020,Argentina: Wildfire - Cordoba (El Chacay y Las Albahcas - 29/09/2020,2020-09-29T00:00:00Z,300,Wildfire
Argentina,2020,Argentina: Floods - Rioja - 11/02/2020,2020-02-11T00:00:00Z,6,Flood
Argentina,2020,Argentina: Floods - Salta (Oran and Tartagal) -10/02/2020,2020-02-10T00:00:00Z,22,Flood
Argentina,2021,"Argentina: Floods - Salta (Anta, Apolinario Saravia) - 22/11/2021",2021-11-22T00:00:00Z,50,Flood
Argentina,2021,Argentina: Wildfire - Patagonia - 07/03/2021,2021-03-07T00:00:00Z,200,Wildfire
Argentina,2021,Argentina: Wildfire - Buenos Aires (Pinamar) - 28/11/2021,2021-11-28T00:00:00Z,10,Wildfire
Argentina,2021,Argentina: Storm: - Mendoza (Rivadavia) - 03/03/2021,2021-03-03T00:00:00Z,320,Storm
Argentina,2021,Argentina: Floods - Córdoba (Marcos Juarez) - 09/04/2021,2021-04-09T00:00:00Z,48,Flood
Argentina,2021,Argentina: Floods - Santa Fe (Venado Tuerto) - 08/04/2021,2021-04-08T00:00:00Z,79,Flood
Argentina,2021,Argentina: Earthquake - San Juan (Media Agua) - 19/01/2021,2021-01-19T00:00:00Z,4,Earthquake
American Samoa,2018,"American Samoa, New Zealand, Samoa, Tonga: Tropical Cyclone GITA - 9/2/2018",2018-02-09T00:00:00Z,4600,Storm
American Samoa,2020,"Samoa; American Samoa: Tropical Depression (Invest 96P, Invest 97P, Invest 98P), Tropical Cyclone 18P (Wasi / Vicky) -  16/2/2020",2020-02-16T00:00:00Z,390,Storm
Antigua and Barbuda,2008,,2008-10-15T00:00:00Z,45,Storm
Antigua and Barbuda,2017,15 countries - Hurricane Irma - 27/08/2017,2017-08-27T00:00:00Z,1400,Storm
Australia,2008,,2008-11-16T00:00:00Z,1000,Storm
Australia,2009,",",2009-01-01T00:00:00Z,7500,Wildfire
Australia,2010,2010-000049,2010-01-01T00:00:00Z,1000,Flood
Australia,2011,Tropical Cyclone 'Yasi',2011-01-01T00:00:00Z,10000,Storm
Australia,2012,,2012-01-01T00:00:00Z,3000,Flood
Australia,2012,,2012-01-01T00:00:00Z,13000,Flood
Australia,2013,Murray-River Tornado,2013-03-21T00:00:00Z,62,Storm
Australia,2013,Tasmania Bushfires,2013-01-05T00:00:00Z,3000,Wildfire
Australia,2013,Tropical Cyclone Oswald,2013-03-21T00:00:00Z,9000,Storm
Australia,2013,New-South Wales Bushfires January 2013,2013-01-01T00:00:00Z,130,Wildfire
Australia,2013,New-South Wales Bushfires October 2013,2013-10-01T00:00:00Z,540,Wildfire
Australia,2014,South Australia state fire,2014-01-01T00:00:00Z,31,Wildfire
Australia,2014,Perth Hills bushfire,2014-01-11T00:00:00Z,140,Wildfire
Australia,2014,Cyclone Ita,2014-04-10T00:00:00Z,1000,Storm
Australia,2015,Floods on the South coast of New South Wales,2015-08-25T00:00:00Z,300,Flood
Australia,2015,Esperance fires,2015-11-15T00:00:00Z,300,Wildfire
Australia,2015,Cyclone Marcia,2015-02-19T00:00:00Z,800,Storm
Australia,2015,Cyclone Nathan,2015-03-22T00:00:00Z,400,Storm
Australia,2015,North-eastern Victoria landslide,2015-12-08T00:00:00Z,3,Wet Mass Movement
Australia,2015,South-eastern Queensland floods,2015-05-01T00:00:00Z,260,Flood
Australia,2015,Great Ocean Road bushfire,2015-12-19T00:00:00Z,300,Wildfire
Australia,2015,Adelaide fire,2015-11-25T00:00:00Z,2500,Wildfire
Australia,2015,New South Wales floods,2015-04-21T00:00:00Z,520,Flood
Australia,2015,Adelaide Hills bushfire,2015-01-02T00:00:00Z,70,Wildfire
Australia,2015,Cyclone Olwyn,2015-03-12T00:00:00Z,180,Storm
Australia,2015,New South Wales thunderstorms,2015-12-15T00:00:00Z,78,Storm
Australia,2016,Western Australia floods,2016-12-25T00:00:00Z,100,Flood
Australia,2016,Huon River floods,2016-07-08T00:00:00Z,28,Flood
Australia,2016,Waroona-Yarloop Fire,2016-01-07T00:00:00Z,700,Wildfire
Australia,2016,Hunter Valley floods,2016-01-05T00:00:00Z,850,Flood
Australia,2016,New South Wales floods (June),2016-06-05T00:00:00Z,500,Flood
Australia,2016,Urandangi flood,2016-02-03T00:00:00Z,20,Flood
Australia,2016,Tasmania floods,2016-06-06T00:00:00Z,130,Flood
Australia,2016,New South Wales floods (September- 1st wave),2016-09-14T00:00:00Z,210,Flood
Australia,2016,New South Wales floods (September- 2nd wave),2016-09-24T00:00:00Z,700,Flood
Australia,2017,Australia :  New South Wales  fires  - 18/07/2017,2017-07-18T00:00:00Z,520,Wildfire
Australia,2017,Australia : Tropical cyclone Alfred - 20/02/2017,2017-02-20T00:00:00Z,74,Storm
Australia,2017,Australia :  Central Coast Queensland Severe Weather - Flood - Queensland - 16/10/2017,2017-10-16T00:00:00Z,31,Flood
Australia,2017,Austarlia : Queensland Wildfire - 19/01/2017,2017-01-19T00:00:00Z,130,Wildfire
Australia,2017,Australia : Strong winds - Wollongong- 19/08/2017,2017-08-19T00:00:00Z,80,Storm
Australia,2017,Australia : New South Wales Wildfires 12/02/2017,2017-02-12T00:00:00Z,94,Wildfire
Australia,2017,Australia : Tropical Cyclone Debbie - 28/03/2017,2017-03-28T00:00:00Z,30000,Storm
Australia,2017,Austalia : Victorian Floods - Victoria - 01/12/2017,2017-12-01T00:00:00Z,10,Flood
Australia,2018,Australia: Strong Winds - Melbourne - 24/07/2018,2018-07-24T00:00:00Z,300,Storm
Australia,2018,Australia: Sydney bushfire - Sydney - 15/04/2018,2018-04-14T00:00:00Z,100,Wildfire
Australia,2018,Australia: Winter Wildfires - New South Wales - 15/08/2018,2018-08-14T00:00:00Z,100,Wildfire
Australia,2018,"Autralia: Wildfires - Gracemere, Rockhampton (Queensland) - 28/11/2018",2018-11-28T00:00:00Z,8000,Wildfire
Australia,2018,Australia: Bushfire - Tathra - 20/03/2018,2018-03-20T00:00:00Z,700,Wildfire
Australia,2018,Australia: Flash floods - Tasmania - 11/05/2018,2018-05-11T00:00:00Z,4,Flood
Australia,2018,Australia: Irvinebank  wildfire - North Queensland - 01/10/2018,2018-10-01T00:00:00Z,1,Wildfire
Australia,2018,Australia: Bushfires - North Nowra - 17/08/2018,2018-08-17T00:00:00Z,8,Wildfire
Australia,2018,Australia: Bushfire eastern Kununurra (Western Australia) - 24/09/2018,2018-09-24T00:00:00Z,10,Wildfire
Australia,2018,Australia: Bega Valley fire - 17/08/2018,2018-08-17T00:00:00Z,5,Wildfire
Australia,2018,"Australia: Queensland Bushfire - Baffle Creek, Deepwater Creek, Oyster Creek and Rules Beach - 26/11/2018",2018-11-26T00:00:00Z,800,Wildfire
Australia,2018,Australia: Tropical cyclone Owen - 11/12/2018,2018-12-02T00:00:00Z,80,Storm
Australia,2018,Australia: Wildfire - Eungella (Brisbane) - 30/11/2018,2018-11-30T00:00:00Z,10,Wildfire
Australia,2018,Australia: Floods - Victoria - 14/12/2018,2018-11-28T00:00:00Z,10,Flood
Australia,2018,Australia: Bushfire - Cloudy Bay (Tasmania) - 24/12/2018,2018-12-24T00:00:00Z,50,Wildfire
Australia,2018,Australia: Bushfires - Victoria - 19/03/2018,2018-03-18T00:00:00Z,210,Wildfire
Australia,2018,Australia: Floods - Queensland  - 10/03/2018,2018-03-10T00:00:00Z,520,Flood
Australia,2018,Australia: Cyclone Marcus - 16/03/2018,2018-03-16T00:00:00Z,130,Storm
Australia,2018,Australia: Cyclone Nora - Queensland - 24/03/2018,2018-03-26T00:00:00Z,40,Storm
Australia,2018,Australia: Bruces Creek Bushfire - Bega Valley  - 13/05/2018,2018-03-13T00:00:00Z,180,Wildfire
Australia,2019,Australia: Bushfire - Tingha (New South Wales) - 12/02/2019 ,2019-02-12T00:00:00Z,29,Wildfire
Australia,2019,Australia: Cyclone Veronica - Western Australia - 15/03/2019,2019-03-18T00:00:00Z,1100,Storm
Australia,2019,Australia: Fires - Western Australia - 01/06/2019,2019-06-01T00:00:00Z,2,Wildfire
Australia,2019,Australia: Fires - Tasmania - 01/01/2019,2019-01-15T00:00:00Z,1400,Wildfire
Australia,2019,Australia: Bushfires - Victoria - March 2019 ,2019-03-01T00:00:00Z,1500,Wildfire
Australia,2019,Australia: Wildfire - Queensland - 01/11/2019,2019-11-01T00:00:00Z,840,Wildfire
Australia,2019,Australia: Bushfire - Tabulam (New South Wales) - 12/02/2019 ,2019-02-12T00:00:00Z,26,Wildfire
Australia,2019,"Australia: Wildfire - Tasmania (North Hobart, Lachlan) - 28/10/2019",2019-10-28T00:00:00Z,2,Wildfire
Australia,2019,Australia: Fire - Queensland - 01/08/2019 ,2019-08-01T00:00:00Z,1000,Wildfire
Australia,2019,Australia: Bushfires - Western Australia - 01/12/2019,2019-12-01T00:00:00Z,610,Wildfire
Australia,2019,Australia: Fires - South Australia - 01/11/2019,2019-11-01T00:00:00Z,4200,Wildfire
Australia,2019,Australia: Flood - North Queensland - 30/01/2019,2019-01-30T00:00:00Z,1300,Flood
Australia,2019,Australia: Wildfires - Victoria - 01/12/2019,2019-12-01T00:00:00Z,2100,Wildfire
Australia,2019,Australia: Bushfire - South West WA - 20/02/2019 ,2019-02-20T00:00:00Z,5,Wildfire
Australia,2019,Australia: Wildfire - New South Wales - 01/11/2019,2019-11-08T00:00:00Z,8400,Wildfire
Australia,2019,Australia: Fire - New South Wales - 01/08/2019 ,2019-08-01T00:00:00Z,540,Wildfire
Australia,2019,Australia; Papua New Guinea: Cyclone Trevor - 19/03/2019 ,2019-03-19T00:00:00Z,1800,Storm
Australia,2020,Australia: Flash floods - NSW (Tumbarumba) - 19/10/2020,2020-10-19T00:00:00Z,1,Flood
Australia,2020,Australia: TC Blake - Western Australia - 07/01/2020,2020-01-07T00:00:00Z,200,Storm
Australia,2020,Australia: Landslide - Victoria (Mornington Peninsula Shire/The Esplanade) - 29/09/2020,2020-09-29T00:00:00Z,3,Wet Mass Movement
Australia,2020,Australia: Coastal flood - NSW - 12/12/2020,2020-12-12T00:00:00Z,200,Flood
Australia,2020,Australia: Fires - Tasmania - 01/01/2020,2020-01-01T00:00:00Z,5,Wildfire
Australia,2020,Australia: Landslide - NSW (Sydney) - 23/10/2020,2020-10-23T00:00:00Z,25,Wet Mass Movement
Australia,2020,"Australia: Fires - New South Wales, ACT - 01/01/2020",2020-01-01T00:00:00Z,17000,Wildfire
Australia,2020,Australia: Fires - Western Australia - 01/01/2020,2020-01-01T00:00:00Z,330,Wildfire
Australia,2020,Australia: Tornado - Victoria (Horsham) - 07/12/2020,2020-12-07T00:00:00Z,10,Storm
Australia,2020,Australia: Fires - Western Australia (Perth) - 16/12/2020,2020-12-16T00:00:00Z,40,Wildfire
Australia,2020,Australia: Fire - Queensland (Cooktown) - 03/10/2020,2020-10-03T00:00:00Z,5,Wildfire
Australia,2020,Australia: Bushfires - Victoria (Mount Cottrell) - 14/12/2020,2020-12-14T00:00:00Z,2,Wildfire
Australia,2020,Australia: Fire - NSW (Sydney's North Head) - 17/10/2020,2020-10-17T00:00:00Z,60,Wildfire
Australia,2020,Australia: Fire - Queensland (Fraser Island) - 15/10/2020,2020-10-14T00:00:00Z,10,Wildfire
Australia,2020,Australia: Fire - New South Wales (Sydney) - 29/11/2020,2020-11-29T00:00:00Z,5,Wildfire
Australia,2020,Australia: Fires - Queensland - 01/01/2020,2020-01-01T00:00:00Z,130,Wildfire
Australia,2020,"Australia: Floods - Queensland (Southeast), NSW - 06/02/2020",2020-02-06T00:00:00Z,4000,Flood
Australia,2020,Australia: Coastal erosion - NSW (Sussex Inlet) - 28/07/2020,2020-07-27T00:00:00Z,52,Wet Mass Movement
Australia,2020,Australia: Hail storm - Queensland - 31/10/2020,2020-10-31T00:00:00Z,3,Storm
Australia,2020,Australia: Fire - South Australia (Kangaroo Island) - 04/12/2020,2020-12-04T00:00:00Z,2,Wildfire
Australia,2020,"Australia: Storm - Victoria, NSW, Queensland - 20/05/2020",2020-05-20T00:00:00Z,10,Storm
Australia,2020,Australia: Fires - Victoria - 01/01/2020,2020-01-01T00:00:00Z,26000,Wildfire
Australia,2020,Australia: Fires - South Australia - 01/01/2020,2020-01-01T00:00:00Z,3800,Wildfire
Australia,2021,Australia: Floods - New South Wales - 17/03/2021,2021-03-17T00:00:00Z,40000,Flood
Australia,2021,Australia: Floods - Western Australia (Carnarvon) - 05/02/2021,2021-02-05T00:00:00Z,24,Flood
Australia,2021,Australia: Earthquake - Victoria (Melbourne) - 22/09/2021,2021-09-22T00:00:00Z,2,Earthquake
Australia,2021,Australia: Bushfire - Western Australia (Perth) - 02/01/2021,2021-01-02T00:00:00Z,300,Wildfire
Australia,2021,"Australia, Indonesia, Timor-Leste: Tropical Cyclone SEROJA - Western Australia (AUS), East Nusa Tenggara (IDN) and Dili (TLS) - 29/03/2021",2021-03-29T00:00:00Z,340,Storm
Australia,2021,Australia: Floods - Victoria (Gippsland) - 09/06/2021,2021-06-09T00:00:00Z,520,Flood
Australia,2021,Australia: Land Fires - Victoria (Taylors Lakes) - 11/01/2021 ,2021-01-11T00:00:00Z,5,Wildfire
Australia,2021,Australia: Floods - Northern Territories (Jilkminggan) - 25/02/2021,2021-02-25T00:00:00Z,210,Flood
Australia,2021,"Australia: Flood - New South Wales, Queensland - 10/11/2021",2021-11-09T00:00:00Z,200,Flood
Australia,2021,"Australia: Land Fire - South Australia (Blackford, Lucindale) - 11/01/2021",2021-01-11T00:00:00Z,100,Wildfire
Australia,2021,"Australia: Storm - Victoria, South Australia - 29/10/2021",2021-10-29T00:00:00Z,18,Storm
Australia,2021,"Australia: Flood - New South Wales, Queensland - 10/11/2021",2021-11-09T00:00:00Z,4,Flood
Australia,2021,Australia: Bushfire - Western Australia (Perth) - 02/01/2021,2021-01-02T00:00:00Z,200,Wildfire
Australia,2021,"Australia: Tornado - New South Wales (Meadow Flat, Lithgow) - 29/09/2021",2021-09-29T00:00:00Z,3,Storm
Australia,2021,"Australia: Flood - New South Wales, Queensland - 10/11/2021",2021-11-09T00:00:00Z,50,Flood
Australia,2021,Australia: Storm - New South Wales - 30/09/2021,2021-09-30T00:00:00Z,5000,Storm
Australia,2021,Australia: Fire - Western Australia (Margaret River) - 08/12/2021,2021-12-08T00:00:00Z,45,Wildfire
Australia,2021,Australia: Cyclone Kimi - Queensland - 18/01/2021,2021-01-18T00:00:00Z,200,Storm
Australia,2021,Australia: Storm - Sydney (Lower North Shore) - 19/06/2021,2021-06-19T00:00:00Z,6,Storm
Australia,2021,Australia: Fire - Western Australia (Wooroloo) - 26/12/2021,2021-12-26T00:00:00Z,10,Wildfire
Australia,2021,"Australia: Flood - New South Wales, Queensland - 10/11/2021",2021-11-09T00:00:00Z,800,Flood
Australia,2021,"Australia: Flood - New South Wales, Queensland - 10/11/2021",2021-11-09T00:00:00Z,50,Flood
Australia,2021,"Australia: Adelaide Hills Fire - South Australia (Cherry Gardens, Echunga) - 24/01/2021",2021-01-24T00:00:00Z,20,Wildfire
Australia,2021,"Australia: Fire - Western Australia (Wooroloo, Perth) - 01/02/2021",2021-02-01T00:00:00Z,110,Wildfire
Australia,2021,Australia: Storms - Western Australia - 06/07/2021,2021-07-06T00:00:00Z,3,Storm
Australia,2021,"Australia: Fire - Western Australia (Wooroloo, Perth) - 01/02/2021",2021-02-01T00:00:00Z,440,Wildfire
Australia,2021,Australia: Floods - Victoria (Gippsland) - 09/06/2021,2021-06-09T00:00:00Z,280,Flood
Austria,2013,Central European Floods,2013-06-02T00:00:00Z,1000,Flood
Austria,2016,Klagenfurt snowstorm,2016-04-01T00:00:00Z,25,Extreme temperature
Austria,2016,Spittal an der Drau district floods,2016-07-11T00:00:00Z,66,Flood
Austria,2016,Carinthia mudslides,2016-09-04T00:00:00Z,160,Wet Mass Movement
Austria,2019,Austria: avalanche risk - St. Johann am Tauern - 05/01/2019,2019-01-05T00:00:00Z,32,Wet Mass Movement
Austria,2019,"Austria: Floods and landslides - Salzburg, Steiermark - 17/11/2019",2019-11-17T00:00:00Z,210,Mass movement
Austria,2019,Austria: Pre-emptive evacuation - Tyrol (St. Johann) - 05/01/2019,2019-01-05T00:00:00Z,31,Wet Mass Movement
Austria,2021,"Austria: Floods - Salzburg (Hallein, Pongau) - 17/07/2021",2021-07-17T00:00:00Z,56,Flood
Azerbaijan,2009,,2009-01-01T00:00:00Z,200,Flood
Azerbaijan,2010,2010-000139,2010-01-01T00:00:00Z,32000,Flood
Azerbaijan,2012,,2012-01-01T00:00:00Z,36000,Earthquake
Azerbaijan,2018,Azerbaijan: Risk  of Landslide - Baku - 27/01/2018,2018-01-27T00:00:00Z,390,Wet Mass Movement
Azerbaijan,2019,Azerbaijan: Earthquake - Shamaki - 05/02/2019,2019-02-05T00:00:00Z,140,Earthquake
Burundi,2008,,2008-09-20T00:00:00Z,2800,Flood
Burundi,2010,,2010-01-01T00:00:00Z,1500,Storm
Burundi,2014,Bujumbura floods,2014-02-09T00:00:00Z,13000,Flood
Burundi,2015,Muhuta flood,2015-11-02T00:00:00Z,1500,Flood
Burundi,2015,Bujumbura rural province flood and landslides,2015-03-29T00:00:00Z,1600,Flood
Burundi,2016,Rainy season floods,2015-12-31T00:00:00Z,2400,Flood
Burundi,2016,Gatumba floods,2016-05-15T00:00:00Z,4200,Flood
Burundi,2017,Burundi: wildfires- 7 provinces (01.06.2017),2017-06-01T00:00:00Z,150,Wildfire
Burundi,2017,Burundi: wildfires- 9 provinces (01/10/2017),2017-10-01T00:00:00Z,160,Wildfire
Burundi,2017,"Burundi: violent winds- Bujumbura Rural, Cankuzo (01.07.2017)",2017-07-01T00:00:00Z,110,Storm
Burundi,2017,"Burundi: violent winds- Cankuzo, Rutana (01.05.2017)",2017-05-01T00:00:00Z,460,Storm
Burundi,2017,Bujumbura floods,2017-03-16T00:00:00Z,730,Flood
Burundi,2017,"Burundi: landslides- Kayanza, Muramvya (01.07.2017) ",2017-07-01T00:00:00Z,18,Wet Mass Movement
Burundi,2017,"Burundi: strong winds- Rumonge, Cankuzo (01/10/2017)",2017-10-01T00:00:00Z,1200,Storm
Burundi,2017,Makamba landslides,2017-03-01T00:00:00Z,78,Wet Mass Movement
Burundi,2017,"Muyinga, Cankuzo and Rutana heavy rains",2017-03-01T00:00:00Z,510,Storm
Burundi,2017,Burundi: torrential rains- Cankuzo (06.30.2017),2017-06-30T00:00:00Z,8,Flood
Burundi,2017,Burundi: drought (01.01.2017),2017-01-01T00:00:00Z,5000,Drought
Burundi,2017,"Burundi: landslides- Bubanza, Rumonge (01.05.2017)",2017-05-01T00:00:00Z,39,Wet Mass Movement
Burundi,2017,"Burundi: torrential rains- Bubanza, Gitega (01.05.2017)",2017-05-01T00:00:00Z,470,Flood
Burundi,2017,"Rutana, Muyinga, and Rumonge Storms",2017-03-01T00:00:00Z,370,Storm
Burundi,2017,"Burundi: torrential rains- Karusi, Bururi (01/10/2017)",2017-10-01T00:00:00Z,1600,Flood
Burundi,2018,"Burundi: Strong winds- Karuzi, Cankuzo, Ngozi, Bururi- 01/08/2018",2018-08-01T00:00:00Z,110,Storm
Burundi,2018,Burundi: Flash flooding- 01/09/2018,2018-09-01T00:00:00Z,75,Flood
Burundi,2018,Burundi: Landslides- 01/09/2018,2018-09-01T00:00:00Z,5,Wet Mass Movement
Burundi,2018,Burundi: Storms - Bujumbura Rural; Bururi; Cankuzo; Karuzi; Makamba; Muyinga; Mwaro; Ngozi; Rutana; Ruyigi - April 2018,2018-04-01T00:00:00Z,630,Storm
Burundi,2018,Burundi: Landslides - Murammvya; Kayanza; Bujumbura Rural; Ruyigi - April 2018,2018-04-01T00:00:00Z,290,Wet Mass Movement
Burundi,2018,Burundi: Flash floods - February 2018,2018-02-01T00:00:00Z,2000,Flood
Burundi,2018,Burundi: Storms - January 2018,2018-01-01T00:00:00Z,210,Storm
Burundi,2018,Burundi: Storms - February 2018,2018-02-01T00:00:00Z,380,Storm
Burundi,2018,Burundi: Landslides - January 2018,2018-01-01T00:00:00Z,80,Wet Mass Movement
Burundi,2018,Burundi: Flash flooding- 13 provinces- 01/10/2018,2018-10-01T00:00:00Z,1100,Flood
Burundi,2018,Burundi: Storms - Bujumbura Mairie; Bujumbura Rural; Cankuzo; Gitega; Karuzi; Muyinga; Ngozi; Rumonge; Rutana; Ruyigi - March 2018,2018-03-01T00:00:00Z,230,Storm
Burundi,2018,Burundi: Flash floods - January 2018,2018-01-01T00:00:00Z,2900,Flood
Burundi,2018,Burundi: Landslides - Makamba; Muramvya; Kayanza - February 2018,2018-02-01T00:00:00Z,40,Wet Mass Movement
Burundi,2018,Burundi: Flash floods - Cankuzo; Cibitoke; Gitega; Karuzo; Kirundo; Mwaro; Ngozi; Rutana - May 2018,2018-05-01T00:00:00Z,140,Flood
Burundi,2018,Burundi: Landslides - Bujumbura Rural; Cibitoke; Rutana - May 2018,2018-05-01T00:00:00Z,74,Wet Mass Movement
Burundi,2018,Burundi: Storms - Bururi; Cankuzo; Karuzi; Ngozi; Rutana - May 2018,2018-05-01T00:00:00Z,110,Storm
Burundi,2018,Burundi: Strong winds- 12 provinces- 01/10/2018,2018-10-01T00:00:00Z,460,Storm
Burundi,2018,Burundi: Landslide - Bujumbura Mairie - June 2018,2018-06-01T00:00:00Z,6,Wet Mass Movement
Burundi,2018,Burundi: Flash floods - Bubanza; Bujumbura Mairie; Bujumbura Rural; Cankuzo; Cibitoke; Gitega; Karuzi; Kayanza; Makamba; Muramvya; Muyinga; Mwaro; Ngozi; Rumonge; Rutana; Ruyigi - April 2018,2018-04-01T00:00:00Z,18000,Flood
Burundi,2018,Burundi: Flash floods - Cibitoke - June 2018,2018-06-01T00:00:00Z,6,Flood
Burundi,2018,Burundi: Landslides- 01/10/2018,2018-10-01T00:00:00Z,6,Wet Mass Movement
Burundi,2018,Burundi: Storms - Cankuzo; Cibitoke - June 2018,2018-06-01T00:00:00Z,33,Storm
Burundi,2018,Burundi: Flash floods - March 2018,2018-03-01T00:00:00Z,2600,Flood
Burundi,2018,"Burundi: Drought - Cankuzo, Makamba, Ngozi, Karuzi- Feb to Dec 2018",2018-02-01T00:00:00Z,840,Drought
Burundi,2018,Burundi: Strong winds- 01/09/2018,2018-09-01T00:00:00Z,270,Storm
Burundi,2018,Burundi: Landslides - Bujumbura Rural; Buriri; Gitega; Kayanza; Rumonge - March 2018,2018-03-01T00:00:00Z,93,Wet Mass Movement
Burundi,2018,Burundi: Heavy rain- 01/11/2018,2018-11-01T00:00:00Z,2300,Flood
Burundi,2018,Burundi: Strong winds- 01/11/2018,2018-11-01T00:00:00Z,270,Storm
Burundi,2018,Burundi: Landslide- 01/11/2018,2018-11-01T00:00:00Z,8,Wet Mass Movement
Burundi,2018,Burundi: Strong winds- 01/12/2018,2018-12-01T00:00:00Z,360,Flood
Burundi,2018,"Burundi: Flash floods- Bujumbura Rural, Bubanza, Murambya- July 2018",2018-07-01T00:00:00Z,40,Flood
Burundi,2018,Burundi: Flash floods- 01/12/2018,2018-12-01T00:00:00Z,1500,Flood
Burundi,2018,"Burundi: Strong winds- Bujumbura Rural, Karuzi, Makamba, Bururi- 01/07/2018",2018-07-01T00:00:00Z,51,Storm
Burundi,2018,Burundi: Landslides- 01/12/2018,2018-12-01T00:00:00Z,2,Flood
Burundi,2018,"Burundi: Flash flooding- Karuzi, Cibitoke- 01/08/2018",2018-08-01T00:00:00Z,27,Flood
Burundi,2019,"Burundi: Landslides- Cibitoke, Bubanza- 01/11/2019",2019-12-01T00:00:00Z,240,Wet Mass Movement
Burundi,2019,Burundi: Strong winds- 13 provinces- 01/03/2019,2019-03-01T00:00:00Z,830,Storm
Burundi,2019,Burundi: Landslides- Bubanza- 01/09/2019,2019-09-01T00:00:00Z,3,Wet Mass Movement
Burundi,2019,Burundi: Torrential downpour- 15 provinces- 01/03/2019,2019-03-01T00:00:00Z,2300,Flood
Burundi,2019,"Burundi: Strong winds- Muyinga, Cankuzo, Ngozi, Makamba- 01/07/2019",2019-07-01T00:00:00Z,110,Storm
Burundi,2019,Burundi: Strong winds- 11 provinces- 01/12/2019,2019-12-01T00:00:00Z,320,Storm
Burundi,2019,"Burundi: Torrential downpour- Kirundo, Mwaro, Ngozi, Ruyigi- 01/02/2019",2019-01-01T00:00:00Z,1400,Flood
Burundi,2019,"Burundi: Strong winds-  Ngozi, Kirundo, Mwaro- 01/02/2019",2019-01-01T00:00:00Z,410,Storm
Burundi,2019,Burundi: Landslide- Cibitoke- 01/05/2019,2019-05-01T00:00:00Z,100,Wet Mass Movement
Burundi,2019,"Burundi: Landslides-  Ngozi, Ruyigi- 01/02/2019",2019-01-01T00:00:00Z,10,Wet Mass Movement
Burundi,2019,Burundi: Strong winds- 10 provinces- 01/08/2019,2019-08-01T00:00:00Z,280,Storm
Burundi,2019,"Burundi: Torrential downpour- Muyinga, Kirundo- 01/07/2019",2019-07-01T00:00:00Z,16,Flood
Burundi,2019,Burundi: Torrential downpour- 13 provinces- 01/04/2019,2019-04-01T00:00:00Z,480,Flood
Burundi,2019,Burundi: Strong winds- 9 provinces- 01/06/2019,2019-06-01T00:00:00Z,170,Storm
Burundi,2019,Burundi: Flash floods- 18 provinces- 01/12/2019,2019-12-01T00:00:00Z,7500,Flood
Burundi,2019,Burundi: Strong winds- 13 provinces- 01/10/2019,2019-10-01T00:00:00Z,640,Storm
Burundi,2019,"Burundi: Strong winds- Bubanza, Muramvya, Cankuzo, Karusi, Rutana- 01/01/2019",2019-01-01T00:00:00Z,240,Storm
Burundi,2019,Burundi: Strong winds- 8 provinces- 01/05/2019,2019-05-01T00:00:00Z,230,Storm
Burundi,2019,Burundi: Strong winds- 8 provinces- 01/04/2019,2019-04-01T00:00:00Z,380,Storm
Burundi,2019,Burundi: Mudslide- 4 provinces- 01/12/2019,2019-12-01T00:00:00Z,2700,Wet Mass Movement
Burundi,2019,"Burundi: Torrential downpour- Bubanza, Muramvya, Cibitoke, Kirundo, Muyinga, Cankuzo- 01/06/2019",2019-06-01T00:00:00Z,140,Flood
Burundi,2019,Burundi: Torrential rains- 15 provinces- 01/10/2019,2019-10-01T00:00:00Z,1000,Flood
Burundi,2019,"Burundi: Landslides- Mwaro, Makamba- 01/04/2019",2019-04-01T00:00:00Z,16,Wet Mass Movement
Burundi,2019,"Burundi: Drought- Muyinga, Cankuzo, Makamba, Kirundo, Ngozi- 01/01/2019",2019-01-01T00:00:00Z,1700,Drought
Burundi,2019,Burundi: Strong winds- 9 provinces- 01/11/2019,2019-11-01T00:00:00Z,250,Storm
Burundi,2019,"Burundi: Torrential rains- Mwaro, Gitega, Muyinga, Cibitoke, Ngozi, Muramvya, Ruyigi, Cankuzo, Bujumbura Mairie, Karusi, Bujumbura Rural, Makamba, Rutana- 01/01/2019",2019-01-01T00:00:00Z,1000,Flood
Burundi,2019,Burundi: Strong winds- 14 provinces- 01/09/2019,2019-09-01T00:00:00Z,560,Storm
Burundi,2019,"Burundi: Landslides- Ruyigi, Bujumbura Mairie, Makamba- 01/03/2019",2019-03-01T00:00:00Z,140,Wet Mass Movement
Burundi,2019,Burundi: Flash floods- 17 provinces- 01/11/2019,2019-11-01T00:00:00Z,2400,Flood
Burundi,2019,"Burundi: Torrential downpour- Kirundo, Kayanza, Muramvya, Cibitoke, Muyinga, Ruyigi- 01/05/2019",2019-05-01T00:00:00Z,110,Flood
Burundi,2019,Burundi: Torrential rains- 10 provinces- 01/08/2019,2019-08-01T00:00:00Z,110,Flood
Burundi,2019,Burundi: Flash floods- 16 provinces- 01/09/2019,2019-09-01T00:00:00Z,1300,Flood
Burundi,2020,Burundi: Strong winds- Rumonge- 02/09/2020,2020-09-02T00:00:00Z,98,Storm
Burundi,2020,"Burundi: Flash floods - Bubanza, Muyinga, Rumonge, Ruyigi- 19/04/2020",2020-04-19T00:00:00Z,830,Flood
Burundi,2020,Burundi: Strong winds- Kirundo- 01/10/2020,2020-10-01T00:00:00Z,34,Storm
Burundi,2020,Burundi: Storms and floods - 5 provinces - 22/11/2020,2020-11-22T00:00:00Z,1900,Storm
Burundi,2020,Burundi: Strong winds - 8 provinces- 01/03/2020,2020-03-01T00:00:00Z,280,Storm
Burundi,2020,"Burundi: Flash floods- Rumonge, Muyinga and Bururi- 29/09/2020",2020-09-29T00:00:00Z,460,Flood
Burundi,2020,Burundi: Floods- Bujumbura Rural- 01/05/2020,2020-05-01T00:00:00Z,1400,Flood
Burundi,2020,Burundi: Strong winds - 8 provinces- 01/05/2020,2020-05-01T00:00:00Z,1400,Storm
Burundi,2020,Burundi: Strong winds - Rumonge- 28/04/2020,2020-04-28T00:00:00Z,820,Storm
Burundi,2020,Burundi: Flash floods- Cankuzo- 31/08/2020,2020-08-31T00:00:00Z,130,Flood
Burundi,2020,"Burundi: Flash floods - Rumonge, Bubanza- 17/04/2020",2020-04-17T00:00:00Z,180,Flood
Burundi,2020,Burundi: Flash floods- 18 provinces- 01/03/2020,2020-03-01T00:00:00Z,2200,Flood
Burundi,2020,Burundi: Strong winds- Muyinga- 21/09/2020,2020-09-21T00:00:00Z,250,Storm
Burundi,2020,Burundi: Strong winds - Rumonge- 18/04/2020,2020-04-18T00:00:00Z,500,Storm
Burundi,2020,"Burundi: Flash floods - Rumonge, Bubanza- 29/04/2020",2020-04-29T00:00:00Z,140,Flood
Burundi,2020,Burundi: Flash floods- 17 provinces- 01/01/2020,2020-01-01T00:00:00Z,6300,Flood
Burundi,2020,Burundi: Landslides - 6 provinces- 01/03/2020,2020-03-01T00:00:00Z,220,Wet Mass Movement
Burundi,2020,Burundi: Strong winds - 10 provinces- 01/02/2020,2020-02-01T00:00:00Z,370,Storm
Burundi,2020,Burundi: Landslides - Bubanza- 18/04/2020,2020-04-18T00:00:00Z,12,Wet Mass Movement
Burundi,2020,Burundi: Floods- Bujumbura Rural- 01/02/2020,2020-02-01T00:00:00Z,9700,Flood
Burundi,2020,Burundi: Flash floods- 15 provinces- 01/05/2020,2020-05-01T00:00:00Z,1300,Flood
Burundi,2020,Burundi: Landslides- 5 provinces- 01/01/2020,2020-01-01T00:00:00Z,290,Wet Mass Movement
Burundi,2020,Burundi: Flash floods - 17 provinces- 01/02/2020,2020-02-01T00:00:00Z,2100,Flood
Burundi,2020,Burundi: Flash floods- Ruyigi- 13/10/2020,2020-10-13T00:00:00Z,34,Flood
Burundi,2020,Burundi: Strong winds - 9 provinces- 01/01/2020,2020-01-01T00:00:00Z,790,Storm
Burundi,2020,Burundi: Floods - Bujumbura Rural- 19/04/2020,2020-04-19T00:00:00Z,18000,Flood
Burundi,2020,"Burundi: Strong winds- Bubanza, Rumonge and Cibitoke - 10/10/2020",2020-10-10T00:00:00Z,510,Storm
Burundi,2020,"Burundi: Landslides - Cibitoke, Makamba, Bururi- 01/02/2020",2020-02-01T00:00:00Z,150,Wet Mass Movement
Burundi,2020,"Burundi: Drought- Cankuzo, Kirundo, Makamba, Bujumbura Rural - 01/01/2020",2020-01-01T00:00:00Z,420,Drought
Burundi,2020,Burundi: Landslides- 4 provinces- 01/05/2020,2020-05-01T00:00:00Z,470,Wet Mass Movement
Burundi,2021,Burundi: Strong Winds - Cankuzo - March 2021,2021-03-01T00:00:00Z,39,Storm
Burundi,2021,Burundi: Strong Winds - Muyinga - September 2021,2021-09-01T00:00:00Z,47,Storm
Burundi,2021,Burundi: Floods - Rumonge - March 2021,2021-03-01T00:00:00Z,220,Flood
Burundi,2021,Burundi: Torrential Rains - Gitega - September 2021,2021-09-01T00:00:00Z,55,Storm
Burundi,2021,Burundi: Floods - Bujumbura Mairie - April 2021,2021-04-01T00:00:00Z,560,Flood
Burundi,2021,Burundi: Strong winds - Bujumbura Mairie - January 2021,2021-01-01T00:00:00Z,82,Storm
Burundi,2021,Burundi: Torrential Rains - Cankuzo - September 2021,2021-09-01T00:00:00Z,31,Storm
Burundi,2021,Burundi: Floods - Makamba - May 2021,2021-05-01T00:00:00Z,1100,Flood
Burundi,2021,Burundi: Floods - Bujumbura Rural - January 2021,2021-01-01T00:00:00Z,130,Flood
Burundi,2021,Burundi: Strong Winds - Cibitoke - October 2021,2021-10-01T00:00:00Z,450,Storm
Burundi,2021,Burundi: Torrential Rains - Ruyigi - September 2021,2021-09-01T00:00:00Z,140,Storm
Burundi,2021,Burundi: Strong Winds - Muyinga - November 2021,2021-11-01T00:00:00Z,110,Storm
Burundi,2021,Burundi: Torrential Rains - Rutana - March 2021,2021-03-01T00:00:00Z,48,Storm
Burundi,2021,Burundi: Strong Winds - Rumonge - December 2021,2021-12-01T00:00:00Z,330,Storm
Burundi,2021,Burundi: Torrential Rains - Rumonge - December 2021,2021-12-01T00:00:00Z,82,Storm
Burundi,2021,Burundi: Torrential Rains - Cibitoke - December 2021,2021-12-01T00:00:00Z,56,Storm
Burundi,2021,Burundi: Strong Winds - Cibitoke - December 2021,2021-12-01T00:00:00Z,690,Storm
Burundi,2021,Burundi: Torrential Rains - Bujumbura Rural - January 2021,2021-01-01T00:00:00Z,34,Storm
Burundi,2021,Burundi: Strong Winds - Rutana - April 2021,2021-04-01T00:00:00Z,52,Storm
Burundi,2021,Burundi: Strong Winds - Rutana - January 2021,2021-01-01T00:00:00Z,45,Storm
Burundi,2021,Burundi: Strong Winds - Rutana - October 2021,2021-10-01T00:00:00Z,390,Storm
Burundi,2021,Burundi: Torrential Rains - Muyinga - January 2021,2021-01-01T00:00:00Z,45,Storm
Burundi,2021,Burundi: Torrential Rains - Bubanza - May 2021,2021-05-01T00:00:00Z,61,Storm
Burundi,2021,Burundi: Hailstorms - Ngozi - November 2021,2021-11-01T00:00:00Z,65,Storm
Burundi,2021,Burundi: Floods - Bubanza - May 2021,2021-05-01T00:00:00Z,28,Flood
Burundi,2021,Burundi: Torrential Rains - Ngozi - September 2021,2021-09-01T00:00:00Z,23,Storm
Burundi,2021,Burundi: Torrential Rains - Rutana - October 2021,2021-10-01T00:00:00Z,260,Storm
Burundi,2021,Burundi: Floods - Rumonge - April 2021,2021-04-01T00:00:00Z,2200,Flood
Burundi,2021,Burundi: Torrential Rains - Rutana - December 2021,2021-12-01T00:00:00Z,53,Storm
Burundi,2021,Burundi: Strong Winds - Bujumbura Rural - December 2021,2021-12-01T00:00:00Z,470,Storm
Burundi,2021,Burundi: Floods - Rumonge - April 2021,2021-04-01T00:00:00Z,2500,Flood
Burundi,2021,Burundi: Torrential Rains - Ruyigi - November 2021,2021-11-01T00:00:00Z,80,Storm
Burundi,2021,Burundi: Floods - Makamba - April 2021,2021-04-21T00:00:00Z,760,Flood
Burundi,2021,Burundi: Floods - Bujumbura Rural - April 2021,2021-04-01T00:00:00Z,1600,Flood
Burundi,2021,Burundi: Floods - Bujumbura Rural - May 2021,2021-05-01T00:00:00Z,23000,Flood
Burundi,2021,Burundi: Strong Winds - Rumonge - September 2021,2021-09-01T00:00:00Z,1800,Storm
Burundi,2021,Burundi: Torrential Rains - Kirundo - March 2021,2021-03-01T00:00:00Z,32,Storm
Burundi,2021,Burundi: Strong Winds - Rutana - November 2021,2021-11-01T00:00:00Z,230,Storm
Burundi,2021,Burundi: Strong Winds - Bubanza - April 2021,2021-04-01T00:00:00Z,110,Storm
Burundi,2021,Burundi: Torrential Rains - Rumonge - March 2021,2021-03-01T00:00:00Z,37,Storm
Burundi,2021,Burundi: Torrential Rains - Muyinga - November 2021,2021-11-01T00:00:00Z,43,Storm
Burundi,2021,Burundi: Landslides - Bururi - May 2021,2021-05-01T00:00:00Z,61,Dry mass movement
Burundi,2021,Burundi: Floods - Bujumbura Mairie - December 2021,2021-12-01T00:00:00Z,320,Flood
Burundi,2021,Burundi: Landslides - Bujumbura Rural - April 2021,2021-04-01T00:00:00Z,140,Dry mass movement
Burundi,2021,Burundi: Torrential Rains - Cankuzo - January 2021,2021-01-01T00:00:00Z,31,Storm
Burundi,2021,Burundi: Strong Winds - Muyinga - March 2021,2021-03-01T00:00:00Z,65,Storm
Burundi,2021,Burundi: Strong Winds - Rumonge - October 2021,2021-10-01T00:00:00Z,310,Storm
Burundi,2021,Burundi: Torrential Rains - Ngozi - October 2021,2021-10-01T00:00:00Z,20,Storm
Burundi,2021,Burundi: Strong Winds - Bubanza - November 2021,2021-11-01T00:00:00Z,200,Storm
Burundi,2021,Burundi: Torrential Rains - Rumonge - May 2021,2021-05-01T00:00:00Z,130,Storm
Burundi,2021,Burundi: Torrential Rains - Bujumbura Mairie - February 2021,2021-02-01T00:00:00Z,850,Storm
Burundi,2021,Burundi: Strong Winds - Cibitoke - April 2021,2021-04-01T00:00:00Z,47,Storm
Burundi,2021,Burundi: Torrential Rains - Cankuzo - November 2021,2021-11-01T00:00:00Z,35,Storm
Burundi,2021,Burundi: Strong Winds - Muyinga - October 2021,2021-10-01T00:00:00Z,67,Storm
Burundi,2021,Burundi: Strong Winds - Bujumbura Mairie - March 2021,2021-03-01T00:00:00Z,500,Storm
Burundi,2021,Burundi: Torrential Rains - Muyinga - October 2021,2021-10-01T00:00:00Z,59,Storm
Burundi,2021,Burundi: Strong Winds - Kirundo - March 2021,2021-03-01T00:00:00Z,110,Storm
Burundi,2021,Burundi: Strong Winds - Cibitoke - March 2021,2021-03-01T00:00:00Z,200,Storm
Burundi,2021,Burundi: Strong Winds - Makamba - October 2021,2021-10-01T00:00:00Z,180,Storm
Burundi,2021,Burundi: Torrential Rains - Cibitoke - October 2021,2021-10-01T00:00:00Z,510,Storm
Burundi,2021,Burundi: Torrential Rains - Muyinga - April 2021,2021-04-01T00:00:00Z,23,Storm
Burundi,2021,Burundi: Torrential Rains - Ruyigi - January 2021,2021-01-01T00:00:00Z,41,Storm
Burundi,2021,Burundi: Strong Winds - Bubanza - March 2021,2021-03-01T00:00:00Z,130,Storm
Burundi,2021,Burundi: Torrential Rains - Muyinga - May 2021,2021-05-01T00:00:00Z,34,Storm
Burundi,2021,Burundi: Strong Winds - Bujumbura Rural - March 2021,2021-03-01T00:00:00Z,670,Storm
Burundi,2021,Burundi: Floods - Bujumbura Mairie - November 2021,2021-11-01T00:00:00Z,310,Flood
Burundi,2021,Burundi: Torrential Rains - Ruyigi - February 2021,2021-02-01T00:00:00Z,530,Storm
Burundi,2021,Burundi: Strong Winds - Rutana - February 2021,2021-02-01T00:00:00Z,97,Storm
Burundi,2021,Burundi: Torrential Rains - Rutana - February 2021,2021-02-01T00:00:00Z,46,Storm
Burundi,2021,Burundi: Torrential Rains - Cankuzo - October 2021,2021-10-01T00:00:00Z,160,Storm
Burundi,2021,Burundi: Strong Winds - Kirundo - February 2021,2021-02-01T00:00:00Z,46,Storm
Burundi,2021,Burundi: Torrential Rains - Bubanza - October 2021,2021-10-01T00:00:00Z,100,Storm
Burundi,2021,Burundi: Torrential Rains - Bujumbura Mairie - October 2021,2021-10-01T00:00:00Z,84,Storm
Burundi,2021,Burundi: Strong Winds - Muyinga - May 2021,2021-05-01T00:00:00Z,78,Storm
Burundi,2021,Burundi: Floods - Cibitoke - May 2021,2021-05-01T00:00:00Z,170,Flood
Burundi,2021,Burundi: Strong Winds - Cibitoke - November 2021,2021-11-01T00:00:00Z,280,Storm
Burundi,2021,Burundi: Strong Winds - Makamba - November 2021,2021-11-01T00:00:00Z,77,Storm
Burundi,2021,Burundi: Floods - Bujumbura Rural - May 2021,2021-05-01T00:00:00Z,34000,Flood
Burundi,2021,Burundi: Floods - Rumonge - March 2021,2021-03-01T00:00:00Z,7300,Flood
Burundi,2021,Burundi: Torrential Rains - Bujumbura Mairie - January 2021,2021-01-01T00:00:00Z,1200,Storm
Belgium,2018,Belgium: flood - Hainaut - 22/05/2018,2018-05-22T00:00:00Z,50,Flood
Belgium,2019,Belgium: Landslide - Wallonie (Namur) - 23/11/2019,2019-11-23T00:00:00Z,10,Wet Mass Movement
Belgium,2021,Belgium: Wildfire - Antwerp (Brecht - Wuustwezel) - 23/04/2021,2021-04-23T00:00:00Z,400,Wildfire
Belgium,2021,"Belgium: Floods - Wallonia (Liège, Namur), Flanders (Flemish Brabant) - 14/07/2021",2021-07-14T00:00:00Z,110,Flood
Belgium,2021,"Belgium: Floods - Wallonia (Liège, Namur), Flanders (Flemish Brabant) - 14/07/2021",2021-07-14T00:00:00Z,200,Flood
Belgium,2021,"Belgium: Floods - Wallonia (Liège, Namur), Flanders (Flemish Brabant) - 14/07/2021",2021-07-14T00:00:00Z,12000,Flood
Belgium,2021,"Belgium: Floods - Wallonia (Liège, Namur), Flanders (Flemish Brabant) - 14/07/2021",2021-07-14T00:00:00Z,1800,Flood
Belgium,2021,"Belgium: Floods - Wallonia (Liège, Namur), Flanders (Flemish Brabant) - 14/07/2021",2021-07-14T00:00:00Z,1000,Flood
Belgium,2021,"Belgium: Floods - Wallonia (Liège, Namur), Flanders (Flemish Brabant) - 14/07/2021",2021-07-14T00:00:00Z,600,Flood
Belgium,2021,"Belgium: Floods - Wallonia (Liège, Namur), Flanders (Flemish Brabant) - 14/07/2021",2021-07-14T00:00:00Z,4,Flood
Benin,2008,,2008-07-01T00:00:00Z,150000,Flood
Benin,2009,2009-000127,2009-01-01T00:00:00Z,20000,Flood
Benin,2009,,2009-01-01T00:00:00Z,20000,Flood
Benin,2010,2010-000214,2010-01-01T00:00:00Z,275000,Flood
Benin,2012,,2012-01-01T00:00:00Z,10000,Flood
Benin,2013,Alloya bush fire,2013-01-06T00:00:00Z,3000,Wildfire
Benin,2013,Niger River Floods,2013-09-17T00:00:00Z,10000,Flood
Benin,2013,Ouinhi bush fire,2013-01-31T00:00:00Z,710,Wildfire
Benin,2013,Karimama bush fire,2013-12-19T00:00:00Z,1700,Wildfire
Benin,2016,Alibori department floods,2016-09-01T00:00:00Z,960,Flood
Benin,2017,Benin: Floods - Northern Benin; Melanville; Karimama - 10/09/2017,2017-09-10T00:00:00Z,3500,Flood
Benin,2018,"Benin: Storms - Alibori, Mono, Zou - 24/07/2018",2018-07-24T00:00:00Z,22000,Flood
Benin,2018,Benin: Flood - Borgou - 16/08/2018,2018-08-16T00:00:00Z,94,Flood
Benin,2019,Benin: Floods -  Mono and Couffo departments - 12/10/2019 ,2019-10-12T00:00:00Z,5000,Flood
Benin,2020,Benin: Flood - Kandi (Gogbèdè) - 31/08/2020,2020-08-31T00:00:00Z,20,Flood
Benin,2020,Benin: Flood - Alibori (Malanville) - 01/09/2020,2020-09-01T00:00:00Z,7000,Flood
Benin,2021,Benin: Floods - Rainy season 2021 ,2021-06-01T00:00:00Z,10000,Flood
Burkina Faso,2008,,2008-08-01T00:00:00Z,28000,Flood
Burkina Faso,2009,2009-000172,2009-01-01T00:00:00Z,150000,Flood
Burkina Faso,2010,,2010-01-01T00:00:00Z,20000,Flood
Burkina Faso,2013,Sahel Flood,2013-08-01T00:00:00Z,1800,Flood
Burkina Faso,2015,North-east and central regions floods,2015-07-01T00:00:00Z,3700,Flood
Burkina Faso,2016,Rainy season floods,2016-04-09T00:00:00Z,18000,Flood
Burkina Faso,2017,Burkina Faso: Flash flooding- Oudalan- (31/08/2017),2017-08-31T00:00:00Z,850,Flood
Burkina Faso,2017,"Burkina Faso: Floods- Southwest, East Region (May 2017)",2017-05-01T00:00:00Z,4500,Flood
Burkina Faso,2017,"Burkina Faso: Flash flooding- Soum, Yagha, Namentenga (9/07/2017)",2017-07-09T00:00:00Z,2900,Flood
Burkina Faso,2018,Flood: Burkina Faso - Yatenga - 24/07/2018,2018-07-24T00:00:00Z,560,Flood
Burkina Faso,2018,Burkina Faso: Flood - Bam - 28/08/2018,2018-08-28T00:00:00Z,3000,Flood
Burkina Faso,2018,Burkina Faso: Storm - Sanmatenga - 23/06/2018,2018-06-23T00:00:00Z,390,Storm
Burkina Faso,2018,Burkina Faso: Flood - Yatenga - 24/09/2018,2018-09-24T00:00:00Z,670,Flood
Burkina Faso,2018,Burkina Faso: Flood - 6 provinces - 13/08/2018,2018-08-13T00:00:00Z,550,Flood
Burkina Faso,2020,Burkina Faso: Floods [rainy season] - countrywide - 01/04/2020,2020-04-01T00:00:00Z,20000,Flood
Bangladesh,2008,,2008-08-16T00:00:00Z,1700,Wet Mass Movement
Bangladesh,2008,,2008-08-30T00:00:00Z,57000,Flood
Bangladesh,2008,,2008-07-01T00:00:00Z,2300,Flood
Bangladesh,2009,2009-000123,2009-01-01T00:00:00Z,500000,Flood
Bangladesh,2009,Cyclone 'Aila',2009-01-01T00:00:00Z,842000,Storm
Bangladesh,2010,,2010-01-01T00:00:00Z,500000,Flood
Bangladesh,2010,,2010-01-01T00:00:00Z,12000,Wet Mass Movement
Bangladesh,2010,,2010-01-01T00:00:00Z,12000,Flood
Bangladesh,2010,2010-000211,2010-01-01T00:00:00Z,45000,Storm
Bangladesh,2011,FL-2011-000093-BGD,2011-01-01T00:00:00Z,400000,Flood
Bangladesh,2012,,2012-01-01T00:00:00Z,600000,Flood
Bangladesh,2012,,2012-01-01T00:00:00Z,51000,Storm
Bangladesh,2013,Erosion following floods in Kurigram district,2013-06-01T00:00:00Z,14000,Flood
Bangladesh,2013,"Thakurgaon, Gaibandha, Dinajpur Panchagarh, Nilphamari, Lalmoirhat, Kurigram, Jamalpur and Sirajgonj July Floods",2013-07-01T00:00:00Z,8400,Flood
Bangladesh,2013,Cyclone Mahasen,2013-05-16T00:00:00Z,1100000,Storm
Bangladesh,2013,Brahmanbaria Tornado,2013-03-23T00:00:00Z,37000,Storm
Bangladesh,2014,North-West floods,2014-08-13T00:00:00Z,542000,Flood
Bangladesh,2014,Netrokona thunderstorm,2014-04-27T00:00:00Z,1000,Storm
Bangladesh,2015,Bogra nor'wester,2015-04-05T00:00:00Z,95000,Storm
Bangladesh,2015,Northern districts flash floods,2015-06-17T00:00:00Z,96000,Flood
Bangladesh,2015,Cyclone Komen,2015-07-30T00:00:00Z,331000,Storm
Bangladesh,2015,Sylhet district flash floods,2015-08-18T00:00:00Z,8400,Flood
Bangladesh,2015,Gorkha earthquake - repercussions in Bangladesh,2015-04-25T00:00:00Z,100,Earthquake
Bangladesh,2016,Jessore district floods,2016-08-14T00:00:00Z,34000,Flood
Bangladesh,2016,Monsoon floods,2016-07-25T00:00:00Z,84000,Flood
Bangladesh,2016,Tropical cyclone Roanu,2016-05-17T00:00:00Z,496000,Storm
Bangladesh,2017,Bangladesh : Landslides -  Chittagong  -  22/07/2017,2017-07-22T00:00:00Z,1500,Wet Mass Movement
Bangladesh,2017,Bangladesh; India; Myanmar : Tropical cyclone Mora  - 28/05/2017,2017-05-28T00:00:00Z,478000,Storm
Bangladesh,2017,Bangladesh :  Landslides- TC Mora impact - 12/06/2017,2017-06-12T00:00:00Z,6000,Dry mass movement
Bangladesh,2017,Bangladesh: Monsoon season - Rangpur; Rajshahi; Mymensingh; Sylhet; Chittagong; Dhaka; Khulna - 12/08/2017,2017-07-19T00:00:00Z,436000,Flood
Bangladesh,2017,"Bangladesh : Northeast Floods - Sylhet, Moulvibazar, Sunamganj, Habiganj, Netrokona, Kishoreganj - 28/03/2017",2017-03-28T00:00:00Z,12000,Flood
Bangladesh,2017,Bangladesh: Pabna  and Sunamganj Tornado - 03/04/2017,2017-04-03T00:00:00Z,12000,Storm
Bangladesh,2017,"Bangladesh : Riverbanck erosion - Sirajganj , Shariatpur - 12/04/2017",2017-04-12T00:00:00Z,630,
Bangladesh,2018,Bangladesh: Flood - Dighinala upazila; Khagrachari district - 12/06/2018,2018-06-12T00:00:00Z,6000,Flood
Bangladesh,2018,Bangladesh: Waterlogging - Maheshkhali Upazila; Coxs Bazar district - 03/07/2018,2018-07-03T00:00:00Z,1300,Flood
Bangladesh,2018,Bangladesh: Riverbank erosion - Naria Upazila; Zarija Upazila; Shariatpur district - 06/09/2018,2018-09-06T00:00:00Z,44000,Wet Mass Movement
Bangladesh,2018,Bangladesh: Monsoon riverine floods - Sylhet; Moulvibazar districts - 12/06/2018,2018-06-12T00:00:00Z,12000,Flood
Bangladesh,2018,Bangladesh: Landslide risk - Chittagong district - June 2018,2018-06-01T00:00:00Z,2500,Wet Mass Movement
Bangladesh,2018,Bangladesh: Nor'wester - Barisal; Bhola; Jhalkathi - 17/04/2018,2018-04-17T00:00:00Z,84,Storm
Bangladesh,2018,Bangladesh: Floods - Gaibandha; Bogra; Jamalpur; Tangali districts - September 2018,2018-09-05T00:00:00Z,11000,Flood
Bangladesh,2018,Bangladesh:  Lightning - Rupganj - 15/04/2018,2018-04-15T00:00:00Z,290,Storm
Bangladesh,2018,Bangladesh: Riverbank erosion - Bagerhat district - 18/09/2018,2018-09-18T00:00:00Z,17,Wet Mass Movement
Bangladesh,2018,Bangladesh:  Norwester - Sunamganj -  30/03/2018,2018-03-30T00:00:00Z,170,Storm
Bangladesh,2018,Bangladesh: Flash flood - Feni district - 15/06/2018,2018-06-15T00:00:00Z,180,Flood
Bangladesh,2019,Bangladesh: Nor'wester - Dhaka; Manikganj; Jashore; Chuadanga; Shariatpur; Kushtia - 31/03/2019,2019-03-31T00:00:00Z,1500,Storm
Bangladesh,2019,Bangladesh: Riverline flood -  9 districts - 01/10/2019,2019-10-01T00:00:00Z,240,Flood
Bangladesh,2019,Bangladesh: Riverbed erosion - Munshiganj; Lauhajong Upazila/Thana - 19/06/2019,2019-06-19T00:00:00Z,50,Wet Mass Movement
Bangladesh,2019,Bangladesh: Storms and landslides - Cox's Bazar - 24/05/2019,2019-05-24T00:00:00Z,800,Storm
Bangladesh,2019,Bangladesh: Nor'wester - Dinajpur; Rangpur division - 16/04/2019,2019-04-16T00:00:00Z,8,Storm
Bangladesh,2019,Bangladesh: Riverbank erosion - 01/10/2019,2019-10-01T00:00:00Z,240,Wet Mass Movement
Bangladesh,2019,Bangladesh: Hailstorm - Baghaichhari upazila; Rangamati district - 17/02/2019,2019-02-17T00:00:00Z,63,Storm
Bangladesh,2019,Bangladesh: Nor'wester - Dinajpur district; Parbatipur - 27/06/2019,2019-06-27T00:00:00Z,42,Storm
Bangladesh,2019,Bangladesh: Nor'wester - Joypurhat; Panchbibi - 02/04/2019,2019-04-02T00:00:00Z,2100,Storm
Bangladesh,2019,Bangladesh: Tornado - Bamna; Pathorghata; Barguna Sadar; Barguna - 28/02/2019,2019-02-28T00:00:00Z,630,Storm
Bangladesh,2019,Bangladesh: Riverbed erosion - Lalmonirhat Sadar Upazila - June 2019,2019-06-27T00:00:00Z,200,Wet Mass Movement
Bangladesh,2019,India; Bangladesh: Cyclone Fani - 02/05/2019 ,2019-05-02T00:00:00Z,1666000,Storm
Bangladesh,2019,Bangladesh: Monsoon - Countrywide - June 2019,2019-06-17T00:00:00Z,307000,Flood
Bangladesh,2019,India; Bangladesh: Severe cyclonic storm Bulbul - 05/11/2019,2019-11-05T00:00:00Z,2107000,Storm
Bangladesh,2020,Bangladesh - Riverbank erosion - Chittagong (Brahmanbaria) - 09/06/2020,2020-06-09T00:00:00Z,21,Wet Mass Movement
Bangladesh,2020,"Bangladesh - Riverbank erosion - Dhaka (Tangail), Rangpur (Kurigram, Gaibandha) - 03/06/2020",2020-06-02T00:00:00Z,620,Wet Mass Movement
Bangladesh,2020,Bangladesh: Tornado - Chittagong (Brahmanbaria) - 18/06/2020,2020-06-18T00:00:00Z,50,Storm
Bangladesh,2020,Bangladesh: River erosion - Rangpur (Kurigram) - 01/01/2020,2020-01-01T00:00:00Z,4100,Wet Mass Movement
Bangladesh,2020,Bangladesh: Storm - Chittagong (Brahmanbaria) - 06/06/2020,2020-06-06T00:00:00Z,420,Storm
Bangladesh,2020,Bangladesh: Flood [monsoon] - Countrywide - 26/06/2020,2020-06-26T00:00:00Z,1921000,Flood
Bangladesh,2020,Bangladesh: Tangon river overflowing - Rangpur (Thakurgaon) - 27/09/2020,2020-09-27T00:00:00Z,4200,Flood
Bangladesh,2020,Bangladesh: Landslides - Chittagong (Cox's Bazar) - 17/06/2020,2020-06-17T00:00:00Z,2000,Wet Mass Movement
Bangladesh,2020,Bangladesh: Nor'wester -  Barisal (Bhola) - 27/05/2020,2020-05-27T00:00:00Z,1100,Storm
Bangladesh,2020,"India, Bangladesh, Myanmar, Bhutan: Cyclone Amphan - Countrywide - 11/05/2020",2020-05-16T00:00:00Z,2509000,Storm
Bangladesh,2020,Bangladesh: River erosion - Tangail - April 2020,2020-04-19T00:00:00Z,8,Wet Mass Movement
Bangladesh,2020,Bangladesh: Nor'wester - Rangpur (Lalmonirhat) - 25/05/2020,2020-05-25T00:00:00Z,840,Storm
Bangladesh,2021,Bangladesh: Flood [monsoon] - Mymensingh Division - 01/06/2021,2021-06-01T00:00:00Z,780,Flood
Bangladesh,2021,Bangladesh: Flood [monsoon] - Khulna Division - 01/06/2021,2021-06-01T00:00:00Z,800,Flood
Bangladesh,2021,Bangladesh: Flood - Rangpur Division (4 Districts) - 20/10/2021 ,2021-10-20T00:00:00Z,840,Flood
Bangladesh,2021,Bangladesh: Flood [monsoon] - Dhaka Division - 01/06/2021,2021-06-01T00:00:00Z,810,Flood
Bangladesh,2021,Bangladesh: Flood [monsoon] - Dhaka Division - 01/06/2021,2021-06-01T00:00:00Z,1500,Flood
Bangladesh,2021,Bangladesh: Flood [monsoon] - Dhaka Division - 01/06/2021,2021-06-01T00:00:00Z,180,Flood
Bangladesh,2021,Bangladesh: Flood [monsoon] - Dhaka Division - 01/06/2021,2021-06-01T00:00:00Z,210,Flood
Bangladesh,2021,Bangladesh: Flood [monsoon] - Barisal Division - 01/06/2021,2021-06-01T00:00:00Z,840,Flood
Bangladesh,2021,Bangladesh: Flood [monsoon] - Barisal Division - 01/06/2021,2021-06-01T00:00:00Z,42,Flood
Bangladesh,2021,Bangladesh: Flood [monsoon] - Rangpur Division - 01/06/2021,2021-06-01T00:00:00Z,3200,Flood
Bangladesh,2021,Bangladesh: Flood [monsoon] - Rangpur Division - 01/06/2021,2021-06-01T00:00:00Z,840,Flood
Bangladesh,2021,Bangladesh: Flood [monsoon] - Rangpur Division - 01/06/2021,2021-06-01T00:00:00Z,210,Flood
Bangladesh,2021,Bangladesh: Flood [monsoon] - Dhaka Division - 01/06/2021,2021-06-01T00:00:00Z,34,Flood
Bangladesh,2021,"Bangladesh: Nor'wester - Dhaka (Faridpur), Khulna (Chuadanga) - 27/05/2021",2021-05-27T00:00:00Z,210,Storm
Bangladesh,2021,Bangladesh: Flood [monsoon] - Rangpur Division - 01/06/2021,2021-06-01T00:00:00Z,1700,Flood
Bangladesh,2021,Bangladesh: Flood [monsoon] - Chattogram Division - 01/06/2021,2021-06-01T00:00:00Z,36000,Flood
Bangladesh,2021,Bangladesh: Flood [monsoon] - Chattogram Division - 01/06/2021,2021-06-01T00:00:00Z,25000,Flood
Bangladesh,2021,Bangladesh: Flood [monsoon] - Rajshahi Division - 01/06/2021,2021-06-01T00:00:00Z,420,Flood
Bangladesh,2021,Bangladesh: Flood [monsoon] - Rajshahi Division - 01/06/2021,2021-06-01T00:00:00Z,2100,Flood
Bangladesh,2021,Bangladesh: Flood [monsoon] - Dhaka Division - 01/06/2021,2021-06-01T00:00:00Z,270,Flood
Bangladesh,2021,Bangladesh: Flood [monsoon] - Rajshahi Division - 01/06/2021,2021-06-01T00:00:00Z,110,Flood
Bangladesh,2021,Bangladesh: Flood [monsoon] - Dhaka Division - 01/06/2021,2021-06-01T00:00:00Z,42,Flood
Bangladesh,2021,Bangladesh: Flood [monsoon] - Mymensingh Division - 01/06/2021,2021-06-01T00:00:00Z,2000,Flood
Bangladesh,2021,Bangladesh: Flood [monsoon] - Rajshahi Division - 01/06/2021,2021-06-01T00:00:00Z,1300,Flood
Bangladesh,2021,Bangladesh: Flood [monsoon] - Dhaka Division - 01/06/2021,2021-06-01T00:00:00Z,840,Flood
Bangladesh,2021,Bangladesh: River Erosion - Dhaka Division (Rajbari) - 01/11/2021,2021-11-01T00:00:00Z,13,Wet Mass Movement
Bangladesh,2021,Bangladesh: Flood [monsoon] - Mymensingh Division - 01/06/2021,2021-06-01T00:00:00Z,17,Flood
Bangladesh,2021,Bangladesh: Wet Mass Movement - Rajshahi Division (Nawabgonj/Shibgonj) - 13/11/2021,2021-11-13T00:00:00Z,110,Wet Mass Movement
Bangladesh,2021,Bangladesh: Flood [monsoon] - Mymensingh Division - 01/06/2021,2021-06-01T00:00:00Z,420,Flood
Bangladesh,2021,"India, Bangladesh: Tropical Cyclone Yaas - 23/05/2021",2021-05-23T00:00:00Z,18000,Storm
Bangladesh,2021,Bangladesh: Wet Mass Movement - Rajshahi Division (Sirajganj/Chaulahi) - 21/11/2021,2021-11-21T00:00:00Z,8,Wet Mass Movement
Bulgaria,2012,,2012-01-01T00:00:00Z,2100,Flood
Bulgaria,2014,Floods in West and North-West,2014-07-31T00:00:00Z,800,Flood
Bulgaria,2014,Black Sea coastal areas flash floods,2014-06-19T00:00:00Z,500,Flood
Bulgaria,2014,Yambol flood,2014-12-04T00:00:00Z,1000,Flood
Bulgaria,2015,Dobrich and Varna floods,2015-02-01T00:00:00Z,820,Flood
Bulgaria,2016,Dobrich area floods,2016-10-12T00:00:00Z,24,Flood
Bulgaria,2017,Bulgaria: floods - Burgas - 24/10/2017,2017-10-24T00:00:00Z,22,Flood
Bulgaria,2018,Bulgaria: Floods - Roman - 02/07/2018,2018-07-02T00:00:00Z,50,Flood
Bulgaria,2021,"Bulgaria: Floods - Sofia (Novi Iskar), Pernik (Batanovtsi) - 12/01/2021",2021-01-12T00:00:00Z,25,Flood
Bahamas,2008,TC-2008-000143,2008-07-09T00:00:00Z,500,Storm
Bahamas,2015,Hurricane Joaquin,2015-10-05T00:00:00Z,2800,Storm
Bahamas,2016,Hurricane Matthew,2016-09-28T00:00:00Z,3500,Storm
Bahamas,2017,15 countries - Hurricane Irma - 27/08/2017,2017-08-27T00:00:00Z,1600,Storm
Bahamas,2018,Bahamas: Mud fire - 28/01/2018,2018-01-28T00:00:00Z,150,Wildfire
Bahamas,2018,Bahamas: Mud fire - 05/03/2018,2018-03-04T00:00:00Z,80,Wildfire
Bahamas,2019,"Barbados, Canada, Grenada, Saint Lucia, St Vincent and the Grenadines, Bahamas, United States: Tropical storm / Hurricane Dorian - 26/08/2019 ",2019-08-26T00:00:00Z,9800,Storm
Bosnia and Herzegovina,2014,Tuzla flood,2014-08-01T00:00:00Z,640,Flood
Bosnia and Herzegovina,2014,Balkan floods,2014-05-14T00:00:00Z,90000,Flood
Bosnia and Herzegovina,2015,Sarajevo flood,2015-01-19T00:00:00Z,320,Flood
Bosnia and Herzegovina,2019,Bosnia and Herzegovina: floods -  Zenica-Doboj; Republika Srpska - 14/05/2019,2019-05-14T00:00:00Z,15,Flood
Bosnia and Herzegovina,2019,"Bosnia and Herzegovina: Floods - Zenica, Kiseljak - 06/02/2019",2019-02-06T00:00:00Z,100,Flood
Bosnia and Herzegovina,2019,Bosnia and Herzegovina: Floods - Kralievo - 06/02/2019,2019-06-05T00:00:00Z,160,Flood
Bosnia and Herzegovina,2020,Bosnia and Herzegovina: Floods - North East - 22/06/2020,2020-06-22T00:00:00Z,910,Flood
Bosnia and Herzegovina,2021,"Bosnia and Herzegovina: Floods - Herzegovina-Neretva, Isto?no Sarajevo, Sarajevo, Tuzla Cantons - 05/11/2021",2021-11-05T00:00:00Z,300,Flood
Bosnia and Herzegovina,2021,"Bosnia and Herzegovina: Floods - Herzegovina-Neretva, Isto?no Sarajevo, Sarajevo, Tuzla Cantons - 05/11/2021",2021-11-05T00:00:00Z,14,Flood
Belize,2008,FL-2008-000198-BZE,2008-10-19T00:00:00Z,400,Flood
Belize,2013,Tropical storm Barry causing floods,2013-06-18T00:00:00Z,130,Storm
Belize,2015,Floods in Belize City,2015-10-17T00:00:00Z,250,Flood
Belize,2016,Hurricane Earl,2016-08-02T00:00:00Z,3500,Storm
Belize,2020,"COL, NIC, HON, SLV, GUA, BLZ: Hurricane Iota - 14/11/2020 ",2020-11-14T00:00:00Z,290,Storm
Belize,2020,Belize: Tropical Storm Nana - 01/09/2020,2020-09-01T00:00:00Z,4100,Storm
Belize,2020,12 COUNTRIES: Hurricane Eta - 31/10/2020,2020-10-31T00:00:00Z,1900,Storm
Bermuda,2020,Bermuda: Hurricane Paulette - 14/09/2020,2020-09-14T00:00:00Z,50,Storm
Bolivia,2009,2009-000045,2009-01-01T00:00:00Z,630,Flood
Bolivia,2010,,2010-01-01T00:00:00Z,100000,Flood
Bolivia,2010,,2010-01-01T00:00:00Z,300,Wildfire
Bolivia,2011,,2011-01-01T00:00:00Z,10000,Flood
Bolivia,2011,,2011-01-01T00:00:00Z,1000,Wet Mass Movement
Bolivia,2012,,2012-01-01T00:00:00Z,9000,Flood
Bolivia,2013,Cochamba and Beni departments floods,2013-03-01T00:00:00Z,2700,Flood
Bolivia,2013,La Paz and Potosì departments cold wave and snowfall,2013-08-30T00:00:00Z,2000,Extreme temperature
Bolivia,2014,Beni floods,2014-01-24T00:00:00Z,190000,Flood
Bolivia,2014,Morochata mudslide,2014-02-08T00:00:00Z,31,Wet Mass Movement
Bolivia,2014,Rurrenabaque mudslide,2014-01-25T00:00:00Z,160,Wet Mass Movement
Bolivia,2015,Lanslides north of La Paz,2015-01-12T00:00:00Z,3600,Mass movement
Bolivia,2015,Huanuni landslide,2015-02-15T00:00:00Z,190,Wet Mass Movement
Bolivia,2015,Overflow of Acre river,2015-02-18T00:00:00Z,6300,Flood
Bolivia,2015,Flooding in Santa Cruz,2015-08-01T00:00:00Z,1200,Flood
Bolivia,2016,La Paz landslide,2016-11-04T00:00:00Z,200,Wet Mass Movement
Bolivia,2016,Winter floods,2016-01-01T00:00:00Z,1500,Flood
Bolivia,2016,Central and Northern departments floods,2016-12-05T00:00:00Z,5300,Flood
Bolivia,2017,Bolivia : Cochabamba and Sucre  Floods - 20/04/2017,2017-04-10T00:00:00Z,3000,Flood
Bolivia,2017,Bolivia : Auquisamaña  landslide -  La Paz - 15/02/2017,2017-02-15T00:00:00Z,16,Wet Mass Movement
Bolivia,2018,Bolivia: Floods - Countrywide - 23/02/2018,2018-02-23T00:00:00Z,1300,Flood
Bolivia,2018,Bolivia: Flood - Oronckota - 04/04/2018,2018-03-04T00:00:00Z,62,Flood
Bolivia,2018,Bolivia: Tornado - Mendez Municipality - 29/09/2018,2018-09-29T00:00:00Z,190,Storm
Bolivia,2018,Bolivia : Flood in Chapare River - Cochabamba - 04/01/2018,2018-01-04T00:00:00Z,470,Flood
Bolivia,2018,Bolivia: Floods - Potosí - 09/03/2018,2018-03-09T00:00:00Z,310,Flood
Bolivia,2018,Bolivia: Floods - Tipuani - 17/12/2018,2018-12-18T00:00:00Z,47,Flood
Bolivia,2018,Bolivia : Landslide -Villazón - 05/01/2018,2018-01-05T00:00:00Z,34,Wet Mass Movement
Bolivia,2019,Bolivia: Landslide - Inmaculada Concepción Area -  Bajo Llojeta y Kantutani  (La Paz) - 30/04/2019,2019-04-30T00:00:00Z,780,Wet Mass Movement
Bolivia,2019,Bolivia: Floods - Countrywide  - 01/01/2019,2019-01-01T00:00:00Z,73000,Flood
Bolivia,2019,Bolivia: Landslides - Yolosita (Caranavi) -07/02/2019,2019-02-07T00:00:00Z,1000,Flood
Bolivia,2019,Bolivia: Floods - Beni -20/02/2019,2019-02-20T00:00:00Z,10,Flood
Bolivia,2019,Bolivia: Floods - Santa Cruz - 21/03/2019,2019-03-21T00:00:00Z,830,Flood
Bolivia,2019,Bolivia: Wildfires - Chiquitania region (Santa Cruz) - 23/08/2019,2019-08-21T00:00:00Z,500,Wildfire
Bolivia,2019,Bolivia: Wildfire - Robore - 11/09/2019,2019-09-11T00:00:00Z,220,Wildfire
Bolivia,2020,Bolivia: Floods - Santa Cruz - 19/08/2020 ,2020-08-19T00:00:00Z,30,Flood
Bolivia,2020,Bolivia: Wildfires - Santa Cruz (Gurayos) - 11/10/2020,2020-10-11T00:00:00Z,93,Wildfire
Bolivia,2020,Bolivia: Floods - Santa Cruz (Yapacaní) - 24/08/2020,2020-08-24T00:00:00Z,3,Flood
Bolivia,2020,Bolivia: Floods - Santa Cruz  (Laguna Palma Verde) - 22/06/2020 ,2020-06-22T00:00:00Z,450,Flood
Bolivia,2020,Bolivia: Floods - Countrywide - 02/03/2020,2020-01-01T00:00:00Z,12000,Flood
Bolivia,2020,Bolivia: Flood - Potosi (Cotaigaita) - 06/02/2020,2020-02-06T00:00:00Z,780,Flood
Bolivia,2021,Bolivia: Floods - Santa Cruz (Ichilo) - 06/01/2021,2021-01-06T00:00:00Z,93,Flood
Bolivia,2021,Boilivia: Floods - Cochabamba (Cliza) - 01/12/2021,2021-12-01T00:00:00Z,310,Flood
Bolivia,2021,Bolivia: Floods - Cochabamba (Ivirgarzama and Puerto Villarroel) - 24/04/2021,2021-04-24T00:00:00Z,93,Flood
Bolivia,2021,Bolivia: Floods - Cochabamba (Villa Tunari) - 14/01/2021,2021-01-14T00:00:00Z,310,Flood
Bolivia,2021,Bolivia: Floods - Santa Cruz - 26/12/2021,2021-12-26T00:00:00Z,97,Flood
Brazil,2008,,2008-02-02T00:00:00Z,1400,Flood
Brazil,2008,,2008-06-05T00:00:00Z,25000,Storm
Brazil,2008,FL-2008-000045-BRA,2008-03-30T00:00:00Z,190000,Flood
Brazil,2008,,2008-12-01T00:00:00Z,14000,Flood
Brazil,2008,FL-2008-000234-BRA,2008-11-22T00:00:00Z,79000,Flood
Brazil,2009,2009-000239,2009-01-01T00:00:00Z,20000,Flood
Brazil,2009,2009-000089,2009-01-01T00:00:00Z,500000,Flood
Brazil,2009,,2009-01-01T00:00:00Z,2500,Flood
Brazil,2009,,2009-01-01T00:00:00Z,450,Storm
Brazil,2010,,2010-01-01T00:00:00Z,50000,Flood
Brazil,2010,2010-000062,2010-01-01T00:00:00Z,156000,Flood
Brazil,2010,2010-000245,2010-01-01T00:00:00Z,24000,Flood
Brazil,2011,,2011-01-01T00:00:00Z,15000,Flood
Brazil,2011,Duplicate? 102?,2011-01-01T00:00:00Z,10000,Flood
Brazil,2011,FL-2011-000102-BRA,2011-01-01T00:00:00Z,500,Flood
Brazil,2011,,2011-01-01T00:00:00Z,13000,Flood
Brazil,2011,,2011-01-01T00:00:00Z,100000,Flood
Brazil,2011,,2011-01-01T00:00:00Z,31000,Flood
Brazil,2012,,2012-01-01T00:00:00Z,35000,Wet Mass Movement
Brazil,2013,Rio de Janeiro floods,2013-01-01T00:00:00Z,2100,Flood
Brazil,2013,Minas Gerias floods,2013-12-17T00:00:00Z,12000,Flood
Brazil,2013,Espirito Santo floods,2013-12-17T00:00:00Z,61000,Flood
Brazil,2013,Bahia and Rio de Janeiro floods,2013-12-07T00:00:00Z,6600,Flood
Brazil,2014,Sau Paolo flooding,2014-01-12T00:00:00Z,300,Flood
Brazil,2014,Rio Grande do Sul state floods,2014-01-01T00:00:00Z,4600,Flood
Brazil,2014,Humaità-Am floods caused by Madeira river,2014-04-01T00:00:00Z,19000,Flood
Brazil,2014,Rondônia state floods caused by Madeira river,2014-02-08T00:00:00Z,10000,Flood
Brazil,2014,Espirito Santo and Minas Gerais states flooding,2014-01-09T00:00:00Z,70000,Flood
Brazil,2014,Paranà river overflow,2014-06-07T00:00:00Z,40000,Flood
Brazil,2014,Santa Caterina state floods,2014-01-01T00:00:00Z,6000,Flood
Brazil,2015,Flooding in the Southern Cone,2015-12-01T00:00:00Z,6500,Flood
Brazil,2015,Flooding in Southern Brazil,2015-07-14T00:00:00Z,39000,Flood
Brazil,2015,Overflow of River Acre,2015-02-23T00:00:00Z,13000,Flood
Brazil,2015,Xanxerê tornado,2015-04-20T00:00:00Z,1000,Storm
Brazil,2016,Southern regions floods,2016-01-01T00:00:00Z,14000,Flood
Brazil,2017,Brazil: Floods - Pernambuco and Alagoas - 26/05/2017,2017-05-26T00:00:00Z,60000,Flood
Brazil,2017,"Brazil: Uruguay, Caí and Taquari River floods - Rio Grande do Sul - 25/05/2017",2017-05-25T00:00:00Z,2600,Flood
Brazil,2017,Brazil: Rolante and Dos Sinos Rivers floods - several municipalities in Rio Grande do Sul - 05/01/2017,2017-01-05T00:00:00Z,7900,Flood
Brazil,2018,Brazil: heavy rainfall causing floods - Minas Gerais - 10/02/2018,2018-02-10T00:00:00Z,560,Flood
Brazil,2018,Brazil - Landslides - 2018,2018-01-01T00:00:00Z,640,Wet Mass Movement
Brazil,2018,Brazil - Droughts - 2018,2018-01-01T00:00:00Z,2400,Drought
Brazil,2018,Brazil: flash flood - Sao Paulo State - 20/03/2018,2018-03-20T00:00:00Z,1000,Flood
Brazil,2018,Brazil - Floods - 2018,2018-01-01T00:00:00Z,60000,Flood
Brazil,2018,Brazil - Storms - 2018,2018-01-01T00:00:00Z,21000,Storm
Brazil,2019,Brazil: Landslides - Pernambuco - 11/12/2019 ,2019-12-11T00:00:00Z,780,Wet Mass Movement
Brazil,2019,Brazil: Landslides -  Acre (Marechal Thaumaturgo) -  01/01/2019,2019-01-01T00:00:00Z,140,Flood
Brazil,2019,Brazil: Floods - Amazonas (7 Municipalities) - (01 Jan- 28 Feb),2019-01-01T00:00:00Z,4600,Flood
Brazil,2019,Brazil: Storms - Pará - 23/08/2019,2019-08-23T00:00:00Z,120,Storm
Brazil,2019,Brazil: Floods - Goias (Cezarina) - (01 Jan - 28 Feb),2019-01-01T00:00:00Z,60,Flood
Brazil,2019,"Brazil: Landslides - Santa Catarina (Doutor Pedrinho, Luis Alves) - 1Jan - 30 June",2019-01-01T00:00:00Z,11,Wet Mass Movement
Brazil,2019,Brazil: Landslides - Sergipe (Aracaju) - 1Jan - 30 June,2019-01-01T00:00:00Z,36,Wet Mass Movement
Brazil,2019,Brazil: Floods - Maranhão (48 Municipalities) - (1 Mar - 30 Jun),2019-03-01T00:00:00Z,31000,Flood
Brazil,2019,"Brazil: Floods - Mato Grosso do Sul (Paranaíba, Bela Vista, Caracol, Coronel Sapucaia, Itaporã, Mundo Novo and Porto Murtinho) - 1Jan - 30 June",2019-01-01T00:00:00Z,220,Flood
Brazil,2019,Brazil: Landslide - Amazonas ( São Paulo de Olivença) - - (01 Jan- 28 Feb),2019-01-01T00:00:00Z,80,Dry mass movement
Brazil,2019,Brazil: Storms - Minas Gerais - 03/12/2019 ,2019-12-03T00:00:00Z,100,Storm
Brazil,2019,Brazil: Storms - Rio de Janeiro - 28/10/2019,2019-10-28T00:00:00Z,18000,Storm
Brazil,2019,Brazil: Floods - Amapá (Ferreira Gomes) - 01/01/2019,2019-01-01T00:00:00Z,100,Flood
Brazil,2019,"Brazil: Floods - Pernambuco (Amaraji, Barreiros and Camaragibe) - 1 Jan - 30 June",2019-01-01T00:00:00Z,3900,Flood
Brazil,2019,Brazil: Storm - Amazonas - 01/09/2019,2019-09-01T00:00:00Z,110,Storm
Brazil,2019,Brazil: Floods - Rio Grabde do Norte (Touros) - 1 Jan - 30 June,2019-01-01T00:00:00Z,170,Flood
Brazil,2019,Brazil: Pre-emptive evacuation - Brazil - 01/09/2019,2019-09-01T00:00:00Z,1400,Flood
Brazil,2019,Brazil: Costal Erosion - Espirito Santo - 11/11/2019,2019-11-11T00:00:00Z,2,Wet Mass Movement
Brazil,2019,Brazil: Floods - Pernambuco - 12/12/2019,2019-12-12T00:00:00Z,100,Flood
Brazil,2019,Brazil: Floods - Roraima - 06/08/2019,2019-08-06T00:00:00Z,32,Storm
Brazil,2019,Brazil: Storms - Mato Grosso - 14/10/2019 ,2019-10-14T00:00:00Z,21,Storm
Brazil,2019,Brazil: Storms - Rio de Janeiro - 19/11/2019,2019-11-19T00:00:00Z,380,Storm
Brazil,2019,Brazil: Storms - Maranhão - 04/07/2019,2019-07-04T00:00:00Z,78,Storm
Brazil,2019,Brazil: Storms - Pernambuco - 26/07/2019,2018-07-26T00:00:00Z,570,Storm
Brazil,2019,Brazil: Drought - 06/08/2019,2019-08-06T00:00:00Z,160,Drought
Brazil,2019,Brazil: Floods and Landslides - Espirito Santo - 16/11/2019,2019-11-16T00:00:00Z,1700,Flood
Brazil,2019,Brazil: Floods -  Pernambuco - 22/07/2019,2019-07-22T00:00:00Z,3200,Flood
Brazil,2019,Brazil: Coastal Erosion - Santa Catarina - 26/07/2019,2019-07-26T00:00:00Z,2,Wet Mass Movement
Brazil,2019,"Brazil: Storm - Santa Catarina (Içara,  Meleiro and Pescaria Brava) - 1 Jan - 30 June",2019-01-01T00:00:00Z,20,Storm
Brazil,2019,Brazil: Storm - Rio Grabde do Sul (Gentil and Uruguaiana) - 1 Jan - 30 June,2019-01-01T00:00:00Z,39,Storm
Brazil,2019,Brazil: Floods - Para (63 Municipalities) - 01/01/2019-30/06/2019,2019-01-01T00:00:00Z,43000,Flood
Brazil,2019,Brazil: Storms - Sergipe - 17/07/2019,2019-07-17T00:00:00Z,56,Storm
Brazil,2019,Brazil: Landslides - 26/07/2019,2019-07-26T00:00:00Z,480,Wet Mass Movement
Brazil,2019,Brazil: Cyclone - Santa Catarina - 20/09/2019,2019-09-20T00:00:00Z,3,Storm
Brazil,2019,Brazil: Storms - Santa Catarina - 14/10/2019 ,2019-10-14T00:00:00Z,51,Storm
Brazil,2019,Brazil: Dam collapse - 25/01/2019,2019-01-25T00:00:00Z,700,Flood
Brazil,2019,Brazil: Floods and Landslides - Bahia (Salvador) - 26/11/2019,2019-11-26T00:00:00Z,300,Flood
Brazil,2019,Brazil: Storm - Bahia (Santa Cruz da Vitória) - (1 Jan - 28 Feb),2019-01-01T00:00:00Z,200,Storm
Brazil,2019,Brazil: Floods - Amazonas (37 Municipalities) - (01/03/19 - 30/06/19),2019-03-01T00:00:00Z,43000,Flood
Brazil,2019,Brazil: Floods - Morros (Maranhao) - 21/05/2019,2019-05-21T00:00:00Z,450,Flood
Brazil,2019,Brazil: Floods - Santa Catarina (43 Municipalities) - 1 Jan - 30 June,2019-01-01T00:00:00Z,12000,Flood
Brazil,2019,Brazil: Storm- Parana  (Figueira) - 1 Jan - 30 June,2019-01-01T00:00:00Z,80,Storm
Brazil,2019,Brazil: Floods - Vila Velha (Espirito Santo) - 01/05/2019,2019-05-01T00:00:00Z,480,Flood
Brazil,2019,Brazil: Storms - Rio Grande do Sul - 29/07/2019,2019-07-29T00:00:00Z,2400,Storm
Brazil,2019,Brazil: Storm- Mato Grosso do Sul (Bela Vista) - 1 Jan - 30 June,2019-01-01T00:00:00Z,4,Storm
Brazil,2019,Brazil: Floods -  Acre (Cruzeiro do Sul) - (1Jan - 28 Feb),2019-01-01T00:00:00Z,3500,Flood
Brazil,2019,Brazil: Drought -  Alagoas (Traipu) - (1 Jan - 28 Feb),2019-01-01T00:00:00Z,38,Drought
Brazil,2019,Brazil: Drought - Paraíba (Água Branca) - 1 Jan - 30 June,2019-01-01T00:00:00Z,5400,Drought
Brazil,2019,"Brazil: Floods - Mato Grosso (Aripuanã,  Barra do Bugres, Dom Aquino, Juscimeira, Vila Rica) - 1Jan - 30 June",2019-01-01T00:00:00Z,210,Flood
Brazil,2019,Brazil: Floods - Sergipe - 15/07/2019,2019-07-15T00:00:00Z,78,Flood
Brazil,2019,Brazil: Floods - Parana  (Guaraqueçaba  and Rio Bom) - 1 Jan - 30 June,2019-01-01T00:00:00Z,71,Flood
Brazil,2019,"Brazil: Floods - Piaui (Luzilândia, Juazeiro do Piauí, Luís Correia, Parnaíba  and Teresina) - 1 Jan - 30 June",2019-01-01T00:00:00Z,33000,Flood
Brazil,2019,Brazil: Floods - Pará -27/08/2019,2019-08-27T00:00:00Z,120,Flood
Brazil,2019,Brazil: Floods - Rio Grande do Sul (31 Municipalities) - 1 Jan - 30 June,2019-01-01T00:00:00Z,9700,Flood
Brazil,2019,Brazil: Floods - Sao Paulo (26 Municipalities) - 1 Jan - 30 June,2019-01-01T00:00:00Z,36000,Flood
Brazil,2019,Brazil: Floods (Acre) - 01/09/2019,2019-09-01T00:00:00Z,190,Flood
Brazil,2019,Brazil: Floods - Rondonia (7 Municipalities) - 1 Jan - 30 June,2019-01-01T00:00:00Z,610,Flood
Brazil,2019,Brazil: Floods - Rio de Janeiro - 23/11/2019,2019-11-23T00:00:00Z,220,Flood
Brazil,2019,Brazil: Floods - Espirito Santo - 01/10/2019,2019-10-01T00:00:00Z,1700,Flood
Brazil,2019,Brazil: Landslides - Santa Catarina - 01/07/2019,2019-07-01T00:00:00Z,13,Wet Mass Movement
Brazil,2019,Brazil: Storms - Parana - 23/09/2019,2019-09-23T00:00:00Z,590,Storm
Brazil,2019,Brazil: Floods - Rio de Janeiro (15 Municipalities) - 1 Jan - 30 June,2019-01-01T00:00:00Z,8100,Flood
Brazil,2019,Brazil: Wildfires - Mato Grosso - 11/09/2019,2019-09-11T00:00:00Z,60,Wildfire
Brazil,2019,Brazil: Landslides - Sao Paulo (Rio Grande da Serra) - 1Jan - 30 June,2019-01-01T00:00:00Z,10,Wet Mass Movement
Brazil,2019,Brazil: Storms - Mato Grosso do Sul - 28/12/2019 ,2019-12-28T00:00:00Z,36,Storm
Brazil,2019,Brazil: Storm-  Para  (Curralinho and Xinguara) - 1 Jan - 30 June,2019-01-01T00:00:00Z,19,Storm
Brazil,2019,Brazil: Floods - Rio Grande do Sul - 08/11/2019,2019-11-08T00:00:00Z,170,Flood
Brazil,2019,Brazil: Landslides - Espirito Santo - 14/11/2019,2019-11-14T00:00:00Z,390,Wet Mass Movement
Brazil,2019,Brazil: Storms - Mato Grosso Sul - 13/09/2019,2019-09-13T00:00:00Z,170,Storm
Brazil,2019,Brazil: Wildfires - Moto Grosso do Sul - 13/09/2019,2019-09-13T00:00:00Z,5,Wildfire
Brazil,2019,Brazil: Coastal Erosion - Mato Grosso - 26/11/2019,2019-11-26T00:00:00Z,200,Wet Mass Movement
Brazil,2019,"Brazil: Drought - Piaui (Santana do Piauí, São Raimundo Nonato and Vila Nova do Piauí) - (1 Jan - 30 June)",2019-01-01T00:00:00Z,530,Drought
Brazil,2019,Brazil: Landslides - Espirito Santo - 31/12/2019,2019-12-31T00:00:00Z,6,Wet Mass Movement
Brazil,2019,Brazil: Floods - Bahia (01/07/2019) ,2019-07-12T00:00:00Z,3300,Flood
Brazil,2019,Brazil: Coastal Erosion - Ceará - 01/20/2019,2019-10-01T00:00:00Z,40,Wet Mass Movement
Brazil,2019,Brazil: Landslides - Minas Gerais - 20/12/2019,2019-12-20T00:00:00Z,32,Wet Mass Movement
Brazil,2019,Brazil: Floods - Espirito Santo (5 municipalities) - 13/11/2019,2019-11-13T00:00:00Z,95,Flood
Brazil,2019,"Brazil: Floods -Simões Filho, Lauro de Freitas  (Bahia) - 01/05/2019",2019-05-01T00:00:00Z,1900,Flood
Brazil,2019,Brazil: Flood- Bahia (Vitória da Conquista) - 01/01/2019,2019-01-01T00:00:00Z,200,Flood
Brazil,2019,Brazil: Landslide - Minas Gerais (Monte Belo) - (1 Mar - 30 Jun),2019-03-01T00:00:00Z,8900,Wet Mass Movement
Brazil,2019,Brazil: Floods - Amapá (Vitória do Jari) - (1 Mar - 30 Jun),2019-03-01T00:00:00Z,590,Flood
Brazil,2019,Brazil: Floods - Bahia (12 Municipalities) - (1 Mar - 30 Jun),2019-03-01T00:00:00Z,2900,Flood
Brazil,2019,Brazil: Floods - Espírito Santo (8 Municipalities) - (1 Mar - 30 Jun),2019-03-01T00:00:00Z,590,Flood
Brazil,2019,Brazil: Floods - Minas Gerais -27/10/2019,2019-10-27T00:00:00Z,230,Flood
Brazil,2019,Brazil: Floods - Pará - 29/12/2019,2019-12-29T00:00:00Z,3,Flood
Brazil,2019,Brazil: Floods - Ceará - 01/01/2019,2019-01-01T00:00:00Z,9,Flood
Brazil,2019,"Brazil: Floods - Ceará (Barroquinha, Chaval, Santana do Cariri  and Tianguá) - (1 Mar - 30 Jun)",2019-03-01T00:00:00Z,94,Flood
Brazil,2019,Brazil: Storms - Minas Gerais - 22/08/2019 ,2019-08-22T00:00:00Z,24,Storm
Brazil,2019,Brazil: Floods - Minas Gerais (6 Municipalities) - (1 Mar - 30 Jun),2019-03-01T00:00:00Z,10,Flood
Brazil,2019,Brazil: Drought -  Alagoas (Traipu) - (1 Mar - 30 Jun),2019-03-01T00:00:00Z,32,Drought
Brazil,2019,Brazil: Floods - Pernamburo - 17/06/2019,2019-06-13T00:00:00Z,50,Flood
Brazil,2019,Brazil: Storms - Minas Gerais - 27/10/2019,2019-10-27T00:00:00Z,3400,Storm
Brazil,2019,"Brazil: Storm - Espirito Santo (Santa Leopoldina, São Gabriel da Palha) - (1 Jan - 28 Feb)",2019-01-01T00:00:00Z,10,Storm
Brazil,2019,Brazil: Floods - Minas Gerais (Santos Dumont) -  (01 Jan - 28 Feb),2019-01-01T00:00:00Z,1200,Flood
Brazil,2019,"Brazil: Storm-  Rio de Janeiro  (Bom Jesus do Itabapoana, Cantagalo and Valença) - 1 Jan - 30 June",2019-01-01T00:00:00Z,39,Storm
Brazil,2019,"Brazil: Landslide - Pará ( Alenquer, Óbidos, Parauapebas, Tucuruí) - (1Jan - 30 June) ",2019-01-01T00:00:00Z,70,Wet Mass Movement
Brazil,2020,Brazil: Earthquake - Countrywide - 2020,2020-01-01T00:00:00Z,210,Earthquake
Brazil,2020,Brazil: Storm - Countrywide - 2020,2020-01-01T00:00:00Z,220000,Storm
Brazil,2020,Brazil: Wildfires - Countrywide - 2020,2020-01-01T00:00:00Z,24,Wildfire
Brazil,2020,Brazil: Floods - Countrywide - 2020,2020-01-01T00:00:00Z,133000,Flood
Brazil,2020,Brazil: Wet mass movements - Countrywide - 2020,2020-01-01T00:00:00Z,4200,Wet Mass Movement
Brazil,2020,Brazil: Drought - Countrywide - 2020,2020-01-01T00:00:00Z,83,Drought
Brazil,2021,Brazil: Wet Mass movement - Countrywide - 2021,2021-01-01T00:00:00Z,540,Wet Mass Movement
Brazil,2021,Brazil: Wildfire - Countrywide - 2021,2021-01-01T00:00:00Z,77,Wildfire
Brazil,2021,Brazil: Flood - Countrywide - 2021,2021-01-01T00:00:00Z,181000,Flood
Brazil,2021,Brazil: Extreme Temperature - Countrywide - 2021,2021-01-01T00:00:00Z,1400,Extreme temperature
Brazil,2021,Brazil: Drought - Countrywide - 2021,2021-01-01T00:00:00Z,1200,Drought
Brazil,2021,Brazil: Dry Mass Movement - Countrywide - 2021,2021-01-01T00:00:00Z,35000,Dry mass movement
Brazil,2021,Brazil: Storm - Countrywide - 2021,2021-01-01T00:00:00Z,230000,Storm
Barbados,2016,Hurricane Matthew,2016-09-28T00:00:00Z,90,Storm
Barbados,2019,"Barbados, Canada, Grenada, Saint Lucia, St Vincent and the Grenadines, Bahamas, United States: Tropical storm / Hurricane Dorian - 26/08/2019 ",2019-08-26T00:00:00Z,100,Storm
Barbados,2021,"BRB, DOM, CUB, USA: Hurricane Elsa - 02/07/2021",2021-07-02T00:00:00Z,380,Storm
Brunei Darussalam,2014,Heavy flooding and landslide in Tutong district,2014-01-23T00:00:00Z,51,Flood
Brunei Darussalam,2017,"Brunei :  Brunei Darussalam, Flash flood -Tropical Cyclone KAI-TAK-  21/12/2017",2017-12-19T00:00:00Z,94,Flood
Bhutan,2011,EQ-2011-000136-BTN,2011-01-01T00:00:00Z,20000,Earthquake
Bhutan,2015,Nor'wester in Southern Bhutan,2015-04-04T00:00:00Z,2900,Storm
Bhutan,2016,Sarpang River floods,2016-07-18T00:00:00Z,640,Flood
Bhutan,2016,Bajo town fires,2016-06-17T00:00:00Z,56,Wildfire
Bhutan,2020,"India, Bangladesh, Myanmar, Bhutan: Cyclone Amphan - Countrywide - 11/05/2020",2020-05-16T00:00:00Z,84,Storm
Bhutan,2020,Bhutan: Landslide - Wangdue (Rochu) - 05/10/2020,2020-10-05T00:00:00Z,36,Wet Mass Movement
Botswana,2009,,2009-01-01T00:00:00Z,870,Flood
Botswana,2013,Francistown flood,2013-01-15T00:00:00Z,1200,Flood
Botswana,2014,Northern districts hit by tropical storm,2014-01-01T00:00:00Z,2000,Storm
Botswana,2015,Bobonong storm,2015-11-19T00:00:00Z,250,Storm
Botswana,2017,Botswana; Mozambique; South Africa; Zimbabwe: Tropical Cyclone Dineo - 15/02/2017,2017-02-18T00:00:00Z,2000,Storm
Botswana,2018,Botswana: floods - Central District - 23/02/2018,2018-02-23T00:00:00Z,1600,Flood
Botswana,2020,Botswana: Storm- Kweneng (Thamaga)- 06/11/2020,2020-11-06T00:00:00Z,780,Storm
Central African Republic,2008,,2008-07-01T00:00:00Z,14000,Flood
Central African Republic,2009,,2009-01-01T00:00:00Z,3800,Storm
Central African Republic,2009,,2009-01-01T00:00:00Z,11000,Flood
Central African Republic,2012,,2012-01-01T00:00:00Z,14000,Flood
Central African Republic,2012,,2012-01-01T00:00:00Z,1900,Storm
Central African Republic,2012,,2012-01-01T00:00:00Z,2000,Storm
Central African Republic,2013,"Districts of Issongo, Bea-Rex, Makambo, Sara Banga-2-Gbaya, Dombia, Bibalé, Souma Poto Poto, Fondo Yakite and Sara-Dah in Bangui floods",2013-09-03T00:00:00Z,1900,Flood
Central African Republic,2013,Bozoum's severe local storm,2013-06-08T00:00:00Z,6900,Storm
Central African Republic,2013,Severe Local Storm,2013-11-09T00:00:00Z,1700,Storm
Central African Republic,2013,Severe Local Storm,2013-03-04T00:00:00Z,4000,Storm
Central African Republic,2014,Bangassou flood,2014-10-29T00:00:00Z,400,Flood
Central African Republic,2014,Bangui flood/Oubangui river overflown,2014-10-29T00:00:00Z,100,Flood
Central African Republic,2014,"Floods in Ouham Pende/Bozoum town/ Karibet, Yalet, Zama and Sontet neighbourhoods",2014-10-01T00:00:00Z,450,Flood
Central African Republic,2015,Berberati storm,2015-04-24T00:00:00Z,1100,Storm
Central African Republic,2016,Wildfire in Batangafo's IDP camp,2016-02-10T00:00:00Z,2200,Wildfire
Central African Republic,2016,Gadzi heavy storms,2016-10-21T00:00:00Z,680,Storm
Central African Republic,2016,Boda heavy storms,2016-11-07T00:00:00Z,1400,Storm
Central African Republic,2016,Bangui floods,2016-10-26T00:00:00Z,2300,Flood
Central African Republic,2016,Kaga Bandoro floods,2016-10-02T00:00:00Z,850,Flood
Central African Republic,2017,Central African Republic: Flash floods- Ouaka prefecture (Aug-Sep 2017),2017-08-15T00:00:00Z,1100,Flood
Central African Republic,2017,"Central African Republic: Flash floods, Ombella-M'Poko prefecture (19/08/2017)",2017-08-19T00:00:00Z,1800,Flood
Central African Republic,2018,CAR: Flood - Ouham - 26/08/2018,2018-08-26T00:00:00Z,2000,Flood
Central African Republic,2018,CAR: Flood - Bangui - 03/06/2018,2018-06-03T00:00:00Z,1800,Flood
Central African Republic,2018,CAR: Storm - Mambéré-Kadei - 16/07/2018,2018-07-16T00:00:00Z,400,Storm
Central African Republic,2018,CAR: Storms - Vakaga - 31/08/2018,2018-08-31T00:00:00Z,2900,Storm
Central African Republic,2018,CAR: Flood - Bangui - 23/09/2018,2018-09-23T00:00:00Z,2000,Flood
Central African Republic,2018,CAR: Flood - Ouham-Péndé - 31/08/2018,2018-08-31T00:00:00Z,120,Flood
Central African Republic,2019,CAR: Flood - Bangui - 14/08/2019,2019-08-14T00:00:00Z,40,Flood
Central African Republic,2019,CAR: Wildfire - Lobaye - 09/02/2019,2019-02-09T00:00:00Z,58,Wildfire
Central African Republic,2019,CAR: Storm - Ombella M'Poko - 25/02/2019,2019-02-25T00:00:00Z,80,Storm
Central African Republic,2019,CAR: Flood - Nana Gribizi - 09/05/2019,2019-05-09T00:00:00Z,640,Flood
Central African Republic,2019,CAR: Flood - Ombella-M'Poko - 03/04/2019,2019-04-03T00:00:00Z,180,Flood
Central African Republic,2019,CAR: Flood - Ouham-Pendé - 19/08/2019,2019-08-19T00:00:00Z,800,Flood
Central African Republic,2019,CAR: Flood - Ombella M'Poko - 03/08/2019,2019-08-03T00:00:00Z,40,Flood
Central African Republic,2019,CAR: Flood - 8 prefectures (central) - 23/10/2019,2019-10-23T00:00:00Z,100000,Flood
Central African Republic,2020,CAR: Flood - Bamingui Bangoran (Ngarba-Bord; Am Ndjamena) - 01/08/2020,2020-08-01T00:00:00Z,4400,Flood
Central African Republic,2020,CAR: Flood - Bangui; Ombella M'Poko - 01/10/2020,2020-10-01T00:00:00Z,2600,Flood
Central African Republic,2020,CAR: Flood - Bamingui-Bangoran (Ndélé) - 01/11/2020,2020-11-01T00:00:00Z,8000,Flood
Central African Republic,2020,CAR: Flood - Vakaga (Birao) - 17/05/2020,2020-05-17T00:00:00Z,2,Flood
Central African Republic,2021,CAR: Floods - Ombella-Mpoko - October 2021,2021-10-01T00:00:00Z,3800,Flood
Central African Republic,2021,CAR: Floods - Bangui - October 2021,2021-10-01T00:00:00Z,6100,Flood
Central African Republic,2021,CAR: Floods - Lobaye - August 2021,2021-08-01T00:00:00Z,220,Flood
Central African Republic,2021,CAR: Floods - Vakaga - August 2021,2021-08-01T00:00:00Z,520,Flood
Central African Republic,2021,CAR: Floods - Nana-Grébizi - September 2021,2021-09-01T00:00:00Z,970,Flood
Central African Republic,2021,CAR: Floods - Bangui - September 2021,2021-09-01T00:00:00Z,1900,Flood
Central African Republic,2021,CAR: Floods - Haute-Kotto - August 2021,2021-08-01T00:00:00Z,2500,Flood
Central African Republic,2021,CAR: Floods - Ombella-MPoko - August 2021,2021-08-01T00:00:00Z,870,Flood
Central African Republic,2021,CAR: Floods - Ombella-M'Poko - July 2021,2021-07-01T00:00:00Z,190,Flood
Central African Republic,2021,CAR: Floods - Nana-Mambéré - August 2021,2021-08-01T00:00:00Z,300,Flood
Central African Republic,2021,CAR: Floods - Ombella-MPoko - August 2021,2021-08-01T00:00:00Z,260,Flood
Central African Republic,2021,CAR: Floods - Bangui - July - August 2021,2021-07-01T00:00:00Z,2000,Flood
Central African Republic,2021,CAR: Floods - Vakaga - September 2021,2021-09-01T00:00:00Z,520,Flood
Central African Republic,2021,CAR: Floods - Vakaga - September 2021,2021-09-01T00:00:00Z,2800,Flood
Central African Republic,2021,CAR: Floods - Lobaye - July 2021,2021-07-01T00:00:00Z,250,Flood
Central African Republic,2021,CAR: Floods - Lobaye - July 2021,2021-07-01T00:00:00Z,300,Flood
Canada,2008,,2008-04-26T00:00:00Z,1800,Flood
Canada,2008,,2008-10-04T00:00:00Z,200,Flood
Canada,2013,Alberta floods,2013-06-20T00:00:00Z,120000,Flood
Canada,2013,Alberta and British Columbia wildfires,2013-05-09T00:00:00Z,240,Wildfire
Canada,2014,Albany river overflowing,2014-05-11T00:00:00Z,2000,Flood
Canada,2014,Angus  tornado,2014-06-17T00:00:00Z,300,Storm
Canada,2014,Smith Creek Fire,2014-07-17T00:00:00Z,2500,Wildfire
Canada,2014,Flooding in the Eastern Prairies (Saskatchewan and Manitoba),2014-06-15T00:00:00Z,1000,Flood
Canada,2015,British Columbia wildfires,2015-07-01T00:00:00Z,300,Wildfire
Canada,2015,Saskatchewan forest fires,2015-07-01T00:00:00Z,13000,Wildfire
Canada,2016,Lytton wildfires,2016-08-31T00:00:00Z,28,Wildfire
Canada,2016,Alberta wildfires,2016-05-01T00:00:00Z,88000,Wildfire
Canada,2016,Bear Creek wildfires,2016-08-21T00:00:00Z,390,Wildfire
Canada,2016,Manitoba tornado,2016-07-20T00:00:00Z,200,Storm
Canada,2016,Northern British Columbia wildfires,2016-04-18T00:00:00Z,1400,Wildfire
Canada,2016,British Columbia floods (November),2016-11-09T00:00:00Z,28,Flood
Canada,2016,British Columbia floods (June),2016-06-16T00:00:00Z,60,Flood
Canada,2016,Manitoba wildfires,2016-06-23T00:00:00Z,2100,Wildfire
Canada,2016,Saskatchewan floods,2016-07-13T00:00:00Z,600,Flood
Canada,2017,"Canada: Floods - Mud Lake, Labrador - 17/5/2017",2017-05-17T00:00:00Z,32,Flood
Canada,2017,Canada: Quebec Floods (1st wave - April 2017),2017-04-01T00:00:00Z,1000,Flood
Canada,2017,Canada: Wildfires - British Columbia - 1/7/2017,2017-07-01T00:00:00Z,65000,Wildfire
Canada,2017,"Canada: Forest Fire - Red Sucker Lake First Nation, Manitoba - 25/5/2017",2017-05-25T00:00:00Z,620,Wildfire
Canada,2017,"Canada: Wildfires - Alberta, Saskatchewan - 17/10/2017",2017-10-17T00:00:00Z,2000,Wildfire
Canada,2017,Canada: Forest Fires - Ontario - 1/8/2017,2017-08-01T00:00:00Z,430,Wildfire
Canada,2017,"Canada: Flash Floods - Harriston, Ontario - 23/6/2017",2017-06-23T00:00:00Z,15,Flood
Canada,2017,Canada: British Columbia Floods - 1/5/2017,2017-05-01T00:00:00Z,130,Flood
Canada,2017,Canada: Ontario Floods - 17/4/2017,2017-04-17T00:00:00Z,500,Flood
Canada,2017,Canada: British Columbia Landslides - 1/4/2017,2017-04-01T00:00:00Z,150,Dry mass movement
Canada,2017,Canada: Floods - Manitoba - 20/12/2017,2017-12-14T00:00:00Z,20,Flood
Canada,2017,Canada: Manitoba Floods - 31/3/2017,2017-03-31T00:00:00Z,550,Flood
Canada,2017,Canada: Quebec Floods (2nd wave - May 2017),2017-05-01T00:00:00Z,4100,Flood
Canada,2017,Canada: Wildfires - Saskatchewan - 1/8/2017,2017-08-01T00:00:00Z,2800,Wildfire
Canada,2017,Canada: Central and Eastern Floods - 1/4/2017,2017-04-01T00:00:00Z,1300,Flood
Canada,2017,Canada: Wildfires (Kenow) - Alberta (Waterton Lakes National Park) - 11/9/2017,2017-09-11T00:00:00Z,500,Wildfire
Canada,2017,Canada: Wildfires - Manitoba - 1/8/2017,2017-08-01T00:00:00Z,6300,Wildfire
Canada,2017,"Canada: Forest Fire - Miscou Island, New Brunswick - 29/7/2017",2017-07-29T00:00:00Z,63,Wildfire
Canada,2018,Canada: Mudslide - Lillioet (BC) - 18/6/2018,2018-06-18T00:00:00Z,3,Wet Mass Movement
Canada,2018,Canada: Landslide risk - Old Fort (British Columbia) - 30/9/2018,2018-09-30T00:00:00Z,200,Dry mass movement
Canada,2018,Canada: Forest Fire - Halifax (Nova Scotia) - 10/6/2018,2018-06-10T00:00:00Z,28,Wildfire
Canada,2018,Canada: Flooding -  Regional District of Kootenay Boundary (BC) - 6/5/2018,2018-05-06T00:00:00Z,2000,Flood
Canada,2018,Canada: Flooding - Kashechewan First Nations (Ontario) - 26/4/2018,2018-04-26T00:00:00Z,1700,Flood
Canada,2018,Canada: Landslide Risk - Zeballos (British Columbia) - 7/9/2018,2018-09-07T00:00:00Z,23,Dry mass movement
Canada,2018,Canada: Wildfire (Kenora #71) - Wabaseemoong Independent Nation (Ontario) - 19/7/2018,2018-07-19T00:00:00Z,80,Wildfire
Canada,2018,Canada: Lightning/Fire - New Brunswick - 29/6/2018,2018-06-29T00:00:00Z,9,Storm
Canada,2018,Canada: Wildfire - Manitoba - 24/6/2018,2018-06-24T00:00:00Z,98,Wildfire
Canada,2018,Canada: Mudslide - Trail (BC) - 29/3/2018,2018-03-29T00:00:00Z,1,Wet Mass Movement
Canada,2018,Canada: Flood - Naramata (BC) - 20/3/2018,2018-03-20T00:00:00Z,2,Flood
Canada,2018,Canada: Floods - Brantford (Ontario) - 21/2/2018,2018-02-21T00:00:00Z,4900,Flood
Canada,2018,Canada: Floods - Chatham-Kent (Ontario) - 23/2/2018,2018-02-23T00:00:00Z,630,Flood
Canada,2018,Canada: Flooding - New Brunswick - 28/4/2018,2018-04-23T00:00:00Z,1200,Flood
Canada,2018,Canada: Flooding - Cariboo region (BC) - 29/4/2018,2018-04-29T00:00:00Z,50,Flood
Canada,2018,Canada: Mudslide - Campbell River (British Columbia) - 21/1/2018,2018-01-21T00:00:00Z,10,Dry mass movement
Canada,2018,Canada: Wildfire (Parry Sound 33) - Parry Sound (Ontario) - 20/7/2018,2018-07-18T00:00:00Z,190,Wildfire
Canada,2018,Canada: Tornado - Ottawa (Ontario) - 21/9/2018,2018-09-21T00:00:00Z,450,Storm
Canada,2018,Canada: Lightning/Fire - Temagami (Ontario) - 8/7/2018,2018-07-08T00:00:00Z,50,Wildfire
Canada,2018,Canada: Wildfires - Manitoba - 21/5/2018,2018-05-21T00:00:00Z,2300,Wildfire
Canada,2018,Canada: Wildfire - Saskatchewan - 12/5/2018,2018-05-12T00:00:00Z,940,Wildfire
Canada,2018,Canada: Flooding - Alberta - 23/4/2018,2018-04-23T00:00:00Z,340,Flood
Canada,2018,Canada: Flooding - Regional District of Okanagan-Similkameen (BC) - 20/4/2018,2018-04-20T00:00:00Z,860,Flood
Canada,2018,Canada: Extreme Cold - New Brunswick - 6/1/2018,2018-01-06T00:00:00Z,130,Extreme temperature
Canada,2018,Canada: Mudslide - Bonaparte Band (British Columbia) - 11/8/2018,2018-08-11T00:00:00Z,24,Wet Mass Movement
Canada,2018,Canada: Wildfire - British Columbia - 1/7/2018 (Wildfire Season 2018),2018-05-01T00:00:00Z,35,Wildfire
Canada,2018,Canada: Tornado - Gatineau (Quebec) - 21/9/2018,2018-09-21T00:00:00Z,1700,Storm
Canada,2018,Canada: Wildfire (Woods) - Saskatchewan - 19/6/2018,2018-06-19T00:00:00Z,890,Wildfire
Canada,2019,Canada: Flood (Marten River) - Marten Beach (Alberta) - 25/7/2019,2019-07-25T00:00:00Z,10,Flood
Canada,2019,"Canada: Ice jam - Bolton, Caledon (Ontario) - 15/03/2019",2019-03-15T00:00:00Z,250,Flood
Canada,2019,Canada: Flood - Manitoba (Sioux Valley Dakota Nation) - 24/3/2019,2019-03-24T00:00:00Z,6,Flood
Canada,2019,Canada: Wildfire (Multiple) - Northern Alberta - 20/5/2019,2019-05-20T00:00:00Z,11000,Wildfire
Canada,2019,Canada: Flooding (Red River) - Manitoba - 22/4/2019,2019-04-22T00:00:00Z,18,Flood
Canada,2019,Canada: Flood - Ottawa (Ontario) - 27/4/2019,2019-04-27T00:00:00Z,420,Flood
Canada,2019,Canada: Sinkhole - Sechelt (BC) - 12/02/2019,2019-02-05T00:00:00Z,35,Dry mass movement
Canada,2019,Canada: Wildfire - Manitoba (Pauingassi First Nations) - 7/7/2019,2019-07-07T00:00:00Z,110,Wildfire
Canada,2019,Canada: Storm/Lightning - Tillsonburg (Ontario) - 18/8/2019,2019-08-18T00:00:00Z,150,Storm
Canada,2019,Canada: Storm - Quebec (Sherbrooke) - 1/11/2019,2019-11-01T00:00:00Z,630,Storm
Canada,2019,Canada: Wildfire - Ontario (Grassy Narrows First Nation) - 5/7/2019,2019-07-05T00:00:00Z,60,Wildfire
Canada,2019,"Canada: Wildfire (Lejac) - Fraser Lake, Lejac (British Columbia) - 20/5/2019",2019-05-11T00:00:00Z,30,Wildfire
Canada,2019,Canada: Wildfire - Alberta (Loon River Cree) - 1/6/2019,2019-06-01T00:00:00Z,20,Wildfire
Canada,2019,Canada: Wildfire - Alberta (Dene Tha') - 17/6/2019,2019-06-17T00:00:00Z,570,Wildfire
Canada,2019,Canada: Wildfire - Marlboro (Alberta) - 19/5/2019,2019-05-19T00:00:00Z,87,Wildfire
Canada,2019,Canada: Flooding - Alberta (Samson) - 6/7/2019,2019-07-06T00:00:00Z,90,Flood
Canada,2019,Canada: Flood (Mattawa River) - Mattawa (Ontario) - 6/5/2019,2019-05-06T00:00:00Z,24,Flood
Canada,2019,Canada: Wildfire - Manitoba (Little Grand Rapids First Nations) - 2/7/2019,2019-07-02T00:00:00Z,120,Wildfire
Canada,2019,Canada: Wildfire - Alberta (Beaver First Nation) - 18/6/2019,2019-06-18T00:00:00Z,410,Wildfire
Canada,2019,Canada: Flooding - Quebec - 20/4/2019,2019-04-20T00:00:00Z,11000,Flood
Canada,2019,Canada: Flood - Quebec (Mohawks of Kanesatake) - 17/4/2019,2019-04-17T00:00:00Z,8,Flood
Canada,2019,Canada: Storm - New Brunswick; Nova Scotia - 9/12/2019,2019-12-09T00:00:00Z,330,Storm
Canada,2019,Canada: Wildfire - Pikangikum First Nations (Ontario) - 29/5/2019,2019-05-29T00:00:00Z,2900,Wildfire
Canada,2019,Canada: Wildfire - Marcel Colomb First Nations (Manitoba) - 24/7/2019,2019-07-24T00:00:00Z,140,Wildfire
Canada,2019,Canada: Storm/Lightning - Calgary (Alberta) - 2/9/2019,2019-09-02T00:00:00Z,3,Storm
Canada,2019,Canada: Wildfire - Alberta (Peerless Trout First Nation) - 18/6/2019,2019-06-18T00:00:00Z,460,Wildfire
Canada,2019,Canada: Wildfire (Red Lake 23) - Ontario (Keewaywin First Nations) - 30/6/2019,2019-06-30T00:00:00Z,440,Wildfire
Canada,2019,Canada: Wildfire - Ontario (Mattagami) - 9/6/2019,2019-06-09T00:00:00Z,70,Wildfire
Canada,2019,Canada: Flooding - Kashechewan First Nations (Ontario) - 11/4/2019,2019-04-11T00:00:00Z,1800,Flood
Canada,2019,Canada: Flood (Ottawa River) - Renfrew County (Ontario) - 29/4/2019,2019-04-29T00:00:00Z,150,Flood
Canada,2019,Canada: Snowstorm - Manitoba - October 2019 ,2019-10-01T00:00:00Z,6000,Extreme temperature
Canada,2019,Canada: Flood - Ontario (Bearskin Lake First Nation) - 9/11/2019,2019-11-09T00:00:00Z,360,Flood
Canada,2019,"Barbados, Canada, Grenada, Saint Lucia, St Vincent and the Grenadines, Bahamas, United States: Tropical storm / Hurricane Dorian - 26/08/2019 ",2019-08-26T00:00:00Z,210,Storm
Canada,2019,Canada: Wildfire (North Crooked Creek) - Ethel Lake (Yukon) - 10/9/2019,2019-09-10T00:00:00Z,18,Wildfire
Canada,2019,Canada: Flash Flooding - Sussex (New Brunswick) - 24/1/2019,2019-01-24T00:00:00Z,40,Flood
Canada,2019,Canada: Wildfire (RED39) - Pikangikum First Nations (Ontario) - 4/7/2019,2019-07-05T00:00:00Z,2100,Wildfire
Canada,2019,Canada: Flooding - New Brunswick - 20/4/2019,2019-04-20T00:00:00Z,1100,Flood
Canada,2019,Canada: Flood - Ontario (Mohawks of the Bay of Quinte) - 21/5/2019,2019-05-21T00:00:00Z,2,Flood
Canada,2020,Canada: Landslide - British Columbia (Bonaparte Indian Band) - 23/04/2020,2020-04-23T00:00:00Z,3,Flood
Canada,2020,Canada: Flood Risk - Northwest Territories (K'atlodeeche First Nation) - 04/05/2020,2020-05-04T00:00:00Z,20,Flood
Canada,2020,Canada: Flood - British Columbia (Upper Nicola) - 22/05/2020,2020-05-22T00:00:00Z,25,Flood
Canada,2020,Canada: Flooding - Alberta (Chipewyan Prairie First Nation) - 08/06/2020,2020-06-08T00:00:00Z,7,Flood
Canada,2020,Canada: Flooding - British Columbia (Little Shuswap Lake) - 03/06/2020,2020-06-03T00:00:00Z,3,Flood
Canada,2020,Canada: Flood - Quebec (Gaspé Region) - 30/11/2020,2020-11-30T00:00:00Z,16,Flood
Canada,2020,Canada: Flooding - Saskatchewan (Waterhen Lake) - 18/06/2020,2020-06-18T00:00:00Z,11,Flood
Canada,2020,Canada: Flooding - British Columbia (Snuneymuxw First Nation) - 01/02/2020,2020-02-01T00:00:00Z,20,Flood
Canada,2020,Canada: Flooding - British Columbia (Ditidaht) - 01/02/2020,2020-02-01T00:00:00Z,59,Flood
Canada,2020,Canada: Flooding - Alberta (Whitefish Lake) - 08/06/2020,2020-06-08T00:00:00Z,24,Flood
Canada,2020,Canada: Wildfire - Nova Scotia (Porters Lake) - 23/05/2020,2020-05-23T00:00:00Z,170,Wildfire
Canada,2020,Canada: Flooding - Quebec (Quebec City Region) - 24/12/2020,2020-12-24T00:00:00Z,270,Flood
Canada,2020,Canada: Flood Risk - Northwest Territories (Hay River) - 04/05/2020,2020-05-04T00:00:00Z,360,Flood
Canada,2020,Canada: Flood - Manitoba - 30/06/2020,2020-06-30T00:00:00Z,190,Flood
Canada,2020,Canada: Wildfire - Manitoba (Camperville and Pine Creek First Nations) - 17/05/2020,2020-05-17T00:00:00Z,150,Wildfire
Canada,2020,Canada: Wildfire - Manitoba (Beaver Creek Provincial Park) - 01/06/2020,2020-06-01T00:00:00Z,15,Wildfire
Canada,2020,Canada: Flood - British Columbia (Wuikinuxv Nation) - 26/10/2020,2020-10-26T00:00:00Z,30,Flood
Canada,2020,Canada: Wildfire (Magee Road) - British Columbia (Squamish Valley) - 15/04/2020,2020-04-15T00:00:00Z,120,Wildfire
Canada,2020,Canada: Wildfire - British Columbia (Squamish First Nation) - 17/04/2020,2020-04-17T00:00:00Z,9,Wildfire
Canada,2020,Canada: Wildfire (Nipigon 45) - Ontario (Eabametoong First Nation) - 09/08/2020,2020-08-09T00:00:00Z,510,Wildfire
Canada,2020,Canada: Flooding - British Columbia (Spuzzum) - 01/02/2020,2020-02-01T00:00:00Z,5,Flood
Canada,2020,Canada: Wildfire (Christie Mountain) - British Columbia (Regional District of Okanagan-Similkameen) - 18/08/2020,2020-08-18T00:00:00Z,800,Wildfire
Canada,2020,Canada: Wildfire (Doctor Creek) - British Columbia (Regional District of East Kootenay) - 19/08/2020,2020-08-19T00:00:00Z,25,Wildfire
Canada,2020,Canada: Wildfire (Red Lake 49) - Ontario (Red Lake) - 10/08/2020,2020-08-10T00:00:00Z,3800,Wildfire
Canada,2020,Canada: Flood - Alberta (Sucker Creek) - 21/04/2020,2020-04-21T00:00:00Z,8,Flood
Canada,2020,Canada: Flood - Alberta (Kehewin Cree Nation) - 21/04/2020,2020-04-21T00:00:00Z,4,Flood
Canada,2020,Canada: Flood - Alberta (Duncan's First Nation) - 21/04/2020,2020-04-21T00:00:00Z,1,Flood
Canada,2020,"Canada: Flooding - British Columbia (Kent, Fraser Valley) - 31/1/2020",2020-01-31T00:00:00Z,100,Flood
Canada,2020,Canada: Wildfire - Saskatchewan (James Smith Cree Nation) - 08/05/2020,2020-05-08T00:00:00Z,39,Wildfire
Canada,2020,Canada: Extreme weather / Storm - Manitoba (Long Plain) - 18/06/2020,2020-06-18T00:00:00Z,8,Storm
Canada,2020,Canada: Flooding - British Columbia (Cowichan Valley Regional District) - 30/1/2020,2020-01-30T00:00:00Z,300,Flood
Canada,2020,Canada: Flooding - British Columbia (Sunshine Coast Regional District) - 31/1/2020,2020-01-31T00:00:00Z,3,Flood
Canada,2020,Canada: Storm - Nunavut (Sanirajak) - 06/10/2020,2020-10-06T00:00:00Z,100,Storm
Canada,2020,Canada: Flooding - British Columbia (Nanaimo Regional District) - 30/1/2020,2020-01-30T00:00:00Z,9,Flood
Canada,2020,"Canada: Flood - British Columbia (Fairmont Creek, Regional District of East Kootenay) - 31/05/2020",2020-05-31T00:00:00Z,60,Flood
Canada,2020,Canada: Storm - New Brunswick (Fredericton) - 05/06/2020,2020-06-05T00:00:00Z,10,Storm
Canada,2020,"Canada: Flooding - British Columbia (Hope and Yale, Fraser Valley Regional District) - 4/2/2020",2020-02-04T00:00:00Z,68,Flood
Canada,2020,Canada: Landslide - British Columbia (Burnaby) - 23/1/2020,2020-01-23T00:00:00Z,15,Wet Mass Movement
Canada,2020,Canada: Landslide - British Columbia (Vernon) - 1/2/2020,2020-02-01T00:00:00Z,15,Wet Mass Movement
Canada,2020,Canada: Flood - British Columbia (Regional District of Central Kootenay) - 30/05/2020,2020-05-30T00:00:00Z,1300,Flood
Canada,2020,Canada: Flooding - Manitoba (Montcalm) - 11/04/2020,2020-04-11T00:00:00Z,20,Flood
Canada,2020,Canada: Flooding - British Columbia (Chilako River region) - 23/04/2020,2020-04-23T00:00:00Z,100,Flood
Canada,2020,Canada: Flooding - British Columbia (Cache Creek) - 22/04/2020,2020-04-22T00:00:00Z,25,Flood
Canada,2020,Canada: Flood - British Columbia (Regional District of Kootenay Boundary) - 31/05/2020,2020-05-31T00:00:00Z,470,Flood
Canada,2020,Canada: Reparation of Dike to reduce risk of flooding - Ontario (Chatham-Kent) - 02/03/2020,2020-03-02T00:00:00Z,110,Flood
Canada,2020,Canada: Landslide - British Columbia (Cariboo Regional District) - 24/04/2020,2020-04-17T00:00:00Z,15,Flood
Canada,2020,"Canada: Flood - British Columbia (Grand Forks, Regional District of Kootenay Boundary) - 19/05/2020",2020-05-19T00:00:00Z,10,Flood
Canada,2020,Canada: Flood - Manitoba (Stuartburn) - 06/06/2020,2020-06-06T00:00:00Z,200,Flood
Canada,2020,Canada: Flood - Alberta (Thorhild and Lac La Biche counties) - 06/06/2020,2020-06-06T00:00:00Z,70,Flood
Canada,2020,Canada: Flood - British Columbia (Cariboo Regional District) - 08/05/2020,2020-05-08T00:00:00Z,3,Flood
Canada,2020,Canada: Flooding - British Columbia (Kelowna) - 07/05/2020,2020-05-07T00:00:00Z,8,Flood
Canada,2020,Canada: Flood - Ontario (Toronto) - 11/1/2020,2020-01-11T00:00:00Z,8,Flood
Canada,2020,Canada: Flooding - Ontario (Kashechewan First Nations) - 01/05/2020,2020-05-01T00:00:00Z,920,Flood
Canada,2020,Canada: Landslide - British Columbia (Old Fort) - 18/06/2020,2020-06-18T00:00:00Z,57,Dry mass movement
Canada,2020,Canada: Extreme Temp - Alberta (Enoch Cree Nation #440) - 23/01/2020,2020-01-23T00:00:00Z,500,Extreme temperature
Canada,2020,Canada: Ice Jam Flood - Alberta (Regional Municipality of Wood Buffalo) - 25/04/2020,2020-04-25T00:00:00Z,13000,Flood
Canada,2020,Canada: Ice Jam Flood - Alberta (Mackenzie County) - 28/04/2020,2020-04-28T00:00:00Z,1300,Flood
Canada,2020,Canada: Grass Fire - British Columbia (Penticton) - 06/08/2020,2020-08-06T00:00:00Z,200,Wildfire
Canada,2020,Canada: Lanslide Risk - British Columbia (Penticton) - 09/08/2020,2020-08-09T00:00:00Z,5,Wildfire
Canada,2020,Canada: Landslide - British Columbia (Regional District of Fraser-Fort George) - 04/07/2020,2020-07-04T00:00:00Z,23,Wet Mass Movement
Canada,2020,Canada: Flood - British Columbia (Regional District of Thompson-Nicola) - 05/07/2020,2020-07-05T00:00:00Z,30,Wet Mass Movement
Canada,2020,Canada: Avalanche - Newfoundland (St. Johns) - 17/1/2020,2020-01-17T00:00:00Z,7,Wet Mass Movement
Canada,2020,Canada: Landslide - British Columbia (Cariboo Regional District) - 13/05/2020,2020-05-13T00:00:00Z,3,Wet Mass Movement
Canada,2020,Canada: Landslide risk - British Columbia (Columbia Shuswap Regional District) - 22/06/2020,2020-06-22T00:00:00Z,5,Wet Mass Movement
Canada,2020,Canada: Landslide - British Columbia (Quesnel) - 23/04/2020,2020-04-23T00:00:00Z,3,Wet Mass Movement
Canada,2021,Canada: Wildfire - Alberta (Parkland County) - 07/05/2021,2021-05-06T00:00:00Z,180,Wildfire
Canada,2021,Canada: Wildfire - Manitoba (Carberry) - 01/04/2021,2021-04-01T00:00:00Z,50,Wildfire
Canada,2021,Canada: Wildfire - Alberta (Blood Tribe First Nation) - 28/03/2021,2021-03-28T00:00:00Z,60,Wildfire
Canada,2021,"Canada: Wildfire - Alberta (Carmangay, Vulcan County) - 28/03/2021",2021-03-28T00:00:00Z,280,Wildfire
Canada,2021,Canada: Wildfire (Cloverdale Fire) - Saskatchewan (Prince Albert) - 17/05/2021,2021-05-17T00:00:00Z,190,Wildfire
Canada,2021,Canada: Grass fire - Alberta (Cochrane) - 01/04/2021,2021-04-01T00:00:00Z,5,Wildfire
Canada,2021,Canada: Wildfires - Manitoba - 2021,2021-06-01T00:00:00Z,4000,Wildfire
Canada,2021,Canada: Wildfires - Ontario - 08/06/2021,2021-06-08T00:00:00Z,3400,Wildfire
Canada,2021,Canada: Riverine Floods - Quebec (St-Felix-de-Valois) - 27/03/2021,2021-03-27T00:00:00Z,55,Flood
Canada,2021,Canada: Tornado - Quebec (Mascouche) - 21/06/2021,2021-06-21T00:00:00Z,11,Storm
Canada,2021,Canada: Tornado - Ontario (Barrie) - 15/07/2021,2021-07-15T00:00:00Z,100,Storm
Canada,2021,Canada: Flooding - Northwest Territories (Aklavik) - 30/05/2021,2021-05-30T00:00:00Z,170,Flood
Canada,2021,Canada: Flooding - British Columbia (Cowichan Tribes First Nation) - January 2021,2021-01-02T00:00:00Z,50,Flood
Canada,2021,Canada: Wildfire (Bell Fire) - Saskatchewan (Shoal Lake) - 14/07/2021,2021-07-14T00:00:00Z,1200,Wildfire
Canada,2021,"CAN, USA: Flooding - (CAN) British Columbia, USA (Washington) - 10/11/2021	",2021-11-10T00:00:00Z,18000,Flood
Canada,2021,Canada: Flooding - British Columbia (Regional District of Nanaimo) - 02/01/2021,2021-01-02T00:00:00Z,14,Flood
Canada,2021,"Canada: Flooding - Northwest Territories (Fort Simpson, Jean Marie River) - 08/05/2021",2021-05-08T00:00:00Z,170,Flood
Canada,2021,"Canada: Wildfires - British Columbia - 30/06/2021	",2021-06-30T00:00:00Z,32000,Wildfire
Switzerland,2013,Merine river flood,2013-06-09T00:00:00Z,13,Flood
Switzerland,2015,Western Switzerland floods,2015-05-03T00:00:00Z,360,Flood
Switzerland,2017,Switzerland: Landslide - Bondo- 23/08/2017,2017-08-22T00:00:00Z,160,Wet Mass Movement
Switzerland,2018,Switzerland: floods - Yverdon -31/05/2018,2018-05-31T00:00:00Z,4,Flood
Switzerland,2018,Switzerland: (risk) snow avalanche - Mayens de Conthey - 03/01/2018,2018-01-03T00:00:00Z,14,Wet Mass Movement
Switzerland,2019,Switzerland: flash floods - Val-de-Ruz - 21/06/2019,2019-06-21T00:00:00Z,10,Flood
Switzerland,2020,"France, Italy, Switzerland: Storm Alex - Countrywide - 02/10/2020 ",2020-10-02T00:00:00Z,13,Storm
Switzerland,2021,Switzerland: Flood - Neuchâtel (Cressier) - 22/06/2021,2021-06-22T00:00:00Z,35,Flood
Switzerland,2021,"Switzerland: Avalanches and Landslides - Valais (Rarogne, Orsières), Vaud (Les Diablerets) - 29/01/2021",2021-01-29T00:00:00Z,110,Wet Mass Movement
Chile,2008,VO-2008-000056-CHL,2008-02-05T00:00:00Z,8000,Volcanic eruption
Chile,2008,,2008-08-29T00:00:00Z,23000,Flood
Chile,2008,,2008-05-19T00:00:00Z,12000,Flood
Chile,2009,FL-2009-000165-CHL,2009-08-27T00:00:00Z,700,Flood
Chile,2010,2010-000076,2010-01-01T00:00:00Z,2000000,Earthquake
Chile,2011,Volcano 'Puyehue',2011-01-01T00:00:00Z,4000,Volcanic eruption
Chile,2012,,2012-01-01T00:00:00Z,7000,Earthquake
Chile,2012,,2012-01-01T00:00:00Z,300,Flood
Chile,2013,Copahue volcano,2013-05-26T00:00:00Z,2400,Volcanic eruption
Chile,2013,Valparaiso Wildfire,2013-04-24T00:00:00Z,1000,Wildfire
Chile,2013,Biobio forest fire,2013-12-21T00:00:00Z,200,Wildfire
Chile,2014,Iquique earthquake-tsunami,2014-04-01T00:00:00Z,972000,Earthquake
Chile,2014,El Carrizo Fire,2014-01-05T00:00:00Z,15,Wildfire
Chile,2014,"Fundo Los Perales, camino La Pólvora fire (aka Valparaiso fire)",2014-04-12T00:00:00Z,12000,Wildfire
Chile,2014,San Roque fire,2014-01-01T00:00:00Z,300,Wildfire
Chile,2014,La Gruta fire,2014-02-05T00:00:00Z,30,Wildfire
Chile,2015,Floods on the coast,2015-07-01T00:00:00Z,1100,Flood
Chile,2015,Mt Calbuco eruption,2015-04-22T00:00:00Z,6600,Volcanic eruption
Chile,2015,Mt Villarrica eruption,2015-03-03T00:00:00Z,3400,Volcanic eruption
Chile,2015,Illapel earthquake and tsunami,2015-09-16T00:00:00Z,1000000,Earthquake
Chile,2015,Valparaiso and Vina del Mar wildfire,2015-03-15T00:00:00Z,6000,Wildfire
Chile,2015,Northern region floods and mudslides,2015-03-25T00:00:00Z,30000,Wet Mass Movement
Chile,2016,Country-wide floods,2016-04-15T00:00:00Z,420,Flood
Chile,2016,Southern Chile earthquake,2016-12-25T00:00:00Z,15000,Earthquake
Chile,2016,Valparaiso forest fire,2016-11-01T00:00:00Z,620,Wildfire
Chile,2017,"Chile: Floods- Antofagasta, Atacama (07/06/2017)",2017-06-07T00:00:00Z,270,Flood
Chile,2017,"Chile: Forest Fire ""San Juan""- Auraucanía region (31/01/2018)",2018-01-31T00:00:00Z,3,Wildfire
Chile,2017,Chile: Landslide- Los Lagos- (16/12/2017),2017-11-16T00:00:00Z,350,Wet Mass Movement
Chile,2017,Chile: Floods- Central Chile (8 provinces) (16/06/2017),2017-06-16T00:00:00Z,56,Flood
Chile,2017,Chile: landslides and river flooding- 5 regions (25.02.2017),2017-02-25T00:00:00Z,380,Wet Mass Movement
Chile,2017,"Chile: Wildfires- O'Higgins, Valpariso, Central Chile (Jan-March 2017)",2017-01-03T00:00:00Z,5300,Wildfire
Chile,2017,"Chile: Floods- Atacama, Coquimbo, O'Higgins (11/05/2017)",2017-05-11T00:00:00Z,1900,Flood
Chile,2018,Chile: Cold front - 5 regions - May 2018,2018-05-20T00:00:00Z,2400,Extreme temperature
Chile,2018,"Chile: Forest Fire ""El Aromo""- Araucanía (15/02/2018)",2018-02-15T00:00:00Z,3,Wildfire
Chile,2018,Chile: Cold Front - 3 regions - 05/08/2018,2018-08-05T00:00:00Z,61,Flood
Chile,2018,"Chile: Forest Fire ""Victoria""- Araucanía region (01/02/2018)",2018-02-01T00:00:00Z,14,Wildfire
Chile,2018,DELETE EVENT - ALREADY INCLUDED IN THE BROADER 3- REGIONS EVENT Chile: Floods - Araucania - 08/08/2018,2018-08-08T00:00:00Z,9,Flood
Chile,2019,Chile: Wildfires - Valparaiso - 26/12/2019,2019-12-25T00:00:00Z,740,Wildfire
Chile,2019,Chile: Flood - Arica - 01/02/2019,2019-02-01T00:00:00Z,1200,Flood
Chile,2019,Chile: Wildfire - Limache (Marga Marga Province) - 04/01/2019,2019-01-04T00:00:00Z,250,Wildfire
Chile,2019,"Chile: Wildifres - Maule, Ñuble, Biobío, Araucanía, Los Lagos, Aysén - 01/01/2019",2019-01-01T00:00:00Z,220,Wildfire
Chile,2019,Chile: Wildfires - Biobio - 03/01/2019,2019-01-03T00:00:00Z,110,Wildfire
Chile,2019,Chile: Wildfire -  Limache (Marga Marga) - 03/01/2019,2019-05-02T00:00:00Z,180,Wildfire
Chile,2019,Chile: Floods - Puerto Montt (Llanquihue) - 02/05/2019,2019-05-02T00:00:00Z,4,Flood
Chile,2019,Chile: Wildfire - Araucania - 04/02/2019,2019-02-04T00:00:00Z,110,Wildfire
Chile,2019,Chile: Wildfires - Valparaiso - 18/10/2019 ,2019-10-18T00:00:00Z,150,Wildfire
Chile,2019,"Chile: Wildfires - Ñuble, Biobío, La Araucanía and Aysén - 02/03/2019",2019-03-02T00:00:00Z,160,Wildfire
Chile,2019,"Chile: Flood -  Parinacota, Tarapacá, Antofagasta, Arica - 11/02/2019",2019-02-11T00:00:00Z,510,Flood
Chile,2019,Chile: Floods -  Biobio and Concepcion - 29/05/2019,2019-05-29T00:00:00Z,130,Flood
Chile,2019,Chile: Tornado - Biobio - 07/06/2019,2019-06-04T00:00:00Z,110,Storm
Chile,2019,Chile: Earthquake - Coquimbo -22/01/2019,2019-01-22T00:00:00Z,36,Earthquake
Chile,2020,Chile: Wildfires - Concepcion (Chiguayante) - 24/01/2020,2020-01-24T00:00:00Z,67,Wildfire
Chile,2020,Chile: Chada Wildfire - Araucania (Pitrufquén) - 02/02/2020,2020-02-02T00:00:00Z,21,Wildfire
Chile,2020,Chile: Floods - Arica and Parinacota -01/02/2020,2020-02-01T00:00:00Z,1300,Flood
Chile,2020,Chile: Wildfires - Maule (La Molina locality) - 18/02/2020,2020-02-18T00:00:00Z,150,Wildfire
Chile,2020,Chile: Floods - Atacama  - 27/01/2020,2020-01-27T00:00:00Z,500,Flood
Chile,2020,Chile: Earthquake - Huasco - 01/09/2020,2020-09-01T00:00:00Z,2,Earthquake
Chile,2020,Chile: Hijuela Huacha Wildfire- Araucania  (Galvarino) - 10/02/2020,2020-02-09T00:00:00Z,60,Wildfire
Chile,2020,Chile: Floods - Los Lagos ( Chaiten) - 16/05/2020,2020-05-16T00:00:00Z,60,Flood
Chile,2020,Chile: Flood - Valparaiso and Biobio - 04/07/2020,2020-07-04T00:00:00Z,220,Flood
Chile,2020,"Chile: Floods - Coquimbo, Valparaiso, Maule and Bio Bio - 28/06/2020",2020-06-28T00:00:00Z,210,Flood
Chile,2020,Chile: Wildfires - Bio Bio (Laja)- Preventive evacuations - 05/01/2020,2020-01-04T00:00:00Z,60,Flood
Chile,2020,Chile: Landslide - Valparaiso - 20/07/2020,2020-07-20T00:00:00Z,3,Dry mass movement
Chile,2020,Chile: Floods - Bio Bio (Lota) - 27/04/2020,2020-04-24T00:00:00Z,9,Flood
Chile,2020,Chile: Wildfires - Araucania (Renaico commune) - 13/02/2020,2020-02-13T00:00:00Z,75,Wildfire
Chile,2020,Chile: Landslide -  Los Lagos (Puerto Montt) - 11/06/2020,2020-06-11T00:00:00Z,6,Wet Mass Movement
Chile,2020,Chile: Floods -  Palena (Hornopirén  and Chaitén) - 15/05/2020,2020-05-15T00:00:00Z,180,Flood
Chile,2020,Chile: Wildfire -  Curicó (Preventive evacuation) -17/02/2020,2020-02-17T00:00:00Z,450,Wildfire
Chile,2020,"Chile: Floods - O´Higgins, Maule, Ñuble y Biobío - 19/06/2020",2020-06-19T00:00:00Z,32,Flood
Chile,2020,Chile: Floods - Araucanía - 10/07/2020,2020-07-09T00:00:00Z,45,Flood
Chile,2021,Chile: Landslide - Countrywide - 2021,2021-01-01T00:00:00Z,520,Dry mass movement
Chile,2021,Chile: Wildfire - Countrywide - 2021,2021-01-01T00:00:00Z,820,Wildfire
Chile,2021,Chile: Flood - Countrywide - 2021,2021-01-01T00:00:00Z,22,Flood
Chile,2021,Chile: Storm - Countrywide - 2021,2021-01-01T00:00:00Z,290,Storm
Chile,2021,Chile: Weather related - Countrywide - 2021,2021-01-01T00:00:00Z,6,Flood
Chile,2021,Chile: Tsunami - Countrywide - 2021,2021-01-01T00:00:00Z,830,Earthquake
China,2008,TC-2008-000093-PHL,2008-06-24T00:00:00Z,6000,Storm
China,2008,,2008-12-05T00:00:00Z,15000000,Earthquake
China,2008,,2008-08-30T00:00:00Z,650000,Earthquake
China,2008,,2008-05-08T00:00:00Z,16000,Earthquake
China,2008,,2008-06-10T00:00:00Z,860,Earthquake
China,2008,FL-2008-000084-CHN,2008-07-06T00:00:00Z,1660000,Flood
China,2008,TC-2008-000130-CHN,2008-07-08T00:00:00Z,42000,Flood
China,2008,,2008-02-05T00:00:00Z,1900,Flood
China,2008,,2008-05-27T00:00:00Z,4600,Flood
China,2008,,2008-10-01T00:00:00Z,827000,Extreme temperature
China,2008,,2008-08-22T00:00:00Z,390,Storm
China,2008,,2008-07-28T00:00:00Z,274000,Storm
China,2008,,2008-04-19T00:00:00Z,120000,Storm
China,2008,,2008-08-08T00:00:00Z,500,Storm
China,2008,,2008-10-31T00:00:00Z,25000,Flood
China,2008,,2008-07-07T00:00:00Z,31000,Flood
China,2009,,2009-01-01T00:00:00Z,56000,Flood
China,2009,Typhoon 'Koppu',2009-01-01T00:00:00Z,115000,Storm
China,2009,2009-000113,2009-01-01T00:00:00Z,118000,Flood
China,2009,,2009-01-01T00:00:00Z,120000,Flood
China,2009,,2009-01-01T00:00:00Z,123000,Storm
China,2009,Linfa,2009-01-01T00:00:00Z,163000,Storm
China,2009,2009-000244,2009-01-01T00:00:00Z,166000,Storm
China,2009,,2009-01-01T00:00:00Z,938000,Flood
China,2009,Typhoon Morakot (Kiko),2009-01-01T00:00:00Z,1620000,Storm
China,2009,Tropical cylone 'Goni',2009-01-01T00:00:00Z,92000,Storm
China,2009,,2009-01-01T00:00:00Z,48000,Storm
China,2009,2009-000233,2009-01-01T00:00:00Z,61000,Earthquake
China,2009,2009-000130,2009-01-01T00:00:00Z,400000,Earthquake
China,2009,,2009-01-01T00:00:00Z,10000,Wet Mass Movement
China,2010,2010-000070,2010-01-01T00:00:00Z,270000,Flood
China,2010,Typhoon Meranti,2010-01-01T00:00:00Z,186000,Storm
China,2010,2010-000122,2010-01-01T00:00:00Z,15200000,Flood
China,2010,,2010-01-01T00:00:00Z,130,Wet Mass Movement
China,2010,,2010-01-01T00:00:00Z,500,Earthquake
China,2010,2010-000125,2010-01-01T00:00:00Z,5400,Storm
China,2010,,2010-01-01T00:00:00Z,100000,Earthquake
China,2010,,2010-01-01T00:00:00Z,30000,Earthquake
China,2010,Typhoon Fanapi,2010-01-01T00:00:00Z,128000,Storm
China,2011,,2011-01-01T00:00:00Z,150,Earthquake
China,2011,ST-2010-000085-CHN,2011-01-01T00:00:00Z,3200,Storm
China,2011,Typhoon Pedring (Nesat),2011-01-01T00:00:00Z,300000,Storm
China,2011,M6 Earthquake in China,2011-01-01T00:00:00Z,9400,Earthquake
China,2011,,2011-01-01T00:00:00Z,130000,Earthquake
China,2011,,2011-01-01T00:00:00Z,80000,Earthquake
China,2011,Sikkim Earthquake,2011-01-01T00:00:00Z,5000,Earthquake
China,2011,Typhoon 'Kabayan' (Muifa),2011-01-01T00:00:00Z,360000,Storm
China,2011,CW-2011-000001-CHN,2011-01-01T00:00:00Z,88000,Extreme temperature
China,2011,FL-2011-000059-CHN,2011-01-01T00:00:00Z,3514000,Flood
China,2012,,2012-01-01T00:00:00Z,443000,Storm
China,2012,,2012-01-01T00:00:00Z,185000,Earthquake
China,2012,,2012-01-01T00:00:00Z,22000,Earthquake
China,2012,,2012-01-01T00:00:00Z,2079000,Storm
China,2012,,2012-01-01T00:00:00Z,530000,Storm
China,2012,,2012-01-01T00:00:00Z,867000,Storm
China,2012,,2012-01-01T00:00:00Z,48000,Earthquake
China,2012,,2012-01-01T00:00:00Z,1420000,Storm
China,2012,,2012-01-01T00:00:00Z,900,Storm
China,2012,,2012-01-01T00:00:00Z,136000,Storm
China,2013,Guangxi Floods,2013-04-30T00:00:00Z,17000,Flood
China,2013,Sichuan Landslide,2013-07-09T00:00:00Z,200,Wet Mass Movement
China,2013,Monsoon Floods,2013-06-01T00:00:00Z,1577000,Flood
China,2013,Typhoon Usagi,2013-09-22T00:00:00Z,587000,Storm
China,2013,China May Floods,2013-05-26T00:00:00Z,19000,Flood
China,2013,December Floods,2013-12-15T00:00:00Z,150000,Storm
China,2013,Typhoon Fitow,2013-10-07T00:00:00Z,826000,Storm
China,2013,Yunnan landslide,2013-01-11T00:00:00Z,500,Dry mass movement
China,2013,Yunnan-Sichuan earthquake,2013-08-30T00:00:00Z,9000,Earthquake
China,2013,Gansu Earthquake,2013-07-22T00:00:00Z,227000,Earthquake
China,2013,Hubai Earthquake,2013-12-16T00:00:00Z,2000,Earthquake
China,2013,Lushan Earthquake,2013-04-20T00:00:00Z,695000,Earthquake
China,2013,Typhoon Haiyan,2013-11-11T00:00:00Z,181000,Storm
China,2013,Typhoon Utor,2013-08-15T00:00:00Z,513000,Storm
China,2013,Dali Bai Earthquake,2013-04-17T00:00:00Z,11000,Earthquake
China,2013,Eryuan earthquake,2013-03-03T00:00:00Z,21000,Earthquake
China,2013,Songyuan earthquake,2013-11-22T00:00:00Z,45000,Earthquake
China,2013,Typhoon Soulik,2013-07-13T00:00:00Z,500000,Storm
China,2013,Russia China-Floods,2013-07-30T00:00:00Z,354000,Flood
China,2013,Typhoon Trami,2013-08-22T00:00:00Z,190000,Storm
China,2014,Cyclone Fung Wong,2014-09-22T00:00:00Z,158000,Storm
China,2014,Yongshan county earthquake (April),2014-04-05T00:00:00Z,21000,Earthquake
China,2014,"Xinjiang, Guangxi, Yunnan, and Guizhou floods",2014-07-03T00:00:00Z,61000,Flood
China,2014,Typhoon Hagibis,2014-06-15T00:00:00Z,13000,Storm
China,2014,16 province storm,2014-06-25T00:00:00Z,9600,Flood
China,2014,Hunan flood,2014-05-10T00:00:00Z,10000,Flood
China,2014,South China rainstorms,2014-05-10T00:00:00Z,54000,Flood
China,2014,"Guangxi,Jiangxi, Hunan flood",2014-04-26T00:00:00Z,400,Flood
China,2014,Shaanxi et al flood,2014-04-18T00:00:00Z,12000,Flood
China,2014,Chongqing flood,2014-08-31T00:00:00Z,122000,Flood
China,2014,Kangding earthquake,2014-11-22T00:00:00Z,8200,Earthquake
China,2014,Yutian earthquake,2014-02-12T00:00:00Z,85000,Earthquake
China,2014,Ludian earthquake,2014-08-03T00:00:00Z,237000,Earthquake
China,2014,Yongshan county earthquake (August),2014-08-17T00:00:00Z,650,Earthquake
China,2014,Jinggu earthquake (Southwest China earthquake),2014-10-07T00:00:00Z,59000,Earthquake
China,2014,Yunnan (Yingjiang) earthquake,2014-05-24T00:00:00Z,56000,Earthquake
China,2014,Typhoon Rammasun,2014-07-18T00:00:00Z,628000,Storm
China,2014,100 year storm,2014-05-08T00:00:00Z,447000,Storm
China,2014,Floods in the South (July),2014-07-10T00:00:00Z,403000,Flood
China,2014,Floods in the South (second half June),2014-06-18T00:00:00Z,337000,Flood
China,2014,Typhoon Matmo,2014-07-23T00:00:00Z,289000,Storm
China,2014,Typhoon Kalmaegi,2014-09-16T00:00:00Z,252000,Storm
China,2014,Floods in the South (first half June),2014-06-01T00:00:00Z,239000,Flood
China,2014,"Hunan, Sichuan, Guizhou storms",2014-08-11T00:00:00Z,93000,Flood
China,2014,Yunnan flood,2014-05-10T00:00:00Z,260,Flood
China,2014,Fuquan city landslide,2014-08-27T00:00:00Z,230,Wet Mass Movement
China,2014,6 province flood,2014-03-28T00:00:00Z,17000,Flood
China,2015,Typhoon Chan-Hom,2015-07-11T00:00:00Z,1100000,Storm
China,2015,Guizhou earthquake,2015-03-30T00:00:00Z,2500,Earthquake
China,2015,Southern China floods (May),2015-05-20T00:00:00Z,29000,Flood
China,2015,Typhoon Kujira,2015-06-22T00:00:00Z,40000,Storm
China,2015,Typhoon Soudelor,2015-08-09T00:00:00Z,562000,Storm
China,2015,South China floods (April),2015-04-18T00:00:00Z,12000,Flood
China,2015,South-western China floods (August),2015-08-16T00:00:00Z,57000,Flood
China,2015,South and North China storms,2015-07-21T00:00:00Z,8200,Storm
China,2015,Hunan floods (November),2015-11-01T00:00:00Z,5900,Flood
China,2015,Hunan province hailstorm,2015-04-03T00:00:00Z,12000,Storm
China,2015,Pishan earthquake,2015-07-03T00:00:00Z,9000,Earthquake
China,2015,Lishui landslide,2015-11-13T00:00:00Z,81,Wet Mass Movement
China,2015,Typhoon Linfa,2015-07-09T00:00:00Z,56000,Storm
China,2015,North-western and central-eastern China storms,2015-06-25T00:00:00Z,298000,Storm
China,2015,Typhoon Mujigae,2015-10-03T00:00:00Z,1300,Storm
China,2015,Jiangxi and Guizhou storms,2015-05-27T00:00:00Z,8800,Storm
China,2015,South-eastern China floods (July),2015-07-20T00:00:00Z,306000,Flood
China,2015,Southern provinces floods,2015-05-01T00:00:00Z,518000,Flood
China,2015,Typhoon Dujuan,2015-09-29T00:00:00Z,559000,Storm
China,2015,Gorkha earthquake - repercussions in China,2015-04-25T00:00:00Z,6000,Earthquake
China,2015,Cangyuan earthquake,2015-03-01T00:00:00Z,12000,Earthquake
China,2016,Inner Mongolia storm,2016-09-24T00:00:00Z,300,Storm
China,2016,Litang County earthquake,2016-09-23T00:00:00Z,100,Earthquake
China,2016,Hunan landslide,2016-11-07T00:00:00Z,25,Dry mass movement
China,2016,Xinjiang Hutubi Earthquake,2016-12-12T00:00:00Z,5100,Earthquake
China,2016,Chongqing earthquake,2016-12-27T00:00:00Z,500,Earthquake
China,2016,Xinjiang earthquake (November),2016-11-25T00:00:00Z,800,Earthquake
China,2016,Ruoqiang County earthquake,2016-12-14T00:00:00Z,90,Earthquake
China,2016,Yunnan province earthquake,2016-05-18T00:00:00Z,6800,Earthquake
China,2016,Xinjiang earthquake (December),2016-12-27T00:00:00Z,600,Earthquake
China,2016,Qinghai earthquake,2016-10-19T00:00:00Z,30000,Earthquake
China,2016,Typhoon Nepartak,2016-07-02T00:00:00Z,500000,Storm
China,2016,Tropical storm Mirinae,2016-07-25T00:00:00Z,68000,Storm
China,2016,Typhoon Malakas,2016-09-11T00:00:00Z,51000,Storm
China,2016,Typhoon Megi,2016-09-22T00:00:00Z,658000,Storm
China,2016,Xinjiang snowstorm (October),2016-10-10T00:00:00Z,300,Extreme temperature
China,2016,Typhoon Haima,2016-10-14T00:00:00Z,782000,Storm
China,2016,Northeastern provinces floods,2016-07-18T00:00:00Z,552000,Flood
China,2016,Zhejiang province floods,2016-10-06T00:00:00Z,1900,Flood
China,2016,Hebei and Inner Mongolia hailstorms,2016-09-23T00:00:00Z,200,Storm
China,2016,Southern province floods (Sept - 3rd wave),2016-09-08T00:00:00Z,2400,Flood
China,2016,Southern province floods (Sept - 2nd wave),2016-09-05T00:00:00Z,900,Flood
China,2016,Sichuan floods ,2016-09-18T00:00:00Z,5400,Flood
China,2016,Xinjiang Autonomous Region flood (July),2016-07-31T00:00:00Z,300,Flood
China,2016,Southern province floods (Sept - 1st wave),2016-09-01T00:00:00Z,300,Flood
China,2016,"Central and Western provinces hailstorm	",2016-06-04T00:00:00Z,4700,Storm
China,2016,Southern provinces floods (Spring - 4th wave),2016-04-25T00:00:00Z,8100,Flood
China,2016,Southern provinces floods (Spring - 1st wave),2016-03-25T00:00:00Z,25000,Flood
China,2016,Yangtze River floods (1st wave),2016-06-30T00:00:00Z,1990000,Flood
China,2016,Southern province floods (Spring - 2nd wave),2016-04-05T00:00:00Z,1500,Flood
China,2016,Southeastern provinces floods,2016-05-19T00:00:00Z,65000,Flood
China,2016,Xinjiang snowstorm (November),2016-11-09T00:00:00Z,100,Extreme temperature
China,2016,Yangtze River floods (2nd wave),2016-07-19T00:00:00Z,172000,Flood
China,2016,Yunnan province floods,2016-09-15T00:00:00Z,140,Flood
China,2016,Xinjiang Autonomous Region floods (September),2016-09-05T00:00:00Z,7800,Flood
China,2016,Shaanxi Province floods,2016-09-27T00:00:00Z,600,Flood
China,2016,Southern provinces floods (June - 1st wave),2016-06-09T00:00:00Z,16000,Flood
China,2016,Central provinces floods,2016-06-01T00:00:00Z,14000,Flood
China,2016,Southern provinces floods (Spring - 3rd wave),2016-04-15T00:00:00Z,22000,Flood
China,2016,Southern China winter storm,2016-01-20T00:00:00Z,78000,Extreme temperature
China,2016,Tropical Storm Dianmu,2016-08-15T00:00:00Z,56000,Storm
China,2016,Typhoon Meranti,2016-09-09T00:00:00Z,567000,Storm
China,2016,Typhoon Sarika,2016-10-13T00:00:00Z,534000,Storm
China,2016,Yunnan province floods,2016-09-23T00:00:00Z,200,Flood
China,2016,Southern provinces floods (June - 2nd wave),2016-06-13T00:00:00Z,332000,Flood
China,2016,Southeastern provinces floods (November),2016-10-31T00:00:00Z,200,Flood
China,2016,Bomi County avalanche,2016-11-01T00:00:00Z,100,Wet Mass Movement
China,2016,Yunnan Floods,2016-11-02T00:00:00Z,100,Flood
China,2016,"Xinyi City, Guangdong Province floods",2016-11-20T00:00:00Z,100,Flood
China,2016,Typhoon Nida,2016-07-29T00:00:00Z,69000,Storm
China,2016,Typhoon Lionrock,2016-08-16T00:00:00Z,208000,Storm
China,2016,"Southern provinces floods (Spring - 5th wave)	",2016-05-06T00:00:00Z,95000,Flood
China,2016,Southern provinces floods (June - 3rd wave),2016-06-18T00:00:00Z,477000,Flood
China,2016,Jiangsu province hailstorm,2016-06-23T00:00:00Z,24000,Storm
China,2017,China: Heavy Rain - Shaanxi - 31/8/2017,2017-08-31T00:00:00Z,700,Storm
China,2017,China: Earthquake - Qinghai - 15/12/2017,2017-12-15T00:00:00Z,18000,Earthquake
China,2017,China: Heavy Rain - Guizhou - 31/8/2017,2017-08-27T00:00:00Z,700,Storm
China,2017,Southern provinces Floods (Spring - 2nd wave),2017-05-03T00:00:00Z,1200,Flood
China,2017,Guangzhou Flood,2017-05-07T00:00:00Z,7400,Flood
China,2017,Xinjiang Hailstorm,2017-06-06T00:00:00Z,100,Storm
China,2017,"Southern China: Floods - Guangxi, Guizhou, Chongqing - 13/6/2017 (2nd wave)",2017-06-13T00:00:00Z,900,Flood
China,2017,Hubei Earthquake,2017-06-16T00:00:00Z,600,Earthquake
China,2017,China: Heavy Rain - Shanxi - 9/10/2017,2017-10-09T00:00:00Z,300,Storm
China,2017,Xinjiang Floods (1st wave),2017-04-28T00:00:00Z,200,Flood
China,2017,"South Central China: Heavy Rains, Floods - Hubei, Guangxi, Hunan 11/8/2017",2017-08-11T00:00:00Z,113000,Storm
China,2017,China: Southwest floods (8-12 July),2017-07-08T00:00:00Z,7800,Flood
China,2017,Inner Mongolia and Beijing heavy rains (11-14 Aug),2017-08-11T00:00:00Z,3600,Storm
China,2017,China: floods - Hunan - 22/06/2017,2017-06-22T00:00:00Z,1620000,Flood
China,2017,Hong-Kong/Taiwan/China; Philippines - Typhoon Khanun (Odette) - 11/10/2017,2017-10-11T00:00:00Z,411000,Storm
China,2017,"Northwest China: Floods - Qinghai, Shaanxi - 24/9/2017",2017-09-24T00:00:00Z,60000,Flood
China,2017,China: Tropical Storm Mawar - Guangdong ; Fujian - 30/08/2017,2017-08-30T00:00:00Z,79000,Storm
China,2017,"China: Typhoon Merbok / ""Bai Miao"" - Guangdong; Fujian; Jiangxi; Guizhou - 12/06/2017",2017-06-12T00:00:00Z,117000,Storm
China,2017,"China: Floods - Gansu, Shaanxi - 24/7/2017",2017-07-24T00:00:00Z,76000,Flood
China,2017,"Southwest China: Heavy Rain - Guizhou, Chongqing, Sichuan - 19/9/2017",2017-09-19T00:00:00Z,3500,Storm
China,2017,Sichuan and Yunnan storm (17-21 Aug),2017-08-17T00:00:00Z,500,Storm
China,2017,Jiangxi and Hunan flood,2017-03-21T00:00:00Z,1100,Flood
China,2017,China: Southwest floods (19-23 July),2017-07-19T00:00:00Z,2300,Storm
China,2017,China: Heavy Rain - Hainan - 8/11/2017,2017-11-06T00:00:00Z,11000,Storm
China,2017,Jianghan-Sichuan Basin  Flood,2017-04-16T00:00:00Z,3300,Flood
China,2017,Tibet glacial flood,2017-06-16T00:00:00Z,12,Mass movement
China,2017,Jianghan River flood,2017-04-08T00:00:00Z,2100,Flood
China,2017,Southern provinces Floods (Spring - 4th wave),2017-05-22T00:00:00Z,8400,Flood
China,2017,China: Earthquake - Chongqing - 23/11/2017,2017-11-23T00:00:00Z,100,Earthquake
China,2017,East China Floods (3-18 July 2017),2017-07-03T00:00:00Z,6200,Flood
China,2017,"Southwest China: Heavy Rain and Floods - Chongqing, Guizhou, Sichuan, Yunnan - 4/9/2017",2017-09-04T00:00:00Z,4400,Storm
China,2017,Hubei Floods,2017-06-12T00:00:00Z,400,Flood
China,2017,Xinjiang and Shaanxi floods (2-7 July),2017-07-02T00:00:00Z,300,Flood
China,2017,Sichuan floods (30 July - 3 Aug),2017-07-30T00:00:00Z,400,Flood
China,2017,Hubei floods (17-20 July),2017-07-17T00:00:00Z,700,Flood
China,2017,Chongqing and Sichuan floods (6-9 August),2017-08-06T00:00:00Z,2900,Flood
China,2017,China: Strong winds - Jilin - 7/9/2017,2017-09-05T00:00:00Z,100,Storm
China,2017,China: Heavy Rain - Hubei - 8/9/2017,2017-09-08T00:00:00Z,2300,Storm
China,2017,Beijing and Hebei floods (6-9 July),2017-07-06T00:00:00Z,3600,Flood
China,2017,China: Typhoon Talas,2017-07-14T00:00:00Z,33000,Storm
China,2017,Henan floods (30 July - 2 Aug),2017-07-30T00:00:00Z,700,Flood
China,2017,Sichuan floods (26-27 July),2017-07-26T00:00:00Z,600,Storm
China,2017,China: Floods - Jiangsu - 25/9/2017,2017-09-25T00:00:00Z,3200,Flood
China,2017,China: Heavy Rain - Hubei - 24/9/2017,2017-09-24T00:00:00Z,27000,Storm
China,2017,China: Landslide - Hubei - 27/10/2017,2017-10-27T00:00:00Z,40,Dry mass movement
China,2017,Guizhou and Yunnan heavy rain (11-16 Aug),2017-08-11T00:00:00Z,11000,Flood
China,2017,"China, Taiwan, Philippines: Typhoon Nesat (Gorio) / Tropical Depression Haitang / Southwest Monsoon - 25/7/2017",2017-07-25T00:00:00Z,191000,Storm
China,2017,China; Vietnam: Typhoon Hato - 19/08/2017,2017-08-19T00:00:00Z,45000,Storm
China,2017,China: Heavy Rain - Chongqing - 31/8/2017,2017-08-31T00:00:00Z,100,Storm
China,2017,Xinjiang Earthquake,2017-05-11T00:00:00Z,10000,Earthquake
China,2017,Chongqing and Sichuan floods (14-18 July),2017-07-14T00:00:00Z,1800,Flood
China,2017,Kashi Earthquake,2017-01-20T00:00:00Z,200,Earthquake
China,2017,Sichuan landslide,2017-06-24T00:00:00Z,410,Dry mass movement
China,2017,"Southern China: Floods - Zhejiang, Jiangxi, Guizhou, Anhui, Hubei, Chongqing, Sichuan, Yunnan - 22/6/2017 (3rd wave)",2017-06-22T00:00:00Z,547000,Flood
China,2017,"Japan, Taiwan, China: Typhoon Talim / Lannie - 7/9/2017",2017-09-07T00:00:00Z,200000,Storm
China,2017,Southern Yangtze River Floods,2017-06-12T00:00:00Z,6500,Flood
China,2017,Northern China Floods,2017-06-05T00:00:00Z,2500,Flood
China,2017,"Northeast China: Floods - Jilin, Heilongjiang, Liaoning - 2/8/2017",2017-08-02T00:00:00Z,192000,Flood
China,2017,"Southern China: Floods - Jiangxi, Hunan, Guangxi, Guizhou, Chongqing, Guangdong, Fujian - 3/6/2017 (1st wave)",2017-06-03T00:00:00Z,36000,Flood
China,2017,"South Central China: Floods - Guangxi, Hubei, Henan, Guangdong, Guangxi - 1/7/2017",2017-07-01T00:00:00Z,181000,Flood
China,2017,China: Heilongjiang and Jilin floods - 19/07/2017,2017-07-19T00:00:00Z,249000,Flood
China,2017,Zhejiang earthquake,2017-04-12T00:00:00Z,800,Earthquake
China,2017,Yunnan earthquake,2017-03-29T00:00:00Z,5300,Earthquake
China,2017,Northern China Hailstorms,2017-06-17T00:00:00Z,200,Storm
China,2017,Jiangsu Storm,2017-03-01T00:00:00Z,500,Storm
China,2017,Guangxi Floods,2017-06-06T00:00:00Z,300,Flood
China,2017,Ankang City Landslide,2017-04-17T00:00:00Z,26,Dry mass movement
China,2017,Tibet Earthquake,2017-01-31T00:00:00Z,500,Earthquake
China,2017,Anhui Storm,2017-05-19T00:00:00Z,100,Storm
China,2017,China: Landslide - Chongqing - 16/10/2017,2017-10-16T00:00:00Z,900,Dry mass movement
China,2017,Junlian earthquake,2017-01-24T00:00:00Z,4000,Earthquake
China,2017,Sichuan Floods,2017-06-13T00:00:00Z,7000,Flood
China,2017,China: Heavy Rain - Chongqing - 10/10/2017,2017-10-10T00:00:00Z,700,Storm
China,2017,"Southern China: Floods - Sichuan, Guizhou, Tibet, Guangxi, Fujian - 28/6/2017 (4th wave)",2017-06-28T00:00:00Z,18000,Flood
China,2017,Fujian and Guangdong Floods,2017-06-15T00:00:00Z,7400,Flood
China,2017,China: Southwest floods (12-14 July),2017-07-12T00:00:00Z,2500,Flood
China,2017,Hunan landslide,2017-03-09T00:00:00Z,200,Dry mass movement
China,2017,"Southwest China: Heavy Rain - Chongqing, Guizhou - 18/9/2017",2017-09-18T00:00:00Z,1400,Storm
China,2017,Qinghai and Gansu floods (4-7 Aug),2017-08-04T00:00:00Z,1100,Flood
China,2017,Typhoon Pakhar - 24/8/2017,2017-08-24T00:00:00Z,15000,Storm
China,2017,Tibet floods (3-7 August),2017-08-03T00:00:00Z,300,Flood
China,2017,Sichuan earthquake (8 Aug),2017-08-08T00:00:00Z,23000,Earthquake
China,2017,China: Heavy Rain - Chongqing - 1/10/2017,2017-10-01T00:00:00Z,9300,Storm
China,2017,Tibet: Earthquake - Tibet - 23/11/2017,2017-11-18T00:00:00Z,11000,Earthquake
China,2017,China: Heavy Rain - Hunan - 18/9/2017,2017-09-18T00:00:00Z,600,Storm
China,2017,China: Heavy Rain - Shaanxi - 16/9/2017,2017-09-16T00:00:00Z,800,Storm
China,2017,China: Heavy Rain - Shaanxi - 1/10/2017,2017-10-01T00:00:00Z,16000,Storm
China,2017,Xinjiang Floods (2nd wave),2017-05-18T00:00:00Z,300,Flood
China,2017,Southern provinces Floods (Spring - 3rd wave),2017-05-10T00:00:00Z,1600,Flood
China,2017,Southern provinces Floods (Spring - 1st wave),2017-04-18T00:00:00Z,400,Flood
China,2017,China: Heavy Rain - Yunnan - 31/8/2017,2017-08-31T00:00:00Z,100,Storm
China,2017,Shandong heavy rain (17-21 Aug),2017-08-17T00:00:00Z,1100,Storm
China,2017,Liaoning heavy rain (13-17 July),2017-07-13T00:00:00Z,200,Storm
China,2017,Hubei heavy rains (6-9 Aug),2017-08-06T00:00:00Z,600,Storm
China,2017,Sichuan floods (23-26 July),2017-07-23T00:00:00Z,200,Flood
China,2017,China:  Heavy Rain - Shaanxi - 12/9/2017,2017-09-08T00:00:00Z,3600,Storm
China,2017,China: Heavy Rain - Sichuan - 25/8/2017,2017-08-25T00:00:00Z,6800,Storm
China,2017,China - Heilongjiang floods 22-24/07/2017,2017-07-22T00:00:00Z,500,Flood
China,2017,Xinjiang heavy rains (20-23 Aug),2017-08-20T00:00:00Z,100,Flood
China,2017,Xinjiang earthquake (9 Aug),2017-08-09T00:00:00Z,430,Earthquake
China,2017,Shandong floods (6-9 Aug),2017-08-06T00:00:00Z,600,Flood
China,2017,Jiangxi heavy rainfall (11-15 Aug),2017-08-11T00:00:00Z,15000,Storm
China,2017,Inner Mongolia floods (2-4 Aug),2017-08-02T00:00:00Z,400,Flood
China,2017,Sichuan floods (4-7 July),2017-07-04T00:00:00Z,3200,Flood
China,2017,Jilin earthquake (23 July),2017-07-23T00:00:00Z,1700,Earthquake
China,2017,Gansu floods (12-14 July),2017-07-12T00:00:00Z,100,Flood
China,2017,Shanxi floods (24-28 July),2017-07-24T00:00:00Z,800,Flood
China,2017,Xinjiang heavy rains (12-14 Aug),2017-08-12T00:00:00Z,700,Storm
China,2017,China: Landslide - Qinghai - 30/8/2017,2017-08-30T00:00:00Z,90,Dry mass movement
China,2018,"China: Storm - Gansu, Shaanxi, Ningxia Hui - 19/8/2018",2018-08-19T00:00:00Z,3500,Storm
China,2018,"China: Heavy Rain/Flood - Hubei, Hunan, Guangdong, Guangxi (South Central China) - 5/5/2018",2018-05-05T00:00:00Z,8100,Flood
China,2018,China: Heavy Rain - Guangxi - 3/6/2018,2018-06-03T00:00:00Z,50,Storm
China,2018,"Cambodia, Laos, Thailand, Philippines, Vietnam: Southwest Monsoon (Habagat) / Tropical Cyclone Son-Tinh / HENRY / JOSIE - 15/7/2018",2018-07-15T00:00:00Z,14000,Storm
China,2018,China; VietNam: Tropical Cyclone Ewiniar - 02/06/2018,2018-06-02T00:00:00Z,142000,Storm
China,2018,"China, Thailand, VietNam: Tropical Cyclone Bebinca - 9/8/2018",2018-08-09T00:00:00Z,120000,Storm
China,2018,"China, DPR Korea: Tropical Storm Soulik - 24/8/2018",2018-08-15T00:00:00Z,15000,Storm
China,2018,"China, Guam, Northern Mariana Islands, Philippines, Thailand: Typhoon Mangkhut - 7/9/2018",2018-09-07T00:00:00Z,1610000,Storm
China,2018,China: Landslide - Sichuan - 9/12/2018,2018-12-09T00:00:00Z,7,Wet Mass Movement
China,2018,China: Snowstorm - Shannan (Tibet Autonomous Region) - 24/12/2018,2018-12-24T00:00:00Z,12,Extreme temperature
China,2018,China: Extreme Winter - Jiangxi - 27/12/2018,2018-12-27T00:00:00Z,1300,Extreme temperature
China,2018,China: Extreme Winter - Guizhou - 27/12/2018,2018-12-27T00:00:00Z,6600,Extreme temperature
China,2018,China: Extreme Winter - Hunan - 27/12/2018,2018-12-27T00:00:00Z,5000,Extreme temperature
China,2018,China: Earthquake - Yibin (Sichuan) - 16/12/2018,2018-12-16T00:00:00Z,740,Earthquake
China,2018,China: Flood - Gansu - 7/7/2018,2018-07-07T00:00:00Z,30000,Flood
China,2018,"China: Typhoon Ampil - Beijing, Hebei, Jiangsu, Shandong, Shanghai, Tianjin, Zhejiang, Heilongjiang - 22/7/2018",2018-07-22T00:00:00Z,290000,Storm
China,2018,China: Earthquake - Xigaze (Tibet Autonomous Region) - 24/12/2018,2018-12-24T00:00:00Z,2100,Earthquake
China,2018,China: Storm/Heavy Rain - Sichuan - 7/7/2018,2018-07-07T00:00:00Z,101000,Storm
China,2018,China: Flood - Chongqing - 13/07/2018,2018-07-13T00:00:00Z,100000,Flood
China,2018,"China, Japan: Tropical Cyclone Jongdari / Lark - 23/07/2018",2018-07-23T00:00:00Z,153000,Storm
China,2018,"China: Storm - Fujian, Guangdong, Guangxi - 26/08/2018",2018-08-26T00:00:00Z,141000,Storm
China,2018,China: Tropical Storm Rumbia - 14/08/2018,2018-08-14T00:00:00Z,207000,Storm
China,2018,"China, Taiwan: Typhoon Maria - 3/7/2018",2018-07-03T00:00:00Z,518000,Storm
China,2018,China: Heavy Rain - Henan - 21/5/2018,2018-05-21T00:00:00Z,800,Flood
China,2018,China: Heavy Rain - Shaanxi - 20/5/2018,2018-05-20T00:00:00Z,100,Storm
China,2018,"China: Heavy Rain/Flood - Chongqing, Guizhou, Sichuan (Southwest China) - 20/5/2018",2018-05-20T00:00:00Z,6400,Storm
China,2018,China: Flood - Hubei - 15/5/2018,2018-05-15T00:00:00Z,100,Flood
China,2018,China: Flood - Chongqing - 5/5/2018,2018-05-05T00:00:00Z,600,Flood
China,2018,China: Flood - Fujian - 7/5/2018,2018-05-07T00:00:00Z,1000,Flood
China,2018,China: Landslide - Shaanxi - 13/5/2018,2018-05-13T00:00:00Z,4,Wet Mass Movement
China,2018,"China: Storm - Fujian, Guangxi, Hubei, Hunan, Jiangxi, Zhejiang - 4/3/2018",2018-03-04T00:00:00Z,6000,Storm
China,2018,China (North East): Thunderstorm - Heilongjiang - 13/7/2018,2018-07-13T00:00:00Z,100,Storm
China,2018,China (North): Thunderstorm - Beijing - 15/7/2018,2018-07-15T00:00:00Z,400,Storm
China,2018,China: Snow/Winter storm - 8 provinces - 24/01/2018,2018-01-24T00:00:00Z,37000,Storm
China,2018,China: Earthquake - Hubei - 12/10/2018,2018-10-12T00:00:00Z,400,Earthquake
China,2018,"China (South West): Heavy Rain - Chongqing, Guizhou, Sichuan - 17/6/2018",2018-06-17T00:00:00Z,1100,Storm
China,2018,"China (East): Heavy Rain - Fujian, Jiangxi - 17/6/2018",2018-06-17T00:00:00Z,19000,Storm
China,2018,China (North West): Heavy Rain - Shaanxi - 17/6/2018,2018-06-17T00:00:00Z,2700,Storm
China,2018,"China (South Central): Heavy Rain - Hubei, Hunan - 17/6/2018",2018-06-17T00:00:00Z,13000,Storm
China,2018,China: Landslide - Gansu - 14/7/2018,2018-07-14T00:00:00Z,2300,Wet Mass Movement
China,2018,China (North West): Heavy Rain - Xinjiang - 20/6/2018,2018-06-20T00:00:00Z,2500,Storm
China,2018,China (South Central): Heavy Rain - Guangxi - 21/6/2018,2018-06-21T00:00:00Z,1500,Storm
China,2018,"China (South West): Heavy Rain - Guizhou, Yunnan - 21/6/2018",2018-06-21T00:00:00Z,19000,Storm
China,2018,China (South Central): Heavy Rain - Guangxi - 25/6/2018,2018-06-25T00:00:00Z,200,Storm
China,2018,"China (South West): Heavy Rain - Sichuan, Yunnan - 25/6/2018",2018-06-25T00:00:00Z,1600,Storm
China,2018,"China (East): Heavy Rain - Anhui, Jiangsu, Jiangxi, Zheijiang - 28/6/2018",2018-06-28T00:00:00Z,2200,Storm
China,2018,China (South Central): Heavy Rain - Hubei - 28/6/2018,2018-06-28T00:00:00Z,100,Storm
China,2018,China (North West): Heavy Rain - Qinghai - 29/6/2018,2018-06-29T00:00:00Z,100,Storm
China,2018,"China (North West): Heavy Rain - Gansu, Ningxi, Shaanxi, Xinjiang - 1/7/2018",2018-07-01T00:00:00Z,1400,Storm
China,2018,"China (South West): Heavy Rain - Chongqing, Sichuan - 1/7/2018",2018-07-01T00:00:00Z,11000,Storm
China,2018,"China, East: Heavy Rain - Anhui - 17/5/2018",2018-05-17T00:00:00Z,200,Storm
China,2018,"China, North East: Storm - Jilin - 4/5/2018",2018-05-04T00:00:00Z,100,Storm
China,2018,"China, North East: Floods - Jilin - 28/5/2018",2018-05-28T00:00:00Z,100,Flood
China,2018,"China, North East: Earthquake - Jilin - 29/5/2018",2018-05-29T00:00:00Z,4700,Earthquake
China,2018,"China: Heavy Rain/Flood - Henan, Hubei, Hunan (South Central China) - 17/5/2018",2018-05-17T00:00:00Z,7000,Storm
China,2018,China: Heavy Rain - Hunan - 30/5/2018,2018-05-30T00:00:00Z,160,Storm
China,2018,"China, South West: Heavy Rain - Chongqing, Guizhou - 15/5/2018",2018-05-15T00:00:00Z,1400,Storm
China,2018,China: Heavy Rain - Tibet - 1/9/2018,2018-09-01T00:00:00Z,900,Storm
China,2018,China: Heavy Rain - Hubei - 5/9/2018,2018-09-05T00:00:00Z,100,Storm
China,2018,China: Earthquake - Xinjiang - 6/9/2018,2018-09-04T00:00:00Z,3500,Earthquake
China,2018,China: Storm - Inner Mongolia - 12/6/2018,2018-06-12T00:00:00Z,300,Storm
China,2018,China: Heavy Rain - Guangdong - 13/6/2018,2018-06-13T00:00:00Z,100,Storm
China,2018,"China, Philippines, Taiwan: Tropical Cyclone Barijat / Neneng - 8/9/2018",2018-09-08T00:00:00Z,12000,Storm
China,2018,China: Earthquake - Yunnan - 8/9/2018,2018-09-08T00:00:00Z,5000,Earthquake
China,2018,"China: Tropical Cyclone Yagi / Capricorn - Jilin, Liaoning, Shanghai, Zhejiang - 12/8/2018",2018-08-12T00:00:00Z,1,Storm
China,2018,China: Earthquake - Yunnan - 13/8/2018,2018-08-13T00:00:00Z,33000,Earthquake
China,2018,China: Floods - Gansu - 22/7/2018,2018-07-22T00:00:00Z,2500,Flood
China,2018,China: Floods - Xinjiang - 31/7/2018,2018-07-31T00:00:00Z,5500,Flood
China,2018,China: Heavy Rain - Beijing - 11/8/2018,2018-08-11T00:00:00Z,600,Storm
China,2018,China: Heavy Rain - Ningxia Hui Autonomous Region - 22/7/2018,2018-07-22T00:00:00Z,5200,Storm
China,2018,"China: Heavy Rain - Gansu, Qinghai - 5/8/2018",2018-08-05T00:00:00Z,300,Storm
China,2018,"China: Heavy Rain - Hunan, Chongqing, Sichuan - 29/7/2018",2018-07-29T00:00:00Z,3500,Storm
China,2018,China: Heavy Rain -Yunnan - 27/7/2018,2018-07-27T00:00:00Z,760,Storm
China,2018,"China: Storm - Shanxi, Inner Mongolia - 1/9/2018",2018-09-01T00:00:00Z,2000,Storm
China,2018,"China: Extreme Cold - Anhui, Hubei, Hunan, Jiangsu - 1/1/2018",2018-01-01T00:00:00Z,3500,Extreme temperature
China,2018,"China: Storm - Jiangxi, Hubei, Hunan, Guizhou - 15/3/2018",2018-03-15T00:00:00Z,100,Flood
China,2018,"China: Flood - Chongqing, Hubei - 19/4/2018",2018-04-19T00:00:00Z,3600,Flood
China,2018,"China, East: Heavy Rain - Anhui, Jiangsu - 15/5/2018",2018-05-15T00:00:00Z,800,Storm
China,2018,"China: Landslide - Tibet, Sichuan, Yunnan - 11/10/2018",2018-10-11T00:00:00Z,67000,Wet Mass Movement
China,2018,China: Flood - Heilongjiang - 3/8/2018,2018-08-03T00:00:00Z,500,Flood
China,2019,"China: Earthquake - Guangxi (Jingxi, Baise City) - 25/11/2019",2019-11-25T00:00:00Z,940,Earthquake
China,2019,"China: Earthquake - Weiyuan County, Neijiang City (Sichuan) - 8/9/2019",2019-09-08T00:00:00Z,2400,Earthquake
China,2019,"China: Earthquake - Sichuan (Zizhong County, Neijiang City) - 18/12/2019",2019-12-18T00:00:00Z,60,Earthquake
China,2019,China: Mudslide - Jinping County (Yunnan) - 24/6/2019,2019-06-24T00:00:00Z,140,Wet Mass Movement
China,2019,China: Flood - Yingjiang County (Yunnan) - 25/6/2019,2019-06-25T00:00:00Z,21,Flood
China,2019,China: Landslide - Shuicheng county (Guizhou) - 23/7/2019,2019-07-23T00:00:00Z,700,Wet Mass Movement
China,2019,China; Japan; South Korea; Philippines; Taiwan: Typhoon Lekima (Hanna) - 2/8/2019,2019-08-02T00:00:00Z,2097000,Storm
China,2019,China: Floods - Chongqing - 28/7/2019,2019-07-28T00:00:00Z,1200,Flood
China,2019,China: Floods - Sichuan - 28/7/2019,2019-07-28T00:00:00Z,6800,Flood
China,2019,China: Storm - Guangxi - 25/5/2019,2019-05-25T00:00:00Z,8400,Storm
China,2019,"China, South Korea, North Korea: Typhoon Ling Ling - 7/9/2019",2019-09-07T00:00:00Z,2800,Storm
China,2019,"Cambodia, China, Lao PDR, Thailand, Vietnam: Tropical Storm Kajiki (Swordfish) - 3/9/2019",2019-08-30T00:00:00Z,260,Storm
China,2019,China: Flood Season - 7 provinces - 12/7/2019,2019-07-12T00:00:00Z,278000,Flood
China,2019,China: Floods - Shaanxi - 28/7/2019,2019-07-28T00:00:00Z,700,Flood
China,2019,China: Floods - Chongqing - 22/7/2019,2019-07-22T00:00:00Z,600,Flood
China,2019,China: Earthquake - Sichuan (Yibin) - 17/6/2019,2019-06-17T00:00:00Z,95000,Earthquake
China,2019,China: Landslide - Linfen city (Shanxi) - 15/3/2019,2019-03-15T00:00:00Z,300,Wet Mass Movement
China,2019,China: Floods - Shaanxi (Ankang City) - 3/10/2019,2019-10-03T00:00:00Z,600,Flood
China,2019,China: Floods - Sichuan (Nanchong and Bazhong) - 3/10/2019,2019-10-03T00:00:00Z,1600,Flood
China,2019,China: Floods - Gansu - 28/7/2019,2019-07-28T00:00:00Z,300,Flood
China,2019,"China: Floods - Chongqing (Kaizhou, Wanzhou, Chengkou) - 6/10/2019",2019-10-06T00:00:00Z,100,Flood
China,2019,"China: Floods - Sichuan (Dazhou City, Nanchong City) - 6/10/2019",2019-10-06T00:00:00Z,100,Flood
China,2019,China: Earthquake - Guangxi (Beiliu city) - 12/10/2019,2019-10-12T00:00:00Z,66,Earthquake
China,2019,China: Landslide - Chongqing City (Chengkou County) - 9/10/2019,2019-10-09T00:00:00Z,140,Wet Mass Movement
China,2019,China: Earthquake - Guizhou (Tongren county) - 2/10/2019,2019-10-02T00:00:00Z,1000,Earthquake
China,2019,China: Storm - Chongqing - 6/6/2019,2019-06-06T00:00:00Z,100,Storm
China,2019,China: Storm - Heilongjiang - 17/7/2019,2019-07-17T00:00:00Z,2900,Storm
China,2019,China: Floods - Jiangxi; Fujian - 20/7/2019,2019-07-20T00:00:00Z,800,Flood
China,2019,China: Floods - Sichuan - 22/7/2019,2019-07-22T00:00:00Z,1300,Flood
China,2019,China: Earthquake - Sichuan - 3/1/2019,2019-01-03T00:00:00Z,77,Earthquake
China,2019,"China: Floods - Gansu (Dingxi, Tianshui, Qingyang ) - 18/9/2019",2019-09-18T00:00:00Z,300,Flood
China,2019,China: Earthquake - Songyuan (Jilin) - 18/5/2019,2019-05-18T00:00:00Z,75,Earthquake
China,2019,China (South West): Floods - Chongqing; Guizhou; Sichuan - 18/4/2019,2019-04-18T00:00:00Z,2000,Flood
China,2019,China: Forest Fire - Qinyuan county (Shanxi) - 29/3/2019,2019-03-29T00:00:00Z,9000,Wildfire
China,2019,"China: Earthquake - Gansu (Xiahe county, Gannan prefecture) - 28/10/2019",2019-10-28T00:00:00Z,12,Earthquake
China,2019,China (East): Storm - Fujian; Jiangxi - 23/4/2019,2019-04-23T00:00:00Z,1900,Storm
China,2019,"China: Forest Fire - Qipanshan, Shenyang (Liaoning) - 17/4/2019",2019-04-17T00:00:00Z,17000,Wildfire
China,2019,China: Storm - Shaanxi - 21/7/2019,2019-07-21T00:00:00Z,1700,Flood
China,2019,China: Storm - Jiangxi - 21/3/2019,2019-03-21T00:00:00Z,190,Storm
China,2019,China: Floods - Yunnan - 25/7/2019,2019-07-25T00:00:00Z,100,Flood
China,2019,China: Floods - Heilongjiang - 28/7/2019,2019-07-28T00:00:00Z,11000,Flood
China,2019,China: Flood - Liaoning - 2/8/2019,2019-08-02T00:00:00Z,15000,Flood
China,2019,China: Storm - Hubei - 22/7/2019,2019-07-22T00:00:00Z,100,Flood
China,2019,China: Flood - Sichuan - 15/7/2019,2019-07-15T00:00:00Z,6400,Flood
China,2019,China: Floods - Guizhou - 22/7/2019,2019-07-22T00:00:00Z,600,Flood
China,2019,China: Storm - Sichuan (Aba Tibetan and Qiang Autonomous Prefecture) - 19/8/2019,2019-08-19T00:00:00Z,73000,Storm
China,2019,"China: Floods - Qinghai (Gande County, Malang County and Maduo County of Guoluo Tibetan Autonomous Prefecture) - 18/9/2019",2019-09-18T00:00:00Z,150,Flood
China,2019,China: Storm - Guangxi - 25/4/2019,2019-04-25T00:00:00Z,400,Storm
China,2019,China: Storm - Bazhong (Sichuan) - 16/7/2019,2019-07-16T00:00:00Z,8800,Storm
China,2019,China; Taiwan: Tropical Cyclone MITA(G) - 1/10/2019,2019-09-30T00:00:00Z,23000,Storm
China,2019,"China: Soil Erosion - Luohu District, Shenzhen City (Guangdong) - 28/8/2019",2019-08-28T00:00:00Z,1200,Dry mass movement
China,2019,China: Storm - Hubei - 4/8/2019,2019-08-04T00:00:00Z,4200,Storm
China,2019,China: Flood - Wuyi (Zhejiang) - 16/7/2019,2019-07-16T00:00:00Z,36,Flood
China,2019,China: Flood Season - June 2019 (Up to 11/7/2019),2019-06-01T00:00:00Z,1298000,Flood
China,2019,China (South Central): Floods - Guangxi; Hunan - 18/4/2019,2019-04-18T00:00:00Z,1200,Flood
China,2019,China: Tornado - Kiayan City (Liaoning) - 3/7/2019,2019-07-03T00:00:00Z,1600,Storm
China,2019,"China: Flood - Anji County, Huzhou (Zheijaing) - 5/9/2019",2019-09-05T00:00:00Z,150,Flood
China,2019,"China: Storm - Yuhang, Hangzhou (Zheijaing) - 6/9/2019",2019-09-06T00:00:00Z,1300,Storm
China,2019,China: Storm - Jiuquan city (Gansu) - 7/7/2019,2019-07-07T00:00:00Z,93,Storm
China,2019,China: Storm - Jilin - 14/8/2019,2019-08-14T00:00:00Z,2600,Storm
China,2019,China: Landslide - Zhouqu County (Gansu) - 16/7/2019,2019-07-16T00:00:00Z,200,Wet Mass Movement
China,2019,China; Philippines; Taiwan: Tropical Storm Bailu (PHL: Ineng) - 20/8/2019,2019-08-20T00:00:00Z,48000,Storm
China,2019,China: Storm - Tengchong (Yunnan) - 9/7/2019,2019-07-09T00:00:00Z,190,Storm
China,2020,China: Landslide - Guizhou (Zhongping) - 10/07/2020,2020-07-10T00:00:00Z,280,Wet Mass Movement
China,2020,"China: Landslide - Guangxi (Gaotian Town, Yangshuo County) - 07/06/2020",2020-06-07T00:00:00Z,78,Wet Mass Movement
China,2020,"China: Landslide - Guangxi (Maling Town, Lipu City) - 07/06/2020",2020-06-07T00:00:00Z,590,Wet Mass Movement
China,2020,China: Landslide - Guangxi (Yongfu County) - 07/06/2020,2020-06-07T00:00:00Z,70,Wet Mass Movement
China,2020,"China: Earthquake - Yunnan (Qiaojia County, Zhaotong City) - 18/05/2020",2020-05-18T00:00:00Z,500,Earthquake
China,2020,China: Forest Fire - Sichuan (Xichang) - 30/03/2020,2020-03-30T00:00:00Z,24000,Wildfire
China,2020,China: Hailstorm - Hunan - 04/05/2020,2020-05-04T00:00:00Z,27,Storm
China,2020,"China: Storms - Hainan, Guangdong, Guangxi - October 2020",2020-10-01T00:00:00Z,21000,Flood
China,2020,China: Floods - Guizhou - 03/09/2020,2020-09-03T00:00:00Z,1700,Flood
China,2020,China: Floods - Guizhou - 09/09/2020,2020-09-09T00:00:00Z,4000,Flood
China,2020,China: Typhoon Mekkhala - Fujian - 11/08/2020,2020-08-11T00:00:00Z,80,Storm
China,2020,"China, Japan, South Korea: Typhoon Haishen - 31/08/2020",2020-08-31T00:00:00Z,1500,Storm
China,2020,"China, North Korea, South Korea: Typhoon Maysak - 27/08/2020",2020-08-27T00:00:00Z,39000,Storm
China,2020,China: Floods - Shandong - 05/08/2020,2020-08-05T00:00:00Z,710,Flood
China,2020,China: Floods - Sichuan - 10/08/2020,2020-08-10T00:00:00Z,490000,Flood
China,2020,China: Flood - Chongqing - 16/08/2020,2020-08-16T00:00:00Z,251000,Flood
China,2020,China: Tropical Cyclone HAGUPIT - 30/07/2020,2020-07-30T00:00:00Z,326000,Storm
China,2020,China: Flood Season - 27 provinces (districts and cities) - 01/06/2020,2020-06-01T00:00:00Z,3760000,Flood
China,2020,China: Floods - Shaanxi (Baoji) - 15/08/2020,2020-08-15T00:00:00Z,4700,Flood
China,2020,China: Floods - Shaanxi (Wienan) - 05/08/2020,2020-08-05T00:00:00Z,1200,Flood
China,2020,China: Flood - Liaoning - 12/08/2020,2020-08-12T00:00:00Z,5800,Flood
China,2020,China: Floods - Gansu - 03/08/2020,2020-08-03T00:00:00Z,8300,Flood
China,2020,China: Floods - Yunnan (Honghe Hani and Yi Autonomous Prefecture) - 15/08/2020,2020-08-15T00:00:00Z,100,Flood
China,2020,"China: Earthquake - Sichuan (Qingbaijiang District, Chengdu City) - 3/2/2020",2020-02-03T00:00:00Z,200,Earthquake
China,2020,"China: Earthquake - Xinjiang (Jiashi County, Kashgar District) - 19/01/2020",2020-01-19T00:00:00Z,8000,Earthquake
China,2020,"China: Earthquake - Sichuan (Shiqu County, Tibetan Autonomous Prefecture of Garze) - 01/04/2020",2020-04-01T00:00:00Z,6000,Earthquake
China,2020,China: Landslides -  Yunnan (Nujiang Lisu Autonomous Prefecture) - 24/05/2020,2020-05-24T00:00:00Z,1200,Storm
China,2020,"China: Storm - Hubei, Chongqing, Guizhou - 17/04/2020",2020-04-17T00:00:00Z,200,Storm
China,2020,"China: Storm -  Fujian, Jiangxi, Chongqing, Sichuan, Guizhou (Tongren City) - 09/05/2020",2020-05-09T00:00:00Z,500,Storm
China,2020,"China: Storm -  Hubei, Hunan, Chongqing and Sichuan - 06/05/2020",2020-05-06T00:00:00Z,400,Storm
China,2020,"China, Macao, Hong Kong, Thailand, Viet Nam: Tropical Storm Higos (Helen) - 16/08/2020",2020-08-16T00:00:00Z,65000,Storm
China,2020,China: Wet Mass Movement / Barrier Lake - Sichuan (Danba county) - 17/06/2020,2020-06-17T00:00:00Z,20000,Wet Mass Movement
China,2020,China: Landslide - Hubei (Huangmei county) - 08/07/2020,2020-07-08T00:00:00Z,40,Wet Mass Movement
China,2020,China: Landslide - Gansu (Longnan City) - 18/08/2020,2020-08-18T00:00:00Z,250,Wet Mass Movement
China,2020,China: Mudslide - Gansu (Wenxian or Wen County) - 17/08/2020,2020-08-17T00:00:00Z,31000,Wet Mass Movement
China,2020,"China: Landslide - Guangxi (Puyi Township, Yangshuo County) - 07/06/2020",2020-06-07T00:00:00Z,120,Wet Mass Movement
China,2021,"China: Flood - Shanxi, Shaanxi, Henan and Shandong - 01/09/2021",2021-09-01T00:00:00Z,467000,Flood
China,2021,China: Tornado - Hubei (Wuhan) - 15/05/2021,2021-05-15T00:00:00Z,84,Storm
China,2021,"China, Taiwan: Tropical Storm ""Lupit"" - Fujian and Guangdong (CHN), Tainan, Nantou and Kaohsiung (TWN) - 05/08/2021",2021-08-05T00:00:00Z,33000,Storm
China,2021,China: Earthquake - Qinghai - 22/05/2021,2021-05-22T00:00:00Z,108000,Earthquake
China,2021,"China, Viet Nam: Typhoon ""CEMPAKA"" - Guangdong (CHN), Nghe An and Thanh Hoa (VNM) - 17/07/2021",2021-07-17T00:00:00Z,105000,Storm
China,2021,China: Flood [Monsoon] - Sichuan - 07/08/2021,2021-08-07T00:00:00Z,300000,Flood
China,2021,China: Flood [Monsoon] - Shaanxi  - 19/08/2021,2021-08-19T00:00:00Z,99000,Flood
China,2021,China: Flood [Monsoon] - Shanxi - 10/07/2021,2021-07-10T00:00:00Z,74000,Flood
China,2021,China: Flood - Shanxi - 02/10/2021,2021-10-02T00:00:00Z,120000,Flood
China,2021,China: Flood [Monsoon] - Henan (Zhengzhou) - 21/08/2021,2021-08-21T00:00:00Z,240000,Flood
China,2021,China: Flood [Monsoon] - Sichuan - 16/08/2021,2021-08-16T00:00:00Z,16000,Flood
China,2021,China: Flood [Monsoon] - Jiangxi - 28/06/2021,2021-06-28T00:00:00Z,63000,Flood
China,2021,China: Flood [Monsoon] - Heilongjiang - 22/06/2021,2021-06-22T00:00:00Z,20000,Flood
China,2021,China: Flood [Monsoon] - Anhui (Anqing City) - 02/07/2021,2021-07-02T00:00:00Z,37,Flood
China,2021,China: Flood - Sichuan - 03/10/2021,2021-10-03T00:00:00Z,116000,Flood
China,2021,China: Flood [Monsoon] - Sichuan - 05/09/2021,2021-09-05T00:00:00Z,27000,Flood
China,2021,China: Flood [Monsoon] - Shaanxi (Ankang) - 28/08/2021,2021-08-28T00:00:00Z,46000,Flood
China,2021,China: Flood [Monsoon] - Hubei - 08/08/2021,2021-08-08T00:00:00Z,57000,Flood
China,2021,China: Flood [Monsoon] - Sichuan - 21/08/2021,2021-08-21T00:00:00Z,23000,Flood
China,2021,China: Flood [Monsoon] - Yunnan - 06/06/2021,2021-06-06T00:00:00Z,870,Flood
China,2021,China: Flood [Monsoon] - Henan  - 16/07/2021,2021-07-16T00:00:00Z,1490000,Flood
China,2021,China: Flood [Monsoon] - Sichuan - 15/09/2021,2021-09-15T00:00:00Z,16000,Flood
China,2021,China: Flood [Monsoon] - Sichuan - 11/07/2021,2021-07-11T00:00:00Z,173000,Flood
China,2021,China: Flood - Shaanxi - 02/10/2021,2021-10-02T00:00:00Z,47000,Flood
China,2021,China: Flood [Monsoon] - Hebei - 01/07/2021,2021-07-01T00:00:00Z,306000,Flood
China,2021,China: Flood [Monsoon] - Shaanxi - 19/08/2021,2021-08-19T00:00:00Z,2200,Flood
China,2021,China: Flood [Monsoon] - Anhui (Anqing) - 03/07/2021,2021-07-03T00:00:00Z,17,Flood
China,2021,China: Flood [Monsoon] - Anhui (Huangshan City) - 02/07/2021,2021-07-02T00:00:00Z,8,Flood
China,2021,China: Flood [Monsoon] - Countrywide - 01/04/2021,2021-04-01T00:00:00Z,88000,Flood
China,2021,China: Flood [Monsoon] - Henan - 10/07/2021,2021-07-10T00:00:00Z,440,Flood
China,2021,China: Flood [Monsoon] - Beijing - 11/07/2021,2021-07-11T00:00:00Z,24000,Flood
China,2021,China: Flood [Monsoon] - Guangxi (Hechi) - 03/07/2021,2021-07-03T00:00:00Z,430,Flood
China,2021,China: Flood [Monsoon] - Zhejiang (Jinhua) - 17/08/2021,2021-08-17T00:00:00Z,10,Flood
China,2021,China: Flood [Monsoon] - Hunan - 27/06/2021,2021-06-27T00:00:00Z,12,Flood
China,2021,"China, Korea, Philippines, Taiwan: Typhoon Chanthu (locally known as Kiko) - Shanghai (CHN), Jeollanam-do (KOR), Region I, II and CAR (PHL), 10 counties (TWN) - 07/09/2021",2021-09-05T00:00:00Z,331000,Storm
China,2021,"China, Philippines, Taiwan: Typhoon ""In-Fa"" / ""Fabian "" - 9 Provinces (CHN), 8 Regions (PHL),  New Taipei, Taoyuan and Hsinchu (TWN) - 14/07/2021",2021-07-14T00:00:00Z,1430000,Storm
China,2021,"China, Taiwan: Tropical Storm ""Lupit"" - Fujian and Guangdong (CHN), Tainan, Nantou and Kaohsiung (TWN) - 05/08/2021",2021-08-05T00:00:00Z,90000,Storm
China,2021,China: Hailstorm - Jiangsu (Nantong) - 30/04/2021,2021-04-30T00:00:00Z,3100,Storm
China,2021,China: Dam release flood [Monsoon] - Inner Mongolia - 18/07/2021,2021-07-18T00:00:00Z,2,Flood
China,2021,China: Landslide [Monsoon] - Guangxi (Guilin) - 01/07/2021,2021-07-01T00:00:00Z,45,Wet Mass Movement
China,2021,China: Landslide [Monsoon] - Hunan - 03/07/2021,2021-07-03T00:00:00Z,74,Wet Mass Movement
China,2021,"China, Hong Kong, Macau, Philippines, Taiwan, Viet Nam: Tropical Cyclone Kompasu (locally known as Maring) - Fujian (CHN), countrywide (HKG), countrywide (MAC), 7 Regions (PHL), Yilan and Hualien (TWN), Yen Bai (VNM) - 10/10/2021",2021-10-10T00:00:00Z,9200,Storm
China,2021,China: Landslide [Monsoon] - Guizhou - 20/06/2021,2021-06-20T00:00:00Z,400,Wet Mass Movement
China,2021,China: Landslide [Monsoon] - Hubei - 27/06/2021,2021-06-27T00:00:00Z,7,Wet Mass Movement
China,2021,China: Landslide [Monsoon] - Hubei (Huanggang City) - 28/06/2021,2021-06-28T00:00:00Z,22,Wet Mass Movement
China,2021,China: Landslide - Sichuan (Hongya County) - 05/04/2021,2021-04-05T00:00:00Z,68,Dry mass movement
China,2021,"China: Earthquake - Sichuan (Luxian County, Luzhou City) - 16/09/2021",2021-09-16T00:00:00Z,77000,Earthquake
China,2021,China: Earthquake - Xinjiang Uygur Autonomous Region (Aksu) - 23/03/2021,2021-03-23T00:00:00Z,1600,Earthquake
China,2021,China: Earthquake - Yunnan (Chuxiong) - 11/06/2021,2021-06-11T00:00:00Z,290,Earthquake
China,2021,China: Earthquake - Yunnan - 21/05/2021,2021-05-21T00:00:00Z,28000,Earthquake
China,2021,China: Thunderstorm - Guizhou - 15/05/2021,2021-05-15T00:00:00Z,230,Storm
China,2021,China: Strong winds and heavy rains- Hunan (Yueyang) - 15/05/2021,2021-05-15T00:00:00Z,3800,Storm
Côte d'Ivoire,2009,,2009-01-01T00:00:00Z,10000,Wet Mass Movement
Côte d'Ivoire,2013,Prison Tabou flood,2013-12-01T00:00:00Z,78,Flood
Côte d'Ivoire,2014,Abidjan floods,2014-05-15T00:00:00Z,4500,Flood
Côte d'Ivoire,2018,Cote d'Ivoire: Flood - Comoé - 13/07/2018,2018-07-13T00:00:00Z,960,Flood
Côte d'Ivoire,2018,Cote d'Ivoire: Flood - Comoé - 16/10/2018,2018-10-16T00:00:00Z,10,Flood
Côte d'Ivoire,2018,Cote d'Ivoire: Flood - Lagunes - 12/07/2018,2018-07-12T00:00:00Z,48,Flood
Côte d'Ivoire,2018,Cote d'Ivoire: Flood - Marahoué - 17/09/2018,2018-09-17T00:00:00Z,2000,Flood
Côte d'Ivoire,2018,Côte d'Ivoire: Flood - Abidjan - 18/06/2018,2018-06-18T00:00:00Z,140,Flood
Côte d'Ivoire,2019,Cote d'Ivoire: Flood - Yopougon - 11/11/2019 ,2019-11-11T00:00:00Z,10,Flood
Côte d'Ivoire,2019,Cote d'Ivoire: Flood - 6 cities -  04/10/2019 ,2019-10-04T00:00:00Z,610,Flood
Côte d'Ivoire,2019,Côte d'Ivoire: Storm - Vallée de Bandama - 29/05/2019,2019-05-29T00:00:00Z,96,Storm
Côte d'Ivoire,2020,Côte dIvoire: Tornado - (Gontougo - Bouatia) - 10/05/2020,2020-05-10T00:00:00Z,120,Storm
Côte d'Ivoire,2020,Cote d'Ivoire: Flood - Lagunes (Grand Lahou) - 19/06/2020,2020-06-19T00:00:00Z,70,Storm
Côte d'Ivoire,2020,Cote d'Ivoire: Floods - 12 localities - 17/06/2020,2020-05-17T00:00:00Z,1700,Flood
Cameroon,2008,FL-2008-000126-TCD/CMR,2008-07-01T00:00:00Z,1000,Flood
Cameroon,2010,,2010-01-01T00:00:00Z,3000,Flood
Cameroon,2012,,2012-01-01T00:00:00Z,30000,Flood
Cameroon,2013,Kai Kai district flood,2013-09-17T00:00:00Z,10000,Flood
Cameroon,2014,Bibemi floods,2014-08-21T00:00:00Z,3500,Flood
Cameroon,2015,Logone-Et-Chari floods,2015-09-01T00:00:00Z,8600,Flood
Cameroon,2015,Mayo-Danay floods,2015-05-01T00:00:00Z,260,Flood
Cameroon,2015,Douala flood,2015-06-18T00:00:00Z,2500,Flood
Cameroon,2019,Cameroon: Flood - Nord Ouest - 11/08/2019 ,2019-08-11T00:00:00Z,3400,Flood
Cameroon,2019,Cameroon: Landslide West (Bafoussam) - 28/10/2019 ,2019-10-28T00:00:00Z,400,Wet Mass Movement
Cameroon,2019,Cameroon: Flood - Extreme Nord (Darak) - 04/11/2019 ,2019-11-04T00:00:00Z,1200,Flood
Cameroon,2019,Cameroon: Floods - Far North - 29/09/2019 ,2019-09-29T00:00:00Z,19000,Flood
Cameroon,2019,Cameroon: Landslide - West (Njinka) - 10/11/2019,2019-11-10T00:00:00Z,39,Wet Mass Movement
Cameroon,2020,Cameroon: Floods - Littoral (Douala) - 21/08/2020,2020-08-21T00:00:00Z,4400,Flood
Cameroon,2020,Cameroon: Landslide - Southwest (Kupe-Muanenguba/Nguti) - 21/08/2020,2020-08-21T00:00:00Z,200,Wet Mass Movement
Cameroon,2020,Cameroon: Floods - Far North  - 01/07/2020,2020-07-01T00:00:00Z,111000,Flood
Cameroon,2021,Cameroon: Floods - Far North - 2021,2021-07-01T00:00:00Z,1800,Flood
Dem. Rep. Congo,2008,,2008-02-04T00:00:00Z,500,Flood
Dem. Rep. Congo,2008,,2008-03-02T00:00:00Z,4600,Earthquake
Dem. Rep. Congo,2009,,2009-01-01T00:00:00Z,130,Wildfire
Dem. Rep. Congo,2010,,2010-01-01T00:00:00Z,1800,Flood
Dem. Rep. Congo,2010,,2010-01-01T00:00:00Z,65000,Flood
Dem. Rep. Congo,2010,,2010-01-01T00:00:00Z,1500,Flood
Dem. Rep. Congo,2010,,2010-01-01T00:00:00Z,2800,Wildfire
Dem. Rep. Congo,2010,2010-000250,2010-01-01T00:00:00Z,1200,Wet Mass Movement
Dem. Rep. Congo,2010,,2010-01-01T00:00:00Z,26000,Flood
Dem. Rep. Congo,2011,FL-2011-000187-COD,2011-01-01T00:00:00Z,9600,Flood
Dem. Rep. Congo,2011,,2011-01-01T00:00:00Z,2000,Flood
Dem. Rep. Congo,2012,,2012-01-01T00:00:00Z,2000,Flood
Dem. Rep. Congo,2012,,2012-01-01T00:00:00Z,21000,Storm
Dem. Rep. Congo,2013,Nord Kivu flood,2013-01-01T00:00:00Z,2000,Flood
Dem. Rep. Congo,2013,Mbuji-Mayi (Kasaï-Oriental) flood,2013-01-30T00:00:00Z,710,Flood
Dem. Rep. Congo,2013,Gbadolite flood,2013-08-09T00:00:00Z,1000,Flood
Dem. Rep. Congo,2013,Lubutu flood,2013-04-15T00:00:00Z,110,Flood
Dem. Rep. Congo,2014,Congo river overflown,2014-04-10T00:00:00Z,11000,Flood
Dem. Rep. Congo,2014,Basoko flood,2014-10-31T00:00:00Z,2500,Flood
Dem. Rep. Congo,2014,Masisi flood,2014-10-06T00:00:00Z,2100,Flood
Dem. Rep. Congo,2014,Tshikapa flood caused by Tshikapa and Kasaï overflown rivers,2014-04-14T00:00:00Z,320,Flood
Dem. Rep. Congo,2014,Flood across the DRC territory,2014-10-04T00:00:00Z,200,Flood
Dem. Rep. Congo,2014,Bweremana flood,2014-10-13T00:00:00Z,150,Flood
Dem. Rep. Congo,2014,Kindu flood caused by torrential rain,2014-03-22T00:00:00Z,1100,Flood
Dem. Rep. Congo,2014,Kasenyi flood caused by torrential rain,2014-05-07T00:00:00Z,320,Flood
Dem. Rep. Congo,2014,Tshela flood,2014-04-16T00:00:00Z,1800,Flood
Dem. Rep. Congo,2014,South Kivu flooding,2014-10-28T00:00:00Z,4000,Flood
Dem. Rep. Congo,2014,Kalemie flood,2014-04-20T00:00:00Z,1100,Flood
Dem. Rep. Congo,2015,Lufu-Toto flood,2015-11-01T00:00:00Z,75,Flood
Dem. Rep. Congo,2015,Bumba flood,2015-11-01T00:00:00Z,2100,Flood
Dem. Rep. Congo,2015,Kinshasa flood,2015-12-01T00:00:00Z,104000,Flood
Dem. Rep. Congo,2015,Fizi territory flood,2015-03-01T00:00:00Z,260,Flood
Dem. Rep. Congo,2015,Ngungu flood,2015-03-01T00:00:00Z,73,Flood
Dem. Rep. Congo,2016,Kalemie floods,2016-05-01T00:00:00Z,2300,Flood
Dem. Rep. Congo,2016,Boma floods,2016-12-26T00:00:00Z,10000,Flood
Dem. Rep. Congo,2016,Sud Ubangi flood,2016-11-07T00:00:00Z,1400,Flood
Dem. Rep. Congo,2016,Ituri floods,2016-05-01T00:00:00Z,9000,Flood
Dem. Rep. Congo,2016,Bukama floods,2016-01-15T00:00:00Z,42000,Flood
Dem. Rep. Congo,2016,"Floods in Tchomia, Ituri",2016-04-27T00:00:00Z,5200,Flood
Dem. Rep. Congo,2016,Bumba floods,2016-01-01T00:00:00Z,57000,Flood
Dem. Rep. Congo,2016,Nord Kivu storm,2016-03-11T00:00:00Z,1000,Storm
Dem. Rep. Congo,2016,Kongolo and Manono wildfire,2016-07-01T00:00:00Z,1700,Wildfire
Dem. Rep. Congo,2017,DRC: Wildfire - Bas-Uele - 13/03/2017,2017-03-13T00:00:00Z,300,Wildfire
Dem. Rep. Congo,2017,DRC: Earthquake - South Kivu - 20/11/2017,2017-11-20T00:00:00Z,2,Earthquake
Dem. Rep. Congo,2017,DRC: Flood - Kongo-Central - 26/12/2017,2017-12-26T00:00:00Z,230,Flood
Dem. Rep. Congo,2017,DRC: Wildfire - Sud Kivu - 20/05/2017,2017-05-20T00:00:00Z,2000,Wildfire
Dem. Rep. Congo,2017,DRC: Flood - Ituri - 14/06/2017,2017-06-14T00:00:00Z,51,Flood
Dem. Rep. Congo,2017,DRC: Storm - Sud Kivu - 23/05/2017,2017-05-23T00:00:00Z,150,Storm
Dem. Rep. Congo,2017,DRC: Storm - Kasai-Oriental - 28/10/2017,2017-10-28T00:00:00Z,370,Storm
Dem. Rep. Congo,2017,DRC: Flood - Nord Kivu - 19/09/2017,2017-09-19T00:00:00Z,520,Flood
Dem. Rep. Congo,2017,DRC: Storm - Tanganyika - 24/12/2017,2017-12-24T00:00:00Z,100,Storm
Dem. Rep. Congo,2017,DRC: Landslide - Ituri - 16/08/2017,2017-08-16T00:00:00Z,170,Wet Mass Movement
Dem. Rep. Congo,2017,DRC: Storm - Haut-Lomami - 08/09/2017,2017-09-08T00:00:00Z,10,Storm
Dem. Rep. Congo,2017,DRC: Flood - Equateur - 28/11/2017,2017-11-28T00:00:00Z,4600,Flood
Dem. Rep. Congo,2017,DRC: Storm - Haut-Katanga - 05/12/2017,2017-12-05T00:00:00Z,610,Storm
Dem. Rep. Congo,2017,DRC: Storm - Haut-Uele - 27/01/2017,2017-01-27T00:00:00Z,2700,Storm
Dem. Rep. Congo,2017,DRC: Storm - Kwilu - 21/11/2017,2017-11-21T00:00:00Z,10,Storm
Dem. Rep. Congo,2017,DRC: Storm - Kasai - 09/10/2017,2017-10-09T00:00:00Z,2700,Storm
Dem. Rep. Congo,2017,DRC: Storm - Sud Kivu - 19/09/2017,2017-09-19T00:00:00Z,9200,Storm
Dem. Rep. Congo,2017,DRC: Flood - Bas-Uele - 04/11/2017,2017-11-04T00:00:00Z,1200,Flood
Dem. Rep. Congo,2017,DRC: Storm - Maniema - 24/10/2017,2017-10-24T00:00:00Z,2300,Storm
Dem. Rep. Congo,2017,DRC: Storm - Equateur - 05/01/2017,2017-01-05T00:00:00Z,200,Storm
Dem. Rep. Congo,2018,DRC: Flood - Haut-Lomami - 21/03/2018,2018-03-21T00:00:00Z,14000,Flood
Dem. Rep. Congo,2018,DRC: Flood - South Kivu - 21/03/2018,2018-03-21T00:00:00Z,250,Flood
Dem. Rep. Congo,2018,DRC: Flood - Kinshasa - 03/01/2018,2018-01-03T00:00:00Z,16000,Flood
Dem. Rep. Congo,2018,DRC: Storm - Tanganyika - 09/03/2018,2018-03-09T00:00:00Z,450,Storm
Dem. Rep. Congo,2018,DRC: Flood - Gemena; Sud-Ubangi - 05/08/2018,2018-08-05T00:00:00Z,2000,Flood
Dem. Rep. Congo,2018,DRC: Storm - Uvira - 27/03/2018,2018-03-27T00:00:00Z,100,Storm
Dem. Rep. Congo,2018,DRC: Storm - Uvira; Ruzizi; Kalehe; South Kivu - 29/04/2018,2018-04-29T00:00:00Z,24000,Storm
Dem. Rep. Congo,2018,DRC: Storm - South Kivu - 30/03/2018,2018-03-30T00:00:00Z,720,Storm
Dem. Rep. Congo,2018,DRC: Storm - South Kivu - 27/01/2018,2018-01-27T00:00:00Z,1800,Storm
Dem. Rep. Congo,2018,DRC: Storm - Nyiragongo; North Kivu - 13/05/2018,2018-05-13T00:00:00Z,360,Storm
Dem. Rep. Congo,2018,DRC: Wildfire - Kazumba territory; Kasaï-Central - 23/07/2018,2018-07-23T00:00:00Z,46,Wildfire
Dem. Rep. Congo,2018,"DRC: Wildfire - Nord Ubangi, South Ubangi - 04/02/2018",2018-02-04T00:00:00Z,220,Wildfire
Dem. Rep. Congo,2018,DRC: Wildfire - Dibaya territory; Kasaï-Central - 23/07/2018,2018-07-23T00:00:00Z,51,Wildfire
Dem. Rep. Congo,2018,DRC: Storm - Maniema - 22/03/2018,2018-03-22T00:00:00Z,560,Storm
Dem. Rep. Congo,2018,DRC: Flood - Haut-Katanga - 15/04/2018,2018-04-11T00:00:00Z,21000,Flood
Dem. Rep. Congo,2019,DRC: Flash flooding- Kongo Central- 16/05/2019,2019-05-16T00:00:00Z,750,Flood
Dem. Rep. Congo,2019,DRC: Flash floods- Kasai Oriental (Mbujui-Mayi)- 04/12/2019,2019-12-04T00:00:00Z,1500,Flood
Dem. Rep. Congo,2019,DRC: Flash floods- Kinshasa- 04/10/2019,2019-10-04T00:00:00Z,150,Flood
Dem. Rep. Congo,2019,DRC: Flash flooding-  Baraka (South Kivu)- 29/01/2019,2019-01-29T00:00:00Z,130,Flood
Dem. Rep. Congo,2019,DRC: Floods- Tshopo- 31/10/2019,2019-10-31T00:00:00Z,18000,Flood
Dem. Rep. Congo,2019,DRC: Flash flooding- Tshopo (Kisangani)- 23/09/2019,2019-09-23T00:00:00Z,10,Flood
Dem. Rep. Congo,2019,DRC: Flash floods- Maniema- 24/09/2019,2019-09-25T00:00:00Z,13000,Flood
Dem. Rep. Congo,2019,"DRC: Riverine floods of Lomami and Lombo Rivers- Tshopo (Opala, Yabaondo, Isangi)- 08/01/2019",2019-01-08T00:00:00Z,21000,Flood
Dem. Rep. Congo,2019,"DRC: Flooding of Nyamukau river, Bunia (Ituri)- 06/09/2019",2019-09-06T00:00:00Z,10,Flood
Dem. Rep. Congo,2019,DRC: Floods - Zongo- (Sud Ubangi) - 4/08/2019,2019-08-03T00:00:00Z,800,Flood
Dem. Rep. Congo,2019,"DRC: Flash floods- Kasai (Ndjoku Punda, Tshikapa)- 22/11/2019",2019-11-22T00:00:00Z,4800,Flood
Dem. Rep. Congo,2019,"DRC: Flash floods- Maniema (Kindu, Kailo territory)- 31/10/2019",2019-10-31T00:00:00Z,7000,Flood
Dem. Rep. Congo,2019,DRC: Storm - Haut Lomami (Malemba Nkulu) - 04/03/2019,2019-03-04T00:00:00Z,6900,Storm
Dem. Rep. Congo,2019,DRC: Floods- Equateur- 01/11/2019,2019-11-01T00:00:00Z,1500,Flood
Dem. Rep. Congo,2019,DRC: Ulundi riverine flooding- South Kivu (Shabunda territory)- 22/11/2019,2019-11-22T00:00:00Z,9000,Flood
Dem. Rep. Congo,2019,DRC: Flooding of Itimbiri and Congo rivers- Mongala (Bumba territory)- 11/11/2019,2019-11-02T00:00:00Z,2700,Flood
Dem. Rep. Congo,2019,"DRC: Flash floods- Haut Uele (Dungu, Niangara)- 15/10/2019",2019-10-15T00:00:00Z,7000,Flood
Dem. Rep. Congo,2019,"DRC: Flood - Sud Ubangi (Zongo, Libenge), Nord Ubangi- 01/10/2019",2019-10-01T00:00:00Z,137000,Flood
Dem. Rep. Congo,2019,DRC: Mudslides- Masisi (North Kivu)- 27/04/2019,2019-04-27T00:00:00Z,450,Wet Mass Movement
Dem. Rep. Congo,2019,DRC: Floods- Kongo Central (Lukula)- 26/10/2019,2019-10-26T00:00:00Z,300,Flood
Dem. Rep. Congo,2020,DRC: Floods - South Kivu (Bukavu)- 11/01/2020,2020-01-01T00:00:00Z,400,Flood
Dem. Rep. Congo,2020,DRC: Overflow of Kasai river - Kwilu (Bagata territory)- 25/04/2020,2020-04-25T00:00:00Z,60,Flood
Dem. Rep. Congo,2020,"DRC: Floods - South Kivu- Fizi territory (Nundu, Fizi, Baraka), Uvira territory (Uvira city, Ruzizi, Lemera) - 16/04/2020",2020-04-16T00:00:00Z,176000,Flood
Dem. Rep. Congo,2020,DRC: Overflow of Ubangi river - North Ubangi (Yakoma territory)- 20/07/2020,2020-07-20T00:00:00Z,720,Flood
Dem. Rep. Congo,2020,"DRC: Overflow of Ubangi river - North Ubangi (Nganza commune, Gbadolite)- 25/09/2020",2020-09-25T00:00:00Z,57,Flood
Dem. Rep. Congo,2020,DRC: Overflow of Moba river - Tanganyika (Moba) - 14/02/2020,2020-02-14T00:00:00Z,1300,Flood
Dem. Rep. Congo,2020,DRC: Storm - South Kivu (Uvira territory)- 24/11/2020,2020-11-24T00:00:00Z,1200,Storm
Dem. Rep. Congo,2020,DRC: Floods - Maniema (Kabambare territory) - 27/04/2020,2020-04-27T00:00:00Z,4000,Flood
Dem. Rep. Congo,2020,DRC: Flash Floods - Ituri (Irumu territory)- 12/05/2020,2020-05-12T00:00:00Z,210,Flood
Dem. Rep. Congo,2020,DRC: Floods - South Kivu (Uvira)- 01/01/2020,2020-01-01T00:00:00Z,750,Flood
Dem. Rep. Congo,2020,DRC: Floods - Kwilu (Bandundu) - 19/02/2020,2020-02-19T00:00:00Z,10,Flood
Dem. Rep. Congo,2020,DRC: Flash floods - South Kivu (Kalehe territory)- 18/11/2020,2020-11-18T00:00:00Z,10,Flood
Dem. Rep. Congo,2020,"DRC: Flash floods - North Kivu (Masisi territory, Sake town)- 15/11/2020",2020-11-15T00:00:00Z,3800,Flood
Dem. Rep. Congo,2020,DRC: Floods - South Kivu (Fizi territory)- 25/09/2020,2020-09-25T00:00:00Z,650,Flood
Dem. Rep. Congo,2020,DRC: Floods - Haut Lomami - 01/01/2020,2020-01-01T00:00:00Z,34000,Flood
Dem. Rep. Congo,2020,"DRC: Floods - Tanganyika (Kabalo, Kongolo) - 01/01/2020",2020-01-01T00:00:00Z,34000,Flood
Dem. Rep. Congo,2020,DRC: Floods- Kinshasa (Nsele)- 10/01/2020,2020-01-10T00:00:00Z,200,Flood
Dem. Rep. Congo,2020,DRC: Floods - Mai Ndombe - 01/01/2020,2020-01-01T00:00:00Z,4000,Flood
Dem. Rep. Congo,2020,DRC: Overflow of Lake Albert - Ituri (Djugu territory) - 02/05/2020,2020-05-02T00:00:00Z,200,Flood
Dem. Rep. Congo,2020,DRC: Overflow of Kasai river - Maï-Ndombe (Bendela) - 16/05/2020,2020-05-16T00:00:00Z,500,Flood
Dem. Rep. Congo,2020,DRC: Floods - Maniema - 19/03/2020,2020-03-19T00:00:00Z,14000,Flood
Dem. Rep. Congo,2020,DRC: Floods - Kongo-Central (Mbanza-Ngungu) - 07/01/2020,2020-01-07T00:00:00Z,100,Flood
Dem. Rep. Congo,2020,DRC: Floods - Ituri- 04/01/2020,2020-01-04T00:00:00Z,3000,Flood
Dem. Rep. Congo,2021,DRC: Heavy Rains/Strong Winds - Maniema - November 2021,2021-11-01T00:00:00Z,6100,Storm
Dem. Rep. Congo,2021,DRC: Heavy Rains - Tshopo - December 2021,2021-12-01T00:00:00Z,200,Storm
Dem. Rep. Congo,2021,DRC: Landslides - North Kivu - August 2021,2021-08-01T00:00:00Z,8000,Wet Mass Movement
Dem. Rep. Congo,2021,DRC: Torrrential Rains - Lomami - September 2021,2021-09-01T00:00:00Z,150,Storm
Dem. Rep. Congo,2021,"DRC: Volcano Nyiragongo Eruption - North Kivu (Goma, Nyiragongo) - 22/05/2021",2021-05-22T00:00:00Z,599000,Volcanic eruption
Dem. Rep. Congo,2021,DRC: Floods - Ituri - September 2021,2021-09-01T00:00:00Z,15000,Flood
Dem. Rep. Congo,2021,DRC: Heavy Rains/Strong Winds - Ituri - October 2021,2021-10-01T00:00:00Z,250,Storm
Dem. Rep. Congo,2021,DRC: Water Erosion - Kwilu - December 2021,2021-12-01T00:00:00Z,4000,Wet Mass Movement
Dem. Rep. Congo,2021,DRC: Floods - Tanganyika - January-April 2021,2021-01-01T00:00:00Z,217000,Flood
Dem. Rep. Congo,2021,DRC: Floods - Tanganyika - November 2021,2021-11-01T00:00:00Z,2800,Flood
Dem. Rep. Congo,2021,DRC: Floods - Ituri - June 2021,2021-06-01T00:00:00Z,500,Flood
Dem. Rep. Congo,2021,DRC: Floods - Ituri - July 2021,2021-07-01T00:00:00Z,1500,Flood
Dem. Rep. Congo,2021,DRC: Floods - North Kivu - August 2021,2021-08-01T00:00:00Z,7500,Flood
Dem. Rep. Congo,2021,DRC: Floods - North Kivu - September 2021,2021-09-01T00:00:00Z,70,Flood
Dem. Rep. Congo,2021,DRC: Floods - North Kivu - September 2021,2021-09-01T00:00:00Z,10,Flood
Dem. Rep. Congo,2021,DRC: Floods - Ituri - January 2021,2021-01-01T00:00:00Z,6000,Flood
Dem. Rep. Congo,2021,DRC: Heavy Rains - Maï-Ndombe - October 2021,2021-10-01T00:00:00Z,500,Storm
Dem. Rep. Congo,2021,DRC: Strong Winds - Kasai - June 2021,2021-06-01T00:00:00Z,1200,Storm
Dem. Rep. Congo,2021,DRC: Floods - Haut-Uele - July 2021,2021-07-01T00:00:00Z,7100,Flood
Dem. Rep. Congo,2021,DRC: Heavy Rains - Haut-Lomami - November 2021,2021-11-01T00:00:00Z,10000,Storm
Dem. Rep. Congo,2021,DRC: Heavy Rains - Maniema - December 2021,2021-12-01T00:00:00Z,380,Storm
Congo,2019,Republic of Congo: Mudslide- Brazzaville (Ngambio la Base)- 31/12/2019,2019-12-31T00:00:00Z,3000,Wet Mass Movement
Congo,2019,Republic of Congo: Floods- Brazzaville (Talangai)- 23/11/2019,2019-11-23T00:00:00Z,2,Wet Mass Movement
Congo,2019,Republic of Congo: Flood - 4 departments- 01/10/2019,2019-10-01T00:00:00Z,163000,Flood
Congo,2021,Republic of Congo: Floods - Countrywide - 2021,2021-01-01T00:00:00Z,100,Flood
Congo,2021,Republic of Congo: Floods - Countrywide - 2021,2021-01-01T00:00:00Z,6600,Flood
Cook Islands,2010,Rene,2010-01-01T00:00:00Z,380,Storm
Cook Islands,2010,Pat,2010-01-01T00:00:00Z,270,Storm
Cook Islands,2016,Tropical Cyclone Victor,2016-01-15T00:00:00Z,6,Storm
Cook Islands,2021,Cook Islands: Floods - Rarotonga (Tupapa) - 11/05/2021,2021-05-11T00:00:00Z,12,Flood
Colombia,2008,,2008-12-13T00:00:00Z,20000,Flood
Colombia,2008,,2008-04-14T00:00:00Z,13000,Volcanic eruption
Colombia,2008,,2008-09-15T00:00:00Z,10000,Flood
Colombia,2008,VO-2008-000220-COL,2008-11-20T00:00:00Z,12000,Volcanic eruption
Colombia,2008,,2008-01-17T00:00:00Z,8000,Volcanic eruption
Colombia,2009,Galeras Volcano,2009-01-01T00:00:00Z,8500,Volcanic eruption
Colombia,2009,,2009-01-01T00:00:00Z,590,Wet Mass Movement
Colombia,2010,2010-000207,2010-01-01T00:00:00Z,1500000,Flood
Colombia,2010,,2010-01-01T00:00:00Z,1500000,Flood
Colombia,2011,FL-2011-000170-COL,2011-01-01T00:00:00Z,80000,Flood
Colombia,2011,,2011-01-01T00:00:00Z,69000,Flood
Colombia,2012,,2012-01-01T00:00:00Z,4000,Flood
Colombia,2012,,2012-01-01T00:00:00Z,60000,Flood
Colombia,2012,,2012-01-01T00:00:00Z,7200,Volcanic eruption
Colombia,2013,Guayabetal landslide,2013-07-18T00:00:00Z,25,Wet Mass Movement
Colombia,2013,Pasca gale,2013-10-30T00:00:00Z,3,Storm
Colombia,2013,Patia gale,2013-09-14T00:00:00Z,3,Storm
Colombia,2013,Arauca flood,2013-05-08T00:00:00Z,3,Flood
Colombia,2013,Medio Atrato gale,2013-07-14T00:00:00Z,59,Storm
Colombia,2013,Sabanalarga gale,2013-04-17T00:00:00Z,3,Storm
Colombia,2013,Curillo flood,2013-07-19T00:00:00Z,3,Flood
Colombia,2013,Arauquita flood,2013-03-17T00:00:00Z,3,Flood
Colombia,2013,Manizales landslide and flood,2013-11-28T00:00:00Z,77,Wet Mass Movement
Colombia,2013,Santa Catalina gale,2013-08-17T00:00:00Z,7,Storm
Colombia,2013,Buenavista gale,2013-09-19T00:00:00Z,7,Storm
Colombia,2013,Apartado flood,2013-04-26T00:00:00Z,7,Flood
Colombia,2013,El Molino gale,2013-10-23T00:00:00Z,51,Storm
Colombia,2013,Cienaga gale,2013-08-01T00:00:00Z,11,Storm
Colombia,2013,Giron landslide,2013-02-17T00:00:00Z,3,Wet Mass Movement
Colombia,2013,Caparri flood,2013-05-05T00:00:00Z,3,Flood
Colombia,2013,Manzanares gale,2013-07-09T00:00:00Z,14,Storm
Colombia,2013,Genova Landslide,2013-12-23T00:00:00Z,3,Wet Mass Movement
Colombia,2013,Pereira flood,2013-12-03T00:00:00Z,7,Flood
Colombia,2013,Soledad Gale,2013-01-22T00:00:00Z,130,Storm
Colombia,2013,Carmen de Apicala gale,2013-04-18T00:00:00Z,22,Storm
Colombia,2013,Carmen del Darien gale,2013-06-05T00:00:00Z,14,Storm
Colombia,2013,Cucuta flood,2013-05-04T00:00:00Z,3,Flood
Colombia,2013,Putumayo floods,2013-07-17T00:00:00Z,580,Flood
Colombia,2013,Huila November Flood,2013-11-20T00:00:00Z,29,Flood
Colombia,2013,Puerto Leguizamo gale,2013-05-27T00:00:00Z,3,Storm
Colombia,2013,San Jose del Fragua gale,2013-03-25T00:00:00Z,3,Storm
Colombia,2013,Lloro gale,2013-04-26T00:00:00Z,3,Storm
Colombia,2013,Patia flood,2013-05-30T00:00:00Z,25,Flood
Colombia,2013,Nuqui gale,2013-07-26T00:00:00Z,3,Storm
Colombia,2013,Buenaventura flood,2013-05-31T00:00:00Z,11,Flood
Colombia,2013,Sucre gale,2013-07-19T00:00:00Z,7,Storm
Colombia,2013,Sogamoso flood,2013-02-12T00:00:00Z,3,Flood
Colombia,2013,Falan landslide,2013-05-22T00:00:00Z,59,Wet Mass Movement
Colombia,2013,Buenaventura Gale,2013-02-05T00:00:00Z,25,Storm
Colombia,2013,Arauquita flood,2013-04-16T00:00:00Z,7,Flood
Colombia,2013,Solano gale,2013-11-19T00:00:00Z,33,Storm
Colombia,2013,Granada Gale,2013-03-05T00:00:00Z,11,Storm
Colombia,2013,Florencia flood,2013-08-28T00:00:00Z,37,Flood
Colombia,2013,Medio Atrato Wildfire,2013-07-17T00:00:00Z,3,Wildfire
Colombia,2013,Barranquabermeja flood,2013-10-02T00:00:00Z,11,Flood
Colombia,2013,Agrado flood,2013-11-18T00:00:00Z,40,Flood
Colombia,2013,Carmen del Darien flood,2013-05-16T00:00:00Z,37,Flood
Colombia,2013,Sucre landslide,2013-03-25T00:00:00Z,140,Wet Mass Movement
Colombia,2013,Caucasia flood,2013-11-26T00:00:00Z,3,Flood
Colombia,2013,El Tambo gale,2013-07-30T00:00:00Z,190,Storm
Colombia,2013,El Carmen de Atrato gale,2013-08-15T00:00:00Z,37,Storm
Colombia,2013,Pensilvania gale,2013-08-07T00:00:00Z,18,Storm
Colombia,2013,Suarez gale,2013-09-02T00:00:00Z,3,Storm
Colombia,2013,Pradera flood,2013-12-23T00:00:00Z,22,Flood
Colombia,2013,Puerto Guzman flood,2013-08-15T00:00:00Z,11,Flood
Colombia,2013,Monteria flood,2013-08-29T00:00:00Z,7,Flood
Colombia,2013,Quibdo landslide,2013-06-18T00:00:00Z,3,Wet Mass Movement
Colombia,2013,Medellin Landslide,2013-09-06T00:00:00Z,29,Wet Mass Movement
Colombia,2013,Ibague flood,2013-05-23T00:00:00Z,3,Flood
Colombia,2013,Anori flood,2013-11-03T00:00:00Z,3,Flood
Colombia,2013,Guamo flood,2013-05-02T00:00:00Z,85,Flood
Colombia,2013,Belen landslide,2013-05-02T00:00:00Z,22,Wet Mass Movement
Colombia,2013,Villahermosa gale,2013-09-06T00:00:00Z,3,Storm
Colombia,2013,Caldono gale,2013-10-10T00:00:00Z,7,Storm
Colombia,2013,Villahermosa gale,2013-06-30T00:00:00Z,7,Storm
Colombia,2013,Antioquia floods,2013-05-04T00:00:00Z,29,Flood
Colombia,2013,Villahermosa gale,2013-04-28T00:00:00Z,7,Storm
Colombia,2013,El Doncello gale,2013-05-20T00:00:00Z,11,Storm
Colombia,2013,Plato flood,2013-08-30T00:00:00Z,3,Flood
Colombia,2013,Almaguer gale,2013-10-16T00:00:00Z,55,Storm
Colombia,2013,San Juan de Rio Seco landslide,2013-03-21T00:00:00Z,11,Wet Mass Movement
Colombia,2013,Almaguer Wildfire,2013-10-16T00:00:00Z,51,Wildfire
Colombia,2013,Soacha avalanche,2013-10-31T00:00:00Z,11,Wet Mass Movement
Colombia,2013,La Estrella flood,2013-06-30T00:00:00Z,3,Flood
Colombia,2013,Cucuta flood,2013-02-09T00:00:00Z,7,Flood
Colombia,2013,Medio Baudo avalanche,2013-08-18T00:00:00Z,14,Wet Mass Movement
Colombia,2013,Riofrio gale,2013-12-09T00:00:00Z,11,Storm
Colombia,2013,Tuquerres flood,2013-04-23T00:00:00Z,37,Flood
Colombia,2013,Puerto Berrio flood,2013-05-20T00:00:00Z,14,Flood
Colombia,2013,Choco March Flood,2013-03-15T00:00:00Z,2000,Flood
Colombia,2013,Policarpa Landslide,2013-11-02T00:00:00Z,18,Wet Mass Movement
Colombia,2013,San Andres surge,2013-01-11T00:00:00Z,29,Storm
Colombia,2013,Fusagasuga Landslide,2013-11-27T00:00:00Z,11,Wet Mass Movement
Colombia,2013,San Vicente de Chucuri flood,2013-11-07T00:00:00Z,7,Flood
Colombia,2013,Quibdo flood,2013-08-11T00:00:00Z,3,Flood
Colombia,2013,Montecristo landslide,2013-06-15T00:00:00Z,22,Wet Mass Movement
Colombia,2013,Puerto Leguizamo landslide,2013-07-22T00:00:00Z,18,Wet Mass Movement
Colombia,2013,Angelopolis avalanche,2013-08-25T00:00:00Z,3,Wet Mass Movement
Colombia,2013,El Penon gale,2013-09-08T00:00:00Z,7,Storm
Colombia,2013,Venadillo gale,2013-09-09T00:00:00Z,22,Storm
Colombia,2013,Nueva Granada gale,2013-09-28T00:00:00Z,22,Storm
Colombia,2013,Mallama Landslide,2013-12-08T00:00:00Z,7,Wet Mass Movement
Colombia,2013,Choco November Flood,2013-11-19T00:00:00Z,280,Flood
Colombia,2013,Pereira landslide,2013-06-02T00:00:00Z,7,Wet Mass Movement
Colombia,2013,San Martin gale,2013-09-28T00:00:00Z,7,Storm
Colombia,2013,Ariguani flood,2013-10-05T00:00:00Z,18,Flood
Colombia,2013,Penol landslide,2013-07-13T00:00:00Z,7,Wet Mass Movement
Colombia,2013,Giron Landslide,2013-12-01T00:00:00Z,14,Wet Mass Movement
Colombia,2013,Firavitoba wildfire,2013-01-17T00:00:00Z,14,Wildfire
Colombia,2013,Honda flood,2013-02-17T00:00:00Z,14,Flood
Colombia,2013,Suan Wildfire,2013-02-21T00:00:00Z,14,Wildfire
Colombia,2013,Istimina Landslide,2013-08-19T00:00:00Z,3,Wet Mass Movement
Colombia,2013,Acevedo Landslide,2013-08-15T00:00:00Z,22,Wet Mass Movement
Colombia,2013,Yacuanquer landslide,2013-04-23T00:00:00Z,3,Wet Mass Movement
Colombia,2013,Barranquilla gale,2013-09-06T00:00:00Z,11,Storm
Colombia,2013,Dosquebradas landslide,2013-02-13T00:00:00Z,7,Wet Mass Movement
Colombia,2013,Medellin landslide,2013-03-21T00:00:00Z,11,Wet Mass Movement
Colombia,2013,Ocana Wildfire,2013-03-30T00:00:00Z,22,Wildfire
Colombia,2013,Palmira gale,2013-04-30T00:00:00Z,11,Storm
Colombia,2013,Medellin landslide,2013-05-17T00:00:00Z,11,Wet Mass Movement
Colombia,2013,Rioblanco landslide,2013-05-24T00:00:00Z,3,Wet Mass Movement
Colombia,2013,Mocoa landslide,2013-07-26T00:00:00Z,7,Wet Mass Movement
Colombia,2013,Valdivia gale,2013-09-24T00:00:00Z,3,Storm
Colombia,2013,La Vega gale,2013-11-08T00:00:00Z,3,Storm
Colombia,2013,La Vega flood,2013-11-25T00:00:00Z,7,Flood
Colombia,2013,Neiva Landslide,2013-12-26T00:00:00Z,3,Wet Mass Movement
Colombia,2013,Quibdo landslide,2013-07-09T00:00:00Z,3,Wet Mass Movement
Colombia,2013,Corinto flood,2013-12-23T00:00:00Z,3,Flood
Colombia,2013,Santander Landslide,2013-02-07T00:00:00Z,14,Wet Mass Movement
Colombia,2013,Santa Rosa de Cabal landslide,2013-08-07T00:00:00Z,3,Wet Mass Movement
Colombia,2013,Corinto avalanche,2013-12-19T00:00:00Z,40,Wet Mass Movement
Colombia,2013,Mocoa Gale,2013-02-01T00:00:00Z,7,Storm
Colombia,2013,Cali landslide,2013-02-24T00:00:00Z,7,Wet Mass Movement
Colombia,2013,Guadalajara de Buga avalanche,2013-03-15T00:00:00Z,7,Wet Mass Movement
Colombia,2013,San Pablo flood,2013-03-20T00:00:00Z,7,Flood
Colombia,2013,Santa Rosa de Cabal landslide,2013-05-05T00:00:00Z,7,Wet Mass Movement
Colombia,2013,Pasto landslide,2013-05-12T00:00:00Z,3,Wet Mass Movement
Colombia,2013,Salgar landslide,2013-05-21T00:00:00Z,7,Wet Mass Movement
Colombia,2013,El Contadero landslide,2013-05-22T00:00:00Z,3,Wet Mass Movement
Colombia,2013,Jerico landslide,2013-05-26T00:00:00Z,3,Wet Mass Movement
Colombia,2013,Moniquira landslide,2013-06-12T00:00:00Z,3,Wet Mass Movement
Colombia,2013,Chimichagua flood,2013-10-05T00:00:00Z,7,Flood
Colombia,2013,Galan gale,2013-11-08T00:00:00Z,3,Storm
Colombia,2013,Suaza Landslide,2013-11-19T00:00:00Z,3,Wet Mass Movement
Colombia,2013,Quibdo landslides,2013-10-24T00:00:00Z,7,Wet Mass Movement
Colombia,2013,Piamonte gale,2013-07-16T00:00:00Z,3,Storm
Colombia,2013,Yopal gale,2013-09-06T00:00:00Z,3,Storm
Colombia,2013,Buenaventura flood,2013-09-29T00:00:00Z,22,Flood
Colombia,2013,Armenia Landslide,2013-11-18T00:00:00Z,3,Wet Mass Movement
Colombia,2013,Pasto flood,2013-03-21T00:00:00Z,3,Flood
Colombia,2013,Tarso Gale,2013-03-25T00:00:00Z,11,Storm
Colombia,2013,Libano landslide,2013-04-01T00:00:00Z,3,Wet Mass Movement
Colombia,2013,Barrancabermeja gale,2013-04-02T00:00:00Z,3,Storm
Colombia,2013,Circasia gale,2013-04-05T00:00:00Z,3,Storm
Colombia,2013,Ocamonte gale,2013-04-13T00:00:00Z,3,Storm
Colombia,2013,Valledupar flood,2013-05-06T00:00:00Z,3,Flood
Colombia,2013,Florencia landslide,2013-05-21T00:00:00Z,3,Wet Mass Movement
Colombia,2013,San Marco electric storm,2013-05-27T00:00:00Z,3,Storm
Colombia,2013,Ocana Wildfire,2013-07-03T00:00:00Z,3,Wildfire
Colombia,2013,Totoro flood,2013-07-17T00:00:00Z,3,Flood
Colombia,2013,Sogamoso landslide,2013-07-18T00:00:00Z,3,Wet Mass Movement
Colombia,2013,Cordoba Landslide,2013-08-16T00:00:00Z,3,Wet Mass Movement
Colombia,2013,Pauna electric storm,2013-09-02T00:00:00Z,3,Storm
Colombia,2013,Yarumal Landslide,2013-11-03T00:00:00Z,3,Wet Mass Movement
Colombia,2013,Santo Domingo Landslide,2013-11-15T00:00:00Z,3,Wet Mass Movement
Colombia,2013,Sabaneta Landslide,2013-11-26T00:00:00Z,3,Wet Mass Movement
Colombia,2013,Caparrapi Landslide,2013-12-05T00:00:00Z,3,Wet Mass Movement
Colombia,2013,Lloro flood,2013-11-19T00:00:00Z,62,Flood
Colombia,2013,Union Panamericana gale,2013-08-21T00:00:00Z,100,Storm
Colombia,2013,Bajo Baudo flood,2013-09-17T00:00:00Z,100,Flood
Colombia,2013,Puerto Rico flood,2013-05-07T00:00:00Z,92,Flood
Colombia,2013,Cartagena del Chaira flood,2013-05-23T00:00:00Z,3,Flood
Colombia,2013,Rovira landslide,2013-06-01T00:00:00Z,55,Wet Mass Movement
Colombia,2013,Aquitania flood,2013-07-13T00:00:00Z,3,Flood
Colombia,2013,Piamonte flood,2013-08-17T00:00:00Z,88,Flood
Colombia,2013,Alto Baudo gale,2013-08-28T00:00:00Z,18,Storm
Colombia,2013,Tangua Landslide,2013-12-20T00:00:00Z,3,Wet Mass Movement
Colombia,2013,Rio Quito Gale,2013-03-03T00:00:00Z,190,Storm
Colombia,2013,Canton de San Pablo Gale,2013-03-06T00:00:00Z,510,Storm
Colombia,2013,Solita flood,2013-03-17T00:00:00Z,7,Flood
Colombia,2013,Rio Iro flood,2013-03-18T00:00:00Z,40,Flood
Colombia,2013,Santa Maria Avalanche,2013-03-18T00:00:00Z,29,Wet Mass Movement
Colombia,2013,Medio Atrato gale,2013-05-21T00:00:00Z,470,Storm
Colombia,2013,Santa Barbara landslide,2013-05-29T00:00:00Z,3,Wet Mass Movement
Colombia,2013,Alejandria landslide,2013-06-18T00:00:00Z,3,Wet Mass Movement
Colombia,2013,Tierralta gale,2013-07-29T00:00:00Z,22,Storm
Colombia,2013,Arauquita flood,2013-07-30T00:00:00Z,44,Flood
Colombia,2013,Popayan landslide,2013-12-29T00:00:00Z,2200,Wet Mass Movement
Colombia,2013,Ibague landslide,2013-06-04T00:00:00Z,3,Wet Mass Movement
Colombia,2013,Ibague flood,2013-07-02T00:00:00Z,3,Flood
Colombia,2013,Nariño Earthquake,2013-02-09T00:00:00Z,2200,Earthquake
Colombia,2014,Angelopolis and Conception landslides,2014-05-09T00:00:00Z,7,Wet Mass Movement
Colombia,2014,El Charco municipality flood,2014-01-28T00:00:00Z,22,Flood
Colombia,2014,"Flooding and landslides affecting Cundinamarca, Tolima, Huila, Choco and Quindio departments",2014-03-02T00:00:00Z,130,Flood
Colombia,2014,Floods in Antioquia dept.,2014-06-02T00:00:00Z,110,Flood
Colombia,2014,Soacha and Ubala landslides,2014-04-28T00:00:00Z,7,Wet Mass Movement
Colombia,2014,Medio Atrato and Bajo Baudo municipalities flood,2014-10-24T00:00:00Z,99,Flood
Colombia,2014,El Tambo municipality storm,2014-09-28T00:00:00Z,11,Storm
Colombia,2014,Bucamaranga municipality flood,2014-08-20T00:00:00Z,11,Flood
Colombia,2014,Lopez de Micay municipality storm,2014-08-15T00:00:00Z,85,Storm
Colombia,2014,Timana municipality landslide,2014-05-11T00:00:00Z,11,Wet Mass Movement
Colombia,2014,Santa Rosa de Cabal municipality storm,2014-11-13T00:00:00Z,77,Storm
Colombia,2014,Turbaco municipality storm,2014-05-10T00:00:00Z,11,Storm
Colombia,2014,Pasto municipality flood,2014-12-21T00:00:00Z,37,Flood
Colombia,2014,Anori municipality landslide,2014-04-24T00:00:00Z,11,Wet Mass Movement
Colombia,2014,Bucaramanga municipality landslide,2014-03-13T00:00:00Z,11,Wet Mass Movement
Colombia,2014,Tumaco municipality flood,2014-01-27T00:00:00Z,62,Flood
Colombia,2014,El Tambo and Buenos Aires municipalities storm,2014-07-06T00:00:00Z,51,Storm
Colombia,2014,Barranquilla municipality flood,2014-10-09T00:00:00Z,3,Flood
Colombia,2014,Uramita municipality storm,2014-10-03T00:00:00Z,3,Storm
Colombia,2014,Inirida municipality storm,2014-01-24T00:00:00Z,11,Storm
Colombia,2014,Cucunuba municipality fire,2014-09-29T00:00:00Z,3,Wildfire
Colombia,2014,Piedecuesta municipality landslide,2014-09-12T00:00:00Z,3,Wet Mass Movement
Colombia,2014,Olaya municipality landslide,2014-04-22T00:00:00Z,48,Wet Mass Movement
Colombia,2014,Arauquita municipality flood,2014-06-25T00:00:00Z,44,Flood
Colombia,2014,Timbiqui and Lopez de Micay municipalities flood,2014-10-12T00:00:00Z,11,Flood
Colombia,2014,"Floods in Mallama and Ipiales municipalities in Narino dept., La Vega municipality in Cauca dept., Santa Maria, Palermo and Teruel municipalities in Huila dept.",2014-03-06T00:00:00Z,33,Flood
Colombia,2014,Buenaventura municipality flood,2014-04-26T00:00:00Z,33,Flood
Colombia,2014,Carmen Del Darien municipality storm,2014-07-22T00:00:00Z,33,Storm
Colombia,2014,Flood in Jamundi municipality,2014-10-09T00:00:00Z,950,Flood
Colombia,2014,Popayan municipality storm,2014-09-11T00:00:00Z,3,Storm
Colombia,2014,El Castillo municipality flood,2014-04-24T00:00:00Z,890,Flood
Colombia,2014,Cajamarca municipality flood,2014-09-21T00:00:00Z,18,Flood
Colombia,2014,Saravena municipality flood,2014-10-11T00:00:00Z,25,Flood
Colombia,2014,Armenia municipality landslide,2014-08-22T00:00:00Z,3,Wet Mass Movement
Colombia,2014,San Bernardo del Viento municipality flood,2014-12-22T00:00:00Z,25,Flood
Colombia,2014,San Agustín and Garrapatas overflown rivers after Sipi quake,2014-01-06T00:00:00Z,680,Flood
Colombia,2014,Floods and landslides  in Tolima and the capital district provinces,2014-02-12T00:00:00Z,25,Wet Mass Movement
Colombia,2014,Cajibio and Mercaderes municipality storm,2014-03-30T00:00:00Z,40,Storm
Colombia,2014,Flooding and wet mass movements in Tolima dept.,2014-04-26T00:00:00Z,25,Wet Mass Movement
Colombia,2014,Istimina and Quibdo municipalities landslide,2014-09-17T00:00:00Z,25,Wet Mass Movement
Colombia,2014,Timbio and Jambalo municipalities landslide,2014-12-02T00:00:00Z,14,Wet Mass Movement
Colombia,2014,Bajo Baudo municipality storm,2014-11-12T00:00:00Z,40,Storm
Colombia,2014,Bogotà municipality landslide,2014-12-14T00:00:00Z,3,Wet Mass Movement
Colombia,2014,Fusagasuga municipality flood,2014-10-30T00:00:00Z,40,Flood
Colombia,2014,El Santuario municipality flood,2014-08-14T00:00:00Z,3,Flood
Colombia,2014,Istmina municipality landslide,2014-01-30T00:00:00Z,11,Wet Mass Movement
Colombia,2014,San Roque municipality storm,2014-07-26T00:00:00Z,3,Storm
Colombia,2014,Mistrato municipality storm,2014-07-20T00:00:00Z,3,Storm
Colombia,2014,Atrato municipality flood,2014-07-24T00:00:00Z,44,Flood
Colombia,2014,Mocoa municipality landslide,2014-07-02T00:00:00Z,3,Wet Mass Movement
Colombia,2014,Quipile municipality landslide,2014-06-26T00:00:00Z,3,Wet Mass Movement
Colombia,2014,Dagua municipality storm,2014-11-09T00:00:00Z,3,Storm
Colombia,2014,Istmina municipality landslide,2014-09-25T00:00:00Z,7,Wet Mass Movement
Colombia,2014,Riofrio municipality storm,2014-04-09T00:00:00Z,7,Storm
Colombia,2014,Sampues municipality fire,2014-03-19T00:00:00Z,14,Wildfire
Colombia,2014,Betulia municipality landslide,2014-09-19T00:00:00Z,7,Wet Mass Movement
Colombia,2014,Yumbo municipality fire,2014-08-15T00:00:00Z,7,Wildfire
Colombia,2014,Magui municipality flood,2014-12-30T00:00:00Z,18,Flood
Colombia,2014,Algarrobo municipality flood,2014-11-13T00:00:00Z,18,Flood
Colombia,2014,Ocana municipality flood,2014-11-10T00:00:00Z,14,Flood
Colombia,2014,Villavicencio municipality landslide,2014-06-14T00:00:00Z,7,Wet Mass Movement
Colombia,2014,Medellin municipality landslide 2,2014-12-11T00:00:00Z,14,Wet Mass Movement
Colombia,2014,Rainy season in North and West Colombia,2014-03-15T00:00:00Z,1200,Flood
Colombia,2014,Riosucio municipality storm,2014-07-28T00:00:00Z,2000,Storm
Colombia,2014,Cicuco municipality storm,2014-06-24T00:00:00Z,3,Storm
Colombia,2014,Medellin municipality landslide,2014-07-14T00:00:00Z,14,Wet Mass Movement
Colombia,2014,Villagomez municipality landslide,2014-06-23T00:00:00Z,3,Wet Mass Movement
Colombia,2014,Cordoba municipality flood,2014-06-10T00:00:00Z,3,Flood
Colombia,2014,Villavicencio municipality storm,2014-06-10T00:00:00Z,3,Storm
Colombia,2014,Balboa municipality landslide,2014-05-02T00:00:00Z,3,Wet Mass Movement
Colombia,2014,Inundations in Putumayo dept.,2014-06-09T00:00:00Z,3,Flood
Colombia,2014,Arauquita municipality flood,2014-07-08T00:00:00Z,14,Flood
Colombia,2014,Pereira municipality landslide,2014-05-10T00:00:00Z,14,Wet Mass Movement
Colombia,2014,Barbacoas municipality flood,2014-10-18T00:00:00Z,14,Flood
Colombia,2014,Armenia municipality landslide,2014-11-24T00:00:00Z,3,Wet Mass Movement
Colombia,2014,Guatica municipality storm,2014-04-12T00:00:00Z,3,Storm
Colombia,2014,Bucaramanga municipality flood,2014-11-01T00:00:00Z,3,Flood
Colombia,2014,Unguia municipality flood,2014-06-24T00:00:00Z,22,Flood
Colombia,2014,Orocue municipality fire,2014-04-07T00:00:00Z,3,Wildfire
Colombia,2014,Istmina municipality landslide,2014-03-24T00:00:00Z,3,Wet Mass Movement
Colombia,2014,Cajamarca municipality landslide,2014-06-07T00:00:00Z,3,Wet Mass Movement
Colombia,2014,Pacho municipality flood,2014-03-14T00:00:00Z,3,Flood
Colombia,2014,Chiles and Cerro Negro volcanic eruptions prompting preventive evacuations,2014-10-22T00:00:00Z,13000,Volcanic eruption
Colombia,2014,Villagomez municipality landslide,2014-02-25T00:00:00Z,3,Wet Mass Movement
Colombia,2014,Timana municipality storm,2014-01-30T00:00:00Z,3,Storm
Colombia,2014,Timbiqui municipality earthquake,2014-08-03T00:00:00Z,3,Earthquake
Colombia,2014,Pasca municipality landslide,2014-10-31T00:00:00Z,3,Wet Mass Movement
Colombia,2014,Certegui municipality storm,2014-04-30T00:00:00Z,3,Storm
Colombia,2014,Bolivar municipality landslide,2014-12-20T00:00:00Z,11,Wet Mass Movement
Colombia,2014,Cartagena municipality storm,2014-10-07T00:00:00Z,7,Storm
Colombia,2014,Herveo municipality flood,2014-05-22T00:00:00Z,3,Flood
Colombia,2014,Don Matias municipality landslide,2014-11-13T00:00:00Z,3,Wet Mass Movement
Colombia,2014,Guayabetal municipality landslide,2014-06-11T00:00:00Z,7,Wet Mass Movement
Colombia,2014,Marquetalia municipality landslide,2014-05-09T00:00:00Z,3,Wet Mass Movement
Colombia,2014,Tamalameque municipality flood,2014-11-13T00:00:00Z,18,Flood
Colombia,2014,Iles municipality landslide,2014-05-08T00:00:00Z,3,Wet Mass Movement
Colombia,2014,Cartagena municipality landslide,2014-03-19T00:00:00Z,7,Wet Mass Movement
Colombia,2014,Timbio municipality storm,2014-02-24T00:00:00Z,7,Storm
Colombia,2014,Armenia municipality landslide,2014-10-20T00:00:00Z,3,Wet Mass Movement
Colombia,2014,Ibague and Espinal municipalities storm,2014-10-30T00:00:00Z,7,Storm
Colombia,2014,Timbiqui municipality flood,2014-11-11T00:00:00Z,140,Flood
Colombia,2014,Vetas municipality landslide,2014-11-11T00:00:00Z,3,Wet Mass Movement
Colombia,2014,Venadillo storm and landslide,2014-05-24T00:00:00Z,7,Storm
Colombia,2015,San Jose del Guaviare flood,2015-05-28T00:00:00Z,11,Flood
Colombia,2015,Filadelfia forest fire,2015-08-05T00:00:00Z,4,Wildfire
Colombia,2015,Toledo landslide,2015-05-27T00:00:00Z,110,Mass movement
Colombia,2015,Chitaga flood,2015-06-07T00:00:00Z,100,Flood
Colombia,2015,Puerto Parra  gale,2015-03-12T00:00:00Z,120,Storm
Colombia,2015,Sahagun gale,2015-06-05T00:00:00Z,74,Storm
Colombia,2015,Labateca  flood,2015-06-05T00:00:00Z,93,Flood
Colombia,2015,"Arauquita, Fortul and Saravena flood",2015-05-25T00:00:00Z,130,Flood
Colombia,2015,"Bello, Remedio and Segovia landslide",2015-05-29T00:00:00Z,87,Mass movement
Colombia,2015,Condoto and Medio San Juan Gale,2015-05-14T00:00:00Z,130,Storm
Colombia,2015,Chitaga and Cacota landslides,2015-06-24T00:00:00Z,130,Mass movement
Colombia,2015,Puerto Asis and San Miguel flood,2015-07-22T00:00:00Z,590,Flood
Colombia,2015,Unguia gale,2015-06-02T00:00:00Z,150,Storm
Colombia,2015,Salgar and Urrao flood mixed to landslides,2015-05-18T00:00:00Z,780,Flood
Colombia,2015,Cubara flood,2015-05-25T00:00:00Z,59,Flood
Colombia,2015,Cumbitara gale,2015-06-25T00:00:00Z,56,Storm
Colombia,2015,Lopez de Micay flood,2015-05-24T00:00:00Z,37,Flood
Colombia,2015,Cordoba landslide,2015-07-03T00:00:00Z,250,Mass movement
Colombia,2015,Santa Marta flood,2015-07-23T00:00:00Z,37,Flood
Colombia,2015,Guaitarilla flood,2015-04-18T00:00:00Z,33,Flood
Colombia,2015,Palmas del Socorro earthquake,2015-04-11T00:00:00Z,4,Earthquake
Colombia,2015,Unguia earthquake,2015-07-28T00:00:00Z,37,Earthquake
Colombia,2015,Armenia forest fire,2015-08-19T00:00:00Z,4,Wildfire
Colombia,2015,Santander department earthquake,2015-03-10T00:00:00Z,74,Earthquake
Colombia,2015,Tamalameque gale,2015-08-07T00:00:00Z,290,Storm
Colombia,2015,Riosucio flood,2015-07-15T00:00:00Z,190,Flood
Colombia,2015,Barranquilla landslide,2015-06-08T00:00:00Z,22,Mass movement
Colombia,2015,Purace gale,2015-06-30T00:00:00Z,19,Storm
Colombia,2015,Quibdo gale,2015-08-05T00:00:00Z,19,Storm
Colombia,2015,Santander de Quilichao gale,2015-08-17T00:00:00Z,19,Storm
Colombia,2015,Angelopolis hailstorm,2015-04-20T00:00:00Z,15,Storm
Colombia,2015,Florencia landslide,2015-05-14T00:00:00Z,15,Mass movement
Colombia,2015,Santa Rosa gale,2015-05-30T00:00:00Z,15,Storm
Colombia,2015,Cacota flood,2015-07-24T00:00:00Z,15,Flood
Colombia,2015,Urrao flash flood,2015-11-24T00:00:00Z,11,Flood
Colombia,2015,Nocaima gale,2015-03-15T00:00:00Z,7,Storm
Colombia,2015,La Celia flood,2015-03-18T00:00:00Z,7,Flood
Colombia,2015,Taminango forest fire,2015-08-04T00:00:00Z,26,Wildfire
Colombia,2015,Bogota landslide,2015-03-21T00:00:00Z,7,Mass movement
Colombia,2015,Quibdo landslide,2015-08-20T00:00:00Z,4,Mass movement
Colombia,2015,Acevedo landslide,2015-06-05T00:00:00Z,7,Mass movement
Colombia,2015,Unguia gale (Aug),2015-08-18T00:00:00Z,4,Storm
Colombia,2015,Rioacha gale,2015-08-01T00:00:00Z,4,Storm
Colombia,2015,Cartagena del Chaira flood,2015-06-08T00:00:00Z,7,Flood
Colombia,2015,Caparrapi forest fire,2015-07-25T00:00:00Z,4,Wildfire
Colombia,2015,Villavicencio landslide,2015-06-11T00:00:00Z,7,Mass movement
Colombia,2015,Cisneros landslide,2015-07-18T00:00:00Z,4,Mass movement
Colombia,2015,Sandona flood,2015-04-15T00:00:00Z,240,Flood
Colombia,2015,Silvia gale,2015-07-06T00:00:00Z,4,Storm
Colombia,2015,Corozal landslide,2015-07-01T00:00:00Z,4,Mass movement
Colombia,2015,Cajamarca riverine flood,2015-07-21T00:00:00Z,7,Flood
Colombia,2015,Quibdo landslide (May),2015-05-25T00:00:00Z,4,Mass movement
Colombia,2015,Medio Baudo landslide,2015-05-23T00:00:00Z,4,Mass movement
Colombia,2015,Guaranda gale,2015-05-17T00:00:00Z,4,Storm
Colombia,2015,Sabanalarga flood,2015-08-13T00:00:00Z,7,Flood
Colombia,2015,Nueva Granada gale,2015-04-17T00:00:00Z,4,Storm
Colombia,2015,Mercaderes gale,2015-04-15T00:00:00Z,4,Storm
Colombia,2015,Santa Rosa de Osos landslide,2015-04-15T00:00:00Z,4,Mass movement
Colombia,2015,San Jose del Fragua gale,2015-04-06T00:00:00Z,4,Storm
Colombia,2015,Toledo landslide (April),2015-04-04T00:00:00Z,4,Mass movement
Colombia,2015,Cumbitara gale (March),2015-03-21T00:00:00Z,4,Storm
Colombia,2015,Aguachica forest fire,2015-03-15T00:00:00Z,4,Wildfire
Colombia,2015,Villamaria landslide,2015-04-18T00:00:00Z,4,Mass movement
Colombia,2015,Solano flood,2015-06-29T00:00:00Z,30,Flood
Colombia,2015,Quibdo gale (May),2015-05-28T00:00:00Z,4,Storm
Colombia,2015,Marsella landslide,2015-06-20T00:00:00Z,4,Mass movement
Colombia,2015,Florencia landslide (June),2015-06-23T00:00:00Z,4,Mass movement
Colombia,2015,Gameza flood,2015-06-25T00:00:00Z,4,Flood
Colombia,2015,Puerto Gaitan flood,2015-06-28T00:00:00Z,4,Flood
Colombia,2015,San Vicente del Caguan floods and landslides,2015-06-30T00:00:00Z,4,Flood
Colombia,2015,"Medellin, Betania and Andesi landslides",2015-04-09T00:00:00Z,180,Mass movement
Colombia,2015,Penoli and Sonson gale,2015-07-28T00:00:00Z,26,Storm
Colombia,2015,El Canton del San Pablo flood,2015-07-21T00:00:00Z,26,Flood
Colombia,2015,Tenerife gale,2015-06-27T00:00:00Z,26,Storm
Colombia,2015,Chigorodo gale,2015-06-03T00:00:00Z,22,Storm
Colombia,2015,Labateca landslide,2015-06-19T00:00:00Z,170,Mass movement
Colombia,2015,Libano and Chaparral gale,2015-04-14T00:00:00Z,26,Storm
Colombia,2016,Hurricane Matthew,2016-09-28T00:00:00Z,210,Storm
Colombia,2016,El Nino heavy rains and floods,2016-04-01T00:00:00Z,31000,Flood
Colombia,2017,Colombia: Guachaca River - Santa Marta - 02/08/2017,2017-08-02T00:00:00Z,90,Flood
Colombia,2017,Colombia: first rainy season - March 2017,2017-03-17T00:00:00Z,17000,Flood
Colombia,2017,Colombia: Second rainy season - country wide - September 2017,2017-09-06T00:00:00Z,2000,Flood
Colombia,2017,"Cundinamarca, Huila, Antioquia floods",2017-02-21T00:00:00Z,2000,Flood
Colombia,2017,Colombia: Gale - Córdoba - 09/08/2017,2017-08-09T00:00:00Z,110,Storm
Colombia,2017,Mocoa mudslide,2017-04-01T00:00:00Z,3400,Wet Mass Movement
Colombia,2017,Colombia: Landslide - Cundinamarca - 17/07/2017  ,2017-07-17T00:00:00Z,130,Wet Mass Movement
Colombia,2018,Colombia: Landslide - Boyaca - 01/10/2018 ,2018-10-01T00:00:00Z,200,Dry mass movement
Colombia,2018,Colombia: Flood - Quindio - 21/10/2018,2018-10-21T00:00:00Z,15,Flood
Colombia,2018,Colombia: Flood - Antioquia - 28/07/2018,2018-07-28T00:00:00Z,2,Flood
Colombia,2018,Colombia: oil spill - Santander - March 2018,2018-03-02T00:00:00Z,180,
Colombia,2018,Colombia: Cauca River hydroelectrical project - Antioquia - April,2018-04-28T00:00:00Z,26000,Dry mass movement
Colombia,2018,Colombia: Flood - Meta - 02/05/2018,2018-05-02T00:00:00Z,740,Flood
Colombia,2018,Colombia: landslide - Santander - 08/05/2018,2018-05-08T00:00:00Z,200,Wet Mass Movement
Colombia,2018,Colombia: landslide - Risaralda - 10/06/2018,2018-06-09T00:00:00Z,15,Wet Mass Movement
Colombia,2018,Colombia: mass movement / Dry Mass Movement - Antioquia - 08/06/2018,2018-06-08T00:00:00Z,59,Dry mass movement
Colombia,2018,Colombia: mass movement / Dry Mass Movement - Antioquia - 02/04/2018,2018-04-02T00:00:00Z,4,Dry mass movement
Colombia,2018,Colombia: flood - Orinoquía region - June,2018-06-02T00:00:00Z,1700,Flood
Colombia,2018,Colombia: landslide - Santander - 22/04/2018,2018-04-22T00:00:00Z,22,Dry mass movement
Colombia,2018,Colombia: landslide - Santander - 26/07/2018,2018-07-26T00:00:00Z,330,Wet Mass Movement
Colombia,2018,Colombia: riverine flood - Nariño - 31/03/2018 ,2018-03-31T00:00:00Z,1,Flood
Colombia,2018,Colombia: flood - Norte de Santander - 05/04/2018,2018-04-05T00:00:00Z,85,Flood
Colombia,2018,Colombia: storm - Huila - 14/04/2018 ,2018-04-14T00:00:00Z,11,Storm
Colombia,2018,Colombia: Flood - Guajira - 14/10/2018,2018-11-14T00:00:00Z,1000,Flood
Colombia,2018,Colombia: Galeras Volcano - Nariño -29/05/2018,2018-05-29T00:00:00Z,370,Earthquake
Colombia,2018,Colombia: riverine flood - Guaviare - 30/04/2018,2018-04-30T00:00:00Z,11,Flood
Colombia,2018,Colombia: Flood - Arauca - 21/06/2018,2018-06-21T00:00:00Z,150,Flood
Colombia,2018,Colombia: landslide - Antioquia - 15/02/2018,2018-02-15T00:00:00Z,67,Wet Mass Movement
Colombia,2018,Colombia: flash flood - Tolima - 22/03/2018,2018-03-22T00:00:00Z,16,Flood
Colombia,2018,Colombia: landslide - QUindio - 22/02/2018,2018-02-22T00:00:00Z,15,Wet Mass Movement
Colombia,2018,Colombia: landslide - Cundinamarca - 26/08/2018,2018-08-26T00:00:00Z,230,Wet Mass Movement
Colombia,2018,Colombia: Floods - Arauca - 08/09/2018,2018-09-08T00:00:00Z,1900,Flood
Colombia,2018,Colombia: Floods - Magdalena - 21/10/2018,2018-10-21T00:00:00Z,940,Flood
Colombia,2018,Colombia: Flood - Antioquia - 25/11/2018,2018-11-25T00:00:00Z,32,Flood
Colombia,2018,Colombia: Landslide - Caldas - 11/10/2018,2018-10-11T00:00:00Z,59,Wet Mass Movement
Colombia,2018,Colombia: Floods - Risaralda - 01/11/2018,2018-11-01T00:00:00Z,7,Flood
Colombia,2018,Colombia: Floods - Putumayo - 16/08/2018,2018-08-16T00:00:00Z,30000,Flood
Colombia,2018,Colombia: Floods - Antioquia -  14/11/2018,2018-11-14T00:00:00Z,11,Flood
Colombia,2018,Colombia: landslide - Antioquia - 10/04/2018,2018-04-10T00:00:00Z,4,Wet Mass Movement
Colombia,2018,Colombia: Floods - Santander - 13/10/2018,2018-10-13T00:00:00Z,11,Flood
Colombia,2018,Colombia: Flood - Sucre - 18/05/2018,2018-05-18T00:00:00Z,7,Flood
Colombia,2018,Colombia: Flood - Choco - 06/06/2018,2018-06-06T00:00:00Z,1100,Flood
Colombia,2018,Colombia: Floods - Antioquia - 01/10/2018,2018-10-01T00:00:00Z,930,Flood
Colombia,2019,"Colombia: Landslide - Antioquia, Caldas - 12/06/2019",2019-06-12T00:00:00Z,56,Dry mass movement
Colombia,2019,"Colombia: Gale - Bolivar, Maria la Baja - 23/07/2019",2019-07-23T00:00:00Z,67,Storm
Colombia,2019,"Colombia: Floods - Caqueta, Florencia - 25/07/2019",2019-07-25T00:00:00Z,4,Flood
Colombia,2019,Colombia: flood - Antioquia (Jericó) - 04/11/2019,2019-11-04T00:00:00Z,1000,Flood
Colombia,2019,Colombia: Floods in Meta and Guaviare - 18/06/2019,2019-06-18T00:00:00Z,600,Flood
Colombia,2019,"Colombia: Gale - Bolivar, Arjona - 23/07/2019",2019-07-23T00:00:00Z,4,Storm
Colombia,2019,"Colombia: Gale - Cordoba, San Pelayo - 25/07/2019",2019-07-25T00:00:00Z,15,Storm
Colombia,2019,"Colombia: Wildire - Sierra de Santa Marta, Cesar - 28/02/2019",2019-02-24T00:00:00Z,200,Wildfire
Colombia,2019,"Colombia: Flood - Putumayo, Puerto Guzman - 22/06/2019",2019-06-18T00:00:00Z,11000,Flood
Colombia,2019,"Colombia: Gale - Norte de Santander, Durania - 26/07/2019",2019-07-26T00:00:00Z,4,Storm
Colombia,2019,"Colombia: Riverine flood - Meta, La Macarena - 10/06/2019",2019-06-10T00:00:00Z,280,Flood
Colombia,2019,"Colombia: Wet Mass Movement - Boyaca, Chiscas - 05/07/2019",2019-07-05T00:00:00Z,19,Wet Mass Movement
Colombia,2019,Colombia: Floods - Santander (Cimitarra) - 16/11/2019,2019-11-16T00:00:00Z,7,Flood
Colombia,2019,Colombia: Rainny season - nationwide - March-June 2019,2019-03-15T00:00:00Z,1400,Flood
Colombia,2019,"Colombia: Gale - Choco, Lloro - 27/07/2019",2019-07-29T00:00:00Z,11,Storm
Colombia,2019,Colombia: Landslide - Cauca region - 21/04/2019 ,2019-04-21T00:00:00Z,30,Wet Mass Movement
Colombia,2019,"Colombia: Floods - Caldas, Chinchina - 28/07/2019",2019-07-28T00:00:00Z,4,Flood
Colombia,2019,Colombia: Landslides - Boyaca - 01/04/2019,2019-04-01T00:00:00Z,63,Wet Mass Movement
Colombia,2019,"Colombia: Gale - Valle del Cauca, Jamundi - 25/07/2019",2019-07-29T00:00:00Z,11,Storm
Colombia,2019,"Colombia: Gale - Chocó, Litoral de San Juan - 19/07/2019",2019-07-19T00:00:00Z,48,Storm
Colombia,2019,"Colombia: Floods - Meta, Villavicencio - 19/07/2019",2019-07-19T00:00:00Z,70,Flood
Colombia,2019,Colombia: Flash flood - Antioquia (Apartadó) - 28/10/2019,2019-10-28T00:00:00Z,8000,Flood
Colombia,2019,Colombia: Floods - Choco - 22/02/2019,2019-02-22T00:00:00Z,37,Flood
Colombia,2019,"Colombia: Flass flood - Valle del Cauca, Roldanillo - 09/06/2019",2019-06-09T00:00:00Z,15,Flood
Colombia,2019,"Colombia: Floods - Bolivar, Cartagena - 15/07/2019",2019-07-01T00:00:00Z,4,Flood
Colombia,2019,Colombia: Flood - Antioquia (Jericó) - 15/11/2019,2019-11-15T00:00:00Z,93,Flood
Colombia,2019,Colombia: Flood - Antioquia (Vigía del Fuerte) - 12/11/2019,2019-11-09T00:00:00Z,81,Flood
Colombia,2019,Colombia: Floods - Magdalena (Zona Bananera) - 30/09/2019,2019-09-30T00:00:00Z,2600,Flood
Colombia,2019,Colombia: Landslide - Antioquia (Medellin) - 14/11/2019,2019-11-14T00:00:00Z,19,Wet Mass Movement
Colombia,2019,"Colombia: Wet Mass Movement - Choco, Quibdo - 26/07/2019",2019-07-26T00:00:00Z,4,Wet Mass Movement
Colombia,2019,"Colombia: Mudslide - Cundinamarca, Las Palmas - 26/06/2019",2019-05-26T00:00:00Z,56,Wet Mass Movement
Colombia,2019,Colombia: Landslide - Risaralda (Pereira) - 11/06/2019,2019-06-11T00:00:00Z,1200,Dry mass movement
Colombia,2019,Colombia: Landslide - Risaralda (Pereira) - 13/10/2019,2019-10-13T00:00:00Z,37,Wet Mass Movement
Colombia,2019,Colombia: Floods - Nariño - 20/04/2019,2019-04-20T00:00:00Z,210,Flood
Colombia,2019,Colombia: Floods - Nariño (Barbacoas) - 05/12/2019,2019-12-05T00:00:00Z,7400,Flood
Colombia,2020,Colombia: Flood - Meta (Guamal) - 27/06/2020,2020-06-27T00:00:00Z,1500,Flood
Colombia,2020,Colombia: Floods - Magdalena (Aracataca) - 10/06/2020,2020-06-09T00:00:00Z,740,Flood
Colombia,2020,Colombia: Landslide - Antioquia (Jericó) - 03/07/2020,2020-07-02T00:00:00Z,22,Wet Mass Movement
Colombia,2020,Colombia: Flood - Chocó (Bojayá) - 09/05/2020,2020-05-09T00:00:00Z,1300,Flood
Colombia,2020,Colombia: Landslide - Bogotá DC (Ciudad Bolivar) - 31/08/2020,2020-08-31T00:00:00Z,110,Wet Mass Movement
Colombia,2020,Colombia: Flood - Antioquia (Andes and Jardín) - 25/04/2020,2020-04-25T00:00:00Z,560,Flood
Colombia,2020,Colombia: Floods - Meta - 05/07/2020,2020-07-05T00:00:00Z,2000,Flood
Colombia,2020,Colombia: Floods - Antioquia (Rionegro) - 09/07/2020,2020-07-09T00:00:00Z,15,Flood
Colombia,2020,Colombia: Floods - Santander (Piedecuesta) -  26/02/2020,2020-02-26T00:00:00Z,150,Flood
Colombia,2020,Colombia: Wildfire - La Guajira (Dibulla) - 18/03/2020,2020-03-18T00:00:00Z,110,Wildfire
Colombia,2020,Colombia: Floods - Antioquia (Chigordó and Urrao) - 22/10/2020,2020-10-22T00:00:00Z,11,Flood
Colombia,2020,Colombia: Landslide - Norte de Santander (Cúcuta) - 18/11/2020,2020-11-17T00:00:00Z,290,Wet Mass Movement
Colombia,2020,Colombia: Wildfire - Cundinamarca (Quetame) - 02/03/2020,2020-03-02T00:00:00Z,200,Wildfire
Colombia,2020,Colombia: Floods - Norte de Santander (Carmen de Tonchalá) - 09/11/2020,2020-11-09T00:00:00Z,110,Flood
Colombia,2020,Colombia: Landslide - Magdalena (Santa Marta) - 13/09/2020,2020-09-13T00:00:00Z,140,Dry mass movement
Colombia,2020,Colombia: Flood - Antioquia (Medellín) - 18/09/2020,2020-09-18T00:00:00Z,110,Flood
Colombia,2020,Colombia: Mudslide - Nariño (Ricaurte) - 12/05/2020,2020-05-12T00:00:00Z,110,Wet Mass Movement
Colombia,2020,Colombia: Riverine Flood - Chocó (Riosucio) - 01/12/2020,2020-12-01T00:00:00Z,52,Flood
Colombia,2020,Colombia: Landslide - Caldas (Pueblo Nuevo) - 17/02/2020,2020-02-17T00:00:00Z,37,Wet Mass Movement
Colombia,2020,Colombia: Flood - Antioquia (Vegachi) - 23/06/2020,2020-06-23T00:00:00Z,930,Flood
Colombia,2020,Colombia: Flood - Antioquia (Marinilla) - 28/06/2020,2020-06-23T00:00:00Z,65,Flood
Colombia,2020,Colombia: Riverine flood - Chocó (Bojayá) - 01/04/2020,2020-04-01T00:00:00Z,560,Flood
Colombia,2020,Colombia: Flood - Antioquia (Donmatias) - 23/06/2020,2020-06-23T00:00:00Z,7,Flood
Colombia,2020,Colombia: Flood - Santander (Floridablanca) - 28/01/2020,2020-01-28T00:00:00Z,480,Flood
Colombia,2020,Colombia: Landslide - Santander (Girón) -  03/04/2020,2020-04-03T00:00:00Z,370,Wet Mass Movement
Colombia,2020,Colombia: Floods - Magdalena (Santa Marta) - 13/07/2020,2020-07-13T00:00:00Z,89,Flood
Colombia,2020,Colombia: La Niña Floods - Chocó - 12/11/2020,2020-11-12T00:00:00Z,35000,Flood
Colombia,2020,Colombia: Landslide - Antioquia (Quebrada Negra) - 12/02/2020,2020-02-12T00:00:00Z,190,Wet Mass Movement
Colombia,2020,Colombia: La Niña Floods - Antioquia - 12/11/2020,2020-11-12T00:00:00Z,250,Flood
Colombia,2020,Colombia: Landslide - Santander (Floridablanca) -  03/04/2020,2020-04-03T00:00:00Z,63,Wet Mass Movement
Colombia,2020,Colombia: Floods - Norte de Santander (Villa del Rosario) - 17/11/2020,2020-11-17T00:00:00Z,1200,Flood
Colombia,2020,12 COUNTRIES: Hurricane Eta - 31/10/2020,2020-10-31T00:00:00Z,8000,Storm
Colombia,2020,Colombia: Landslide - Antioquia (Copacabana) - 29/08/2020,2020-08-29T00:00:00Z,37,Wet Mass Movement
Colombia,2020,Colombia: Floods - Antioquia (Dabeiba) - 01/12/2020,2020-12-01T00:00:00Z,260,Flood
Colombia,2020,Colombia: Landslide - Antioquia (San Luis) - 08/12/2020,2020-12-08T00:00:00Z,30,Wet Mass Movement
Colombia,2020,"COL, NIC, HON, SLV, GUA, BLZ: Hurricane Iota - 14/11/2020 ",2020-11-14T00:00:00Z,8300,Storm
Colombia,2020,Colombia: Flood - Huila (Sueza) - 04/09/2020,2020-09-04T00:00:00Z,150,Flood
Colombia,2021,Colombia: Floods - Arauca - 11/07/2021,2021-07-11T00:00:00Z,660,Flood
Colombia,2021,Colombia: Floods - Antioquia (El Bagre) - 10/06/2021,2021-06-10T00:00:00Z,220,Flood
Colombia,2021,Colombia: Landslide - Cauca (Totoro) - 11/11/2021,2021-11-11T00:00:00Z,50,Wet Mass Movement
Colombia,2021,Colombia: Landslide - Magdalena (Santa Marta) - 01/09/2021,2021-09-01T00:00:00Z,210,Wet Mass Movement
Colombia,2021,Colombia: Landslides - Tolima (Ibagué) - 28/10/2021,2021-10-28T00:00:00Z,7,Wet Mass Movement
Colombia,2021,Colombia: Landslide - Magdalena (Santa Marta) - 01/09/2021,2021-09-01T00:00:00Z,210,Wet Mass Movement
Colombia,2021,"Colombia: Landslide - Risaralda (Pereira, La Reversa) - 10/01/2021",2021-01-10T00:00:00Z,4,Wet Mass Movement
Colombia,2021,Colombia: Landslides - Antioquia (Venecia) -  21/05/2021,2021-05-21T00:00:00Z,440,Wet Mass Movement
Colombia,2021,Colombia: Landslide - Santander (San Gil) - 03/05/2021,2021-05-03T00:00:00Z,12,Wet Mass Movement
Colombia,2021,Colombia: Floods - Norte de Santander (Puerto Santander) - 29/04/2021,2021-04-29T00:00:00Z,580,Flood
Colombia,2021,Colombia: Floods - Antioquia (El Bagre) - 10/06/2021,2021-06-10T00:00:00Z,67,Flood
Colombia,2021,Colombia: Landslide - Quindio (Carlarca) - 11/11/2021,2021-11-11T00:00:00Z,56,Wet Mass Movement
Colombia,2021,Colombia: Flood - Antioquia (Bello) - 24/06/2021,2021-06-24T00:00:00Z,25,Flood
Colombia,2021,Colombia: Floods - Risaralda (La Virginia) -  18/05/2021,2021-05-18T00:00:00Z,520,Flood
Colombia,2021,Colombia: Floods - Meta (Villavicencio) - 12/04/2021,2021-04-12T00:00:00Z,50,Flood
Colombia,2021,Colombia: Floods - Antioquia (Cisneros) - 01/06/2021,2021-06-01T00:00:00Z,220,Flood
Colombia,2021,Colombia: Floods - Chocó (Medio Baudó) - 23/08/2021,2021-07-23T00:00:00Z,260,Flood
Colombia,2021,Colombia: Floods - Antioquia (Medellin) - 12/11/2021,2021-11-12T00:00:00Z,15,Flood
Colombia,2021,"Colombia: Floods - Antioquia, Meta and Putumayo - 24/10/2021",2021-10-24T00:00:00Z,7,Flood
Colombia,2021,"Colombia: Floods - Antioquia, Meta and Putumayo - 24/10/2021",2021-10-24T00:00:00Z,10,Flood
Colombia,2021,Colombia: Floods - Antioquia (Medellin) - 01/01/2021,2021-01-01T00:00:00Z,4000,Flood
Colombia,2021,Colombia: Floods - Cundinamarca - 15/08/2021,2021-08-15T00:00:00Z,360,Flood
Colombia,2021,Colombia: Floods - Antioquia (Medellin) - 30/11/2021,2021-11-30T00:00:00Z,370,Flood
Colombia,2021,Colombia: Floods - Norte de Santander (Cúcuta) - 26/04/2021,2021-04-26T00:00:00Z,170,Flood
Colombia,2021,Colombia: Volcanic eruption - Antioquia (Necoclí) -  21/05/2021,2021-05-30T00:00:00Z,100,Volcanic eruption
Colombia,2021,Colombia: Evacuated - Antioquia (Medellin) - 01/01/2021,2021-01-01T00:00:00Z,4800,Flood
Colombia,2021,Colombia: Floods - Chocó (Alto y Medio Baudó) - 16/11/2021,2021-11-16T00:00:00Z,570,Flood
Colombia,2021,Colombia: Floods - Antioquia (San Luis) -  25/05/2021,2021-05-25T00:00:00Z,150,Flood
Colombia,2021,"Colombia: Floods - Chocó (Medio Baudó, Berreberre river) - 21/01/2021",2021-01-21T00:00:00Z,630,Flood
Colombia,2021,"Colombia: Flood - La Mojana (Cordoba, Bolivar, Sucre) - 31/08/2021",2021-08-31T00:00:00Z,9300,Flood
Colombia,2021,"Colombia: Flood - La Mojana (Cordoba, Bolivar, Sucre) - 31/08/2021",2021-08-31T00:00:00Z,4300,Flood
Colombia,2021,"Colombia: Floods - Antioquia (Venecia, Bolombolo) - 26/11/2021",2021-11-26T00:00:00Z,110,Flood
Colombia,2021,Colombia: Floods - Tolima (Ibagué) - 23/09/2021,2021-09-23T00:00:00Z,1100,Flood
Colombia,2021,"Colombia: Flood - La Mojana (Cordoba, Bolivar, Sucre) - 31/08/2021",2021-08-31T00:00:00Z,1900,Flood
Colombia,2021,Colombia: Landslides - Antioquia (Santo Domingo) - 31/05/2021,2021-05-31T00:00:00Z,250,Wet Mass Movement
Colombia,2021,Colombia: Landslide - Risaralda (Santa Cecilia) - 25/04/2021,2021-04-25T00:00:00Z,44,Wet Mass Movement
Colombia,2021,Colombia: Wet mass movement - Antioquia (Bello) - 09/11/2021,2021-11-09T00:00:00Z,21,Wet Mass Movement
Comoros,2012,,2012-01-01T00:00:00Z,11000,Flood
Comoros,2014,Mahale quake,2014-03-12T00:00:00Z,3000,Earthquake
Comoros,2014,Anjouan and Moheli floods,2014-03-27T00:00:00Z,9000,Flood
Comoros,2017,Comoros: floods - Grande Comore - 28/04/2017,2017-04-28T00:00:00Z,94,Flood
Comoros,2019,"Mozambique, Comoros, Tanzania, Mayotte: Cyclone Kenneth - 23/04/2019",2019-04-23T00:00:00Z,19000,Storm
Cabo Verde,2014,Pico do Fogo eruption,2014-11-23T00:00:00Z,2500,Volcanic eruption
Cabo Verde,2015,Hurricane Fred,2015-08-31T00:00:00Z,190,Storm
Cabo Verde,2016,Brava island seismic activity,2016-08-01T00:00:00Z,300,Earthquake
Cabo Verde,2020,Cabo Verde: Floods - Praia - 12/09/2020,2020-09-12T00:00:00Z,750,Flood
Costa Rica,2008,FL-2008-000198-CRI,2008-10-13T00:00:00Z,2500,Flood
Costa Rica,2008,FL-2008-000232-CRI,2008-11-26T00:00:00Z,6900,Flood
Costa Rica,2008,,2008-11-22T00:00:00Z,600,Flood
Costa Rica,2008,TC-2008-000147-CRI,2008-02-09T00:00:00Z,2100,Flood
Costa Rica,2009,2009-000009,2009-01-01T00:00:00Z,2400,Earthquake
Costa Rica,2011,TC-2011-000157-CRI,2011-01-01T00:00:00Z,2100,Flood
Costa Rica,2012,,2012-01-01T00:00:00Z,2000,Flood
Costa Rica,2013,Heredia flash floods,2013-06-07T00:00:00Z,45,Flood
Costa Rica,2013,Turrialba volcanic eruption,2013-05-21T00:00:00Z,20,Volcanic eruption
Costa Rica,2015,Caribbean and Northern regions flood,2015-06-21T00:00:00Z,1100,Flood
Costa Rica,2016,Quebrada Honda landslide pre-emptive evacuations,2016-09-06T00:00:00Z,80,Dry mass movement
Costa Rica,2016,Sardinal forest fire,2016-02-07T00:00:00Z,42,Wildfire
Costa Rica,2016,Upala ground shakings,2016-07-02T00:00:00Z,21,Earthquake
Costa Rica,2016,Valle Central heavy rains,2016-10-06T00:00:00Z,150,Flood
Costa Rica,2016,Mt. Turrialba eruption,2016-05-01T00:00:00Z,4,Volcanic eruption
Costa Rica,2016,Hurricane Otto,2016-11-21T00:00:00Z,5500,Storm
Costa Rica,2017,Costa Rica: landslide - Guanacaste Province - 25/05/2017,2017-05-25T00:00:00Z,27,Wet Mass Movement
Costa Rica,2017,Costa Rica: Wet mass movement - Cartago Province - 06/06/2017,2017-06-06T00:00:00Z,38,Wet Mass Movement
Costa Rica,2017,Costa Rica: floods - Heradia province - 17/05/2017,2017-05-17T00:00:00Z,150,Flood
Costa Rica,2017,"Costa Rica ; Honduras, Nicaragua ;Panama; United States: Tropical storm Nate - 05/10/2017",2017-10-05T00:00:00Z,10000,Storm
Costa Rica,2017,Costa Rica: landslide - San Jose Province - 15/06/2017,2017-06-15T00:00:00Z,58,Wet Mass Movement
Costa Rica,2017,Costa Rica: landslides - San José Province - 09/06/2017,2017-06-09T00:00:00Z,68,Wet Mass Movement
Costa Rica,2018,Costa Rica: Tropical waves - Alajuela; Guanacaste - June 2018,2018-06-19T00:00:00Z,110,Storm
Costa Rica,2018,Costa Rica: Flood - 5 provinces - July ,2018-07-13T00:00:00Z,1400,Flood
Costa Rica,2018,Costa Rica: Landslide - San José - 10/09/2018,2018-09-10T00:00:00Z,89,Dry mass movement
Costa Rica,2018,Costa Rica: Landslide - Puntarenas - 06/11/2018,2018-11-06T00:00:00Z,40,Dry mass movement
Costa Rica,2018,"Guatemala, Honduras, Nicaragua, Costa Rica, El Salvador: Floods - 05/10/2018",2018-10-05T00:00:00Z,4100,Flood
Costa Rica,2019,Costa Rica: Floods - Upala - 08/07/2019,2019-07-08T00:00:00Z,94,Flood
Costa Rica,2019,Costa Rica: Floods - Upala - 30/12/2019,2019-12-30T00:00:00Z,7,Flood
Costa Rica,2019,Costa Rica: Floods - Guanacaste - 15/10/2019,2019-10-15T00:00:00Z,83,Flood
Costa Rica,2019,Costa Rica: Floods - Heredia (Sarapiquí) - 29/11/2019,2018-11-29T00:00:00Z,30,Flood
Costa Rica,2019,"Costa Rica: Mudslide - Puntaneras, Rio Claro de Golfito - 08/09/2019",2019-09-08T00:00:00Z,64,Flood
Costa Rica,2019,"Costa Rica: Floods - Puntaneras (Lagarto, La Lucha) - 08/09/2019",2019-09-08T00:00:00Z,98,Flood
Costa Rica,2019,"Costa Rica: Flood - Alajuela, Guatuso - 06/09/2019",2019-09-06T00:00:00Z,13,Flood
Costa Rica,2020,Costa Rica: Floods - Parrita - 01/06/2020,2020-06-01T00:00:00Z,37,Flood
Costa Rica,2020,Costa Rica: Landslides - San Jose and Valladolid - 23/10/2020,2020-10-23T00:00:00Z,61,Wet Mass Movement
Costa Rica,2020,Costa Rica: Floods - Guanacaste - 30/08/2020,2020-08-30T00:00:00Z,750,Flood
Costa Rica,2020,Costa Rica: Landslides - Rio Claro - 17/01/2020,2020-01-17T00:00:00Z,100,Wet Mass Movement
Costa Rica,2020,Costa Rica: Storm - 12 cantons - 04/11/2020,2020-11-04T00:00:00Z,690,Storm
Costa Rica,2020,12 COUNTRIES: Hurricane Eta - 31/10/2020,2020-10-31T00:00:00Z,2100,Storm
Costa Rica,2020,Costa Rica: Wildfires - Heredia - 15/01/2020,2020-01-15T00:00:00Z,530,Wildfire
Costa Rica,2021,Costa Rica: Floods - Limon - 16/04/2021,2021-04-16T00:00:00Z,260,Flood
Costa Rica,2021,"Costa Rica: Floods - Caribe (Matina, Cariari, Sarapiqui) - 01/12/2021",2021-11-28T00:00:00Z,27,Flood
Cuba,2008,TC-2008-000143,2008-08-29T00:00:00Z,61000,Storm
Cuba,2008,TF-2008-000214-CUB,2008-08-11T00:00:00Z,20000,Storm
Cuba,2008,TF-2008- 000230-CUB,2008-11-17T00:00:00Z,20000,Flood
Cuba,2008,,2008-08-20T00:00:00Z,13000,Storm
Cuba,2008,Hurricane Ike,2008-08-09T00:00:00Z,2616000,Storm
Cuba,2012,,2012-01-01T00:00:00Z,343000,Storm
Cuba,2012,,2012-01-01T00:00:00Z,8500,Storm
Cuba,2015,Baracoa flood,2015-05-02T00:00:00Z,2000,Flood
Cuba,2016,Hurricane Matthew,2016-09-28T00:00:00Z,1079000,Storm
Cuba,2017,15 countries - Hurricane Irma - 27/08/2017,2017-08-27T00:00:00Z,1738000,Storm
Cuba,2018,Cuba: Rogue waves - La Havana - 22/12/2018,2018-12-22T00:00:00Z,520,Storm
Cuba,2018,"Cuba, USA: Subtropical storm Alberto - 28/05/2018",2018-05-28T00:00:00Z,52000,Storm
Cuba,2018,"USA, Cuba: Hurricane Michael - 07/10/2018",2018-10-07T00:00:00Z,300,Storm
Cuba,2019,Cuba: Tornado - Havana -  27/01/2019,2019-01-27T00:00:00Z,9900,Storm
Cuba,2020,Cuba: Tornado - Guantanamo - 17/05/2020,2020-05-17T00:00:00Z,3,Storm
Cuba,2020,12 COUNTRIES: Hurricane Eta - 31/10/2020,2020-10-31T00:00:00Z,188000,Storm
Cuba,2020,"Cuba: Floods - Camaguey, Ciego de Avila, Cienfuegos, Sancti Spiritus, Villa Clara - 20/05/2020",2020-05-20T00:00:00Z,640,Flood
Cuba,2020,"DOM, HTI, CUB, PRI, USA: Hurricane Laura - Caribbean - 21/08/2020",2020-08-21T00:00:00Z,418000,Storm
Cuba,2020,"Mexico, Cuba, USA: Hurricane Delta - 06/10/2020",2020-10-06T00:00:00Z,33000,Storm
Cuba,2021,CUB; USA: Hurricane Ida - 26/08/2021,2021-08-26T00:00:00Z,3000,Storm
Cuba,2021,CUB; USA: Hurricane Ida - 26/08/2021,2021-08-26T00:00:00Z,11000,Storm
Cuba,2021,"BRB, DOM, CUB, USA: Hurricane Elsa - 02/07/2021",2021-07-02T00:00:00Z,180000,Storm
Cayman Islands,2008,TC-2008-000143,2008-08-26T00:00:00Z,720,Storm
Cayman Islands,2021,"JAM, CYM, DOM, HTI, MEX: Hurricane Grace - 14/08/2021",2021-08-14T00:00:00Z,41,Storm
Cyprus,2016,Argaka and Evrychou wildfires,2016-06-18T00:00:00Z,40,Wildfire
Cyprus,2018,Cyprus: Wildfire - Pachna - 26/07/2018,2018-07-16T00:00:00Z,8,Wildfire
Cyprus,2021,Cyprus: Wildfire - Limassol and Larnaca Districts - 03/07/2021,2021-07-03T00:00:00Z,59,Wildfire
Czech Republic,2013,Central European Floods,2013-06-05T00:00:00Z,26000,Flood
Czech Republic,2018,Czech Republic: Floods - Brtnice town - 01/06/2018,2018-06-01T00:00:00Z,12,Flood
Czech Republic,2020,Czech Republic: Floods - Liberec - 20/06/2020,2020-06-20T00:00:00Z,10,Flood
Czech Republic,2020,Czech Republic: Floods - ?ár - 14/06/2020,2020-06-14T00:00:00Z,2,Flood
Czech Republic,2020,Czech Republic: Floods - Uni?ov and umpersk - 08/06/2020,2020-06-08T00:00:00Z,12,Flood
Czech Republic,2020,Czech Republic: Floods - Chrudim - 14/06/2020,2020-06-14T00:00:00Z,17,Flood
Czech Republic,2020,Czech Republic: Floods - Olomouc - 08/06/2020,2020-06-08T00:00:00Z,2,Flood
Czech Republic,2021,"Czech Republic: Flood - Havlí?k?v Brod (Nová Ves) - 11/07/2021	",2021-07-11T00:00:00Z,20,Flood
Czech Republic,2021,Czech Republic: Tornado - South Moravia (B?eclav and Hodonín Districts) - 24/06/2021,2021-06-24T00:00:00Z,2800,Storm
Germany,2013,Central European Floods,2013-05-30T00:00:00Z,53000,Flood
Germany,2016,Lower Bavaria floods,2016-05-26T00:00:00Z,2000,Flood
Germany,2017,"Lower Saxony Floods - Nette, Brocken, Innerste, Oker, Grane Rivers  (July 2017)",2017-07-25T00:00:00Z,200,Flood
Germany,2017,Berlin flood,2017-06-29T00:00:00Z,18,Flood
Germany,2018,Germany: forest fire - Brandenburg - 23/08/2018,2018-08-23T00:00:00Z,500,Wildfire
Germany,2018,Germany: flash flood - Schleswig-Holstein - 10/05/2018,2018-05-10T00:00:00Z,9,Flood
Germany,2019,Germany: Wildfire - Mecklenburg - 01/07/2019,2019-07-01T00:00:00Z,650,Wildfire
Germany,2019,Germany: tornado - Roetgen - 13/03/3019,2019-03-13T00:00:00Z,30,Storm
Germany,2020,Germany: Floods - Rheinland-Pfalz (Trier-Saarburg) - 03/02/2020,2020-02-03T00:00:00Z,2,Flood
Germany,2021,Germany: Flooding - Bavaria (Dorfen) - 30/08/2021,2021-08-30T00:00:00Z,250,Flood
Germany,2021,"Germany: Storm Bernd Floods - Nordrhein-Westfalen, Rheinland-Pfalz - 14/07/2021",2021-07-14T00:00:00Z,16000,Flood
Germany,2021,Germany: Flood - Hessen (Büdingen) - 29/01/2021,2021-01-29T00:00:00Z,180,Flood
Germany,2021,Germany: Flood - Nordrhein-Westfalen (Fröndenberg) - 05/07/2021,2021-07-05T00:00:00Z,700,Flood
Germany,2021,Germany: Storm/Flood/Landslide - Bayern (Berchtesgadener Land) - 17/07/2021,2021-07-17T00:00:00Z,160,Storm
Djibouti,2018,"Djibouti, Ethiopia, Somalia, Yemen: Tropical Cyclone Sagar - 19/05/2018",2018-05-19T00:00:00Z,9400,Storm
Djibouti,2019,Djibouti: Flash floods- 6 regions- 21/11/2019,2019-11-21T00:00:00Z,10000,Flood
Djibouti,2020,Djibouti: Floods - Countrywide - 01/01/2020,2020-01-01T00:00:00Z,11,Flood
Dominica,2011,Tropical storm Orphelia,2011-01-01T00:00:00Z,96,Storm
Dominica,2013,Severe rains and high winds due to a Low Level Trough System,2013-12-24T00:00:00Z,18,Storm
Dominica,2015,Tropical storm Erika,2015-08-27T00:00:00Z,710,Storm
Dominica,2017,4 countries - Hurricane Maria - 16/09/2017,2017-09-16T00:00:00Z,35000,Storm
Dominica,2018,Dominica: Tropical Storm Isaac,2018-09-10T00:00:00Z,340,Storm
Dominica,2018,Dominica: Flood - Saint John - 12/11/2018,2018-11-10T00:00:00Z,6,Flood
Dominican Republic,2008,TC-2008-000143-DOM,2008-08-26T00:00:00Z,4400,Storm
Dominican Republic,2008,,2008-08-18T00:00:00Z,4600,Storm
Dominican Republic,2011,FL-2011-000061-DOM,2011-01-01T00:00:00Z,4000,Flood
Dominican Republic,2011,Tropical storm 'Emily',2011-01-01T00:00:00Z,7000,Storm
Dominican Republic,2011,Hurricane Irene,2011-01-01T00:00:00Z,5900,Storm
Dominican Republic,2012,,2012-01-01T00:00:00Z,11000,Flood
Dominican Republic,2012,,2012-01-01T00:00:00Z,11000,Flood
Dominican Republic,2012,,2012-01-01T00:00:00Z,19000,Storm
Dominican Republic,2012,,2012-01-01T00:00:00Z,2200,Storm
Dominican Republic,2013,Depresion Tropical Gabrielle,2013-09-08T00:00:00Z,230,Storm
Dominican Republic,2013,Tropical Strom Chantal,2013-07-06T00:00:00Z,14000,Storm
Dominican Republic,2014,Storm across the Dominican Republic,2014-05-20T00:00:00Z,7100,Storm
Dominican Republic,2014,Tropical storm Crystobal,2014-08-22T00:00:00Z,4000,Storm
Dominican Republic,2014,Cibao region flood,2014-11-01T00:00:00Z,350,Flood
Dominican Republic,2015,Santo Domingo floods,2015-11-30T00:00:00Z,410,Flood
Dominican Republic,2015,Northern region floods,2015-02-20T00:00:00Z,20000,Flood
Dominican Republic,2015,Hurricane Erika,2015-08-28T00:00:00Z,7400,Storm
Dominican Republic,2016,Spring floods ,2016-04-27T00:00:00Z,11000,Flood
Dominican Republic,2016,Hurricane Matthew,2016-09-28T00:00:00Z,42000,Storm
Dominican Republic,2017,Dominican Republic: Floods - 4 provinces - 18/05/2017,2017-05-16T00:00:00Z,290,Flood
Dominican Republic,2017,4 countries - Hurricane Maria - 16/09/2017,2017-09-16T00:00:00Z,23000,Storm
Dominican Republic,2017,"Dominican republic: Flood - Santiago, San Pedro de Macorís - 9/10/2017",2017-10-09T00:00:00Z,35,Flood
Dominican Republic,2017,Dominican Republic: Flood - La Vega - 6/11/2017,2017-11-06T00:00:00Z,280,Flood
Dominican Republic,2017,15 countries - Hurricane Irma - 27/08/2017,2017-08-27T00:00:00Z,24000,Storm
Dominican Republic,2017,Dominican Republic: Flood - Samaná - 31/05/2017,2017-05-31T00:00:00Z,20,Flood
Dominican Republic,2017,"Dominican Republic: Flood - Espaillat, Puerto Plata - 23/03/2017",2017-03-23T00:00:00Z,1800,Flood
Dominican Republic,2017,"Dominican Republic: Flood - María Trinidad Sánchez, Puerto Plata, Santo Domingo - 17/11/2017",2017-11-17T00:00:00Z,1500,Flood
Dominican Republic,2017,Dominican Republic: Flood - Puerto Plata - 14/12//2017,2017-12-13T00:00:00Z,75,Flood
Dominican Republic,2017,Dominican Republic: Country-wide floods - April 2017,2017-03-25T00:00:00Z,18000,Flood
Dominican Republic,2017,Dominican Republic: Flood -  Santiago Rodríguez - 7/05/2017,2017-05-07T00:00:00Z,110,Flood
Dominican Republic,2017,Domincan Republic: Flood - Sánchez Ramírez - 10/04/2017,2017-04-10T00:00:00Z,110,Flood
Dominican Republic,2018,Dominican Republic: Floods - Santo Domingo - 15/09/2018,2018-09-15T00:00:00Z,200,Flood
Dominican Republic,2018,Dominican Republic: Floods - 9 Provinces -  28/09/2018,2018-09-28T00:00:00Z,560,Flood
Dominican Republic,2018,Dominican Republic: Floods - 1 province - 18/03/2018,2018-03-16T00:00:00Z,2800,Flood
Dominican Republic,2018,Dominican Republic: Flood - Provincia de San Cristóbal - 7/05/2018,2018-05-05T00:00:00Z,3900,Flood
Dominican Republic,2018,Dominican Republic: flood - San Cristobal; Santo Domingo; Barahona - 02/05/2018 ,2018-05-02T00:00:00Z,3900,Flood
Dominican Republic,2018,Dominican Republic: Floods - 1 province - 6/04/2018,2018-04-06T00:00:00Z,4200,Flood
Dominican Republic,2018,Dominican Republic and Puerto Rico: Tropical Storm Beryl - 10/07/2018,2018-07-10T00:00:00Z,12000,Storm
Dominican Republic,2019,Dominican Republic: Storm - 18 provinces - 20/09/2019,2019-09-20T00:00:00Z,4900,Storm
Dominican Republic,2020,Dominican Republic: Floods - Countrywide - 09/11/2020,2020-11-09T00:00:00Z,3700,Flood
Dominican Republic,2020,"Haiti, Dominican Republic, The Bahamas, Cuba, Puerto Rico, USA: Hurricane Isaias - 30/07/2020",2020-07-30T00:00:00Z,5500,Storm
Dominican Republic,2020,"DOM, HTI, CUB, PRI, USA: Hurricane Laura - Caribbean - 21/08/2020",2020-08-21T00:00:00Z,15000,Storm
Dominican Republic,2020,12 COUNTRIES: Hurricane Eta - 31/10/2020,2020-10-31T00:00:00Z,6700,Storm
Dominican Republic,2021,DOM; USA: Tropical Storm Fred - 11/08/2021,2021-08-11T00:00:00Z,6000,Storm
Dominican Republic,2021,Dominican Republic - Sistema Frontal - Countrywide - 09/03/2021,2021-03-09T00:00:00Z,660,Storm
Dominican Republic,2021,"BRB, DOM, CUB, USA: Hurricane Elsa - 02/07/2021",2021-07-02T00:00:00Z,120,Storm
Dominican Republic,2021,"JAM, CYM, DOM, HTI, MEX: Hurricane Grace - 14/08/2021",2021-08-14T00:00:00Z,3600,Storm
Algeria,2008,,2008-01-31T00:00:00Z,25000,Flood
Algeria,2009,,2009-01-01T00:00:00Z,2500,Flood
Algeria,2013,,2013-10-01T00:00:00Z,340,Flood
Algeria,2014,Algiers earthquake,2014-08-01T00:00:00Z,4500,Earthquake
Algeria,2015,Tamanrasset flood,2015-03-19T00:00:00Z,2300,Flood
Algeria,2015,Flood in Sahrawi refugees' Tindouf camps,2015-10-16T00:00:00Z,17000,Flood
Algeria,2016,Floods in Sahrawi refugee camps,2016-08-15T00:00:00Z,2000,Flood
Algeria,2018,Algeria: Flood - Batna - 14/04/2018,2018-04-14T00:00:00Z,2,Flood
Algeria,2018,Algeria: Flood - Tiaret - 25/04/2018,2018-04-25T00:00:00Z,2,Flood
Algeria,2018,Flood: Algeria - Tamanrasset - 04/08/2018,2018-08-04T00:00:00Z,15,Flood
Algeria,2019,Algeria: Cold wave - 25 governorates - 11/01/2019,2019-01-11T00:00:00Z,1400,Extreme temperature
Algeria,2019,Algeria: Flood - Jilel - 01/09/2019,2019-09-01T00:00:00Z,2,Flood
Algeria,2019,Algeria: Flood - Annaba - 27/01/2019,2019-01-27T00:00:00Z,1800,Flood
Algeria,2020,Algeria: Floods - Countrywide - 21/12/2020,2020-12-21T00:00:00Z,15,Flood
Algeria,2020,Algeria: Wildfire - Tizi Ouzou (Boghni/Tala Guilef) - 10/07/2020,2020-07-10T00:00:00Z,6,Wildfire
Algeria,2020,Algeria: Earthquake - Mila Province - 07/08/2020,2020-08-07T00:00:00Z,9500,Earthquake
Algeria,2020,Algeria: Wildfire - North (10 Wilayas) - 06/11/2020,2020-11-06T00:00:00Z,25,Wildfire
Algeria,2021,Algeria: Floods - Chlef - 06/03/2021,2021-03-06T00:00:00Z,1600,Flood
Algeria,2021,"Algeria, Tunisia, Italy: Mediterranean Hurricane - Countrywide - 23/10/2021",2021-10-23T00:00:00Z,15,Storm
Algeria,2021,Algeria: Wildfires - 14 Governorates - 10/08/2021,2021-08-09T00:00:00Z,5000,Wildfire
Algeria,2021,"Algeria, Tunisia, Italy: Mediterranean Hurricane - Countrywide - 23/10/2021",2021-10-23T00:00:00Z,34,Storm
Ecuador,2008,FL-2008-00018-ECU,2008-01-30T00:00:00Z,14000,Flood
Ecuador,2010,,2010-01-01T00:00:00Z,500,Flood
Ecuador,2012,,2012-01-01T00:00:00Z,4800,Flood
Ecuador,2013,Floods in the North-West,2013-01-01T00:00:00Z,7300,Flood
Ecuador,2013,Tungurahua volcano,2013-07-14T00:00:00Z,200,Volcanic eruption
Ecuador,2014,Carchi earthquake,2014-10-01T00:00:00Z,18,Earthquake
Ecuador,2014,Quito Fire,2014-09-30T00:00:00Z,560,Wildfire
Ecuador,2015,Floods in the North-west and South-central provinces,2015-03-18T00:00:00Z,1500,Flood
Ecuador,2015,Mt Cotopaxi eruption,2015-08-15T00:00:00Z,400,Volcanic eruption
Ecuador,2016,Pastaza Province Rains,2016-11-02T00:00:00Z,4,Flood
Ecuador,2016,Chimborazo landslide risk,2016-08-19T00:00:00Z,81,Dry mass movement
Ecuador,2016,Mt. Tungurahua eruption,2016-02-26T00:00:00Z,500,Volcanic eruption
Ecuador,2016,Northwestern Ecuador earthquakes (May),2016-05-18T00:00:00Z,10000,Earthquake
Ecuador,2016,Northwestern Ecuador earthquake (December),2016-12-19T00:00:00Z,2600,Earthquake
Ecuador,2016,Orellana Rains,2016-09-19T00:00:00Z,26,Flood
Ecuador,2016,Northwestern Ecuador earthquakes (July),2016-07-11T00:00:00Z,200,Earthquake
Ecuador,2016,Santo Domingo Floods,2016-04-26T00:00:00Z,200,Flood
Ecuador,2016,Northwestern Ecuador earthquake (April),2016-04-16T00:00:00Z,259000,Earthquake
Ecuador,2016,Esmeraldas province riverine floods and landslides,2016-01-24T00:00:00Z,17000,Flood
Ecuador,2017,Ecuador: Flooding- Azuay (27/07/2017),2017-07-27T00:00:00Z,7,Flood
Ecuador,2017,Ecuador: Flooding- Tungurahua (25/07/2017),2017-07-25T00:00:00Z,7,Flood
Ecuador,2017,Ecuador: Rainy Season- country-wide (Jan-June 2017),2017-01-01T00:00:00Z,2900,Flood
Ecuador,2017,Ecuador: Rio Blanco and Morona River Floods (12/06/2017),2017-12-06T00:00:00Z,8,Flood
Ecuador,2018,Ecuador: Riverine flood- Rio Pindo- Pastaza province 16/04/2018,2018-04-16T00:00:00Z,20,Flood
Ecuador,2018,Ecuador: Sierra Negra volcano - Galapagos - 26/06/2018,2018-06-26T00:00:00Z,250,Volcanic eruption
Ecuador,2018,Ecuador: Coastal Flood - 3 provinces - 23/12/2018,2018-12-23T00:00:00Z,37,Flood
Ecuador,2018,Ecuador: Landslide - Morona Santiago - 24/11/2018 ,2018-11-24T00:00:00Z,150,Wet Mass Movement
Ecuador,2018,"Ecuador: Rough waves - Esmeraldas, Manabí and El Oro - 22/12/2018",2018-12-22T00:00:00Z,160,Wet Mass Movement
Ecuador,2018,Ecuador: Floodings - Chimborazo - 20/11/2018,2018-11-20T00:00:00Z,11,Flood
Ecuador,2018,Ecuador: Rainy season - Ecuador - 01/10/2018,2018-10-01T00:00:00Z,100,Flood
Ecuador,2018,Ecuador: Forest Fire - Pichincha - 29/09/2018,2018-09-29T00:00:00Z,280,Wildfire
Ecuador,2018,Ecuador: Riverine floods- Rio Babahoyo - 23/03/2018,2018-03-23T00:00:00Z,400,Flood
Ecuador,2018,Ecuador: Earthquake - Chimborazo - 06/09/2018,2018-09-06T00:00:00Z,2800,Earthquake
Ecuador,2019,Ecuador: Wildfire - Loja (Quilanga) - 26/08/2019,2019-08-26T00:00:00Z,60,Wildfire
Ecuador,2019,Ecuador: Floods - Morona Santiago - 14/11/2019,2019-11-14T00:00:00Z,26,Flood
Ecuador,2019,Ecuador: Floods - Pastaza - 19/10/2019,2019-10-19T00:00:00Z,19,Flood
Ecuador,2019,Ecuador: Riverine floods - Manabi - 07/03/2019,2019-03-07T00:00:00Z,470,Flood
Ecuador,2019,Ecuador: Rainy season - Ecuador - 01/01/2019,2019-01-01T00:00:00Z,120,Flood
Ecuador,2019,Ecuador Rainy season - Nationwide - 01/10/2019,2019-10-01T00:00:00Z,37,Flood
Ecuador,2019,Ecuador: Continued heavy rains - Several Provinces - 17/06/2019,2019-06-17T00:00:00Z,320,Flood
Ecuador,2019,Ecuador: Riverine Flood - Morona Santiago (Morona) - 20/12/2019,2019-12-20T00:00:00Z,30,Flood
Ecuador,2020,Ecuador: Floods - El Oro (Machala) -  21/02/2020,2020-02-21T00:00:00Z,100,Flood
Ecuador,2020,Ecuador: Floods - Quito - 12/04/2020,2020-04-12T00:00:00Z,190,Flood
Ecuador,2020,Ecuador: Landslide - Azuay - 02/06/2020,2020-06-02T00:00:00Z,19,Wet Mass Movement
Ecuador,2020,"Ecuador: Floods - Azuay (Cuenca, el Descanso) - 02/05/2020",2020-05-02T00:00:00Z,19,Flood
Ecuador,2020,Ecuador: Floods - Morona Santiago (Macas) - 18/01/2020 ,2020-01-18T00:00:00Z,50,Flood
Ecuador,2020,Ecuador: Floods - Zamora Chinchipe - 01/05/2020,2020-05-01T00:00:00Z,93,Flood
Ecuador,2020,Ecuador: Floods - Morona Santiago (San Luis) - 02/05/2020,2020-05-02T00:00:00Z,7,Flood
Ecuador,2020,Ecuador: Floods - Manabí - 20/02/2020,2020-02-20T00:00:00Z,220,Flood
Ecuador,2020,Ecuador: Evacuated - Cañar (Honorato Vasquez) - 01/07/2020,2020-07-01T00:00:00Z,22,Flood
Ecuador,2020,Ecuador: Rainy Season - Countrywide - 01/01/2020,2020-01-01T00:00:00Z,490,Flood
Ecuador,2021,Ecuador: Wildfire - Countrywide - 2021,2021-01-01T00:00:00Z,4,Wildfire
Ecuador,2021,Ecuador: Storm - Countrywide - 2021,2021-01-01T00:00:00Z,120,Storm
Ecuador,2021,Ecuador: Wet Mass Movement - Countrywide - 2021,2021-01-01T00:00:00Z,840,Wet Mass Movement
Ecuador,2021,Ecuador: Flood - Countrywide - 2021,2021-01-01T00:00:00Z,3900,Flood
Ecuador,2021,Ecuador: Dry Mass Movement - Countrywide - 2021,2021-01-01T00:00:00Z,760,Dry mass movement
Egypt,2008,,2008-06-09T00:00:00Z,20000,Dry mass movement
Egypt,2014,Asyut dam flood,2014-03-08T00:00:00Z,200,Flood
Egypt,2015,Northern Egypt floods,2015-10-25T00:00:00Z,100,Flood
Egypt,2016,Flash floods in Upper Egypt and along the Red Coast,2016-10-26T00:00:00Z,820,Flood
Egypt,2018,Egypt: Wildfire - New Valley - 05/10/2018,2018-10-05T00:00:00Z,8,Wildfire
Egypt,2020,Egypt: Flash floods - 9 provinces - 12/03/2020,2020-03-12T00:00:00Z,8400,Flood
Egypt,2021,Egypt: Floods and Scorpion Infestation - Aswan Governorate - 12/11/2021,2021-11-12T00:00:00Z,1100,Flood
Eritrea,2013,Hashenkit flood,2013-08-01T00:00:00Z,100,Flood
Spain,2011,EQ-2011-000050-ESP,2011-01-01T00:00:00Z,15000,Earthquake
Spain,2012,,2012-01-01T00:00:00Z,2000,Wildfire
Spain,2012,,2012-01-01T00:00:00Z,2000,Wildfire
Spain,2012,,2012-01-01T00:00:00Z,4000,Wildfire
Spain,2012,,2012-01-01T00:00:00Z,9000,Flood
Spain,2012,,2012-01-01T00:00:00Z,5000,Wildfire
Spain,2013,Valencia barbecue fire,2013-06-28T00:00:00Z,700,Wildfire
Spain,2013,Villardiergua de la Ribera fire,2013-08-16T00:00:00Z,300,Wildfire
Spain,2013,Barcelona fire,2013-01-01T00:00:00Z,150,Wildfire
Spain,2013,Torrential rains and Garona River overflowed,2013-06-17T00:00:00Z,500,Flood
Spain,2013,Andratx fire,2013-07-29T00:00:00Z,700,Wildfire
Spain,2013,Tres Cantos fire,2013-08-22T00:00:00Z,40,Wildfire
Spain,2013,Majorca fire,2013-08-21T00:00:00Z,200,Wildfire
Spain,2014,Tivissa fire,2014-06-15T00:00:00Z,19,Wildfire
Spain,2014,Alicante fire,2014-09-11T00:00:00Z,1000,Wildfire
Spain,2014,Valencia fire,2014-05-14T00:00:00Z,200,Wildfire
Spain,2014,Alicante fire,2014-09-11T00:00:00Z,1400,Wildfire
Spain,2014,Costa del Sol fire,2014-06-01T00:00:00Z,600,Wildfire
Spain,2014,Tenerife flood,2014-10-19T00:00:00Z,400,Flood
Spain,2014,Cogolludo and Bustares fires,2014-07-18T00:00:00Z,180,Wildfire
Spain,2015,Granada fire,2015-07-08T00:00:00Z,660,Wildfire
Spain,2015,Òdena fire,2015-07-26T00:00:00Z,100,Wildfire
Spain,2015,Ebro riverine flood,2015-02-28T00:00:00Z,1500,Flood
Spain,2015,Sierra da Gata fires,2015-08-09T00:00:00Z,1900,Wildfire
Spain,2016,Forest Fire in La Palma Island,2016-08-03T00:00:00Z,3000,Wildfire
Spain,2016,Linea de la Concepcion and San Roque (Cadiz province) Forest fire,2016-07-11T00:00:00Z,550,Wildfire
Spain,2016,Galicia Floods,2016-03-29T00:00:00Z,200,Flood
Spain,2016,Benitachel and Javea Forest Fire,2016-09-04T00:00:00Z,1400,Wildfire
Spain,2016,Southern Spain Rain,2016-12-02T00:00:00Z,50,Flood
Spain,2016,Galicia Forest fires,2016-08-09T00:00:00Z,200,Wildfire
Spain,2017,Spain: Wildfire- Huelva (26/06/2017),2017-06-24T00:00:00Z,2000,Wildfire
Spain,2017,"Spain: Wildfires- Galicia, Asturias (15/10/2017) ",2017-10-15T00:00:00Z,100,Wildfire
Spain,2017,Spain: flash floods - Province of Málaga - 19/02/2017,2017-02-19T00:00:00Z,3,Flood
Spain,2018,Spain: Storm Carlos - Tenerife - 18/11/2018 ,2018-11-18T00:00:00Z,39,Storm
Spain,2018,Spain: flash flood - Sant Llorenç des Cardassar  - 09/10/2018,2018-10-09T00:00:00Z,24,Flood
Spain,2018,Spain: riverine flood - Zaragoza; Navarre -12/04/2018,2018-04-12T00:00:00Z,33,Flood
Spain,2018,Spain: flood - Girona,2018-11-18T00:00:00Z,42,Flood
Spain,2018,Spain: storm - Andalusia - 17/03/2018 ,2018-03-17T00:00:00Z,500,Storm
Spain,2019,"Portugal, Spain: Storm Elsa - Portugal and Northern Spain - 19/12/2019",2019-12-19T00:00:00Z,4,Storm
Spain,2019,Spain: DANA flash floods - 4 provinces (South East) - 12/09/2019,2019-09-12T00:00:00Z,5200,Flood
Spain,2019,España: DANA - Murcia and Valencia - 01/12/2019,2019-12-01T00:00:00Z,100,Storm
Spain,2019,Spain: floods - Alicante - 18/04/2019,2019-04-18T00:00:00Z,320,Flood
Spain,2019,Spain: Wildfires - Nationwide - 2019,2019-01-01T00:00:00Z,18000,Wildfire
Spain,2019,Spain: flood - Tafalla - 08/07/2019,2019-07-08T00:00:00Z,3,Flood
Spain,2019,Spain: flood - Alicante - 21/08/2019,2019-08-21T00:00:00Z,6,Flood
Spain,2020,"Spain: Wildfire - Andalucía (Malaga, Estepona) - 29/08/2020",2020-08-29T00:00:00Z,3400,Wildfire
Spain,2020,Spain: Wildfire - Extremadura (Caceres) - 29/08/2020,2020-08-28T00:00:00Z,310,Wildfire
Spain,2020,Spain: Storm Gloria - 24 provinces (East) - 19/01/2020,2020-01-19T00:00:00Z,170,Storm
Spain,2020,"Spain, Portugal: Storm Barbara - Countrywide - 19/10/2020",2020-10-19T00:00:00Z,3,Storm
Spain,2020,Spain: Wildfires - Castilla la Mancha - 01/01/2020,2020-01-01T00:00:00Z,300,Wildfire
Spain,2020,Spain: Wildfires - Galicia - 01/01/2020,2020-01-01T00:00:00Z,260,Wildfire
Spain,2020,Spain: Wildfire - Madrid - 01/08/2020,2020-07-31T00:00:00Z,93,Wildfire
Spain,2020,Spain: Wildfires - Valencia - 01/01/2020,2020-01-01T00:00:00Z,25,Wildfire
Spain,2020,"Spain: Wildifire - Islas Canarias (La Palma, Garafía) - 21/07/2020",2020-08-21T00:00:00Z,3000,Wildfire
Spain,2020,Spain: Wildfire - Balear Islands (sAlbufera) - 25/09/2020,2020-09-25T00:00:00Z,16,Wildfire
Spain,2020,Spain: Wildfire - Murcia (Mulas) - 29/08/2020,2020-08-29T00:00:00Z,98,Wildfire
Spain,2020,Spain: Floods - Valencia (Castelló) - 31/03/2020,2020-03-31T00:00:00Z,91,Flood
Spain,2021,Spain: Floods  Andalucia (Cádiz)  07/03/2021,2021-03-07T00:00:00Z,55,Flood
Spain,2021,Spain: Wildfire - Ávila (Navalacruz) - 14/08/2021,2021-08-14T00:00:00Z,1000,Wildfire
Spain,2021,"Spain: Wildfire - Madrid (Batres) - 15/08/2021	",2021-08-15T00:00:00Z,700,Wildfire
Spain,2021,Spain: Forest Fire  Mallorca (Alcudia)  09/02/2021,2021-02-09T00:00:00Z,75,Wildfire
Spain,2021,Spain: Wildfire - Gipuzkoa (Bidasoaldea - Irun) - 20/02/2021,2021-02-20T00:00:00Z,95,Wildfire
Spain,2021,"Spain: Floods  Andalucía (Huelva - Lepe, Cartaya, Isla Cristina)  23/09/2021",2021-09-23T00:00:00Z,1800,Flood
Spain,2021,"Spain: Storm Barra Flooding -  Aragón (Novillas, Zaragoza) - 07/12/2021",2021-12-07T00:00:00Z,55,Flood
Spain,2021,"Spain: Storm Barra Flooding -  Aragón (Novillas, Zaragoza) - 07/12/2021",2021-12-07T00:00:00Z,200,Flood
Spain,2021,"Spain: Volcanic eruption - Santa Cruz de Tenerife (La Palma - Los Llanos de Aridane, El Paso, Tazacorte) - 19/09/2021",2021-09-19T00:00:00Z,7000,Volcanic eruption
Spain,2021,"Spain: Wildfire - Andalusia (Málaga) - 08/09/2021	",2021-09-08T00:00:00Z,2700,Wildfire
Spain,2021,"Spain: Wildfire - Barcelona (Castellví de Rosanes, Martorell) - 13/07/2021",2021-07-13T00:00:00Z,72,Wildfire
Ethiopia,2008,FF-2008-000227-ETH,2008-11-16T00:00:00Z,52000,Flood
Ethiopia,2008,,2008-05-30T00:00:00Z,810,Flood
Ethiopia,2008,,2008-08-20T00:00:00Z,20000,Flood
Ethiopia,2010,,2010-01-01T00:00:00Z,5000,Flood
Ethiopia,2010,2010-000217,2010-01-01T00:00:00Z,5000,Flood
Ethiopia,2012,,2012-01-01T00:00:00Z,20000,Flood
Ethiopia,2013,Strong Winds,2013-04-01T00:00:00Z,1200,Storm
Ethiopia,2013,Ethiopia Rainy Season Floods,2013-04-01T00:00:00Z,58000,Flood
Ethiopia,2013,Kabridehar Woreda flood,2013-01-01T00:00:00Z,2300,Flood
Ethiopia,2014,Kabridehar Woreda storm,2014-04-01T00:00:00Z,1600,Storm
Ethiopia,2014,Shilabo Woreda,2014-04-01T00:00:00Z,10000,Flood
Ethiopia,2014,Shebelle flood,2014-01-01T00:00:00Z,880,Flood
Ethiopia,2014,Babile Woreda storm,2014-01-01T00:00:00Z,780,Storm
Ethiopia,2014,Kebribeyah Woreda wildfire,2014-01-01T00:00:00Z,190,Wildfire
Ethiopia,2014,Awash river flood,2014-09-01T00:00:00Z,36000,Flood
Ethiopia,2015,Dolo Ado Woreda flood,2015-04-01T00:00:00Z,13000,Flood
Ethiopia,2015,Afar volcanic eruption,2015-12-15T00:00:00Z,3900,Volcanic eruption
Ethiopia,2015,SNNPR region fires,2015-03-14T00:00:00Z,9900,Wildfire
Ethiopia,2015,Deboweyin woreda flood,2015-05-01T00:00:00Z,1200,Flood
Ethiopia,2015,Arsi Zone fire,2015-01-01T00:00:00Z,75,Wildfire
Ethiopia,2015,Gamo Gofa zone flood,2015-11-01T00:00:00Z,500,Flood
Ethiopia,2015,Mida Oromo woreda fire,2015-05-01T00:00:00Z,350,Wildfire
Ethiopia,2015,Awash Fantale woreda flood,2015-04-01T00:00:00Z,720,Flood
Ethiopia,2015,Bugna woreda fire,2015-05-01T00:00:00Z,100,Wildfire
Ethiopia,2015,Shebelle zone flood,2015-10-23T00:00:00Z,47000,Flood
Ethiopia,2015,Sheygoosh woreda flood,2015-04-01T00:00:00Z,420,Flood
Ethiopia,2015,Korahe zone flood,2015-10-24T00:00:00Z,6500,Flood
Ethiopia,2015,Liben zone flood,2015-11-11T00:00:00Z,20000,Flood
Ethiopia,2015,Dugda Dawa woreda flood,2015-04-01T00:00:00Z,1200,Flood
Ethiopia,2015,Moret Jiru woreda fire,2015-05-01T00:00:00Z,80,Wildfire
Ethiopia,2015,Angolela woreda fire,2015-05-01T00:00:00Z,35,Wildfire
Ethiopia,2016,Belg rains flash floods,2016-03-01T00:00:00Z,298000,Flood
Ethiopia,2016,Kiremt rains floods,2016-06-30T00:00:00Z,49000,Flood
Ethiopia,2017,Ethiopia: Flood - Amhara - 01/07/2017,2017-07-01T00:00:00Z,140,Flood
Ethiopia,2017,Ethiopia: Flood - Oromia - 06/06/2017,2017-06-06T00:00:00Z,2700,Flood
Ethiopia,2017,Ethiopia: Landslide - Amhara - 01/09/2017,2017-09-01T00:00:00Z,440,Wet Mass Movement
Ethiopia,2017,Ethiopia: Flood - Tigray - 01/09/2017,2017-09-01T00:00:00Z,510,Flood
Ethiopia,2017,Ethiopia: Landslide - Amhara - 01/07/2017,2017-07-01T00:00:00Z,360,Wet Mass Movement
Ethiopia,2017,Ethiopia: Flood - Amhara - 01/09/2017,2017-09-01T00:00:00Z,1100,Flood
Ethiopia,2017,Ethiopia: Flood - Afar - 01/05/2017,2017-05-01T00:00:00Z,700,Flood
Ethiopia,2017,Ethiopia: Flood - Gambella - 01/09/2017,2017-09-01T00:00:00Z,4800,Flood
Ethiopia,2017,Ethiopia: Floods - Somali - 01/05/2017,2017-05-01T00:00:00Z,3700,Flood
Ethiopia,2017,Ethiopia: Drought - 01/01/2017,2017-01-01T00:00:00Z,381000,Drought
Ethiopia,2017,Ethiopia: Flood - Gambella - 18/05/2017,2017-05-18T00:00:00Z,2400,Flood
Ethiopia,2017,"Ethiopia: Flood - Afar, Oromia - 08/09/2017",2017-09-08T00:00:00Z,36000,Flood
Ethiopia,2017,Ethiopia: Flood - Amhara - 01/07/2017,2017-07-01T00:00:00Z,120,Flood
Ethiopia,2018,Ethiopia: Drought - 01/01/2018,2018-01-01T00:00:00Z,120000,Drought
Ethiopia,2018,Ethiopia: Flood - 4 regions - 15/04/2018,2018-04-15T00:00:00Z,171000,Flood
Ethiopia,2018,Ethiopia: Landslide - SNNPR - 26/05/2018,2018-05-26T00:00:00Z,650,Wet Mass Movement
Ethiopia,2018,"Djibouti, Ethiopia, Somalia, Yemen: Tropical Cyclone Sagar - 19/05/2018",2018-05-19T00:00:00Z,4100,Storm
Ethiopia,2019,Ethiopia: Flood - 5 regions - 23/09/2019,2019-09-23T00:00:00Z,177000,Flood
Ethiopia,2019,Ethiopia: Drought - 01/01/2019,2019-01-01T00:00:00Z,131000,Drought
Ethiopia,2019,Ethiopia: Flood - Amhara - 01/08/2019,2019-08-01T00:00:00Z,2,Flood
Ethiopia,2019,Ethiopia: Flood - 6 states - 01/05/2019,2019-05-01T00:00:00Z,190000,Flood
Ethiopia,2019,Ethiopia: Flood - SNNP - 01/04/2019,2019-04-01T00:00:00Z,5600,Flood
Ethiopia,2020,Ethiopia: Flood - Somali (9 zones/26 woredas) - 01/04/2020,2020-04-01T00:00:00Z,198000,Flood
Ethiopia,2020,Ethiopia: Drought - 01/01/2020,2020-01-01T00:00:00Z,20000,Drought
Ethiopia,2020,Flood: Ethiopia - Dire Dawa - 24/04/2020,2020-04-24T00:00:00Z,2000,Flood
Ethiopia,2020,Ethiopia: Kiremt Rains Floods - 6 regions - 01/07/2020,2020-07-01T00:00:00Z,343000,Flood
Ethiopia,2020,"Ethiopia: flood - SNNP (Gamo, South Omo, Gofa, Alaba, Silte) - 01/04/2020",2020-04-01T00:00:00Z,13000,Flood
Ethiopia,2020,"Ethiopia: flood - Afar (Zone 1, 2, 3) - 01/04/2020",2020-04-01T00:00:00Z,3700,Flood
Ethiopia,2020,Ethiopia: Floods - Oromia (West Guji - Gelana and Bulle Hora) - 01/04/2020,2020-04-01T00:00:00Z,84000,Flood
Ethiopia,2021,"Ethiopia: Belg rains (SNNP, Oromia, Afar, Somali)  - 01/04/2021",2021-04-01T00:00:00Z,171000,Flood
Ethiopia,2021,"Ethiopia: Wildfires - SNNP, Oromia - 01/03/2021",2021-03-01T00:00:00Z,610,Wildfire
Ethiopia,2021,"Ethiopia: Wildfires - SNNP, Oromia - 01/03/2021",2021-03-01T00:00:00Z,140,Wildfire
Ethiopia,2021,"Ethiopia: Drought - Afar, Oromia, Somali - 01/01/2021 ",2021-01-01T00:00:00Z,54000,Drought
Ethiopia,2021,"Ethiopia: Kiremt Rain Season Floods - Gambela, Afar - 01/06/2021",2021-06-01T00:00:00Z,450,Flood
Ethiopia,2021,Ethiopia: Bega Rains - SNNP - 01/10/2021,2021-10-01T00:00:00Z,160,Flood
Ethiopia,2021,"Ethiopia: Kiremt Rain Season Floods - Gambela, Afar - 01/06/2021",2021-06-01T00:00:00Z,14000,Flood
Finland,2008,,2008-01-28T00:00:00Z,20,Storm
Finland,2013,Pyhajoki flash flood,2013-04-20T00:00:00Z,30,Flood
Finland,2018,Finland: forest fire - Pyhäranta - 22/07/2018,2018-07-22T00:00:00Z,51,Wildfire
Fiji,2009,Cyclone Mick,2009-01-01T00:00:00Z,3800,Storm
Fiji,2009,2009-000010,2009-01-01T00:00:00Z,9400,Flood
Fiji,2010,Cyclone 'Tomas',2010-01-01T00:00:00Z,18000,Storm
Fiji,2012,,2012-01-01T00:00:00Z,8400,Storm
Fiji,2012,,2012-01-01T00:00:00Z,15000,Flood
Fiji,2012,,2012-01-01T00:00:00Z,3600,Flood
Fiji,2014,Tropical depression,2014-02-27T00:00:00Z,800,Storm
Fiji,2016,Tropical Cyclone Zena,2016-04-05T00:00:00Z,12000,Storm
Fiji,2016,Tropical cyclone Winston,2016-02-07T00:00:00Z,62000,Storm
Fiji,2016,Tropical Depression - FIJI,2016-12-16T00:00:00Z,2100,Storm
Fiji,2017,Fiji : Viti Levu Flood - 08/02/2017,2017-02-08T00:00:00Z,190,Flood
Fiji,2017,Fiji : Tropical Cyclone Ella - Country wide - 09/05/2017,2017-05-09T00:00:00Z,160,Storm
Fiji,2017,Fiji : Magnitude-6.9 earthquake - Fiji - 04/01/2017,2017-01-04T00:00:00Z,30,Earthquake
Fiji,2018,Fiji: Tropical Cyclone Keni - 09/04/2018,2018-04-09T00:00:00Z,10000,Flood
Fiji,2018,Fiji: Tropical Cyclone Josie - 31/03/2018,2018-03-31T00:00:00Z,2300,Storm
Fiji,2019,Fiji: Storm - Viti Levu (Veriaisi) - 7/10/2019 ,2019-10-07T00:00:00Z,20,Storm
Fiji,2019,Fiji: Flooding - Central Division- 22/04/2019 ,2019-04-22T00:00:00Z,57,Storm
Fiji,2019,Fiji: Tropical Cyclone Mona - 2/1/2019,2019-01-02T00:00:00Z,2300,Storm
Fiji,2019,Fiji: Tropical Cyclone Sarai - 12/12/2019,2019-12-12T00:00:00Z,2500,Storm
Fiji,2019,Fiji: Cylone Pola - 23/2/2019,2019-02-23T00:00:00Z,15,Storm
Fiji,2019,Fiji: Landslide - Cakaudrove (Northern Division)- 24/04/2019 ,2019-04-24T00:00:00Z,10,Wet Mass Movement
Fiji,2019,Fiji: Landslide - Navosa - February 2019,2019-02-01T00:00:00Z,80,Wet Mass Movement
Fiji,2020,"Fiji, Vanuatu: Cyclone Yasa - countrywide - 16/12/2020",2020-12-13T00:00:00Z,23000,Storm
Fiji,2020,Fiji: Sea Level Rise - Kadavu (Narikoso) - 20/11/2020,2020-11-20T00:00:00Z,35,Wet Mass Movement
Fiji,2020,"Fiji, Tuvalu: TC Tino - 17/01/2020",2020-01-17T00:00:00Z,3100,Storm
Fiji,2020,"Vanuatu, Solomon Islands, Fiji, Tonga: Tropical Cyclone Harold - 01/04/2020",2020-04-01T00:00:00Z,10000,Storm
Fiji,2021,Fiji: Cyclones Ana & Bina - countrywide - 28/01/2021,2021-01-28T00:00:00Z,14000,Storm
Fiji,2021,Fiji: Floods - Central Division - 02/05/21,2021-05-02T00:00:00Z,5,Flood
Fiji,2021,Fiji: Floods - countrywide - 02/03/2021,2021-03-02T00:00:00Z,2,Flood
Fiji,2021,"Fiji: Landslide - Naitasiri Province (Sawani, Navatuvula Village) - 11/12/2021",2021-12-11T00:00:00Z,12,Wet Mass Movement
France,2008,,2008-03-08T00:00:00Z,870,Storm
France,2010,Xynthia,2010-01-01T00:00:00Z,4500,Storm
France,2013,Saint-Béat flood,2013-06-18T00:00:00Z,400,Flood
France,2013,Segré landslide,2013-11-21T00:00:00Z,6,Wet Mass Movement
France,2013,Barèges flood,2013-06-17T00:00:00Z,500,Flood
France,2013,"Haute-Garonne, Hautes-Pyrénées, Pyrénées-Atlantiques and Landes departments June floods",2013-06-17T00:00:00Z,2500,Flood
France,2013,Lourdes floods,2013-06-18T00:00:00Z,2000,Flood
France,2013,Clérieux flood,2013-10-23T00:00:00Z,350,Flood
France,2013,Perpignan March floods,2013-03-04T00:00:00Z,700,Flood
France,2013,Côte-d'Or floods,2013-03-05T00:00:00Z,250,Flood
France,2014,Tropical cyclone Edna,2014-02-04T00:00:00Z,300,Storm
France,2014,North-western France floods,2014-02-09T00:00:00Z,100,Flood
France,2014,South and South-west France flash floods,2014-09-28T00:00:00Z,300,Flood
France,2014,Peyriac-de-Mer fire,2014-07-30T00:00:00Z,2,Wildfire
France,2014,Floods in the Pyrénées-Orientales and Aude dept.,2014-11-30T00:00:00Z,3400,Flood
France,2015,Flash flood in the French Riviera,2015-10-03T00:00:00Z,120,Flood
France,2016,Isere Landslide,2016-06-19T00:00:00Z,190,Dry mass movement
France,2017,France - bushfire - Herault - 09/08/2017,2017-08-09T00:00:00Z,200,Wildfire
France,2017,France: forest fires - 6 departments - 16/07/2017,2017-07-16T00:00:00Z,7100,Wildfire
France,2017,15 countries - Hurricane Irma - 27/08/2017,2017-08-27T00:00:00Z,1500,Storm
France,2017,15 countries - Hurricane Irma - 27/08/2017,2017-08-27T00:00:00Z,1500,Storm
France,2017,France: rock fall - Culoz - 08/03/2017,2017-03-08T00:00:00Z,200,Dry mass movement
France,2017,France: Storm Egon - 11 departments - 12/01/2017,2017-01-12T00:00:00Z,1000,Storm
France,2017,France: wildfires  Riviera; Corsica  25/07/2017,2017-07-25T00:00:00Z,10000,Wildfire
France,2018,France: Argens flood - 31/10/218,2018-10-31T00:00:00Z,220,Flood
France,2018,Mauritius; France (La Réunion): Tropical cyclone Berguitta - 15/01/2018,2018-01-15T00:00:00Z,210,Storm
France,2018,France: storm - Saint-Maxime - 10/10/2018,2018-10-10T00:00:00Z,5,Storm
France,2018,France: flood - Aude - 14/10/2018,2018-10-14T00:00:00Z,1800,Flood
France,2018,France: flood - Ardèche; Drôme; Gard - 10/08/2018,2018-08-10T00:00:00Z,1600,Flood
France,2018,France: Seine River flood - Ile-de-France - 23/01/2018,2018-01-23T00:00:00Z,1500,Flood
France,2018,France: riverine flood - Ornans - 22/01/2018,2018-01-22T00:00:00Z,40,Flood
France,2018,France: floods - Île-de-France - 11/06/2018,2018-06-11T00:00:00Z,16,Flood
France,2018,France: forest fire - Corsica - 02/01/2018,2018-01-02T00:00:00Z,650,Wildfire
France,2018,France (New Caledonia): wildfire - Ouvéa - 03/11/2018,2018-11-03T00:00:00Z,35,Wildfire
France,2018,France: Landslide - La bathie - 25/12/2018,2018-12-25T00:00:00Z,10,Wet Mass Movement
France,2018,France: Storm Adrian - 29/10/2018,2018-10-28T00:00:00Z,8,Storm
France,2018,France: storms - Lot-et-Garonne - 31/05/2018,2018-05-31T00:00:00Z,43,Storm
France,2018,France: flood - Gironde - 30/05/2018,2018-05-30T00:00:00Z,6,Flood
France,2018,France: storm - Marne; Ardenne - 29/04/2018,2018-04-29T00:00:00Z,48,Storm
France,2018,France: mudslide - Marcilly - 28/05/2018,2018-05-28T00:00:00Z,2,Wet Mass Movement
France,2018,France: seismic activity - Mayotte - 10/05/2018,2018-06-14T00:00:00Z,15,Earthquake
France,2018,France: Landslide - Villeneuve-sur-Lot - 23/12/2018,2018-12-23T00:00:00Z,32,Wet Mass Movement
France,2018,France: storms - Brittany; Normandy; Bourgogne-Franche-Comte - 03/06/2018,2018-06-03T00:00:00Z,110,Storm
France,2019,France: Storm - Romans-sur-Isère - 06/07/2019,2019-07-06T00:00:00Z,19,Storm
France,2019,France: Storm - Nouvelle-Aquitaine (Pyrénées-Atlantiques) - 22/12/2019,2019-12-22T00:00:00Z,60,Storm
France,2019,France: Floods - Villeneuve-lès-Béziers - 23/10/209,2019-10-23T00:00:00Z,100,Flood
France,2019,France: Wildfire - Gard - 29/06/2019,2019-06-28T00:00:00Z,120,Wildfire
France,2019,France: Floods - Provence-Alpes-Côte d'Azur - 01/12/2019,2019-12-01T00:00:00Z,160,Flood
France,2019,France: Floods - Brittany (Ille-et-Vilaine) - 21/12/2019,2019-12-21T00:00:00Z,24,Flood
France,2019,France: Wildfire - Guichainville,2019-09-11T00:00:00Z,7,Wildfire
France,2019,France: Tornado - Arles - 15/10/2019,2019-10-19T00:00:00Z,60,Storm
France,2019,France: Landslide - Provence-Alpes-Côte d'Azur (Alpes-de-Haute-Provence) - 02/12/2019,2019-12-02T00:00:00Z,7,Wet Mass Movement
France,2019,France: Floods - Hérault -22/10/2019,2019-10-22T00:00:00Z,500,Flood
France,2019,France: Floods - Nouvelle-Aquitaine - 13/12/2019 ,2019-12-13T00:00:00Z,640,Flood
France,2019,"France: Floods - Provence-Alpes-Côte d'Azur, Occitanie - 23/11/2019 ",2019-11-23T00:00:00Z,1700,Flood
France,2019,France: thunderstorm - Le Havre - 18/06/2019,2019-06-18T00:00:00Z,17,Storm
France,2019,France: risk of rock fall - Evreux - 11/06/2019,2019-06-11T00:00:00Z,4,Dry mass movement
France,2019,France: Flash floods - Normandy - 24/06/2019,2019-06-24T00:00:00Z,60,Flood
France,2019,France: wildfire - Bagnols-sur-Cèze - 27/03/2019,2019-03-27T00:00:00Z,9,Wildfire
France,2019,France: risk of rock fall - Sisteron - 31/03/3019,2019-03-31T00:00:00Z,48,Dry mass movement
France,2019,France: Storm Amelie - 4 departments - 03/11/2019,2019-11-03T00:00:00Z,20,Storm
France,2019,"France: Snowfall -  Auvergne-Rhône-Alpes (Drôme, Ardèche, Isère, Rhône) - 14/11/2019",2019-11-14T00:00:00Z,8,Storm
France,2019,France: Floods - Aude - 23/10/2019,2019-10-22T00:00:00Z,150,Flood
France,2019,"France: Earthquake - Auvergne-Rhône-Alpes (Drôme, Ardèche) - 11/11/2019",2019-11-11T00:00:00Z,2000,Earthquake
France,2019,France: Wildfire - Banyuls - 04/09/2019,2019-09-05T00:00:00Z,100,Wildfire
France,2019,France: wildfire - Corsica - 24/02/2019,2019-02-24T00:00:00Z,10,Wildfire
France,2019,France : Floods - Hauts-de-France - 04/11/2019,2019-11-04T00:00:00Z,50,Flood
France,2019,France: forest fire - Aude - 14/08/2019,2019-08-14T00:00:00Z,22,Wildfire
France,2019,France: forest fire - Landes - 06/03/2019,2019-03-06T00:00:00Z,10,Wildfire
France,2019,France: Wildfire - Bédenac - 04/09/2019,2019-09-04T00:00:00Z,25,Wildfire
France,2019,"France: Floods - Nice, Saint Laurent - 31/10/2019",2019-10-31T00:00:00Z,30,Flood
France,2019,France: forest fire - Courbessac - 01/09/2019,2019-09-01T00:00:00Z,20,Wildfire
France,2019,France: forest fire - Générac - 30/07/2019,2019-07-30T00:00:00Z,190,Wildfire
France,2019,France: Earthquake - Gironde - 20/03/2019,2019-03-20T00:00:00Z,2,Earthquake
France,2019,France: forest fire - Sologne - 31/08/2019,2019-08-31T00:00:00Z,40,Wildfire
France,2020,France: Tornado -  Hauts-de-France (Hangest-en-Santerre) - 28/09/2020,2020-10-28T00:00:00Z,28,Storm
France,2020,France: Storm Leon - Pays-de-la-Loire - 01/03/2020,2020-03-01T00:00:00Z,7,Storm
France,2020,UK; France: Storm Bella - 26/12/2020,2020-12-26T00:00:00Z,30,Storm
France,2020,France: Floods - Occitanie (Anduze) - 19/09/2020,2020-09-19T00:00:00Z,3400,Flood
France,2020,"France, Italy, Switzerland: Storm Alex - Countrywide - 02/10/2020 ",2020-10-02T00:00:00Z,930,Storm
France,2020,France: Floods - Nouvelle-Aquitaine (Gironde) - 12/05/2020,2020-05-12T00:00:00Z,46,Flood
France,2020,France: Storm - Belfort - 26/06/2020,2020-06-26T00:00:00Z,62,Storm
France,2020,France: Storm Norberto - Belle-Île-en-Mer - 05/03/2020,2020-03-05T00:00:00Z,44,Storm
France,2020,France: Wildfires - Provence-Alpes-Côte d'Azur (Vaucluse) - 15/08/2020,2020-08-15T00:00:00Z,230,Wildfire
France,2020,"France: Wildfires - (Centre-Val de Loire, Provence-Alpes-Côte d'Azur, Nouvelle-Aquitaine) - 13/08/2020",2020-09-13T00:00:00Z,30,Wildfire
France,2020,"France: Storm Gloria -  Pyrénées-Orientales, Aude - 21/01/2020",2020-01-21T00:00:00Z,2000,Flood
France,2020,France: Floods - Boulogne-Billancourt - 10/05/2020,2020-05-10T00:00:00Z,67,Flood
France,2020,France: Floods - Nouvelle-Aquitaine (Landes) - 12/05/2020,2020-05-12T00:00:00Z,12,Flood
France,2020,France: Floods - Corsica - 11/06/2020,2020-06-11T00:00:00Z,70,Flood
France,2020,France: Wildfire - Aveyron(Olemps) - 31/07/2020,2020-07-31T00:00:00Z,50,Wildfire
France,2020,France: Pre-emptive evacuation - Occitanie (Tarn) - 11/05/2020,2020-05-12T00:00:00Z,3,Flood
France,2020,France: Pre-emptive evacuation - Occitanie (Aude) - 12/05/2020,2020-05-12T00:00:00Z,150,Flood
France,2020,France: Floods - Occitanie (Valleraugue) - 19/09/2020,2020-09-19T00:00:00Z,420,Flood
France,2020,France: Bushfire - Bouches-du-Rhône (Marseille) - 05/08/2020,2020-08-05T00:00:00Z,2700,Wildfire
France,2021,France: Wildfire - Var - 16/08/2021,2021-08-16T00:00:00Z,8000,Wildfire
France,2021,"France: Flood - La Marne and Aisne Departments - 14/07/2021	",2021-07-14T00:00:00Z,43,Flood
France,2021,France: Floods - Corrèze department (Argentat-sur-Dordogne) - 01/02/2021,2021-01-31T00:00:00Z,73,Flood
France,2021,"France: Flood - La Marne and Aisne Departments - 14/07/2021	",2021-07-14T00:00:00Z,75,Flood
France,2021,France: Landslide - Cantal (Vic-sur-Cère) - 24/01/2021,2021-01-24T00:00:00Z,12,Dry mass movement
France,2021,France: Storm Justine - Gironde and Lot-et-Garonne departments - 03/02/2021,2021-01-26T00:00:00Z,680,Storm
France,2021,France: Flooding - Ardèche department (Annonay) - 10/05/2021,2021-05-10T00:00:00Z,7,Flood
France,2021,"France: Flood - La Marne and Aisne Departments - 14/07/2021	",2021-07-14T00:00:00Z,5,Flood
France,2021,"France: Landslide - Haute-Savoie (Bossey) - 22/06/2021	",2021-06-22T00:00:00Z,150,Dry mass movement
France,2021,France: Flooding - Alpes-de-Haute-Provence department (Alpes-du-Sud - Unvernet-Fours) - 10/05/2021,2021-05-10T00:00:00Z,26,Flood
"Micronesia, Fed. Sts.",2015,Typhoon Maysak,2015-03-27T00:00:00Z,6800,Storm
Gabon,2009,,2009-01-01T00:00:00Z,800,Storm
Gabon,2012,,2012-01-01T00:00:00Z,1600,Flood
Gabon,2013,,2013-03-10T00:00:00Z,360,Storm
Gabon,2013,,2013-11-15T00:00:00Z,1400,Flood
Gabon,2017,Gabon: floods - Estuaire - 16/04/2017,2017-04-16T00:00:00Z,4,Flood
Gabon,2017,Gabon: floods - Estuaire - 17/02/2017,2017-02-17T00:00:00Z,4,Flood
Gabon,2020,Gabon: Floods - Libreville - 07/03/2020,2020-03-07T00:00:00Z,2,Flood
United Kingdom,2012,,2012-01-01T00:00:00Z,100,Flood
United Kingdom,2012,,2012-01-01T00:00:00Z,100,Flood
United Kingdom,2012,,2012-01-01T00:00:00Z,100,Flood
United Kingdom,2013,Storm Xaver,2013-12-04T00:00:00Z,20000,Flood
United Kingdom,2013,Storm St. Jude,2013-10-28T00:00:00Z,12,Flood
United Kingdom,2013,Dorset floods,2013-12-15T00:00:00Z,240,Flood
United Kingdom,2014,Winter storms (UK),2014-01-01T00:00:00Z,620,Storm
United Kingdom,2015,Storm Eva,2015-12-23T00:00:00Z,5100,Storm
United Kingdom,2015,Storm Desmond,2015-12-01T00:00:00Z,1000,Storm
United Kingdom,2016,Northern regions flooding,2016-01-01T00:00:00Z,930,Flood
United Kingdom,2016,Storm Angus,2016-11-19T00:00:00Z,220,Flood
United Kingdom,2016,Storm Katie,2016-03-27T00:00:00Z,19,Storm
United Kingdom,2017,United Kingdom and Ireland: Flash floods (22/08/2017),2017-08-22T00:00:00Z,3,Flood
United Kingdom,2017,United Kingdom and Ireland: Hurricane Ophelia (12.10.2017),2017-10-09T00:00:00Z,5,Storm
United Kingdom,2017,Scotland: Floods- Aberdeenshire (05/06/2017),2017-06-05T00:00:00Z,10,Flood
United Kingdom,2017,Southern England flash flood,2017-07-18T00:00:00Z,120,Flood
United Kingdom,2017,"United Kingdom and Ireland: Flash flooding- North-west England, Wales and Ireland- 22.11.2017",2017-11-22T00:00:00Z,30,Flood
United Kingdom,2017,United Kingdom: flash floods - Eastern and Southern England - 08/08/2017,2017-08-08T00:00:00Z,21,Flood
United Kingdom,2017,United Kingdom: coastal flooding (13.01.2017),2017-01-13T00:00:00Z,6000,Storm
United Kingdom,2018,United Kingdom: Storm Emma - South West England; Sunderland; Whitley Bay - 02/03/2018,2018-03-02T00:00:00Z,2,Storm
United Kingdom,2018,United Kingdom: wildfire - Manchester - 24/06/2018,2018-06-24T00:00:00Z,120,Wildfire
United Kingdom,2018,United Kingdom: coastal erosion - The Marrams; Norfolk  - 17/03/2018,2018-03-17T00:00:00Z,23,Storm
United Kingdom,2018,United Kingdom: flood - Milford Haven; Wales - 08/11/2018,2018-11-08T00:00:00Z,23,Flood
United Kingdom,2019,United Kingdom:forest fire - Durness - 15/04/2019 ,2019-04-15T00:00:00Z,5,Wildfire
United Kingdom,2019,"United Kingdom: Floods - Yorkshire and the Humber (Doncaster), Hampshire - 12/11/2019",2019-11-11T00:00:00Z,2800,Flood
United Kingdom,2019,United Kingdom: heavy rain and floods - countrywide - 14/06/2019,2019-06-14T00:00:00Z,1600,Flood
United Kingdom,2019,United Kingdom: Floods -  Yorkshire and Humber (Sheffield) - 07/11/2019,2019-11-07T00:00:00Z,24,Flood
United Kingdom,2019,United Kingdom: Landslide - Nottinghamshire - 07/11/2019,2019-11-08T00:00:00Z,81,Wet Mass Movement
United Kingdom,2019,United Kingdom: Wildfires - Northern Ireland (Mourne) 21/04/2019 -,2019-04-21T00:00:00Z,5,Wildfire
United Kingdom,2019,United Kingdom: Floods - England (Cornwall) - 19/12/2019,2019-12-19T00:00:00Z,120,Flood
United Kingdom,2019,United Kingdom: landslide - Loch Katrine - 05/08/2019,2019-08-04T00:00:00Z,14,Wet Mass Movement
United Kingdom,2019,United Kingdom: Floods - Nottinghamshire (Worksop) - 07/11/2019,2019-11-07T00:00:00Z,57,Flood
United Kingdom,2019,United Kingdom: Floods - England and Wales - 26/10/2019,2019-10-26T00:00:00Z,140,Flood
United Kingdom,2019,United Kingdom: risk of dam collapse at Toddbrook Reservoir- Whaley Bridge - 01/08/2019,2019-08-01T00:00:00Z,6500,Flood
United Kingdom,2019,United Kingdom: Floods - England (Kent) - 21/12/2019,2019-12-21T00:00:00Z,460,Flood
United Kingdom,2019,United Kingdom - flood - North West - 28/07/2019,2019-07-28T00:00:00Z,30,Flood
United Kingdom,2020,United Kingdom - Landslide (Kent) - 29/05/2020,2020-05-29T00:00:00Z,46,Wet Mass Movement
United Kingdom,2020,"United Kingdom, France, Portugal, Spain: Storm Barbara - Countrywide - 20/10/2020",2020-10-20T00:00:00Z,14,Storm
United Kingdom,2020,United Kingdom: Floods - Yorkshire - 28/02/2020,2020-02-28T00:00:00Z,6,Flood
United Kingdom,2020,United Kingdom: Wildfires - Wales (Bangor) - 30/05/2020,2020-05-30T00:00:00Z,20,Wildfire
United Kingdom,2020,UK; France: Storm Bella - 26/12/2020,2020-12-26T00:00:00Z,3000,Storm
United Kingdom,2020,"United Kingdom: Storm Ciara - (England, Wales) - 08/02/2020",2020-02-08T00:00:00Z,42,Storm
United Kingdom,2020,United Kingdom: Floods - Yorkshire (Snaith) -25/02/2020,2020-02-25T00:00:00Z,7,Flood
United Kingdom,2020,United Kingdom: Floods - Scotland - 12/08/2020,2020-08-12T00:00:00Z,250,Flood
United Kingdom,2020,United Kingdom: Floods - England (Kent) 05/03/2020,2020-03-05T00:00:00Z,40,Flood
United Kingdom,2020,United Kingdom: Storm Francis - 25/08/2020,2020-08-25T00:00:00Z,120,Storm
United Kingdom,2020,United Kingdom - Storm Dennis - 15/02/2020,2020-02-15T00:00:00Z,1000,Storm
United Kingdom,2020,"United Kingdom: Landslide - England (Kent, Eastchurch) - 31/05/2020",2020-05-31T00:00:00Z,48,Dry mass movement
United Kingdom,2020,"United Kingdom: Wildfires (England, Surrey) - 07/08/2020",2020-08-07T00:00:00Z,230,Wildfire
United Kingdom,2021,United Kingdom: Landslide - England (Nottingham - Sneinton) - 03/02/2021,2021-02-03T00:00:00Z,12,Wet Mass Movement
United Kingdom,2021,"United Kingdom: Storm Christoph - England, Wales - 18/01/2021",2021-01-18T00:00:00Z,380,Storm
United Kingdom,2021,United Kingdom: Flooding - England (London) - 12/07/2021,2021-07-12T00:00:00Z,120,Flood
Georgia,2013,"Western Georgia: Konchkati, Tkhinvali, Shrosha, Natanebi, Zemo and Kvemo Aketi, Ureki Tsvermagala territory Flash floods",2013-08-01T00:00:00Z,250,Flood
Georgia,2013,Western Georgia flash floods,2013-07-19T00:00:00Z,150,Flood
Georgia,2013,Eastern & Western Georgia storm,2013-03-24T00:00:00Z,1100,Storm
Georgia,2014,West Georgia flood,2014-09-21T00:00:00Z,120,Flood
Georgia,2015,Eastern regions hailstorm (June),2015-06-07T00:00:00Z,74,Storm
Georgia,2015,Tblisi floods,2015-06-13T00:00:00Z,1100,Flood
Georgia,2015,Eastern and western regions hailstorm (Aug),2015-08-20T00:00:00Z,60,Storm
Georgia,2018,Georgia : Landslide - Svaneti - 06/06/2018,2018-07-05T00:00:00Z,24,Wet Mass Movement
Georgia,2018,"Georgia: Flood - Chuberi, Kakheti, Gori and Gardabani - 23/07/2018",2018-07-23T00:00:00Z,280,Flood
Georgia,2020,Georgia: Floods - Racha - 30/07/2020,2020-07-30T00:00:00Z,150,Flood
Georgia,2020,Georgia: Floods - Guria (Lanchkhuti Municipality) - 29/07/2020,2020-07-29T00:00:00Z,10,Flood
Georgia,2021,"Georgia: Floods - Adjara, Guria - 22/09/2021",2021-09-22T00:00:00Z,17,Flood
Georgia,2021,"Georgia: Floods - Adjara, Guria - 22/09/2021",2021-09-22T00:00:00Z,68,Flood
Ghana,2008,,2008-07-01T00:00:00Z,14000,Flood
Ghana,2009,2009-000132,2009-01-01T00:00:00Z,52000,Flood
Ghana,2011,,2011-01-01T00:00:00Z,17000,Flood
Ghana,2011,FL-2011-000106-GHA,2011-01-01T00:00:00Z,32000,Flood
Ghana,2013,,2013-09-01T00:00:00Z,1600,Flood
Ghana,2013,"Gushegu, Yendi Municipal, Savelugu/Nanton, Saboba, Zabzugu, Tatale/Sanguli, Tamale Metropolis, Moin, Walewale and Bunkpurugu/Yunyoo districts",2013-03-07T00:00:00Z,23000,Flood
Ghana,2013,Bunkpurugu/Yunyuo district flash flood,2013-08-29T00:00:00Z,6000,Flood
Ghana,2015,Greater Accra region flood,2015-06-03T00:00:00Z,9300,Flood
Ghana,2016,Floods in Kumasi,2016-06-24T00:00:00Z,200,Flood
Ghana,2016,Floods in Chereponi,2016-05-06T00:00:00Z,1000,Flood
Ghana,2016,Torrential rains in the Northern region,2016-03-04T00:00:00Z,1800,Flood
Ghana,2016,Floods in Upper East,2016-07-27T00:00:00Z,2700,Flood
Ghana,2016,Floods in Tamale,2016-07-23T00:00:00Z,200,Flood
Ghana,2016,Floods in Eastern region,2016-09-15T00:00:00Z,2000,Flood
Ghana,2017,Ghana: Storm - Brong Ahafo - 24/02/2017,2017-02-24T00:00:00Z,930,Storm
Ghana,2017,Ghana: Storms - Northern - 11/05/2017,2017-05-11T00:00:00Z,1100,Storm
Ghana,2017,Ghana: Storm - Brong Ahafo - 17/10/2017,2017-10-17T00:00:00Z,200,Storm
Ghana,2017,Ghana: Flood - Ashanti - 24/09/2017,2017-09-24T00:00:00Z,2,Flood
Ghana,2017,Ghana: Flood - Northern - 25/07/2017,2017-07-25T00:00:00Z,2400,Flood
Ghana,2017,Ghana: Storm - Upper East - 30/05/2017,2017-05-30T00:00:00Z,6300,Storm
Ghana,2017,"Ghana: Flood - Volta, Western - 16/06/2017",2017-06-16T00:00:00Z,2500,Flood
Ghana,2017,"Ghana: Flood - Eastern, Western, Central, Greater Accra - 16/06/2017",2017-06-16T00:00:00Z,6000,Flood
Ghana,2017,Ghana: Flood - Western -26/06/2017,2017-06-26T00:00:00Z,300,Flood
Ghana,2017,Ghana: Storm - Upper East - 30/04/2017,2017-04-30T00:00:00Z,850,Storm
Ghana,2017,Ghana: Flood - Northern - 04/08/2017,2017-08-04T00:00:00Z,1500,Flood
Ghana,2017,Ghana: Flood - Accra - 06/07/2017,2017-07-06T00:00:00Z,700,Flood
Ghana,2017,Ghana: Storm - Volta - 01/03/2017,2017-03-01T00:00:00Z,500,Storm
Ghana,2018,Ghana: Flood - Ashanti - 28/06/2018,2018-06-28T00:00:00Z,300,Flood
Ghana,2018,Ghana: Storm - Central - 14/03/2018,2018-03-14T00:00:00Z,300,Storm
Ghana,2018,Ghana: Flood - Eastern region - 16/10/2018,2018-10-16T00:00:00Z,2000,Flood
Ghana,2018,Ghana: Storm - Volta - 04/03/2018,2018-03-04T00:00:00Z,840,Storm
Ghana,2018,Ghana: Floods - Accra - 19/06/2018,2018-06-18T00:00:00Z,2000,Flood
Ghana,2018,Ghana: Storm - Ashanti - 04/03/2018,2018-03-04T00:00:00Z,600,Storm
Ghana,2018,Ghana: Flood - Northern region - 01/09/2018,2018-09-01T00:00:00Z,52000,Flood
Ghana,2018,DELETE-Double entry,2018-06-18T00:00:00Z,200,Flood
Ghana,2018,Ghana: Storms - Northern - 15/03/2018,2018-03-15T00:00:00Z,3000,Storm
Ghana,2019,Ghana: Storm - Ashanti - 05/05/2019,2019-05-05T00:00:00Z,110,Storm
Ghana,2019,Ghana: Flood - Ashanti - 20/05/2019,2019-05-20T00:00:00Z,200,Flood
Ghana,2019,Ghana: Flood - Accra; Western - 30/05/2019,2019-05-30T00:00:00Z,2,Flood
Ghana,2019,Ghana: Storm - Central - 24/03/2019,2019-03-24T00:00:00Z,2000,Storm
Ghana,2019,Ghana: Flood - Ashanti - 01/02/2019,2019-02-01T00:00:00Z,800,Flood
Ghana,2019,Ghana: Tidal waves inundation - Volta - 03/07/2019 ,2019-07-03T00:00:00Z,520,Flood
Ghana,2019,Ghana: Flood - Upper East region - 06/10/2019 ,2019-10-06T00:00:00Z,7700,Flood
Ghana,2019,Ghana: Flood - Eastern - 09/04/2019,2019-04-09T00:00:00Z,800,Flood
Ghana,2019,Ghana: Flood - Ashanti - 04/04/2019,2019-04-04T00:00:00Z,400,Flood
Ghana,2019,Ghana: Storm - Volta - 06/03/2019,2019-03-06T00:00:00Z,410,Storm
Ghana,2019,Ghana: Flood - Kwahu West - 06/10/2019 ,2019-10-06T00:00:00Z,1200,Flood
Ghana,2019,Ghana: Flood - Eastern region - 27/10/2019,2019-10-27T00:00:00Z,1800,Flood
Ghana,2020,Ghana: Flood - Accra - 08/06/2020,2020-06-08T00:00:00Z,200,Flood
Ghana,2020,Ghana: Flood [Begram dam spillage] - Savannah - 01/09/2020,2020-09-01T00:00:00Z,1200,Flood
Ghana,2020,Ghana: Floods - Upper East - 01/09/2020,2020-09-01T00:00:00Z,550,Flood
Ghana,2021,Ghana: Storm - Volta (Adaklu-Kpogadzi) - 14/02/2021,2021-02-14T00:00:00Z,120,Storm
Ghana,2021,Ghana: Storm - Bono Region (Tain District - Seikwa) - 11/01/2021,2021-01-11T00:00:00Z,90,Storm
Ghana,2021,Ghana: Storm - Eastern Region (Akyem Oda) - 05/04/2021,2021-04-05T00:00:00Z,1000,Storm
Ghana,2021,Ghana: Storm - Ahafo (Asutifi South District - Hwidiem) - 14/05/2021,2021-05-14T00:00:00Z,2,Storm
Ghana,2021,Ghana: Storm - Upper East (Builsa North) - 11/05/2021,2021-05-11T00:00:00Z,200,Storm
Ghana,2021,"Ghana: Tidal waves flood - Volta (Keta, Ketu South and Anlo) - 07/11/2021",2021-11-07T00:00:00Z,7000,Flood
Ghana,2021,Ghana: Tidal wave - Volta (Ketu South) - 05/04/2021,2021-04-05T00:00:00Z,700,Flood
Ghana,2021,Ghana: Storm - Oti (Nkwanta South Municipality - Keri) - 22/04/2021,2021-04-22T00:00:00Z,30,Storm
Ghana,2021,Ghana: Storm - Western Region (Prestea-Huni Valley) - 18/10/2021,2021-10-18T00:00:00Z,7,Storm
Ghana,2021,Ghana: Storm - Ashanti (Kumasi) - 20/10/2021,2021-10-20T00:00:00Z,200,Storm
Ghana,2021,Ghana: Storm - Oti (Kadjebi) - 03/10/2021,2021-10-03T00:00:00Z,15,Storm
Ghana,2021,Ghana: (wind)storm - Ashanti (Obuasi East district) - 14/01/2021,2021-01-14T00:00:00Z,21,Storm
Ghana,2021,Ghana: Storm - Oti (Krachi East Municipality - Matamanu) - 06/06/2021,2021-06-06T00:00:00Z,50,Storm
Ghana,2021,Ghana: Floods - Upper West Region - 13/08/2021,2021-08-13T00:00:00Z,1200,Flood
Ghana,2021,Ghana: Floods - Ashanti - 25/06/2021,2021-06-25T00:00:00Z,200,Flood
Ghana,2021,Ghana: Storm - Upper East Region (Builsa South) - 01/08/2021,2021-08-01T00:00:00Z,1000,Storm
Ghana,2021,Ghana: Storm - Volta (Akatsi South Municipality) - 22/03/2021,2021-03-22T00:00:00Z,110,Storm
Ghana,2021,Ghana: Storm - Eastern Region (Ayensuano District; Atiwa East) - 04/03/2021,2021-03-04T00:00:00Z,95,Storm
Guinea,2011,FL-2011-000131-GIN,2011-01-01T00:00:00Z,4500,Flood
Guinea,2013,Prefecture de Siguiri flood,2013-07-31T00:00:00Z,300,Flood
Guinea,2015,Kolokala landslide,2015-09-07T00:00:00Z,270,Mass movement
Guinea,2015,Touguiwel flood,2015-07-01T00:00:00Z,3300,Flood
Guinea,2015,Floods in Conakry and sparsely in other parts of the country,2015-07-24T00:00:00Z,31000,Flood
Guinea,2016,Wildfires in Guinea,2016-01-12T00:00:00Z,420,Wildfire
Guinea,2016,Floods in Conakry,2016-07-12T00:00:00Z,63,Flood
Guinea,2017,Guinea: Floods -  Nzérékoré Prefecture - 04/07/2017,2017-07-04T00:00:00Z,700,Flood
Guinea,2017,Guinea: landslide - Conakry Region - 22/08/2017,2017-08-22T00:00:00Z,18,Dry mass movement
Guinea,2018,Guinea: Storm - Mandiana - 23/05/2018,2018-05-23T00:00:00Z,2400,Storm
Guinea,2018,Flood: Guinea - Kankan - 29/08/2018,2018-08-29T00:00:00Z,1400,Flood
Guinea,2019,Guinea: (Wind)Storm - Pela (Nzérékoré) - 25/10/2019 ,2019-10-25T00:00:00Z,18,Storm
Guinea,2020,Guinea: Floods - Siguiri (Kintinian / Fifa; Boukaria) - 05/09/2020,2020-09-05T00:00:00Z,1800,Flood
Guinea,2020,Guinea: Floods - Kankan (Mandiana/Koundjan) - 01/09/2020,2020-09-01T00:00:00Z,370,Flood
Guinea,2020,"Guinea: Storm - Nzérékoré (Bossou,  Tchéassou) - 19/05/2020",2020-05-19T00:00:00Z,220,Storm
Guinea,2021,Guinea: Annual floods and rains - Countrywide - 2021 ,2021-01-01T00:00:00Z,2600,Flood
Gambia,2008,,2008-09-01T00:00:00Z,400,Flood
Gambia,2010,,2010-01-01T00:00:00Z,25000,Flood
Gambia,2012,,2012-01-01T00:00:00Z,7700,Flood
Gambia,2013,Niani district storm,2013-06-16T00:00:00Z,400,Storm
Gambia,2016,Heavy rains and windstroms,2016-08-01T00:00:00Z,4600,Storm
Gambia,2017,Gambia: floods - Central River Region - 21/08/17,2017-08-21T00:00:00Z,800,Flood
Gambia,2017,Gambia: storm - Lower River Region; North Bank Region- 06/07/2017,2017-07-06T00:00:00Z,78,Storm
Gambia,2019,Gambia: Windstorm surge - Upper river - 19/06/2019 ,2019-06-19T00:00:00Z,4000,Storm
Gambia,2020,The Gambia: Floods - West Coast region - 13/10/2020,2020-10-13T00:00:00Z,16000,Flood
Gambia,2020,Gambia: (Wind)storm - Upper River region - 14/06/2020,2020-06-14T00:00:00Z,1600,Storm
Gambia,2021,The Gambia: Storm - Centre River and Upper River regions - 02/07/2021,2021-07-02T00:00:00Z,890,Storm
Gambia,2021,The Gambia: (Wind)Storm - Banjul - 07/07/2021,2021-07-07T00:00:00Z,1500,Storm
Guinea-Bissau,2008,,2008-07-01T00:00:00Z,750,Flood
Guinea-Bissau,2010,,2010-01-01T00:00:00Z,2000,Flood
Guinea-Bissau,2018,Guinea Bissau: Storm - 28/06/2018,2018-06-28T00:00:00Z,3700,Storm
Guinea-Bissau,2019,Guinea-Bissau: Storm - Northern Oio - 18/06/2019 ,2019-06-18T00:00:00Z,410,Storm
Greece,2009,,2009-01-01T00:00:00Z,330,Wildfire
Greece,2013,Marathon wildfire,2013-08-05T00:00:00Z,60,Wildfire
Greece,2014,Northern Greece earthquake,2014-05-24T00:00:00Z,26,Earthquake
Greece,2014,Kefalonia earthquake (February),2014-02-03T00:00:00Z,3100,Earthquake
Greece,2014,Kelafonia earthquake,2014-01-26T00:00:00Z,5100,Earthquake
Greece,2015,Laconia fires,2015-07-17T00:00:00Z,270,Wildfire
Greece,2016,Chios Island Wildfire,2016-07-25T00:00:00Z,930,Wildfire
Greece,2016,Central and Western Greece River Floods,2016-11-26T00:00:00Z,1,Flood
Greece,2016,Rhodes Island Wildfire,2016-06-21T00:00:00Z,790,Wildfire
Greece,2016,Thassos Island Wildfire,2016-09-10T00:00:00Z,1200,Wildfire
Greece,2017,Aegean Sea Earthquake,2017-06-12T00:00:00Z,800,Earthquake
Greece,2018,Greece: Wildfires - Evia - 12/08/2018,2018-08-12T00:00:00Z,100,Wildfire
Greece,2018,"Greece: Floods - (Larissa ,Magnesia, Halkidiki, Mandra, Magoula, Nea Peramos) - 27-06/2018",2018-06-26T00:00:00Z,24,Flood
Greece,2018,Greece: Wildfire - Kontodespoti - 13/08/2018,2018-08-13T00:00:00Z,500,Wildfire
Greece,2018,Greece: Flash floods - Athens - 27/07/2018,2018-07-24T00:00:00Z,15,Flood
Greece,2018,Greece: Wildfire - Spina - 05/07/2018,2018-07-05T00:00:00Z,20,Wildfire
Greece,2018,Greece: Cyclone Zorba - 30/09/2018,2018-09-30T00:00:00Z,1300,Storm
Greece,2018,"Greece: Wildfires - Athens,  Attika,  Mati - 24/07/2018",2018-07-24T00:00:00Z,7200,Wildfire
Greece,2018,Greece: Landslide - Koziakas - 27/02/2018,2018-02-27T00:00:00Z,16,Mass movement
Greece,2018,Greece: Riverine Flood - Thessaly - 26/02/2018,2018-02-21T00:00:00Z,30,Flood
Greece,2018,Greece: Wildfires - Kefaloia -27/09/2018,2018-09-27T00:00:00Z,7,Wildfire
Greece,2019,Greece: Wildfire Evia - 5/07/2019,2019-07-05T00:00:00Z,2300,Wildfire
Greece,2019,Greece: Wildfires - Evia - 13/08/2019,2019-08-13T00:00:00Z,500,Wildfire
Greece,2020,"Greece, Turkey: 7.0 ?zmir/Samos Earthquake- ?zmir (Turkey), Samos (Greece) - 30/10/2020",2020-10-30T00:00:00Z,720,Earthquake
Greece,2020,Greece: Wildfire - East Attica (Keretea) - 09/09/2020,2020-08-31T00:00:00Z,2400,Wildfire
Greece,2020,Greece: Floods - Crete - 10/11/2020,2020-11-10T00:00:00Z,87,Flood
Greece,2020,Greece: Wildfire - Peolonnese Region - 22/07/2020,2020-07-22T00:00:00Z,4000,Wildfire
Greece,2020,Greece: Floods - Western region - 13/07/2020,2020-07-13T00:00:00Z,60,Flood
Greece,2020,Greece - Cyclone Ianos - Karditsa and Central Regions - 18/09/2020,2020-09-18T00:00:00Z,600,Storm
Greece,2020,Greece: Floods - Evia - 08/08/2020,2020-08-08T00:00:00Z,4800,Flood
Greece,2021,Greece: Storm Athena - Northern and Central Greece - 07/10/2021,2021-10-07T00:00:00Z,100,Storm
Greece,2021,"Greece: Wildfire - Countrywide - 01/07/2021	",2021-07-01T00:00:00Z,52000,Wildfire
Greece,2021,Greece: Earthquake - Thessaly (Larisa Regional Unit) - 03/03/2021,2021-03-03T00:00:00Z,4400,Earthquake
Greece,2021,Greece: Flash floods - Evros (Alexandroupoli) - 02/02/2021,2021-02-01T00:00:00Z,16,Flood
Greece,2021,Greece: Earthquake - Crete - 27/09/2021,2021-09-27T00:00:00Z,3500,Earthquake
Greece,2021,"Greece: Floods - Thrace (Alexandroupoli, Orestiada, Didymoteicho, Rodopi) - 12/01/2021",2021-01-12T00:00:00Z,81,Flood
Greece,2021,"Greece: Wildfires - Chios (Sidirouda, Katavasi, Diefha) - 08/07/2021",2021-07-08T00:00:00Z,50,Wildfire
Greece,2021,Greece: Floods - Attica and Central Macedonia (Serres) - 04/01/2021,2021-01-04T00:00:00Z,39,Flood
Greece,2021,"Greece: Wildfire (Stamata) - Attica (Dionysos municipality) - 27/07/2021	",2021-07-27T00:00:00Z,6000,Wildfire
Greece,2021,"Greece: Wildfire - Peloponnese (Corinth, Attica - Geraneia mountains) - 19/05/2021",2021-05-19T00:00:00Z,300,Wildfire
Greece,2021,Greece: Storm Athena - Northern and Central Greece - 07/10/2021,2021-10-07T00:00:00Z,72,Storm
Grenada,2017,Grenada - St Vincent and Grenadine: Tropical Storm Don - 18/07/2017,2017-07-18T00:00:00Z,140,Storm
Grenada,2017,Grenada: Tropical Storm Bret - 19/06/2017,2017-06-19T00:00:00Z,6,Storm
Grenada,2018,Grenada: Floods - St. George; St. David - 01/08/2018,2018-08-01T00:00:00Z,27,Flood
Grenada,2019,"Barbados, Canada, Grenada, Saint Lucia, St Vincent and the Grenadines, Bahamas, United States: Tropical storm / Hurricane Dorian - 26/08/2019 ",2019-08-26T00:00:00Z,26,Storm
Greenland,2017,Western coast Earthquake and Tsunami,2017-06-18T00:00:00Z,78,Earthquake
Greenland,2018,Greenland: iceberg-caused tsunami - Innaarsuit - 14/07/2018,2018-07-14T00:00:00Z,170,Flood
Guatemala,2008,,2008-07-21T00:00:00Z,5000,Storm
Guatemala,2008,,2008-01-12T00:00:00Z,2200,Extreme temperature
Guatemala,2008,FL-2008-000198-GTM,2008-10-22T00:00:00Z,11000,Flood
Guatemala,2009,,2009-01-01T00:00:00Z,990,Dry mass movement
Guatemala,2010,Hurricane Agatha,2010-01-01T00:00:00Z,112000,Storm
Guatemala,2010,2010-000208,2010-01-01T00:00:00Z,51000,Wet Mass Movement
Guatemala,2011,Depression Tropical,2011-01-01T00:00:00Z,29000,Flood
Guatemala,2011,,2011-01-01T00:00:00Z,100,Flood
Guatemala,2012,,2012-01-01T00:00:00Z,33000,Volcanic eruption
Guatemala,2012,,2012-01-01T00:00:00Z,31000,Earthquake
Guatemala,2013,Coatepeque earthquake,2013-06-09T00:00:00Z,80,Earthquake
Guatemala,2014,San Marcos quake (Guatemala-Mexico border earthquake),2014-07-07T00:00:00Z,9900,Earthquake
Guatemala,2014,"Flooding caused by torrential rains in Escuintla (worst hit), Chimaltenango, San Marcos, Baja Verapaz, Jutiapa, Huehuetenango and Guatemala departments",2014-09-27T00:00:00Z,480,Flood
Guatemala,2015,Livingston and El Estor floods,2015-08-01T00:00:00Z,1100,Flood
Guatemala,2015,El Cambray II landslide,2015-10-02T00:00:00Z,500,Wet Mass Movement
Guatemala,2015,Chinautla land slide,2015-07-11T00:00:00Z,350,Flood
Guatemala,2015,Floods in Petén and Alta Verapaz,2015-11-15T00:00:00Z,190,Flood
Guatemala,2015,"Floods in Escuintla, Retalhuleu and Suchitepe?quez",2015-10-25T00:00:00Z,620,Flood
Guatemala,2015,Botoncillo and Bola de Monte storm surge,2015-05-02T00:00:00Z,100,Flood
Guatemala,2016,Zacapa Landslide,2016-08-15T00:00:00Z,95,Dry mass movement
Guatemala,2016,Guatemala Rain Season (August-October),2016-07-31T00:00:00Z,810,Flood
Guatemala,2016,Hurricane Earl,2016-08-02T00:00:00Z,710,Storm
Guatemala,2016,Guatemala City Rain (July),2016-07-08T00:00:00Z,90,Flood
Guatemala,2016,Guatemala City Rain (April),2016-04-26T00:00:00Z,5,Flood
Guatemala,2017,Guatemala:  Rainy season- Floods - Country wide - April 2017,2017-04-20T00:00:00Z,40000,Flood
Guatemala,2017,Guatemala: Cold front - 15 departments - October 2017,2017-11-02T00:00:00Z,3200,Extreme temperature
Guatemala,2017,Guatemala: earthquake - San Marcos; Quetzaltenango; Retalhuleu  - 14/06/2017,2017-06-14T00:00:00Z,36,Earthquake
Guatemala,2017,Guatemala Caribbean coast floods,2017-01-07T00:00:00Z,400,Flood
Guatemala,2017,Guatemala: Peten and Huehutenango floods - 19/06/2017,2017-06-19T00:00:00Z,1100,Flood
Guatemala,2017,Guatemala: Flood- 4 departments - 24/10/2017 ,2017-10-24T00:00:00Z,220,Flood
Guatemala,2017,México; Guatemala: Earthquake (Chiapas earthquake) - 07/09/2017,2017-09-07T00:00:00Z,280,Earthquake
Guatemala,2018,Guatemala: flood - 6 departments - 01/01/2018,2018-01-01T00:00:00Z,260,Flood
Guatemala,2018,Guatemala: Volcanic Eruption - 18/11/2018,2018-11-18T00:00:00Z,4100,Volcanic eruption
Guatemala,2018,Guatemala: Cold wave - 11 Departments - 26/12/2018,2018-12-26T00:00:00Z,4100,Extreme temperature
Guatemala,2018,"Guatemala: Volcanic Eruption - Guatemala, Chimaltenango, Sacatepéquez, Escuintla  - 3/6/2018",2018-06-03T00:00:00Z,13000,Volcanic eruption
Guatemala,2018,Guatemala: flood - 4 departmens - 26/01/2018,2018-01-26T00:00:00Z,160,Flood
Guatemala,2018,"Guatemala, Honduras, Nicaragua, Costa Rica, El Salvador: Floods - 05/10/2018",2018-10-05T00:00:00Z,2000,Flood
Guatemala,2018,Guatemala: Volcanic Eruption - Chimaltenango - 12/10/2018,2018-10-12T00:00:00Z,62,Volcanic eruption
Guatemala,2018,Guatemala: Rainy season - countrywide - May,2018-05-01T00:00:00Z,3300,Flood
Guatemala,2019,Guatemala: Rainy Season - Nationwide - 22/05/2019,2019-05-22T00:00:00Z,5000,Flood
Guatemala,2019,Guatemala: Cold wave - Nationwide - 12/11/2019,2019-11-12T00:00:00Z,3500,Extreme temperature
Guatemala,2019,Guatemala: Cold wave - Guatemala - 01/01/2019,2019-01-01T00:00:00Z,12000,Extreme temperature
Guatemala,2019,"Guatemala: Lahar - Volcan de Fuego - Escuintla, Siquinalá - 04/06/2019",2019-06-04T00:00:00Z,370,Volcanic eruption
Guatemala,2020,12 COUNTRIES: Hurricane Eta - 31/10/2020,2020-10-31T00:00:00Z,184000,Storm
Guatemala,2020,"El Salvador, Guatemala, Mexico: Tropical Storm Amanda - 31/05/2020",2020-05-31T00:00:00Z,910,Storm
Guatemala,2020,"COL, NIC, HON, SLV, GUA, BLZ: Hurricane Iota - 14/11/2020 ",2020-11-14T00:00:00Z,126000,Storm
Guatemala,2020,Guatemala: Rainy season (floods and landslides) - Countrywide - 01/05/2020,2020-05-01T00:00:00Z,10000,Wet Mass Movement
Guatemala,2020,Guatemala: Cold season - countrywide - 27/11/2020,2020-11-27T00:00:00Z,1500,Extreme temperature
Guatemala,2020,Guatemala: Floods - Alta Verapaz and Izabal - 17/01/2020,2020-01-17T00:00:00Z,3600,Flood
Guatemala,2020,Guatemala: Cold season - countrywide - 01/01/2020,2020-01-01T00:00:00Z,12000,Extreme temperature
Guatemala,2021,Guatemala: Earthquake - Countrywide - 2021,2021-01-01T00:00:00Z,210,Earthquake
Guatemala,2021,"Guatemala: Wet mass movement, Landslide - Countrywide - 2021",2021-01-01T00:00:00Z,1200,Wet Mass Movement
Guatemala,2021,Guatemala: Storm - Countrywide - 2021,2021-01-01T00:00:00Z,2100,Storm
Guatemala,2021,Guatemala: Cold Wave - Countrywide - 2021,2021-01-01T00:00:00Z,84,Extreme temperature
Guatemala,2021,Guatemala: Flood - Countrywide - 2021,2021-01-01T00:00:00Z,12000,Flood
French Guiana,2020,French Guiana: Floods - Saint-Laurent du Maroni (Camopi-Trois Sauts) - 02/05/2020,2020-05-02T00:00:00Z,140,Flood
Guam,2018,"China, Guam, Northern Mariana Islands, Philippines, Thailand: Typhoon Mangkhut - 7/9/2018",2018-09-07T00:00:00Z,2100,Storm
Guam,2018,"Guam, Northern Mariana Islands, Philippines: Super Typhoon Yutu - 24/10/2018",2018-10-24T00:00:00Z,290,Storm
Guam,2019,Guam; Northern Mariana Islands: Typhoon Wutip - 21/2/2019,2019-02-21T00:00:00Z,430,Storm
Guam,2019,Guam (USA); Philippines: Typhoon Kammuri (locally named TISOY) - 26/11/2019,2019-11-24T00:00:00Z,19,Storm
Guyana,2017,Guyana: Storm-Region 7 (08/18/2017),2017-08-18T00:00:00Z,15,Storm
Guyana,2017,Guyana: River flooding (several)- Region 7 and 8 (18/05/2017),2017-05-18T00:00:00Z,180,Flood
Guyana,2018,Guyana: overtopping of sea wall- West Demerara (01/03/2018),2018-03-01T00:00:00Z,45,Storm
Guyana,2018,Guyana: Floods - Nine -05/07/2018,2018-03-23T00:00:00Z,65,Flood
Guyana,2018,Guyana: Flodds Rupununi - 26/07/2018,2018-07-26T00:00:00Z,58,Flood
Guyana,2021,Guyana; Suriname: Floods - Countrywide - 01/05/2021,2021-05-01T00:00:00Z,220,Flood
"Hong Kong, China",2016,Typhoon Nida,2016-07-29T00:00:00Z,220,Storm
"Hong Kong, China",2017,China; Vietnam: Typhoon Hato - 19/08/2017,2017-08-19T00:00:00Z,3000,Storm
"Hong Kong, China",2017,Hong Kong floods (17-19 July),2017-07-17T00:00:00Z,90,Flood
"Hong Kong, China",2017,Hong-Kong/Taiwan/China; Philippines - Typhoon Khanun (Odette) - 11/10/2017,2017-10-11T00:00:00Z,200,Storm
"Hong Kong, China",2018,"China, Guam, Northern Mariana Islands, Philippines, Thailand: Typhoon Mangkhut - 7/9/2018",2018-09-07T00:00:00Z,1400,Storm
"Hong Kong, China",2019,Hong Kong; VietNam: Tropical Cyclone WIPHA - 31/7/2019,2019-07-31T00:00:00Z,210,Storm
"Hong Kong, China",2020,"China, Macao, Hong Kong, Thailand, Viet Nam: Tropical Storm Higos (Helen) - 16/08/2020",2020-08-16T00:00:00Z,50,Storm
"Hong Kong, China",2020,"China, Hong Kong, Thailand, Viet Nam: Tropical Storm Nangka (Storm 7) - 13/10/2020",2020-10-11T00:00:00Z,110,Storm
"Hong Kong, China",2021,"China, Hong Kong, Macau, Philippines, Taiwan, Viet Nam: Tropical Cyclone Kompasu (locally known as Maring) - Fujian (CHN), countrywide (HKG), countrywide (MAC), 7 Regions (PHL), Yilan and Hualien (TWN), Yen Bai (VNM) - 10/10/2021",2021-10-10T00:00:00Z,260,Storm
"Hong Kong, China",2021,"Hong Kong, Macau, Philippines: Tropical Cyclone Lionrock (locally known as Lannie) - countrywide - 04/10/2021",2021-10-04T00:00:00Z,140,Storm
Honduras,2008,FL-2008-000198-HON,2008-10-19T00:00:00Z,70000,Flood
Honduras,2008,,2008-12-12T00:00:00Z,250,Flood
Honduras,2009,2009-000108,2009-01-01T00:00:00Z,2300,Earthquake
Honduras,2010,Hurricane Agatha,2010-01-01T00:00:00Z,8000,Storm
Honduras,2011,FL-2011-000127-HND,2011-01-01T00:00:00Z,12000,Flood
Honduras,2014,Cyclone Hanna causing floods,2014-01-01T00:00:00Z,2500,Flood
Honduras,2015,Floods in Siguatepeque and Tegucigalpa,2015-06-02T00:00:00Z,120,Flood
Honduras,2015,Floods in Comayagua and Siguatepeque,2015-10-17T00:00:00Z,1200,Flood
Honduras,2015,"Overflow of the Lean, Lancetilla and San Alejo rivers",2015-12-05T00:00:00Z,700,Flood
Honduras,2016,Hurricane Earl,2016-08-02T00:00:00Z,11,Storm
Honduras,2016,Rio Negro riverine flood,2016-01-04T00:00:00Z,230,Flood
Honduras,2016,Central and southern regions heavy rainfall and floods,2016-08-28T00:00:00Z,25,Flood
Honduras,2016,Southern departments floods,2016-10-18T00:00:00Z,180,Flood
Honduras,2016,June Floods in Honduras,2016-06-06T00:00:00Z,73,Flood
Honduras,2016,Northwestern regions heavy rainfall and floods,2016-03-21T00:00:00Z,220,Flood
Honduras,2016,Northwestern  Nicaragua earthquake-impact in Honduras,2016-06-09T00:00:00Z,160,Earthquake
Honduras,2018,Honduras: rainy season - 6 departments - May 2018,2018-05-20T00:00:00Z,160,Flood
Honduras,2018,"Guatemala, Honduras, Nicaragua, Costa Rica, El Salvador: Floods - 05/10/2018",2018-10-05T00:00:00Z,17000,Flood
Honduras,2018,Honduras: Flood - 14/11/2018,2018-11-14T00:00:00Z,150,Flood
Honduras,2018,Honduras: Floods - Cortes - 11/09/2018,2018-09-11T00:00:00Z,30,Flood
Honduras,2018,Honduras: Flood - 11/12/2018,2018-12-11T00:00:00Z,110,Flood
Honduras,2018,Honduras: dry mass movement - Comayagua - July,2018-12-01T00:00:00Z,390,Dry mass movement
Honduras,2019,Honduras: Floods - Copan (La Trinidad) - 07/10/2019,2019-10-07T00:00:00Z,300,Flood
Honduras,2019,Honduras: Wildifire - El Hatillo - 21/03/2019,2019-03-19T00:00:00Z,86,Wildfire
Honduras,2020,Honduras: Wildfire - Tegucigalpa (El Hatillo) - 19/03/2020,2020-03-19T00:00:00Z,86,Wildfire
Honduras,2020,"El Salvador, Guatemala, Mexico: Tropical Storm Amanda - 31/05/2020",2020-05-31T00:00:00Z,60,Storm
Honduras,2020,Honduras: Floods Frente Frio I - La Ceiba - 01/12/2020,2020-12-01T00:00:00Z,9,Flood
Honduras,2020,Honduras: Floods - Copán (Santa Rosa de Copán) - 22/09/2020,2020-09-15T00:00:00Z,99,Flood
Honduras,2020,"COL, NIC, HON, SLV, GUA, BLZ: Hurricane Iota - 14/11/2020 ",2020-11-14T00:00:00Z,743000,Storm
Honduras,2020,Honduras: Floods Frente Frio II - Atlantida (La Ceiba) - 01/12/2020,2020-12-06T00:00:00Z,34,Flood
Honduras,2020,Honduras: Floods - Cortés (Potrerillos) - 17/09/2020,2020-09-17T00:00:00Z,190,Flood
Honduras,2020,12 COUNTRIES: Hurricane Eta - 31/10/2020,2020-10-31T00:00:00Z,175000,Storm
Honduras,2020,Honduras: Floods - Atlantida (Jutiapa) - 29/02/2020,2020-02-29T00:00:00Z,2,Flood
Honduras,2020,Honduras: Cold Front - Caribbean coast - 01/12/2020,2020-12-01T00:00:00Z,18000,Storm
Honduras,2020,Honduras: Floods - Atlantida (Masica) - 02/03/2020,2020-03-02T00:00:00Z,800,Flood
Honduras,2021,Honduras: Floods - Cortés (Puerto Cortés) - 13/11/2021,2021-11-13T00:00:00Z,47,Flood
Honduras,2021,Honduras: Flood - Cortés (Omoa) - 08/11/2021,2021-11-13T00:00:00Z,220,Flood
Croatia,2014,Balkan floods,2014-05-14T00:00:00Z,18000,Flood
Croatia,2015,Peljesac peninsula fire,2015-07-20T00:00:00Z,50,Wildfire
Croatia,2015,Karlovac flood,2015-10-15T00:00:00Z,960,Flood
Croatia,2017,Croatia: Adriatic coast wildfires - Srinjine; rnovnica; Podstrana; Stroanac; Hvar; Brac; Zadar - 03/08/2017,2017-08-03T00:00:00Z,33,Wildfire
Croatia,2017,Croatia: Forest fire - the Adriatic coast - June 2017,2017-06-20T00:00:00Z,200,Wildfire
Croatia,2018,Croatia: Flooding of the Drava in Dubrava Kriovljanska - 31/10/2018,2018-10-31T00:00:00Z,20,Flood
Croatia,2018,Croatia: Lika river flood - Kosinj valley - 18/03/2018,2018-03-18T00:00:00Z,56,Flood
Croatia,2018,Croatia: Forest Fire - Mokalo  (Southern Peljesac peninsula) - 25/09/2018,2018-09-25T00:00:00Z,40,Wildfire
Croatia,2018,Croatia: Landslide - Hrvatska Kostajnica; Sisak-Moslavina - 13/03/2018,2018-03-13T00:00:00Z,23,Wet Mass Movement
Croatia,2020,Croatia: Earthquake - Sisak Moslavina (Petrinja)  - 29/12/2020,2020-12-29T00:00:00Z,40000,Earthquake
Croatia,2020,Croatia: Earthquake - Zagreb and Krapina - 22/03/2020,2020-03-22T00:00:00Z,1600,Earthquake
Haiti,2008,,2008-02-09T00:00:00Z,20,Storm
Haiti,2008,,2008-06-09T00:00:00Z,111000,Storm
Haiti,2008,TC-2008-000143-HTI,2008-08-26T00:00:00Z,11000,Storm
Haiti,2008,,2008-08-18T00:00:00Z,17000,Storm
Haiti,2009,,2009-01-01T00:00:00Z,9900,Flood
Haiti,2010,,2010-01-01T00:00:00Z,73000,Storm
Haiti,2010,2010-000009,2010-01-01T00:00:00Z,1500000,Earthquake
Haiti,2011,Hurricane Irene,2011-01-01T00:00:00Z,500,Storm
Haiti,2012,,2012-01-01T00:00:00Z,1500,Flood
Haiti,2012,,2012-01-01T00:00:00Z,32000,Storm
Haiti,2012,,2012-01-01T00:00:00Z,45000,Storm
Haiti,2012,,2012-01-01T00:00:00Z,7600,Flood
Haiti,2013,"Hinche, Maïssade, Port-de-Paix, Saint-Louis du Nord and Grande Saline floods",2013-06-14T00:00:00Z,870,Flood
Haiti,2013,,2013-07-27T00:00:00Z,230,Storm
Haiti,2014,Floods in the North-east,2014-10-31T00:00:00Z,6500,Flood
Haiti,2015,West Department flash flood,2015-04-04T00:00:00Z,1500,Flood
Haiti,2016,Hurricane Matthew,2016-09-28T00:00:00Z,176000,Storm
Haiti,2016,"Floods in the Centre, Ouest, and Nippes departments",2016-04-12T00:00:00Z,170,Flood
Haiti,2016,"Floods in Nord-Ouest, Artibonite, Sud, Nippes, Centre and GrandAnse departments",2016-10-18T00:00:00Z,3400,Flood
Haiti,2016,Saint-Michel de lAttalaye tornado,2016-09-23T00:00:00Z,290,Storm
Haiti,2016,Port-au-Prince floods and mud streams,2016-07-18T00:00:00Z,8,Flood
Haiti,2016,Floods in Nord and Grand'Anse departments,2016-02-09T00:00:00Z,840,Flood
Haiti,2017,Haiti: Flash floods- 5 departments (16/05/2017),2017-05-16T00:00:00Z,340,Flood
Haiti,2017,15 countries - Hurricane Irma - 27/08/2017,2017-08-27T00:00:00Z,13000,Storm
Haiti,2017,"Haiti: Flash floods- Sud, Sud-est, Grand-Anse, Nippes (20/04/2017)",2017-04-20T00:00:00Z,1700,Flood
Haiti,2018,Haiti: Landslides- Port au Prince- 03/05/2018,2018-05-03T00:00:00Z,25,Flood
Haiti,2018,"Haiti: Flooding- Nippes, North, North-East, North-West- 03/01/2018",2018-01-03T00:00:00Z,210,Flood
Haiti,2018,Haiti: Earthquake - Port-de-Paix - 06/10/2018,2018-10-06T00:00:00Z,8600,Earthquake
Haiti,2019,Haiti: Windstorm - Grande Anse - 16/08/2019 ,2019-08-16T00:00:00Z,890,Storm
Haiti,2019,Haiti: Rainstorm - 03/06/2019 ,2019-06-03T00:00:00Z,69,Storm
Haiti,2019,Haiti: Storm - West - 02/05/2019 ,2019-07-02T00:00:00Z,49,Storm
Haiti,2019,"Haiti: Flash floods - Ouest (Léogâne, Petit-Goâve) - 19/10/2019",2019-10-19T00:00:00Z,20,Flood
Haiti,2019,Haiti: Flood - Ouest - 18/09/2019 ,2019-09-18T00:00:00Z,120,Flood
Haiti,2020,"Haiti, Dominican Republic, The Bahamas, Cuba, Puerto Rico, USA: Hurricane Isaias - 30/07/2020",2020-07-30T00:00:00Z,12000,Storm
Haiti,2020,"DOM, HTI, CUB, PRI, USA: Hurricane Laura - Caribbean - 21/08/2020",2020-08-21T00:00:00Z,960,Storm
Haiti,2021,"Haiti: 7.2 Earthquake - Sud, GrandAnse and Nippes departments - 14/08/2021",2021-08-14T00:00:00Z,220000,Earthquake
Haiti,2021,Haiti: Floods - North-West and Nord-East Departments - 06/04/2021,2021-04-06T00:00:00Z,560,Flood
Hungary,2013,Central European Floods,2013-06-05T00:00:00Z,1300,Flood
Hungary,2014,Cold snap in Pest,2014-12-01T00:00:00Z,6,Extreme temperature
Hungary,2014,Eastern Europe floods,2014-09-14T00:00:00Z,290,Flood
Hungary,2017,Hungary: Hailstorm - Megyaszó - 21/06/2017,2017-06-21T00:00:00Z,96,Storm
Hungary,2019,"Hungary: Storms - Pusztadobos, Nyírkarász and Nyírmada - 27/06/2019",2019-06-27T00:00:00Z,110,Storm
Hungary,2020,Hungary: Floods - Fejér - 14/06/2020,2020-06-14T00:00:00Z,14,Flood
Indonesia,2008,,2008-01-02T00:00:00Z,50000,Flood
Indonesia,2008,,2008-01-30T00:00:00Z,40000,Flood
Indonesia,2008,,2008-09-09T00:00:00Z,820,Earthquake
Indonesia,2008,,2008-02-20T00:00:00Z,3300,Earthquake
Indonesia,2008,,2008-08-07T00:00:00Z,2000,Earthquake
Indonesia,2008,,2008-11-17T00:00:00Z,10000,Earthquake
Indonesia,2008,,2008-02-01T00:00:00Z,500,Earthquake
Indonesia,2008,,2008-10-03T00:00:00Z,5100,Flood
Indonesia,2008,,2008-04-15T00:00:00Z,5000,Volcanic eruption
Indonesia,2008,,2008-11-11T00:00:00Z,2400,Flood
Indonesia,2008,,2008-04-23T00:00:00Z,34000,Flood
Indonesia,2008,,2008-10-01T00:00:00Z,32000,Flood
Indonesia,2008,,2008-06-09T00:00:00Z,17000,Flood
Indonesia,2008,,2008-11-02T00:00:00Z,3500,Flood
Indonesia,2008,,2008-05-01T00:00:00Z,16000,Wet Mass Movement
Indonesia,2009,2009-000211,2009-01-01T00:00:00Z,676000,Earthquake
Indonesia,2009,2009-000173,2009-01-01T00:00:00Z,178000,Earthquake
Indonesia,2010,,2010-01-01T00:00:00Z,130,Flood
Indonesia,2010,,2010-01-01T00:00:00Z,100,Flood
Indonesia,2010,Mount Merapi,2010-01-01T00:00:00Z,361000,Volcanic eruption
Indonesia,2010,,2010-01-01T00:00:00Z,44000,Earthquake
Indonesia,2010,,2010-01-01T00:00:00Z,4600,Earthquake
Indonesia,2011,,2011-01-01T00:00:00Z,1000,Flood
Indonesia,2011,Mount Lokon,2011-01-01T00:00:00Z,5300,Volcanic eruption
Indonesia,2011,,2011-01-01T00:00:00Z,95,Earthquake
Indonesia,2011,FL-2011-000048-IDN,2011-01-01T00:00:00Z,1000,Flood
Indonesia,2012,,2012-01-01T00:00:00Z,190,Volcanic eruption
Indonesia,2012,,2012-01-01T00:00:00Z,71000,Flood
Indonesia,2012,,2012-01-01T00:00:00Z,190,Earthquake
Indonesia,2012,,2012-01-01T00:00:00Z,2100,Storm
Indonesia,2012,,2012-01-01T00:00:00Z,130,Wet Mass Movement
Indonesia,2012,,2012-01-01T00:00:00Z,30000,Flood
Indonesia,2013,South Jakarta City flood,2013-01-01T00:00:00Z,85,Flood
Indonesia,2013,East Luwu flood,2013-07-26T00:00:00Z,30,Flood
Indonesia,2013,Mentawai Islands flood,2013-07-04T00:00:00Z,7000,Flood
Indonesia,2013,Blitar flood,2013-12-20T00:00:00Z,4500,Flood
Indonesia,2013,Kolaka flood,2013-06-18T00:00:00Z,36,Flood
Indonesia,2013,Central Tapanuli flood,2013-05-06T00:00:00Z,11000,Flood
Indonesia,2013,Mandailing Natal flood,2013-02-14T00:00:00Z,4800,Flood
Indonesia,2013,Pandeglang flood,2013-01-01T00:00:00Z,22,Flood
Indonesia,2013,Monsoon rains causing Jakarta floods,2013-01-17T00:00:00Z,83000,Storm
Indonesia,2013,Simalungun flood,2013-07-24T00:00:00Z,170,Flood
Indonesia,2013,West Kutai flood,2013-11-19T00:00:00Z,190,Flood
Indonesia,2013,Tanjung Pinang City flood,2013-04-09T00:00:00Z,120,Flood
Indonesia,2013,Rejang Lebong flood,2013-11-15T00:00:00Z,200,Flood
Indonesia,2013,Bandung flood,2013-01-01T00:00:00Z,55,Flood
Indonesia,2013,Banjar City flood,2013-07-25T00:00:00Z,240,Flood
Indonesia,2013,Minahasa flood,2013-01-27T00:00:00Z,250,Flood
Indonesia,2013,North Barito flood,2013-11-18T00:00:00Z,2000,Flood
Indonesia,2013,Parigi Moutong flood,2013-10-05T00:00:00Z,370,Flood
Indonesia,2013,Rokan Hulu flood,2013-12-08T00:00:00Z,230,Flood
Indonesia,2013,Bandung flood,2013-05-10T00:00:00Z,390,Flood
Indonesia,2013,Parigi Moutong flood,2013-05-10T00:00:00Z,650,Flood
Indonesia,2013,Pasaman flood,2013-08-31T00:00:00Z,5,Flood
Indonesia,2013,Gorontalo waterspout,2013-07-26T00:00:00Z,290,Storm
Indonesia,2013,Mandailing Natal flood,2013-04-28T00:00:00Z,810,Flood
Indonesia,2013,North Gorontalo flood,2013-02-26T00:00:00Z,980,Flood
Indonesia,2013,Banggai flood,2013-06-15T00:00:00Z,47,Flood
Indonesia,2013,Konawe flood,2013-11-07T00:00:00Z,320,Flood
Indonesia,2013,Jepara flood,2013-05-03T00:00:00Z,350,Flood
Indonesia,2013,Tasikmalaya flood,2013-07-22T00:00:00Z,1500,Flood
Indonesia,2013,Kampar flood,2013-02-18T00:00:00Z,3500,Flood
Indonesia,2013,Pontianak flood,2013-12-05T00:00:00Z,4100,Flood
Indonesia,2013,Bangkalan flood,2013-03-16T00:00:00Z,4400,Flood
Indonesia,2013,Melawi flood,2013-12-10T00:00:00Z,140,Flood
Indonesia,2013,South Mongondow Bolaang flood,2013-09-04T00:00:00Z,400,Flood
Indonesia,2013,Serang City flood,2013-12-16T00:00:00Z,2500,Flood
Indonesia,2013,Pandeglang flood,2013-06-01T00:00:00Z,2500,Flood
Indonesia,2013,Bengkalis flood,2013-11-19T00:00:00Z,15,Flood
Indonesia,2013,East Jakarta City flood,2013-08-09T00:00:00Z,400,Flood
Indonesia,2013,Mt Sinabung eruption in November,2013-11-24T00:00:00Z,18000,Volcanic eruption
Indonesia,2013,Jakarta CIty Centre flood,2013-01-16T00:00:00Z,1300,Flood
Indonesia,2013,Mt Sinabung eruption in December,2013-12-30T00:00:00Z,19000,Volcanic eruption
Indonesia,2013,Way Ella water resevoir damn break because of heavy rains,2013-07-25T00:00:00Z,4900,Flood
Indonesia,2013,Serang flood,2013-06-01T00:00:00Z,5400,Flood
Indonesia,2013,Serang City flood,2013-06-01T00:00:00Z,450,Flood
Indonesia,2013,Jombang flood,2013-04-15T00:00:00Z,130,Flood
Indonesia,2013,Central Maluku flood,2013-01-01T00:00:00Z,320,Flood
Indonesia,2013,Banjamegara earthquake,2013-04-19T00:00:00Z,5200,Earthquake
Indonesia,2013,Muaro Jambi flood,2013-02-20T00:00:00Z,1100,Flood
Indonesia,2013,Lombok earthquake,2013-06-22T00:00:00Z,7500,Earthquake
Indonesia,2013,West Sumbawa flood,2013-12-16T00:00:00Z,500,Flood
Indonesia,2013,South Jakarta CIty flood,2013-01-16T00:00:00Z,2600,Flood
Indonesia,2013,Pandeglang flood,2013-06-01T00:00:00Z,47000,Flood
Indonesia,2013,Demak flood,2013-04-20T00:00:00Z,15000,Flood
Indonesia,2013,Sekadau flood,2013-09-01T00:00:00Z,12,Flood
Indonesia,2013,Tebing Tinggi floods,2013-12-30T00:00:00Z,18000,Flood
Indonesia,2013,Muka Payung landslide,2013-03-25T00:00:00Z,120,Wet Mass Movement
Indonesia,2013,Parigi Moutong flood,2013-04-12T00:00:00Z,780,Flood
Indonesia,2013,Sukoharjo flood,2013-01-05T00:00:00Z,1300,Flood
Indonesia,2013,Tanah Bumbu flood,2013-01-01T00:00:00Z,590,Flood
Indonesia,2013,"Bojonegoro, Tuban, Gresik and Mojokerto floods",2013-12-14T00:00:00Z,20000,Flood
Indonesia,2013,Aceh Besar flood,2013-01-01T00:00:00Z,600,Flood
Indonesia,2013,Sawahlunto / Sijunjung flood,2013-05-03T00:00:00Z,750,Flood
Indonesia,2013,Padang Cty flood,2013-01-01T00:00:00Z,300,Flood
Indonesia,2013,South Lampung flood,2013-01-01T00:00:00Z,160,Flood
Indonesia,2013,Central Maluku flood,2013-07-25T00:00:00Z,5200,Flood
Indonesia,2013,Nabire flood,2013-07-28T00:00:00Z,3700,Flood
Indonesia,2013,Mt Rokatenga volcanic eruption,2013-02-03T00:00:00Z,2000,Volcanic eruption
Indonesia,2013,Mt Sinabung eruption in September,2013-09-15T00:00:00Z,6300,Volcanic eruption
Indonesia,2013,Goayo Lues flood,2013-02-05T00:00:00Z,9,Flood
Indonesia,2013,Central Aceh earthquake,2013-07-02T00:00:00Z,53000,Earthquake
Indonesia,2013,Rokan Hulu flood,2013-02-21T00:00:00Z,7000,Flood
Indonesia,2013,Konawe flood,2013-07-15T00:00:00Z,100,Flood
Indonesia,2013,Aceh Jaya flood,2013-05-04T00:00:00Z,14000,Flood
Indonesia,2013,Bojonegoro January flood,2013-02-17T00:00:00Z,2700,Flood
Indonesia,2013,Bogor district flash flood,2013-07-13T00:00:00Z,90,Flood
Indonesia,2013,Gunung Kidul flood,2013-01-01T00:00:00Z,88,Flood
Indonesia,2013,Gorontalo City flood,2013-01-01T00:00:00Z,2800,Flood
Indonesia,2013,Manokwari flood,2013-01-05T00:00:00Z,85,Flood
Indonesia,2013,Tasikmalaya flood,2013-07-24T00:00:00Z,3100,Flood
Indonesia,2013,Kampar flood,2013-12-05T00:00:00Z,85,Flood
Indonesia,2013,Wonogiri flood,2013-02-20T00:00:00Z,83,Flood
Indonesia,2013,Sumenep flood,2013-03-02T00:00:00Z,800,Flood
Indonesia,2013,Landak flood,2013-12-03T00:00:00Z,20,Flood
Indonesia,2013,Nagan Raya flood,2013-08-30T00:00:00Z,10,Flood
Indonesia,2013,Lebak flood,2013-06-01T00:00:00Z,5800,Flood
Indonesia,2013,Gorontalo flood,2013-03-04T00:00:00Z,530,Flood
Indonesia,2013,Sigi flood,2013-10-01T00:00:00Z,430,Flood
Indonesia,2013,North Konawe flood,2013-07-16T00:00:00Z,8000,Flood
Indonesia,2013,Asahan flood,2013-02-21T00:00:00Z,3600,Flood
Indonesia,2014,Balikpapan City landslide,2014-12-22T00:00:00Z,15,Wet Mass Movement
Indonesia,2014,Mt.Sangeang Api eruption,2014-05-30T00:00:00Z,7500,Volcanic eruption
Indonesia,2014,Mt Sinabung eruption (June),2014-06-29T00:00:00Z,17000,Volcanic eruption
Indonesia,2014,Temanggung district landslide (June),2014-06-26T00:00:00Z,4,Dry mass movement
Indonesia,2014,Temanggung district landslide (Mar),2014-03-07T00:00:00Z,4,Dry mass movement
Indonesia,2014,Mt Sinabung eruption (Feb),2014-02-01T00:00:00Z,32000,Volcanic eruption
Indonesia,2014,Mt Sinabung eruption (Jan),2014-01-01T00:00:00Z,33000,Volcanic eruption
Indonesia,2014,Cianjur district landslide,2014-02-19T00:00:00Z,1000,Dry mass movement
Indonesia,2014,Tasikmalaya landslide,2014-07-12T00:00:00Z,96,Dry mass movement
Indonesia,2014,Mt. Kelud eruption,2014-02-13T00:00:00Z,88000,Volcanic eruption
Indonesia,2014,Cianjur district landslide (Aug),2014-08-18T00:00:00Z,30,Dry mass movement
Indonesia,2014,North Maluku province earthquake,2014-11-21T00:00:00Z,200,Earthquake
Indonesia,2014,Cianjur district landslide (July),2014-07-23T00:00:00Z,15,Dry mass movement
Indonesia,2014,Bueleng district flood,2014-01-23T00:00:00Z,62,Flood
Indonesia,2014,Flooding in Palu City and Parigi Moutong district,2014-01-17T00:00:00Z,250,Flood
Indonesia,2014,Cilacap flood,2014-04-16T00:00:00Z,240,Flood
Indonesia,2014,Sidoarjo flood,2014-06-17T00:00:00Z,3900,Flood
Indonesia,2014,Flooding in North Sumatera province,2014-12-18T00:00:00Z,4400,Flood
Indonesia,2014,West Java province flood (Mar),2014-03-02T00:00:00Z,1200,Flood
Indonesia,2014,"Flooding causing landslides in Cianjur, Garut, and Bogor districts (West Java)",2014-12-22T00:00:00Z,1200,Flood
Indonesia,2014,Tanah Bumbu district gale,2014-02-20T00:00:00Z,2,Storm
Indonesia,2014,Purworejo district gale,2014-11-26T00:00:00Z,2,Storm
Indonesia,2014,Bone Bolango flood,2014-08-15T00:00:00Z,1200,Flood
Indonesia,2014,Flooding in Maluku province,2014-01-09T00:00:00Z,1400,Flood
Indonesia,2014,Bener Meriah and Aceh Besar districts flood,2014-10-04T00:00:00Z,120,Flood
Indonesia,2014,Central Java floods,2014-12-19T00:00:00Z,22000,Flood
Indonesia,2014,Bolaang Mongondow district flood,2014-03-16T00:00:00Z,1500,Flood
Indonesia,2014,East Java floods,2014-12-16T00:00:00Z,1600,Flood
Indonesia,2014,Barito river overflown,2014-12-27T00:00:00Z,15000,Flood
Indonesia,2014,Tangerang City flood (Feb),2014-01-29T00:00:00Z,2000,Flood
Indonesia,2014,Banteng flood,2014-01-16T00:00:00Z,2000,Flood
Indonesia,2014,Banjarnegara and other landslides,2014-12-02T00:00:00Z,2200,Wet Mass Movement
Indonesia,2014,East Java floods (late Dec),2014-12-27T00:00:00Z,2300,Flood
Indonesia,2014,Flooding in Tapanuli Tengah district,2014-01-06T00:00:00Z,2100,Flood
Indonesia,2014,Aceh Tenggara district flood,2014-04-14T00:00:00Z,2500,Flood
Indonesia,2014,Muko Muko district flood,2014-11-13T00:00:00Z,2600,Flood
Indonesia,2014,Floods in South Sumatera,2014-01-07T00:00:00Z,1400,Flood
Indonesia,2014,Pemalang flood,2014-02-01T00:00:00Z,3000,Flood
Indonesia,2014,Flooding in Lampung province,2014-01-06T00:00:00Z,9000,Flood
Indonesia,2014,Pamekasan and Pasuruan flood,2014-04-22T00:00:00Z,3500,Flood
Indonesia,2014,"Jakarta City (East, South, West) flood (Feb)",2014-02-23T00:00:00Z,7800,Flood
Indonesia,2014,Jambi province flood,2014-12-26T00:00:00Z,1000,Flood
Indonesia,2014,Seasonal flooding and landslides in East Java,2014-01-07T00:00:00Z,6800,Flood
Indonesia,2014,Tangerang City flood (Jan),2014-02-22T00:00:00Z,4600,Flood
Indonesia,2014,Flooding and landslides in Garut and Bandung districts (West Java),2014-12-18T00:00:00Z,6100,Flood
Indonesia,2014,Flooding in Asahan district,2014-10-29T00:00:00Z,6100,Flood
Indonesia,2014,South Jakarta City flood (Dec),2014-12-23T00:00:00Z,5800,Flood
Indonesia,2014,Bogor and Cianjur landslides,2014-01-28T00:00:00Z,5300,Wet Mass Movement
Indonesia,2014,Temanggung district gale,2014-12-07T00:00:00Z,12,Storm
Indonesia,2014,Lebak district landslide,2014-01-06T00:00:00Z,25,Wet Mass Movement
Indonesia,2014,Cipatat landslide,2014-01-21T00:00:00Z,130,Wet Mass Movement
Indonesia,2014,Kampar district flood,2014-11-13T00:00:00Z,130,Flood
Indonesia,2014,Rokan Hulu district flood,2014-12-19T00:00:00Z,150,Flood
Indonesia,2014,Sukabumi flood,2014-11-25T00:00:00Z,11,Flood
Indonesia,2014,Tojo Una-Una district flood,2014-08-10T00:00:00Z,160,Flood
Indonesia,2014,Melawi district flood,2014-03-03T00:00:00Z,160,Flood
Indonesia,2014,Flooding in Kepulauan Mentawai district,2014-12-23T00:00:00Z,170,Flood
Indonesia,2014,Garut flood,2014-12-09T00:00:00Z,1100,Flood
Indonesia,2014,Flooding causing landslide in Riau province,2014-12-27T00:00:00Z,170,Flood
Indonesia,2014,Strong wind in South East Tengah,2014-10-07T00:00:00Z,45,Storm
Indonesia,2014,South Konawe district flood,2014-03-22T00:00:00Z,120,Flood
Indonesia,2014,Seluma flood,2014-11-07T00:00:00Z,160,Flood
Indonesia,2014,Gale in Selayar district,2014-12-08T00:00:00Z,30,Storm
Indonesia,2014,Flood in Palembang City,2014-01-17T00:00:00Z,50,Flood
Indonesia,2014,North Lombok district flood,2014-12-27T00:00:00Z,200,Flood
Indonesia,2014,Flooding in Pidie Jaya district,2014-11-22T00:00:00Z,200,Flood
Indonesia,2014,Strong wind in Bireuen district,2014-08-27T00:00:00Z,220,Storm
Indonesia,2014,Pasaman flash flood,2014-11-13T00:00:00Z,220,Flood
Indonesia,2014,Awu river overflown,2014-05-12T00:00:00Z,200,Flood
Indonesia,2014,Storm in Deli Serdang district,2014-03-15T00:00:00Z,8,Storm
Indonesia,2014,Bogor district gale,2014-03-21T00:00:00Z,230,Storm
Indonesia,2014,Flooding causing landslides in West Java,2014-01-12T00:00:00Z,197000,Flood
Indonesia,2014,"Flooding in East Aceh, North Aceh and Aceh Tamiang districts",2014-12-17T00:00:00Z,78000,Flood
Indonesia,2014,Flooding and landslide in Kebumen district (Central Java),2014-11-23T00:00:00Z,270,Flood
Indonesia,2014,Landslide in Tapanuli Tengah district,2014-11-27T00:00:00Z,290,Wet Mass Movement
Indonesia,2014,Seasonal flooding causing landslides in Central Java,2014-01-14T00:00:00Z,166000,Flood
Indonesia,2014,Flooding in Simeulue district,2014-05-07T00:00:00Z,6,Flood
Indonesia,2014,Flooding  in Jakarta City (Jan),2014-01-12T00:00:00Z,81000,Flood
Indonesia,2014,Flooding in Lhokseumaw City,2014-08-18T00:00:00Z,380,Flood
Indonesia,2014,Flooding in Papua province,2014-12-23T00:00:00Z,20,Flood
Indonesia,2014,Kebumen district flood,2014-11-25T00:00:00Z,400,Flood
Indonesia,2014,East Kotawaringin district surge,2014-03-07T00:00:00Z,65,Storm
Indonesia,2014,Riau province wildfires,2014-02-22T00:00:00Z,430,Wildfire
Indonesia,2014,Kepulauan Sangihe district landslide,2014-12-18T00:00:00Z,250,Wet Mass Movement
Indonesia,2014,Wonogiri and Sukoharjo flood,2014-03-25T00:00:00Z,440,Flood
Indonesia,2014,Flooding in North Kolaka,2014-06-11T00:00:00Z,390,Flood
Indonesia,2014,Flooding in West Papua province,2014-02-15T00:00:00Z,460,Flood
Indonesia,2014,"Flooding causing landslides in Boyolali, Grobogan and Purbalingga districts (Central Java)",2014-01-06T00:00:00Z,470,Flood
Indonesia,2014,Flooding in Central Sulawesi province,2014-07-10T00:00:00Z,500,Flood
Indonesia,2014,Karawang district flood,2014-02-23T00:00:00Z,75,Flood
Indonesia,2014,Flooding in Wajo district (January),2014-06-03T00:00:00Z,520,Flood
Indonesia,2014,Flooding and landslide in Bogor district,2014-08-15T00:00:00Z,440,Flood
Indonesia,2014,Flood and landslides in Sukabumi,2014-06-26T00:00:00Z,530,Flood
Indonesia,2014,Garut and Bandung City districts gale,2014-12-16T00:00:00Z,590,Storm
Indonesia,2014,Bolaang Mongondow district flood,2014-08-16T00:00:00Z,90,Flood
Indonesia,2014,Bandung and West Bandung districts gale,2014-11-27T00:00:00Z,15,Storm
Indonesia,2014,Tanah Bumbu district flood,2014-08-09T00:00:00Z,620,Flood
Indonesia,2014,Jakarta City (East) flood (Apr),2014-03-29T00:00:00Z,650,Flood
Indonesia,2014,Flooding causing landslides in Tanah Datar and Solok City,2014-11-24T00:00:00Z,680,Flood
Indonesia,2014,Jakarta City (West) flood (July),2014-07-07T00:00:00Z,50,Flood
Indonesia,2014,Storm in Padang City,2014-04-27T00:00:00Z,13,Storm
Indonesia,2014,Flooding in Aceh province,2014-11-01T00:00:00Z,51000,Flood
Indonesia,2014,Kutai Kartanegara flood,2014-05-12T00:00:00Z,640,Flood
Indonesia,2014,Bekasi district gale,2014-11-09T00:00:00Z,13,Storm
Indonesia,2014,Flooding and landslide in Sumedang and Garut (West Java),2014-04-14T00:00:00Z,700,Flood
Indonesia,2014,East Nusa Tenggara floods,2014-12-31T00:00:00Z,720,Flood
Indonesia,2014,Flooding and landslides in North Sulawesi,2014-01-15T00:00:00Z,40000,Flood
Indonesia,2014,Flooding in East Lombok district,2014-01-20T00:00:00Z,910,Flood
Indonesia,2014,Flooding in South Sulawesi (June),2014-01-15T00:00:00Z,480,Flood
Indonesia,2014,East Kotawaringin district surge,2014-03-25T00:00:00Z,37,Storm
Indonesia,2014,Kutai Kartanegara and Nunukan districts flood,2014-01-10T00:00:00Z,930,Flood
Indonesia,2014,Temanggung district gale,2014-06-26T00:00:00Z,20,Storm
Indonesia,2014,Storm in Padang Pariaman district,2014-02-21T00:00:00Z,12,Storm
Indonesia,2014,Minahasa storm,2014-04-23T00:00:00Z,100,Storm
Indonesia,2014,Flooding in Maluku Tenggara district,2014-02-02T00:00:00Z,1000,Flood
Indonesia,2014,Garut district gale,2014-11-19T00:00:00Z,110,Storm
Indonesia,2014,Storm surge in East Nusa Tenggara province,2014-01-30T00:00:00Z,1100,Storm
Indonesia,2014,Bandung district flood (Nov),2014-11-19T00:00:00Z,96,Flood
Indonesia,2014,Cimanuk river overflown,2014-03-28T00:00:00Z,630,Flood
Indonesia,2014,Jakarta City (East) flood,2014-11-20T00:00:00Z,1100,Flood
Indonesia,2015,West Aceh floods,2015-11-24T00:00:00Z,7100,Flood
Indonesia,2015,Sumbawa flood,2015-02-20T00:00:00Z,6500,Flood
Indonesia,2015,Bandung landslide,2015-05-05T00:00:00Z,200,Wet Mass Movement
Indonesia,2015,Jawa Barat floods (Feb),2015-02-06T00:00:00Z,5800,Flood
Indonesia,2015,Luwu Utara flood,2015-04-13T00:00:00Z,210,Flood
Indonesia,2015,Kutai Barat flood,2015-04-14T00:00:00Z,210,Flood
Indonesia,2015,Jawa Barat flood (January),2015-01-21T00:00:00Z,230,Flood
Indonesia,2015,Karanganyar flood,2015-04-22T00:00:00Z,260,Flood
Indonesia,2015,Jawa Tengah landslides,2015-01-20T00:00:00Z,240,Wet Mass Movement
Indonesia,2015,Gorontalo Utara flood,2015-02-06T00:00:00Z,51,Flood
Indonesia,2015,Sumedang landslide,2015-03-15T00:00:00Z,32,Wet Mass Movement
Indonesia,2015,Aceh Tamiang flood,2015-09-27T00:00:00Z,500,Flood
Indonesia,2015,Solok landslides,2015-12-04T00:00:00Z,32,Wet Mass Movement
Indonesia,2015,Binjai City flood,2015-02-08T00:00:00Z,500,Flood
Indonesia,2015,Bolaang Mongondow gale,2015-04-14T00:00:00Z,30,Storm
Indonesia,2015,Jawa Tengah flood (January),2015-01-03T00:00:00Z,500,Flood
Indonesia,2015,Minahasa Tenggara flood,2015-05-15T00:00:00Z,1000,Flood
Indonesia,2015,Enrekang landslide,2015-06-08T00:00:00Z,30,Wet Mass Movement
Indonesia,2015,Semarang City landslide,2015-05-05T00:00:00Z,5,Wet Mass Movement
Indonesia,2015,Kota Bukittinggi floods,2015-11-27T00:00:00Z,460,Flood
Indonesia,2015,Kota Medan flood,2015-10-19T00:00:00Z,450,Flood
Indonesia,2015,East Kalimantan flood,2015-01-17T00:00:00Z,1000,Flood
Indonesia,2015,Pidie flood,2015-11-26T00:00:00Z,1300,Flood
Indonesia,2015,Bogor landslides,2015-12-01T00:00:00Z,30,Wet Mass Movement
Indonesia,2015,Karanganyar landslide,2015-03-22T00:00:00Z,250,Wet Mass Movement
Indonesia,2015,Aceh Singkil flood,2015-11-03T00:00:00Z,410,Flood
Indonesia,2015,Cilacap earthquake,2015-07-25T00:00:00Z,3,Earthquake
Indonesia,2015,Jawa Tengah landslides,2015-03-07T00:00:00Z,29,Wet Mass Movement
Indonesia,2015,West Papua underwater earthquake,2015-09-25T00:00:00Z,200,Earthquake
Indonesia,2015,Bandung flood,2015-01-25T00:00:00Z,320,Flood
Indonesia,2015,Kota Subulussalam flood and landslides,2015-12-13T00:00:00Z,27,Flood
Indonesia,2015,Donggala flood,2015-06-19T00:00:00Z,4,Flood
Indonesia,2015,Magelang gale,2015-03-23T00:00:00Z,3,Storm
Indonesia,2015,Ambon City landslide,2015-06-20T00:00:00Z,4,Wet Mass Movement
Indonesia,2015,Temanggung gale,2015-03-04T00:00:00Z,4,Storm
Indonesia,2015,Sukabumi landslide,2015-01-30T00:00:00Z,4,Wet Mass Movement
Indonesia,2015,Kalimantan floods,2015-01-18T00:00:00Z,1300,Flood
Indonesia,2015,Singkawang City flood (January),2015-01-21T00:00:00Z,360,Flood
Indonesia,2015,Pemerintah Aceh floods,2015-10-20T00:00:00Z,1900,Flood
Indonesia,2015,Cianjur flood,2015-09-27T00:00:00Z,790,Storm
Indonesia,2015,Cianjur landslide,2015-01-28T00:00:00Z,360,Wet Mass Movement
Indonesia,2015,Cilacap gale,2015-11-14T00:00:00Z,5,Storm
Indonesia,2015,Poso flood,2015-05-01T00:00:00Z,380,Flood
Indonesia,2015,Mt Gamalama eruption,2015-07-16T00:00:00Z,1800,Volcanic eruption
Indonesia,2015,Bulungan flood,2015-02-09T00:00:00Z,2200,Flood
Indonesia,2015,Mt Karangetang eruption,2015-05-07T00:00:00Z,2000,Volcanic eruption
Indonesia,2015,Samarinda City landslide,2015-02-07T00:00:00Z,5,Wet Mass Movement
Indonesia,2015,Alor earthquake,2015-04-11T00:00:00Z,5400,Earthquake
Indonesia,2015,Bandung flood,2015-12-17T00:00:00Z,53,Flood
Indonesia,2015,North Maluku earthquake,2015-11-16T00:00:00Z,12000,Earthquake
Indonesia,2015,Mt Sinabung eruption,2015-06-02T00:00:00Z,13000,Volcanic eruption
Indonesia,2015,Wajo flood,2015-06-04T00:00:00Z,53,Flood
Indonesia,2015,Aceh flood,2015-07-14T00:00:00Z,2300,Flood
Indonesia,2015,Deli Serdang flood,2015-12-09T00:00:00Z,55,Flood
Indonesia,2015,Temanggung gale (Jan),2015-01-30T00:00:00Z,5,Storm
Indonesia,2015,Solok gale,2015-06-01T00:00:00Z,15,Storm
Indonesia,2015,Sambas gale,2015-08-25T00:00:00Z,8,Storm
Indonesia,2015,Bogor City gale,2015-06-04T00:00:00Z,8,Storm
Indonesia,2015,Balikpapan City landslide,2015-06-20T00:00:00Z,9,Wet Mass Movement
Indonesia,2015,Kuningan gale,2015-11-08T00:00:00Z,10,Storm
Indonesia,2015,Banjarnegara gale,2015-10-31T00:00:00Z,10,Storm
Indonesia,2015,Mataram city flood,2015-05-02T00:00:00Z,2500,Flood
Indonesia,2015,Sukabumi gale,2015-05-03T00:00:00Z,10,Storm
Indonesia,2015,Penajam Paser Utara flood,2015-04-21T00:00:00Z,10,Flood
Indonesia,2015,Kolaka flood,2015-05-05T00:00:00Z,65,Flood
Indonesia,2015,Wonogiri landslide,2015-04-06T00:00:00Z,10,Wet Mass Movement
Indonesia,2015,Nunukan flood,2015-05-16T00:00:00Z,11,Flood
Indonesia,2015,Jawa Barat gale,2015-02-15T00:00:00Z,11,Storm
Indonesia,2015,Bulukumba gale,2015-11-29T00:00:00Z,40,Storm
Indonesia,2015,Kupang flood,2015-01-24T00:00:00Z,1200,Flood
Indonesia,2015,Jawa Tengah landslides,2015-02-10T00:00:00Z,13,Wet Mass Movement
Indonesia,2015,Cilacap flood (Jan),2015-01-18T00:00:00Z,17,Flood
Indonesia,2015,Bogor landslides,2015-12-13T00:00:00Z,14,Wet Mass Movement
Indonesia,2015,Cilacap landslides and floods,2015-12-09T00:00:00Z,25,Flood
Indonesia,2015,Pemerintah Aceh gale,2015-07-12T00:00:00Z,19,Storm
Indonesia,2015,Bojonegoro flood,2015-02-07T00:00:00Z,15,Flood
Indonesia,2015,Siau Tagulandang Biaro islands flood,2015-06-18T00:00:00Z,340,Flood
Indonesia,2015,Jakarta City Utara flood,2015-01-23T00:00:00Z,550,Flood
Indonesia,2015,Jawa Tengah landslides,2015-02-08T00:00:00Z,530,Wet Mass Movement
Indonesia,2015,Bone Bolango flood,2015-06-22T00:00:00Z,520,Flood
Indonesia,2015,Gorontalo flood,2015-05-07T00:00:00Z,360,Flood
Indonesia,2015,Pangandaran flood,2015-12-21T00:00:00Z,97,Flood
Indonesia,2015,Jawa Barat gale (Jan),2015-01-23T00:00:00Z,91,Storm
Indonesia,2015,Rokan Hilir gale,2015-07-26T00:00:00Z,86,Storm
Indonesia,2015,Rote Ndao flood,2015-01-09T00:00:00Z,85,Flood
Indonesia,2015,Pasaman flood,2015-12-15T00:00:00Z,1000,Flood
Indonesia,2015,Natuna gale,2015-09-28T00:00:00Z,790,Storm
Indonesia,2015,Jawa Barat flood (Jan),2015-01-04T00:00:00Z,330,Flood
Indonesia,2015,Jawa Tengah floods,2015-03-13T00:00:00Z,320,Flood
Indonesia,2015,Enrekang landslide (Feb),2015-02-01T00:00:00Z,50,Wet Mass Movement
Indonesia,2015,Aceh Tenggara flood,2015-11-05T00:00:00Z,690,Flood
Indonesia,2015,Aceh Jaya landslide,2015-07-14T00:00:00Z,33,Wet Mass Movement
Indonesia,2015,Temanggung gale,2015-11-25T00:00:00Z,10,Storm
Indonesia,2015,Serdang Bedagai flood,2015-12-16T00:00:00Z,20,Flood
Indonesia,2015,Cilacap landslides,2015-12-12T00:00:00Z,25,Wet Mass Movement
Indonesia,2015,Klaten landslide,2015-03-01T00:00:00Z,20,Wet Mass Movement
Indonesia,2015,Tasikmalaya landslide,2015-01-12T00:00:00Z,21,Wet Mass Movement
Indonesia,2015,Bantul flood,2015-01-18T00:00:00Z,22,Flood
Indonesia,2015,Sulawesi Utara flood,2015-02-04T00:00:00Z,2500,Flood
Indonesia,2015,Jombang flood,2015-12-31T00:00:00Z,25,Flood
Indonesia,2015,Rokan flood,2015-11-25T00:00:00Z,55,Flood
Indonesia,2015,Pasuruan City flood,2015-01-30T00:00:00Z,590,Flood
Indonesia,2015,Pemerintah Aceh floods,2015-12-10T00:00:00Z,70000,Flood
Indonesia,2015,Kota Bukittinggi flood,2015-10-16T00:00:00Z,300,Flood
Indonesia,2015,Jakarta City floods,2015-02-09T00:00:00Z,15000,Flood
Indonesia,2015,Pesisir Selatan flood,2015-03-01T00:00:00Z,300,Flood
Indonesia,2015,Sulawesi Utara flood,2015-01-11T00:00:00Z,4200,Flood
Indonesia,2015,Aceh Tengah flood,2015-04-12T00:00:00Z,70,Flood
Indonesia,2015,Pulau Morotai gale,2015-06-08T00:00:00Z,71,Storm
Indonesia,2015,Kutai Kertanegara flood,2015-02-20T00:00:00Z,290,Flood
Indonesia,2015,Lombok Barat flood,2015-12-12T00:00:00Z,600,Flood
Indonesia,2015,Pasaman landslide,2015-11-03T00:00:00Z,75,Wet Mass Movement
Indonesia,2015,Kota Pematang Siantar floods and landslides,2015-12-01T00:00:00Z,77,Flood
Indonesia,2015,Sumatera Barat gale,2015-03-11T00:00:00Z,79,Storm
Indonesia,2015,Sumatera Barat floods and landslides,2015-11-29T00:00:00Z,85,Flood
Indonesia,2015,Kutai Kertanegara landslide,2015-07-31T00:00:00Z,110,Wet Mass Movement
Indonesia,2015,Pemerintah Aceh flood (May),2015-05-09T00:00:00Z,120,Flood
Indonesia,2015,Banjarnegara flood,2015-03-31T00:00:00Z,120,Flood
Indonesia,2015,Padang City flood,2015-05-14T00:00:00Z,130,Flood
Indonesia,2015,Purbalingga gale,2015-12-03T00:00:00Z,15,Storm
Indonesia,2015,Singkawang City flood,2015-06-14T00:00:00Z,140,Flood
Indonesia,2015,Kerinci flood,2015-12-03T00:00:00Z,150,Flood
Indonesia,2015,Jember landslide,2015-01-04T00:00:00Z,180,Wet Mass Movement
Indonesia,2015,Subulussalam flood,2015-01-11T00:00:00Z,4200,Flood
Indonesia,2015,Jawa Barat floods,2015-03-16T00:00:00Z,8700,Flood
Indonesia,2015,Tana Soraja landslide,2015-05-05T00:00:00Z,50,Wet Mass Movement
Indonesia,2015,Morowali flood,2015-06-08T00:00:00Z,200,Flood
Indonesia,2015,Pemerintah Aceh flood (Apr),2015-04-17T00:00:00Z,5700,Flood
Indonesia,2015,Bogor flood,2015-11-15T00:00:00Z,280,Flood
Indonesia,2015,Pesisir Selatan flood (January),2015-01-23T00:00:00Z,7800,Flood
Indonesia,2016,West Bandung and Sukabumi landslides,2016-04-01T00:00:00Z,180,Wet Mass Movement
Indonesia,2016,Peak rainy season floods and landslides,2016-01-01T00:00:00Z,948000,Flood
Indonesia,2016,Pesisir Selatan Earthquake,2016-06-02T00:00:00Z,170,Earthquake
Indonesia,2016,Ponorogo Landslide,2016-04-16T00:00:00Z,110,Dry mass movement
Indonesia,2016,Banjarnegara Landslide,2016-03-25T00:00:00Z,630,Dry mass movement
Indonesia,2016,Serang Landslides,2016-07-25T00:00:00Z,1300,Dry mass movement
Indonesia,2016,Temanggung Landslide,2016-11-08T00:00:00Z,4,Dry mass movement
Indonesia,2016,Toraja Utara Landslides,2016-10-25T00:00:00Z,170,Dry mass movement
Indonesia,2016,Central Java Floods (June),2016-06-06T00:00:00Z,2000,Flood
Indonesia,2016,Aceh province earthquake (also known as: Pidie Jaya district earthquake),2016-12-07T00:00:00Z,91000,Earthquake
Indonesia,2016,West Java Floods,2016-09-13T00:00:00Z,7900,Flood
Indonesia,2016,West Java Floods,2016-05-22T00:00:00Z,7300,Flood
Indonesia,2016,Jawa Barat Landslides (Dec),2016-12-18T00:00:00Z,320,Dry mass movement
Indonesia,2016,Cirebon Flood,2016-03-16T00:00:00Z,55,Flood
Indonesia,2016,Central Java Floods (July),2016-07-16T00:00:00Z,2700,Flood
Indonesia,2016,Tapanuli Tengah floods,2016-03-22T00:00:00Z,250,Flood
Indonesia,2016,Deli Serdang Wind storm,2016-05-07T00:00:00Z,15,Storm
Indonesia,2016,Dompu Earthquake,2016-08-01T00:00:00Z,350,Earthquake
Indonesia,2016,Aceh Barat landslide,2016-03-21T00:00:00Z,5,Dry mass movement
Indonesia,2016,Kercini Floods,2016-05-14T00:00:00Z,5,Flood
Indonesia,2016,Deli Serdang ,2016-05-15T00:00:00Z,15,Storm
Indonesia,2016,Central Java Floods (May),2016-05-16T00:00:00Z,540,Flood
Indonesia,2016,Paser Floods,2016-05-19T00:00:00Z,340,Flood
Indonesia,2016,Buru earthquake,2016-01-17T00:00:00Z,750,Earthquake
Indonesia,2016,Kota Ternate Earthquake,2016-06-08T00:00:00Z,120,Earthquake
Indonesia,2016,"Java, Sumatra, Kalimantan Floods",2016-04-01T00:00:00Z,5000,Flood
Indonesia,2016,Aceh Floods,2016-11-30T00:00:00Z,30000,Flood
Indonesia,2016,East Java Floods,2016-11-14T00:00:00Z,530,Dry mass movement
Indonesia,2016,Jawa Tengah Landslides,2016-12-02T00:00:00Z,37,Dry mass movement
Indonesia,2016,Enrekang Landslides,2016-11-22T00:00:00Z,13,Dry mass movement
Indonesia,2016,Lombok Barat Landslide,2016-10-07T00:00:00Z,210,Dry mass movement
Indonesia,2016,Kota Sorong Landslide,2016-07-09T00:00:00Z,44,Dry mass movement
Indonesia,2016,Mount Sinabung Volcanic Eruption,2016-05-21T00:00:00Z,16000,Volcanic eruption
Indonesia,2016,Aceh Singkil gale,2016-08-11T00:00:00Z,10,Storm
Indonesia,2016,Kalimantan Floods,2016-05-01T00:00:00Z,1200,Flood
Indonesia,2016,February Floods (2nd half),2016-02-15T00:00:00Z,17000,Flood
Indonesia,2016,East Java Floods,2016-09-16T00:00:00Z,5600,Flood
Indonesia,2016,March floods,2016-03-01T00:00:00Z,19000,Flood
Indonesia,2016,Aceh Floods,2016-11-07T00:00:00Z,5300,Flood
Indonesia,2016,Lake Paniai overflows,2016-10-14T00:00:00Z,3000,Flood
Indonesia,2016,Buru floods,2016-05-01T00:00:00Z,410,Flood
Indonesia,2016,Berau Forest Fire,2016-05-03T00:00:00Z,4,Wildfire
Indonesia,2016,East Java Floods,2016-06-08T00:00:00Z,390,Flood
Indonesia,2016,Langkat storm,2016-07-08T00:00:00Z,5,Storm
Indonesia,2016,Jakarta Floods,2016-09-07T00:00:00Z,20,Flood
Indonesia,2016,Jakarta Floods,2016-11-11T00:00:00Z,55,Flood
Indonesia,2016,Banyumas Storm,2016-11-04T00:00:00Z,5,Storm
Indonesia,2016,Jawa Timur Floods,2016-11-29T00:00:00Z,1100,Flood
Indonesia,2016,West Java Floods (October 1st wave),2016-10-02T00:00:00Z,2300,Flood
Indonesia,2016,"Central Java Floods (November 2nd wave)	",2016-11-26T00:00:00Z,30000,Flood
Indonesia,2016,Padang Floods,2016-03-21T00:00:00Z,210,Flood
Indonesia,2016,Strong Wind ,2016-04-01T00:00:00Z,170,Storm
Indonesia,2016,Sumatra Floods,2016-04-15T00:00:00Z,1300,Flood
Indonesia,2016,North Sumatra Storms,2016-05-15T00:00:00Z,200,Storm
Indonesia,2016,West Sumatra Floods,2016-06-02T00:00:00Z,2000,Flood
Indonesia,2016,West Java storms,2016-07-18T00:00:00Z,1600,Storm
Indonesia,2016,Jakarta Floods,2016-08-19T00:00:00Z,500,Flood
Indonesia,2016,Tasikmalaya Storm,2016-08-13T00:00:00Z,6,Storm
Indonesia,2016,Riau wildfire,2016-08-22T00:00:00Z,2000,Wildfire
Indonesia,2016,West Kalimantan Floods,2016-05-15T00:00:00Z,1100,Flood
Indonesia,2016,Pacitan Landslide,2016-08-13T00:00:00Z,20,Dry mass movement
Indonesia,2016,Sigi floods,2016-05-17T00:00:00Z,45,Flood
Indonesia,2016,Java Floods ,2016-04-15T00:00:00Z,3300,Flood
Indonesia,2016,Luwu Timur Floods,2016-05-23T00:00:00Z,15,Flood
Indonesia,2016,Pandeglang floods,2016-06-09T00:00:00Z,300,Flood
Indonesia,2016,Maluki Utara Floods,2016-06-20T00:00:00Z,210,Flood
Indonesia,2016,Indragiri Hilir Surge,2016-07-18T00:00:00Z,23,Storm
Indonesia,2016,Jakarta Floods ,2016-07-22T00:00:00Z,32,Flood
Indonesia,2016,Bandung floods,2016-07-01T00:00:00Z,5,Flood
Indonesia,2016,Kota Semarang floods,2016-07-03T00:00:00Z,15,Flood
Indonesia,2016,Sulawesi Floods ,2016-07-16T00:00:00Z,1400,Flood
Indonesia,2016,Maluku Floods ,2016-07-16T00:00:00Z,1500,Flood
Indonesia,2016,Raja Ampat Floods,2016-07-31T00:00:00Z,20,Flood
Indonesia,2016,Dogiyai Floods,2016-07-30T00:00:00Z,500,Flood
Indonesia,2016,Aceh Jaya Floods,2016-08-24T00:00:00Z,120,Flood
Indonesia,2016,Mempawah gale,2016-08-30T00:00:00Z,15,Storm
Indonesia,2016,Magelang Floods,2016-08-06T00:00:00Z,8,Flood
Indonesia,2016,Ende Floods,2016-08-03T00:00:00Z,230,Flood
Indonesia,2016,Langkat Floods,2016-09-21T00:00:00Z,680,Flood
Indonesia,2016,Deli Serdang Floods,2016-09-02T00:00:00Z,600,Flood
Indonesia,2016,Kepulauan Anambas Strong Wind,2016-09-12T00:00:00Z,23,Storm
Indonesia,2016,Jakarta Floods,2016-09-25T00:00:00Z,140,Flood
Indonesia,2016,Lombok Tengah Floods,2016-09-24T00:00:00Z,93,Flood
Indonesia,2016,Mamuju Utara Floods,2016-09-13T00:00:00Z,5,Flood
Indonesia,2016,Wajo Floods,2016-10-08T00:00:00Z,20,Flood
Indonesia,2016,Central Java Floods (November 1st wave),2016-11-16T00:00:00Z,1100,Flood
Indonesia,2016,Sulawesi floods,2016-04-15T00:00:00Z,1200,Flood
Indonesia,2016,Central Java Storms,2016-10-23T00:00:00Z,32,Storm
Indonesia,2016,Central Java Floods (September),2016-09-01T00:00:00Z,620,Flood
Indonesia,2016,Aceh Floods,2016-10-17T00:00:00Z,15000,Flood
Indonesia,2016,Central Java Storms,2016-10-03T00:00:00Z,1400,Storm
Indonesia,2016,West Java Floods (October 2nd wave),2016-10-19T00:00:00Z,2600,Flood
Indonesia,2016,Sulawesi Floods,2016-06-21T00:00:00Z,2200,Flood
Indonesia,2016,Balangan Floods,2016-12-01T00:00:00Z,7,Flood
Indonesia,2016,Magelang Strong Wind,2016-12-16T00:00:00Z,4,Storm
Indonesia,2016,Sulawesi Selatan Strong Wind and Floods,2016-12-12T00:00:00Z,23,Storm
Indonesia,2016,Jember Floods,2016-12-08T00:00:00Z,58,Flood
Indonesia,2016,Cilacap tornado,2016-12-06T00:00:00Z,5,Storm
Indonesia,2016,Sukabumi Floods,2016-12-05T00:00:00Z,340,Flood
Indonesia,2016,Serang Floods,2016-12-01T00:00:00Z,1500,Flood
Indonesia,2016,Cirebon Flood and Strong Wind,2016-12-25T00:00:00Z,31,Storm
Indonesia,2016,Sukabumi Strong Wind,2016-12-14T00:00:00Z,5,Storm
Indonesia,2017,Jawa Tengah Storms (February),2017-02-01T00:00:00Z,1300,Storm
Indonesia,2017,Kota Ambon Landslide (April),2017-04-30T00:00:00Z,9,Wet Mass Movement
Indonesia,2017,Kota Bitung Floods,2017-01-26T00:00:00Z,1400,Flood
Indonesia,2017,Cilacap tornado (9 Aug),2017-08-09T00:00:00Z,4,Storm
Indonesia,2017,Jawa Tengah floods,2017-02-15T00:00:00Z,1100,Flood
Indonesia,2017,Gorontalo Floods (April),2017-04-29T00:00:00Z,350,Flood
Indonesia,2017,"Indonesia: Tropical Depression Cempaka - East Java, Central Java - 28/11/2017",2017-11-28T00:00:00Z,28000,Storm
Indonesia,2017,Aceh Tenggara Floods (2nd wave),2017-04-11T00:00:00Z,2500,Flood
Indonesia,2017,Kota Pontianak tornado (8 July),2017-07-08T00:00:00Z,2,Storm
Indonesia,2017,Sulawesi Floods (July 1-9),2017-07-01T00:00:00Z,180,Flood
Indonesia,2017,Bogor landslides (July 28),2017-07-28T00:00:00Z,3,Dry mass movement
Indonesia,2017,Belitung floods (July 15),2017-07-15T00:00:00Z,3700,Flood
Indonesia,2017,Jawa Timur Flood (February),2017-02-03T00:00:00Z,310,Flood
Indonesia,2017,Indonesia: Earthquake - North Sumatra - 21/11/2017,2017-11-21T00:00:00Z,760,Earthquake
Indonesia,2017,Muara Pungkut Kotanopan Flash floods,2017-04-26T00:00:00Z,180,Flood
Indonesia,2017,Kalimantan Floods (May),2017-05-17T00:00:00Z,160,Flood
Indonesia,2017,Jawa Tengah Storms (June),2017-06-06T00:00:00Z,10,Storm
Indonesia,2017,Halmahera Utara Storm Surge,2017-02-13T00:00:00Z,470,Storm
Indonesia,2017,Cirebon Landslides,2017-04-22T00:00:00Z,32,Dry mass movement
Indonesia,2017,Aceh Jaya Tornado (3 Aug),2017-08-03T00:00:00Z,5,Storm
Indonesia,2017,Nusa Tenggara Barat Floods (March),2017-03-26T00:00:00Z,4500,Flood
Indonesia,2017,Lima Puluh Koto floods (24 Aug),2017-08-24T00:00:00Z,23,Flood
Indonesia,2017,Aceh Tengah floods and landslides (29 Aug),2017-08-29T00:00:00Z,35,Flood
Indonesia,2017,Jawa Tengah Landslides (Jan 17-24),2017-01-17T00:00:00Z,140,Dry mass movement
Indonesia,2017,Bogor tornado (1 July),2017-07-01T00:00:00Z,21,Storm
Indonesia,2017,Wajo floods and landslides (15 July),2017-09-01T00:00:00Z,140,Flood
Indonesia,2017,Jambi Floods,2017-01-05T00:00:00Z,140,Flood
Indonesia,2017,Balangan landslides,2017-04-10T00:00:00Z,3,Wet Mass Movement
Indonesia,2017,Mojokerto Floods,2017-03-26T00:00:00Z,84,Flood
Indonesia,2017,Cirebon Floods,2017-01-01T00:00:00Z,200,Flood
Indonesia,2017,Bandung Floods,2017-04-14T00:00:00Z,97,Flood
Indonesia,2017,Kepulauan Sangihe Floods and Landslides (17 July),2017-07-17T00:00:00Z,260,Flood
Indonesia,2017,Indonesia: Floods - East Lombok - 18/11/2017,2017-11-18T00:00:00Z,460,Flood
Indonesia,2017,Lombok Floods,2017-01-31T00:00:00Z,20,Flood
Indonesia,2017,Sulawesi Floods (June - 3rd wave),2017-06-20T00:00:00Z,3300,Flood
Indonesia,2017,Kalimantan Floods (June),2017-06-02T00:00:00Z,2000,Flood
Indonesia,2017,Minahasa Floods,2017-02-19T00:00:00Z,8200,Flood
Indonesia,2017,Kota Padang Sidempuan Floods,2017-03-26T00:00:00Z,1400,Flood
Indonesia,2017,Kepulauan Siau Tagulandang Biaro Tornado,2017-01-08T00:00:00Z,23,Storm
Indonesia,2017,Banten and Jawa Barat Convective Storm,2017-01-17T00:00:00Z,370,Storm
Indonesia,2017,Pidie and Aceh Timur floods,2017-01-01T00:00:00Z,520,Flood
Indonesia,2017,"North Kalimantan, Central Kalimantan, and North Sumatra Dry Season Floods",2017-05-22T00:00:00Z,7000,Flood
Indonesia,2017,Sulawesi Barat and Selatan Storm,2017-02-24T00:00:00Z,140,Storm
Indonesia,2017,Tegal Floods,2017-01-04T00:00:00Z,250,Flood
Indonesia,2017,Sunter Reservoir release flood,2017-04-11T00:00:00Z,170,Flood
Indonesia,2017,Jawa Barat Landslides,2017-02-10T00:00:00Z,12,Dry mass movement
Indonesia,2017,Jawa Barat Floods (2nd wave),2017-03-17T00:00:00Z,900,Flood
Indonesia,2017,Riau Floods,2017-03-01T00:00:00Z,1000,Flood
Indonesia,2017,Kota Bima Floods,2017-01-13T00:00:00Z,960,Flood
Indonesia,2017,Ponorogo Landslides,2017-04-01T00:00:00Z,760,Dry mass movement
Indonesia,2017,Jawa Tengah Tornados,2017-01-02T00:00:00Z,35,Storm
Indonesia,2017,Indonesia: Mt. Sinabung volcanic eruption - 20/5/2017,2017-05-20T00:00:00Z,7200,Volcanic eruption
Indonesia,2017,Kota Kendari Floods,2017-03-01T00:00:00Z,25,Flood
Indonesia,2017,Kulonprogo Storms,2017-01-17T00:00:00Z,190,Storm
Indonesia,2017,Sumatera Floods (1st wave),2017-05-05T00:00:00Z,270,Flood
Indonesia,2017,Poso Earthquake,2017-05-29T00:00:00Z,1100,Earthquake
Indonesia,2017,Gorontalo Floods (June),2017-06-02T00:00:00Z,200,Flood
Indonesia,2017,Sikka Floods,2017-01-07T00:00:00Z,3,Flood
Indonesia,2017,Karawang Floods,2017-06-23T00:00:00Z,67,Flood
Indonesia,2017,Jakarta and Jawa Barat floods,2017-02-19T00:00:00Z,12000,Flood
Indonesia,2017,Padang Pariaman Tornado,2017-02-07T00:00:00Z,5,Storm
Indonesia,2017,"Indonesia: Floods - Sumatra, West Java, South Kalimantan - 1-15 November 2017",2017-11-01T00:00:00Z,11000,Flood
Indonesia,2017,Halmahera Utara Floods (1st wave),2017-06-06T00:00:00Z,97,Flood
Indonesia,2017,Riau Landslide,2017-05-28T00:00:00Z,15,Dry mass movement
Indonesia,2017,Aceh Tenggara Floods (3rd wave),2017-06-11T00:00:00Z,8,Flood
Indonesia,2017,Jawa Timur Storms,2017-02-19T00:00:00Z,130,Storm
Indonesia,2017,Indonesia: Flash Flood - Flash flood - Lampung - 26/10/2017,2017-10-26T00:00:00Z,1500,Flood
Indonesia,2017,Banjar Storm,2017-02-02T00:00:00Z,240,Storm
Indonesia,2017,Bangka Tengah Tornado,2017-01-12T00:00:00Z,15,Storm
Indonesia,2017,Kota Samarinda Floods,2017-04-04T00:00:00Z,2000,Flood
Indonesia,2017,Jakarta and Banten Floods,2017-04-01T00:00:00Z,330,Flood
Indonesia,2017,Aceh Tenggara Floods (1st wave),2017-03-01T00:00:00Z,550,Flood
Indonesia,2017,Sumatera Utara Floods,2017-04-17T00:00:00Z,95,Flood
Indonesia,2017,Jawa Tengah Storms (March),2017-03-01T00:00:00Z,380,Storm
Indonesia,2017,Sumatera Floods (2nd wave),2017-05-23T00:00:00Z,530,Flood
Indonesia,2017,Kebumen Floods,2017-04-17T00:00:00Z,5,Flood
Indonesia,2017,Sijunjung Floods,2017-03-03T00:00:00Z,10,Flood
Indonesia,2017,Sulawesi Selatan Floods,2017-02-02T00:00:00Z,13,Flood
Indonesia,2017,Trenggalek Flood,2017-04-29T00:00:00Z,120,Flood
Indonesia,2017,Magelang Floods (January),2017-01-17T00:00:00Z,25,Flood
Indonesia,2017,West Java floods,2017-06-06T00:00:00Z,300,Flood
Indonesia,2017,Balangan Floods,2017-01-26T00:00:00Z,50,Flood
Indonesia,2017,Sulawesi Floods (June - 1st wave),2017-06-02T00:00:00Z,2000,Flood
Indonesia,2017,Kalimantan Selatan Floods,2017-06-18T00:00:00Z,750,Flood
Indonesia,2017,Magelang Floods (April),2017-04-29T00:00:00Z,170,Flood
Indonesia,2017,Kalimantan Timur Floods,2017-05-08T00:00:00Z,700,Flood
Indonesia,2017,Sulawesi Floods (May - 1st wave),2017-05-12T00:00:00Z,3200,Flood
Indonesia,2017,Pidie and Aceh Tenggara floods,2017-02-22T00:00:00Z,550,Flood
Indonesia,2017,Indonesia: Earthquake - West Java - 15/12/2017,2017-12-15T00:00:00Z,4200,Earthquake
Indonesia,2017,Indonesia: Floods - North Aceh - 5/12/2017,2017-12-05T00:00:00Z,15000,Flood
Indonesia,2017,Indonesia: Landslide - Cianjur - 1/10/2017,2017-10-01T00:00:00Z,1300,Dry mass movement
Indonesia,2017,Halmahera Utara Floods (2nd wave),2017-06-27T00:00:00Z,20,Flood
Indonesia,2017,Nusa Tenggara Barat Flood (February),2017-02-02T00:00:00Z,970,Flood
Indonesia,2017,Perawang Floods,2017-04-27T00:00:00Z,260,Flood
Indonesia,2017,Aceh Utara and Aceh Timur Tornadoes,2017-01-06T00:00:00Z,1200,Storm
Indonesia,2017,Gorontalo Floods (January),2017-01-19T00:00:00Z,3900,Flood
Indonesia,2017,Gorontalo and Sulawesi Utara floods (13-15 Aug),2017-08-13T00:00:00Z,470,Flood
Indonesia,2017,Sulawesi Selatan tornado (24 February),2017-02-24T00:00:00Z,5,Storm
Indonesia,2017,Sulawesi Selatan floods and landslides (7 Aug),2017-08-07T00:00:00Z,180,Flood
Indonesia,2017,Indonesia: Mount Agung Eruption - Bali - 19/9/2017,2017-09-19T00:00:00Z,150000,Volcanic eruption
Indonesia,2017,Kalimantan floods (8-12 Aug),2017-08-08T00:00:00Z,100,Flood
Indonesia,2017,Indonesia: Tornado - Sidoarjo - 23/11/2017,2017-11-22T00:00:00Z,100,Storm
Indonesia,2017,Indonesia: Earthquake - East Nusa Tenggara - 10/10/2017,2017-10-10T00:00:00Z,720,Earthquake
Indonesia,2017,Tasikmalaya earthquake (April 24),2017-04-24T00:00:00Z,17,Earthquake
Indonesia,2017,Aceh Tenggara Tornado,2017-04-17T00:00:00Z,10,Storm
Indonesia,2017,Padang Lawas Tornado,2017-06-11T00:00:00Z,100,Storm
Indonesia,2017,Jawa Tengah and Yogyakarta Floods,2017-03-17T00:00:00Z,30,Flood
Indonesia,2017,Sulawesi Selatan tornado (7 February),2017-02-07T00:00:00Z,110,Storm
Indonesia,2017,Jawa Timur Floods (January),2017-01-16T00:00:00Z,59,Flood
Indonesia,2017,Sungai Bengawan Solo and Sungai Premulung Rivers floods,2017-04-23T00:00:00Z,660,Flood
Indonesia,2017,Sulawesi Floods (June - 2nd wave),2017-06-03T00:00:00Z,2100,Flood
Indonesia,2017,Sulawesi Floods (May - 2nd wave),2017-05-28T00:00:00Z,680,Flood
Indonesia,2017,Yogyakarta tornadoes,2017-01-05T00:00:00Z,93,Storm
Indonesia,2017,Kota Ambon Landslide (May),2017-05-26T00:00:00Z,68,Dry mass movement
Indonesia,2017,Tolitoli Floods,2017-06-13T00:00:00Z,9900,Flood
Indonesia,2017,Kota Mataram Floods,2017-06-12T00:00:00Z,1700,Flood
Indonesia,2017,Jawa Tengah Storms (April),2017-04-01T00:00:00Z,30,Storm
Indonesia,2017,Indonesia: Flood - Pandeglang - 09/02/2017,2017-02-05T00:00:00Z,36000,Flood
Indonesia,2017,Java Storms,2017-05-03T00:00:00Z,4100,Storm
Indonesia,2017,Bekasi Flood,2017-02-17T00:00:00Z,2200,Flood
Indonesia,2017,Jawa Barat Floods (1st wave),2017-03-08T00:00:00Z,3700,Flood
Indonesia,2017,Kalimantan floods (15-16 July),2017-07-15T00:00:00Z,19,Flood
Indonesia,2017,Sulawesi Utara and Gorontalo Storms,2017-02-06T00:00:00Z,4900,Storm
Indonesia,2017,Jawa Timur landslides,2017-04-23T00:00:00Z,12,Wet Mass Movement
Indonesia,2017,Buleleng Flood,2017-02-11T00:00:00Z,33,Flood
Indonesia,2018,Indonesia: Strong Wind - Serang (Banten) - 6/2/2018,2018-02-06T00:00:00Z,4,Storm
Indonesia,2018,Indonesia: Strong Wind - Ogan Ilir (Sumatra Selatan) - 4/2/2018,2018-02-04T00:00:00Z,4,Storm
Indonesia,2018,Indonesia: Earthquake - Pidie (Aceh) - 8/2/2018,2018-02-08T00:00:00Z,7,Earthquake
Indonesia,2018,Indonesia: Surge - Merauke (Papua) - 31/1/2018,2018-01-31T00:00:00Z,360,Storm
Indonesia,2018,"Indonesia: Floods/Surge/Strong Winds - Boalemo (Gorontalo), Takalar, Bulukumba (Sulawesi Selantan), Banggai (Sulawesi Tengah), Parigi Moutong (Sulawesi Tenggara) - 17/1/2018",2018-01-17T00:00:00Z,37,Storm
Indonesia,2018,"Indonesia: Strong Wind - Tapin, Banjar (Kalimantan Selantan), Kapuas (Kalimantan Tengah) - 15/1/2018",2018-01-15T00:00:00Z,26,Storm
Indonesia,2018,Indonesia: Surge - Sumenep (East Java) - 30/1/2018,2018-01-30T00:00:00Z,56,Storm
Indonesia,2018,"Indonesia: Strong Wind - Pacitan, Jombang, Probolinggo, Sumenep (East Java) - 17/1/2018",2018-01-17T00:00:00Z,70,Storm
Indonesia,2018,Indonesia: Floods and Landslides - Wonogiri (Central Java) - 25/1/2018,2018-01-25T00:00:00Z,52,Flood
Indonesia,2018,Indonesia: Flash Flood - Papua - 19/10/2018,2018-10-19T00:00:00Z,11,Flood
Indonesia,2018,Indonesia: Floods - Tanggamus (Sumatra) - 7/11/2018,2018-11-07T00:00:00Z,100,Flood
Indonesia,2018,Indonesia: Floods - North Sumatra - 11/10/2018,2018-10-11T00:00:00Z,830,Flood
Indonesia,2018,Indonesia: Flood - Asahan Regency (North Sumatra) - 15/9/2018,2018-09-15T00:00:00Z,820,Flood
Indonesia,2018,Indonesia: Landslide - Pekalongan (Central Java) - 29/1/2018,2018-01-29T00:00:00Z,4,Wet Mass Movement
Indonesia,2018,Indonesia: Landslide - Bogor (West Java) - 31/1/2018,2018-01-31T00:00:00Z,4,Wet Mass Movement
Indonesia,2018,"Indonesia: Volcanic Eruption / Tsunami - Banten, Lampung (Sunda Strait) - 22/12/2018",2018-12-22T00:00:00Z,47000,Volcanic eruption
Indonesia,2018,Indonesia: Strong Wind - Serang (Banten) - 30/1/2018,2018-01-19T00:00:00Z,7,Storm
Indonesia,2018,Indonesia: Earthquake - Sarmi Regency (Papua) - 15/6/2018,2018-06-15T00:00:00Z,320,Earthquake
Indonesia,2018,Indonesia: Floods - Padang (West Sumatra) - 3/11/2018,2018-11-03T00:00:00Z,300,Flood
Indonesia,2018,Indonesia: Earthquake - Sumenep Regency (East Java) - 13/6/2018,2018-06-13T00:00:00Z,93,Earthquake
Indonesia,2018,Indonesia: Flood - Rokan Hilir Regency (Riau) - 25/10/2018,2018-10-25T00:00:00Z,2500,Flood
Indonesia,2018,Indonesia: Floods - West Sumatra - 9/10/2018,2018-10-09T00:00:00Z,26,Flood
Indonesia,2018,"Indonesia: Storm/Landslides - Yogyakarta, Central Java - 1/1/2018",2018-01-01T00:00:00Z,60,Wet Mass Movement
Indonesia,2018,Indonesia: Storm - Pasaman Regency (West Sumatra) - 1/8/2018,2018-08-01T00:00:00Z,170,Storm
Indonesia,2018,Indonesia: Landslide - Boyolali (Central Java) - 22/1/2018,2018-01-22T00:00:00Z,4,Wet Mass Movement
Indonesia,2018,Indonesia: Floods - Wajo (South Sulawesi) - 21/6/2018,2018-06-21T00:00:00Z,200,Flood
Indonesia,2018,Indonesia: Strong Winds - Wonogiri (Central Java) - 23/4/2018,2018-04-23T00:00:00Z,150,Storm
Indonesia,2018,"Indonesia: Flash Flood - Merangin Regency, Jambi Province (Central Sumatra) - 17/4/2018",2018-04-17T00:00:00Z,350,Flood
Indonesia,2018,Indonesia: Strong Winds - Tulungagung (East Java) - 18/4/2018,2018-04-18T00:00:00Z,67,Storm
Indonesia,2018,Indonesia: Strong Winds - Cilcacap (Central Java) - 18/4/2018,2018-04-18T00:00:00Z,93,Storm
Indonesia,2018,Indonesia: Earthquake - Mamasa (West Sulawesi) - 6/11/2018,2018-11-06T00:00:00Z,11000,Earthquake
Indonesia,2018,Indonesia: Floods - East Bolaang Mongodow (North Sulawesi) - 23/4/2018,2018-04-23T00:00:00Z,500,Flood
Indonesia,2018,Indonesia: Strong Winds - Sindenreng Rappang (South Sulawesi) - 20/4/2018,2018-04-20T00:00:00Z,220,Storm
Indonesia,2018,Indonesia: Floods - Pangkalpinang (Bangka Belitung) - 27/4/2018,2018-04-27T00:00:00Z,590,Flood
Indonesia,2018,Indonesia: Floods - Mandailing Natal (North Sumatra) - 7/11/2018,2018-11-07T00:00:00Z,2000,Flood
Indonesia,2018,Indonesia: Floods - Luwu Regency (South Sulawesi) - 22/6/2018,2018-06-22T00:00:00Z,81,Flood
Indonesia,2018,Indonesia: Floods - Banyuwangi Regency (East Java) - 22/6/2018,2018-06-22T00:00:00Z,150,Flood
Indonesia,2018,"Indonesia: Floods - North Kanawe, Konawe, South Konawe Regencies (Southeast Sulawesi) - 25/6/2018",2018-06-25T00:00:00Z,4,Flood
Indonesia,2018,Indonesia: Volcanic activtiy (Mount Merapi) - Java - 1/6/2018,2018-06-01T00:00:00Z,700,Volcanic eruption
Indonesia,2018,Indonesia: Strong Winds - Bangkalan Regency (East Java) - 12/4/2018,2018-04-12T00:00:00Z,36,Storm
Indonesia,2018,Indonesia: Flood - Bogor Regency (West Java) - 13/4/2018,2018-04-13T00:00:00Z,52,Flood
Indonesia,2018,Indonesia: Floods - Aceh Barat Daya Regency (Aceh) - 12/4/2018,2018-04-12T00:00:00Z,220,Flood
Indonesia,2018,Indonesia: Flash Flood - North Aceh (Aceh) - 1/10/2018,2018-10-01T00:00:00Z,170,Flood
Indonesia,2018,Indonesia: Floods/Landslides - Bogor and Cianjur Regencies (West Java) - 7/4/2018,2018-04-07T00:00:00Z,37,Flood
Indonesia,2018,Indonesia: Floods - Bonebolango (Gorontalo Province) - 29/5/2018,2018-05-29T00:00:00Z,200,Flood
Indonesia,2018,Indonesia: Flood - Kuningan (West Java) - 23/5/2018,2018-05-23T00:00:00Z,340,Storm
Indonesia,2018,Indonesia: Flood - Tegal (Central Java) - 23/5/2018,2018-05-23T00:00:00Z,160,Flood
Indonesia,2018,Indonesia: Flood - Pekalongan (Central Java) - 23/5/2018,2018-05-23T00:00:00Z,1000,Flood
Indonesia,2018,Indonesia: Flood - North Konawe Regency (Southeast Sulawesi) - 21/5/2018,2018-05-21T00:00:00Z,37,Flood
Indonesia,2018,Indonesia: Riverine Flood - Bukit Tinggi (West Sumatra) - 19/5/2018,2018-05-19T00:00:00Z,240,Flood
Indonesia,2018,Indonesia: Flood - Banyuwangi Regency (East Java) - 15/5/2018,2018-05-15T00:00:00Z,30,Flood
Indonesia,2018,Indonesia: Flood - Tapin Regency (South Kalimantan) - 2/5/2018,2018-05-02T00:00:00Z,370,Flood
Indonesia,2018,Indonesia: Volcanic activtiy (Mount Merapi) - Java - 21/5/2018,2018-05-21T00:00:00Z,660,Volcanic eruption
Indonesia,2018,Indonesia: Volcanic activtiy (Mount Merapi) - Java - 11/5/2018,2018-05-11T00:00:00Z,8900,Volcanic eruption
Indonesia,2018,Indonesia: Floods - Pulau Talibu Regency (North Maluku) - 30/5/2018,2018-05-30T00:00:00Z,120,Flood
Indonesia,2018,Indonesia: Flash Flood - Sigi (Central Sulawesi) - 16/11/2018,2018-11-16T00:00:00Z,570,Flood
Indonesia,2018,Indonesia: Landslide - Sibolga City (North Sumatra) - 26/3/2018,2018-03-26T00:00:00Z,9,Wet Mass Movement
Indonesia,2018,Indonesia: Flood - Mamuju (West Sulawesi) - 22/3/2018,2018-03-22T00:00:00Z,1000,Flood
Indonesia,2018,Indonesia: Flood - Banyuasin Regency (South Sumatra) - 15/3/2018,2018-03-15T00:00:00Z,140,Flood
Indonesia,2018,Indonesia: Flood - Bojonegoro Regency (East Java) - 13/3/2018,2018-03-13T00:00:00Z,140,Flood
Indonesia,2018,Indonesia: Flood - West Bangka and Central Bangka Regencies (Bangka Belitung Province) - 11/3/2018,2018-03-11T00:00:00Z,3100,Flood
Indonesia,2018,Indonesia: Landslide - Central Java - 8/3/2018,2018-03-08T00:00:00Z,7,Wet Mass Movement
Indonesia,2018,Indonesia: Floods - Southeast Minahasa Regency (North Sulawesi) - 31/5/2018,2018-05-31T00:00:00Z,70,Storm
Indonesia,2018,Indonesia: Flash Flood - West Kalimantan - 21/11/2018,2018-11-21T00:00:00Z,74,Flood
Indonesia,2018,Indonesia: Floods - Sidenreng Rappang (South Sulawesi) - 10/7/2018,2018-07-10T00:00:00Z,590,Flood
Indonesia,2018,Indonesia: Flood - North Aceh - 17/11/2018,2018-11-17T00:00:00Z,2100,Flood
Indonesia,2018,Indonesia: Floods - Pekanbaru (Riau) - 16/11/2018,2018-11-16T00:00:00Z,160,Flood
Indonesia,2018,Indonesia: Floods - Sidenreng Rappang (South Sulawesi) - 5/7/2018,2018-07-05T00:00:00Z,34,Flood
Indonesia,2018,Indonesia: Flood - Padang City (West Sumatra) - 26/9/2018,2018-09-26T00:00:00Z,42,Flood
Indonesia,2018,Indonesia: Storm - Medan City (North Sumatra) - 5/7/2018,2018-07-05T00:00:00Z,320,Storm
Indonesia,2018,Indonesia: Strong Wind - East Kutai Regency (East Kalimantan) - 30/8/2018,2018-08-30T00:00:00Z,310,Storm
Indonesia,2018,"Indonesia: Flood - Bandung, Cirebon (West Java) - 20/2/2018",2018-02-20T00:00:00Z,2100,Flood
Indonesia,2018,"Indonesia: Flood - Central Lampung Regency (Lampung, Sumatra) - 26/2/2018",2018-02-26T00:00:00Z,4600,Flood
Indonesia,2018,Indonesia: Flood - Seluma Regency (Bengkulu) - 29/8/2018,2018-08-29T00:00:00Z,1800,Flood
Indonesia,2018,Indonesia: Storm - Bintan Pesisir (Riau) - 29/8/2018,2018-08-29T00:00:00Z,52,Storm
Indonesia,2018,Indonesia: Flood - Tegal Regency (Central Java) - 12/2/2018,2018-02-12T00:00:00Z,1000,Flood
Indonesia,2018,Indonesia: Storm - Bengkulu City (Sumatra) - 28/8/2018,2018-08-28T00:00:00Z,40,Storm
Indonesia,2018,"Indonesia: Floods - Pati, Jepara (Central Java) - 9/2/2018",2018-02-08T00:00:00Z,320,Flood
Indonesia,2018,Indonesia: Flood - Sijunjung Regency (West Sumatra) - 6/7/2018,2018-07-06T00:00:00Z,140,Flood
Indonesia,2018,Indonesia: Flood - West Halmahera (North Maluku) - 12/2/2018,2018-02-12T00:00:00Z,200,Flood
Indonesia,2018,Indonesia: Landslide - Bogor (West Java) - 5/2/2018,2018-02-05T00:00:00Z,59,Wet Mass Movement
Indonesia,2018,Indonesia: Ciliwung River Floods - Jakarta - 5/2/2018,2018-02-05T00:00:00Z,6500,Flood
Indonesia,2018,Indonesia: Wildfire - Aceh Barat Regency (Aceh) - 7/7/2018,2018-07-07T00:00:00Z,140,Wildfire
Indonesia,2018,Indonesia: Flood - Bima (Nusa Tenggara Barat) - 15/2/2018,2018-02-15T00:00:00Z,11,Flood
Indonesia,2018,Indonesia: Strong Wind - Banyuwangi (East Java) - 19/2/2018,2018-02-19T00:00:00Z,15,Storm
Indonesia,2018,"Indonesia: Strong Wind - Blitar, Malang (East Java) - 8/2/2018",2018-02-08T00:00:00Z,10,Storm
Indonesia,2018,Indonesia: Strong Wind - Musi Rawas (Sumatra Selatan) - 27/2/2018,2018-02-27T00:00:00Z,30,Storm
Indonesia,2018,"Indonesia: Strong Wind - Ciamis, Kota Bogor, Cirebon, Karawang, Kuningan, Sumedang (West Java) - 1/2/2018",2018-02-01T00:00:00Z,74,Storm
Indonesia,2018,"Indonesia: Floods - Cirebon, Karawang, Bekasi, Kota Bekasi (West Java) - 4/2/2018",2018-02-04T00:00:00Z,2000,Flood
Indonesia,2018,"Indonesia: Landslide - Pacitan, Kota Malang (East Java) - 19/1/2018",2018-01-19T00:00:00Z,11,Wet Mass Movement
Indonesia,2018,Indonesia: Floods - Pekalongan (Central Java) - 15/1/2018,2018-01-15T00:00:00Z,76,Flood
Indonesia,2018,"Indonesia: Strong Wind - Temanggung, Jepara, Cilacap, Magelang, Kebumen, Brebes (Central Java) - 18/1/2018",2018-01-18T00:00:00Z,48,Storm
Indonesia,2018,Indonesia: Storm Surge - Tasikmalaya Regency (West Java) - 26/7/2018,2018-07-26T00:00:00Z,140,Storm
Indonesia,2018,Indonesia: Floods - Batam City (Riau) - 25/7/2018,2018-07-25T00:00:00Z,160,Flood
Indonesia,2018,"Indonesia: Strong Wind - Pandeglang, Serang (Banten) - 15/2/2018",2018-02-15T00:00:00Z,27,Storm
Indonesia,2018,Indonesia: Floods - Padang City (West Sumatra) - 25/7/2018,2018-07-25T00:00:00Z,28,Storm
Indonesia,2018,Indonesia: Floods - Kolaka (Southeast Sulawesi) - 21/7/2018,2018-07-21T00:00:00Z,7,Flood
Indonesia,2018,Indonesia: Volcano - East Java - 22/3/2018,2018-03-22T00:00:00Z,180,Volcanic eruption
Indonesia,2018,"Indonesia: Strong Wind - Cilacap, Jepara, Kota Semarang, Wonosobo (Central Java) - 15/2/2018",2018-02-15T00:00:00Z,44,Storm
Indonesia,2018,Indonesia: Strong Wind - Sumba Timur (Nusa tenggara Timur) - 15/2/2018,2018-02-15T00:00:00Z,7,Storm
Indonesia,2018,"Indonesia: Strong Wind - Barito Utara (Kalimantan Tengah), Banjar, Hulu Sungai Utara (Kalimantan Selatan) - 15/2/2018",2018-02-15T00:00:00Z,44,Storm
Indonesia,2018,"Indonesia: Strong Wind - Majene (Sulawesi Barat), Tana Toraja, Wajo (Sulawesi Selatan) - 15/2/2018",2018-02-15T00:00:00Z,48,Storm
Indonesia,2018,"Indonesia: Flood - Bima Regency, Dompu Regency (West Nusa Tenggara) - 5/3/2018",2018-03-05T00:00:00Z,4200,Flood
Indonesia,2018,Indonesia: Flood - Pangandaran Regency (West Java) - 23/2/2018,2018-02-23T00:00:00Z,94,Flood
Indonesia,2018,Indonesia: Landslide - Brebes (Central Java) - 21/2/2018,2018-02-21T00:00:00Z,980,Wet Mass Movement
Indonesia,2018,Indonesia: Floods/Landslide - Gorontalo and North Sulawesi - 7/2/2018,2018-02-07T00:00:00Z,230,Wet Mass Movement
Indonesia,2018,Indonesia: Earthquake - Banten and Java Barat Province - 23/1/2018,2018-01-23T00:00:00Z,3800,Earthquake
Indonesia,2018,Indonesia: Landslide - Banjarnegara - 7/1/2018,2018-01-07T00:00:00Z,52,Dry mass movement
Indonesia,2018,Indonesia: Floods - Serang (Banten) - 23/2/2018,2018-02-23T00:00:00Z,4,Flood
Indonesia,2018,"Indonesia: Flood - Brebes, Demak, Cilacap, Blora (Central Java) - 20/2/2018",2018-02-20T00:00:00Z,2400,Flood
Indonesia,2018,"Indonesia: Flood - Jombang, Gresik, Bojonegoro (East Java) - 22/2/2018",2018-02-22T00:00:00Z,630,Flood
Indonesia,2018,Indonesia: Strong wind - Banjarnegara Regency (Central Java) - 21/9/2018,2018-09-21T00:00:00Z,28,Storm
Indonesia,2018,Indonesia: Floods - Karawang (West Java) - 4/1/2018,2018-01-03T00:00:00Z,5400,Flood
Indonesia,2018,Indonesia: Strong wind - Wonogiri Regency (Central Java) - 21/9/2018,2018-09-21T00:00:00Z,56,Storm
Indonesia,2018,Indonesia: Strong wind - Takalar Regency (South Sulawesi) - 16/9/2018,2018-09-16T00:00:00Z,60,Storm
Indonesia,2018,Indonesia: Earthquake - Banjarnegara (Central Java) - 18/4/2018,2018-04-18T00:00:00Z,3500,Earthquake
Indonesia,2018,Indonesia: Landslide - Kuningan (West Java) - 16/2/2018,2018-02-16T00:00:00Z,4600,Wet Mass Movement
Indonesia,2018,"Indonesia: Landslide - Banyumas, Purbalingga, Banjarnegara, Batang (Central Java) - 19/2/2018",2018-02-19T00:00:00Z,540,Wet Mass Movement
Indonesia,2018,Indonesia: Landslide - Wonogiri Regency (Central Java) - 16/2/2018,2018-02-16T00:00:00Z,660,Wet Mass Movement
Indonesia,2018,Indonesia: Flood - Ogan Ilir (South Sumatra) - 10/3/2018,2018-03-10T00:00:00Z,120,Flood
Indonesia,2018,Indonesia: Earthquake - Situbondo (East Java) - 11/10/2018,2018-10-11T00:00:00Z,740,Earthquake
Indonesia,2018,Indonesia: Volcanic Eruption - Mt. Agung (Bali) - 27/6/2018,2018-06-27T00:00:00Z,2700,Volcanic eruption
Indonesia,2018,Indonesia: Strong Wind - Pangandaran (West Java) - 26/1/2018,2018-01-26T00:00:00Z,15,Storm
Indonesia,2018,Indonesia: Flood - Boven Digoel (Papua) - 3/3/2018,2018-03-03T00:00:00Z,11,Flood
Indonesia,2018,Indonesia: Flood - Pelalawan (Riau) - 1/12/2018,2018-12-01T00:00:00Z,11,Flood
Indonesia,2018,Indonesia: Landslide - Sukabumi - 31/12/2018,2018-12-31T00:00:00Z,64,Wet Mass Movement
Indonesia,2018,Indonesia: Strong wind - Landak Regency (West Kalimantan) - 17/9/2018,2018-09-17T00:00:00Z,25,Storm
Indonesia,2018,Indonesia: Floods - Matangkuli (North Aceh) - 17/10/2018,2018-10-17T00:00:00Z,250,Flood
Indonesia,2018,Indonesia: Tornado - Bogor - 6/12/2018,2018-12-06T00:00:00Z,3000,Storm
Indonesia,2018,Indonesia: Flash Flood - Banda Aceh - 30/11/2018,2018-11-30T00:00:00Z,74,Flood
Indonesia,2018,Indonesia: Flood - South Aceh (Aceh) - 14/12/2018,2018-12-14T00:00:00Z,240,Flood
Indonesia,2018,Indonesia: Flood - Sigi (Central Sulawesi) - 12/12/2018,2018-12-12T00:00:00Z,430,Flood
Indonesia,2018,Indonesia: Landslide - Toba Samosir Regency (North Sumatra) - 13/12/2018,2018-12-13T00:00:00Z,2,Wet Mass Movement
Indonesia,2018,Indonesia: Flood/Landslide - Pacitan (East Java) - 7/12/2018,2018-12-07T00:00:00Z,240,Flood
Indonesia,2018,Indonesia: Flood - Nias Regency (North Sumatra) - 4/9/2018,2018-09-04T00:00:00Z,4,Flood
Indonesia,2018,Indonesia: Earthquakes - Lombok - 29/7 - 5/8 - 19/8/2018,2018-07-29T00:00:00Z,445000,Earthquake
Indonesia,2018,Indonesia: Flood - Dumai City (Riau) - 17/10/2018,2018-10-17T00:00:00Z,300,Flood
Indonesia,2018,"Indonesia: Earthquake / Tsunami - Palu, Donggala, Sigi (Central Sulawesi) - 28/9/2018",2018-09-28T00:00:00Z,248000,Earthquake
Indonesia,2018,Indonesia: Strong Wind - Wajo (Sulawesi Selatan) - 4/1/2018,2018-01-04T00:00:00Z,74,Storm
Indonesia,2018,"Indonesia: Landslides - Toraja Utara, Luwu (Sulawesi Selatan) - 2/1/2018",2018-01-02T00:00:00Z,33,Wet Mass Movement
Indonesia,2018,Indonesia: Strong Wind - Banjar (Kalimantan Selatan) - 12/1/2018,2018-01-12T00:00:00Z,48,Storm
Indonesia,2018,Indonesia: Landslides - Sumba Timur (Nusa Tenggara Timur) - 9/1/2018,2018-01-09T00:00:00Z,65,Flood
Indonesia,2018,Indonesia: Landslides - Bima (Nusa Tenggara Barat) - 13/1/2018,2018-01-13T00:00:00Z,7,Wet Mass Movement
Indonesia,2018,Indonesia: Strong Wind - Buleleng (Bali) - 11/1/2018,2018-01-11T00:00:00Z,7,Storm
Indonesia,2018,Indonesia: Strong Wind - Banyuwangi (East Java) - 10/1/2018,2018-01-10T00:00:00Z,1700,Flood
Indonesia,2018,Indonesia: Strong Wind - Situbondo (East Java) - 10/1/2018,2018-01-10T00:00:00Z,41,Storm
Indonesia,2018,Indonesia: Landslides - Malang (East Java) - 5/1/2018,2018-01-05T00:00:00Z,7,Wet Mass Movement
Indonesia,2018,Indonesia: Floods - Ponorogo (East Java) - 02/1/2018,2018-01-02T00:00:00Z,110,Flood
Indonesia,2018,Indonesia: Storm - Cilacap (Central Java) - 11/1/2018,2018-01-11T00:00:00Z,4,Storm
Indonesia,2018,Indonesia: Landslides - Kuningan (West Java) - 8/1/2018,2018-01-08T00:00:00Z,15,Wet Mass Movement
Indonesia,2018,"Indonesia - Flood Landslide - Bandung, West Bandung - 3/1/2018",2018-01-03T00:00:00Z,220,Flood
Indonesia,2018,Indonesia: Floods - North Aceh - 1/1/2018,2018-01-01T00:00:00Z,10000,Flood
Indonesia,2018,Indonesia: Floods/Landslides - West Pasaman (West Sumatra) - 7/11/2018,2018-11-07T00:00:00Z,370,Flood
Indonesia,2018,Indonesia: Floods - Pangandaran (West Java) - 6/11/2018,2018-11-06T00:00:00Z,10,Flood
Indonesia,2018,Indonesia: Floods - Cipatujah (TASIKMALAYA) - 6/11/2018,2018-11-06T00:00:00Z,74,Flood
Indonesia,2018,Indonesia: Floods - Jayapura (Papua) - 1/2/2018,2018-02-01T00:00:00Z,93,Flood
Indonesia,2018,Indonesia: Floods/Landslides - Jayapura (Papua) - 11/2/2018,2018-02-11T00:00:00Z,550,Flood
Indonesia,2018,Indonesia: Floods - Halmahera Barat (Maluku Utara) - 9/2/2018,2018-02-09T00:00:00Z,240,Flood
Indonesia,2018,"Indonesia: Strong Wind - Takalar (Sulawesi Selatan), Majene (Sulawesi Barat), Wajo (Sulawesi Selatan) - 1/2/2018",2018-02-01T00:00:00Z,70,Storm
Indonesia,2018,"Indonesia: Strong Wind - Kapuas (Kalimantan Tengah), Hulu Sungai Selatan (East Java) - 1/2/2018",2018-02-01T00:00:00Z,7,Storm
Indonesia,2018,"Indonesia: Landslides - Malang, Banyuwangi, Batu (East Java) - 2/2/2018",2018-02-02T00:00:00Z,22,Wet Mass Movement
Indonesia,2018,"Indonesia: Floods - Probolinggo, Banyuwangi (East Java) - 2/2/2018",2018-02-02T00:00:00Z,22,Flood
Indonesia,2018,"Indonesia: Floods - Brebes, Cilacap, Kendal, Kota Semarang (Central Java) - 9/2/2018",2018-02-09T00:00:00Z,970,Flood
Indonesia,2018,"Indonesia: Landslides - Banjarnegara, Kota Semarang, Kudus, Magelang, Sragen, Tegal, Wonogiri (Central Java) - 5/2/2018",2018-02-05T00:00:00Z,100,Wet Mass Movement
Indonesia,2018,"Indonesia: Strong Wind - Cilacap, Temanggung, Demak (Central Java) - 2/2/2018",2018-02-02T00:00:00Z,89,Storm
Indonesia,2018,Indonesia: Landslide - Tasikmalaya (West Java) - 4/2/2018,2018-02-04T00:00:00Z,4,Wet Mass Movement
Indonesia,2018,Indonesia: Flash Flood - Banyuwangi (East Java) - 22/6/2018,2018-06-22T00:00:00Z,150,Flood
Indonesia,2018,Indonesia: Strong Wind - Kepulauan Seribu (DKI Jakarta) - 2/2/2018,2018-02-02T00:00:00Z,85,Storm
Indonesia,2019,Indonesia: Storm - Musi Rawas (South Sumatra) - 9/1/2019,2019-01-09T00:00:00Z,11,Storm
Indonesia,2019,Indonesia: Landslide - Kalimantan Selatan (Banjar Baru) - 23/7/2019,2019-07-23T00:00:00Z,4,Wet Mass Movement
Indonesia,2019,Indonesia: Floods - Jayapura City (Papua) - 23/2/2019,2019-02-23T00:00:00Z,4700,Flood
Indonesia,2019,"Indonesia: Flash Flood - Sentani district, Jayapura Regency (Papua) - 16/3/2019",2019-03-16T00:00:00Z,12000,Flood
Indonesia,2019,Indonesia: Storm - Banyu Asin (South Sumatra) - 18/3/2019,2019-03-18T00:00:00Z,33,Storm
Indonesia,2019,Indonesia: Flood - Tanggamus (Lampung) - 4/3/2019,2019-03-04T00:00:00Z,65,Flood
Indonesia,2019,Indonesia: Storm - Semarang (Central Java) - 1/3/2019,2019-03-01T00:00:00Z,4,Storm
Indonesia,2019,Indonesia: Storm - Sumba Timur (Nusa Tenggara Timur) - 10/3/2019,2019-03-10T00:00:00Z,60,Storm
Indonesia,2019,Indonesia: Flood - Seram Bagian Timur; Seram Bagian Barat (Maluku) - 10/3/2019,2019-03-10T00:00:00Z,61,Flood
Indonesia,2019,Indonesia: Landslide - West Bandung (West Java) - 5/3/2019,2019-03-05T00:00:00Z,15,Wet Mass Movement
Indonesia,2019,Indonesia: Landslide - Temanggung; Boyolali (Central Java) - 2/3/2019,2019-03-02T00:00:00Z,7,Wet Mass Movement
Indonesia,2019,Indonesia: Flood - Ponorogo (East Java) - 7/3/2019,2019-03-07T00:00:00Z,540,Flood
Indonesia,2019,Indonesia: Landslide - Tanah Datar (West Sumatra) - 3/3/2019,2019-03-03T00:00:00Z,4,Wet Mass Movement
Indonesia,2019,Indonesia: Flooding - West Manggarai Regency (East Nusa Tenggara) - 7/3/2019,2019-03-07T00:00:00Z,680,Flood
Indonesia,2019,Indonesia: Storm Surge - East Nusa Tenggara (Sikka) - 28/10/2019,2019-10-28T00:00:00Z,200,Storm
Indonesia,2019,Indonesia: Flood - Jember (East Java) - 7/3/2019,2019-03-07T00:00:00Z,10,Flood
Indonesia,2019,Indonesia: Flood - Jember (East Java) - 17/3/2019,2019-03-17T00:00:00Z,40,Flood
Indonesia,2019,Indonesia: Landslide - Majalengka (West Java) - 2/3/2019,2019-03-02T00:00:00Z,3,Wet Mass Movement
Indonesia,2019,Indonesia: Landslide - Banjarnegara (Central Java) - 2/3/2019,2019-03-02T00:00:00Z,4,Wet Mass Movement
Indonesia,2019,Indonesia: Storm - Ogan Ilir (South Sumatra) - 19/3/2019,2019-03-19T00:00:00Z,4,Storm
Indonesia,2019,Indonesia: Storm - Maros (Sulawesi Selatan) - 2/3/2019,2019-03-02T00:00:00Z,180,Flood
Indonesia,2019,Indonesia: Storm - Padang Pariaman (West Sumatra) - 5/3/2019,2019-03-05T00:00:00Z,7,Storm
Indonesia,2019,Indonesia: Landslide - Ponorogo (East Java) - 20/3/2019,2019-03-20T00:00:00Z,5,Wet Mass Movement
Indonesia,2019,Indonesia: Flood - Pasaman (West Sumatra) - 4/3/2019,2019-03-04T00:00:00Z,4,Flood
Indonesia,2019,Indonesia: Storm - Kota Baru; Tabalong (Kalimantan Selatan) - 18/3/2019,2019-03-18T00:00:00Z,18,Storm
Indonesia,2019,Indonesia: Storm - Banjar (Kalimantan Selatan) - 23/3/2019,2019-03-23T00:00:00Z,4,Storm
Indonesia,2019,Indonesia: Strong Winds - West Kalimantan (Kapuas Hulu)  - 10/10/2019,2019-10-10T00:00:00Z,4,Storm
Indonesia,2019,Indonesia: Storm - Luwu Utara (Sulawesi Selatan) - 2/3/2019,2019-03-02T00:00:00Z,29,Storm
Indonesia,2019,Indonesia: Strong winds - East Java (Batu City) - 19/10/2019,2019-10-19T00:00:00Z,1400,Storm
Indonesia,2019,Indonesia: Flooding - Bandung Regency (West Java) - 1/3/2019,2019-03-01T00:00:00Z,390,Flood
Indonesia,2019,Indonesia: Landslide - Wonogiri; Magelang (Central Java) - 6/3/2019,2019-03-06T00:00:00Z,14,Wet Mass Movement
Indonesia,2019,Indonesia: Storm - Lumajang (East Java) - 16/2/2019,2019-02-16T00:00:00Z,7,Storm
Indonesia,2019,Indonesia: Storm - Brebes (Central Java) - 6/3/2019,2019-03-06T00:00:00Z,18,Storm
Indonesia,2019,Indonesia: Storm - Situbondo (East Java) - 1/3/2019,2019-03-01T00:00:00Z,4,Storm
Indonesia,2019,Indonesia: Storm - Semarang (Central Java) - 7/3/2019,2019-03-07T00:00:00Z,4,Storm
Indonesia,2019,Indonesia: Flood - Nganjuk (East Java) - 4/3/2019,2019-03-04T00:00:00Z,4,Flood
Indonesia,2019,Indonesia: Earthquake - Banggai Islands (Central Sulawesi) - 12/4/2019,2019-04-12T00:00:00Z,4700,Earthquake
Indonesia,2019,Indonesia: Landslide - Banyumas (Central Java) - 10/3/2019,2019-03-10T00:00:00Z,4,Wet Mass Movement
Indonesia,2019,Indonesia: Landslide - Cilacap (Central Java) - 10/3/2019,2019-03-08T00:00:00Z,4,Wet Mass Movement
Indonesia,2019,Indonesia: Flood - Madiun (East Java) - 5/3/2019,2019-03-05T00:00:00Z,7,Flood
Indonesia,2019,"Indonesia: Flood - Dayeuhkolot sub-district, Bandung (West Java) - 2/4/2019",2019-04-02T00:00:00Z,370,Flood
Indonesia,2019,Indonesia: Storm - Pati (Central Java) - 14/3/2019,2019-03-14T00:00:00Z,25,Storm
Indonesia,2019,Indonesia: Flood - Surakarta (Central Java) - 7/3/2019,2019-03-07T00:00:00Z,560,Flood
Indonesia,2019,Indonesia: Flood - Kuantan Singingi (Riau) - 27/2/2019,2019-02-27T00:00:00Z,150,Flood
Indonesia,2019,Indonesia: Strong Winds - West Java (Bogor) - 9/10/2019,2019-10-09T00:00:00Z,22,Storm
Indonesia,2019,Indonesia: Strong Winds - West Java (Sukabumi) - 29/10/2019,2019-10-29T00:00:00Z,7,Storm
Indonesia,2019,Indonesia: Flood - Sukoharjo (Central Java) - 7/3/2019,2019-03-07T00:00:00Z,550,Flood
Indonesia,2019,Indonesia: Storm - Gresik (East Java) - 9/3/2019,2019-03-09T00:00:00Z,40,Storm
Indonesia,2019,Indonesia: Landslide - Wonogiri (Central Java) - 12/3/2019,2019-03-12T00:00:00Z,4,Wet Mass Movement
Indonesia,2019,Indonesia: Flood - Ponorogo (East Java) - 10/3/2019,2019-03-10T00:00:00Z,4,Flood
Indonesia,2019,Indonesia: Flood - Wonogiri; Purworejo (Central Java) - 17/3/2019,2019-03-17T00:00:00Z,470,Flood
Indonesia,2019,Indonesia: Storm - Purworejo (Central Java) - 15/3/2019,2019-03-15T00:00:00Z,14,Storm
Indonesia,2019,Indonesia: Landslide - Pemalang (Central Java) - 22/3/2019,2019-03-22T00:00:00Z,7,Wet Mass Movement
Indonesia,2019,Indonesia: Storm - Kendal (Central Java) - 17/3/2019,2019-03-17T00:00:00Z,4,Storm
Indonesia,2019,Indonesia: Landslide - Semarang (Central Java) - 26/3/2019,2019-03-26T00:00:00Z,11,Wet Mass Movement
Indonesia,2019,Indonesia: Landslide - Malang (East Java) - 13/3/2019,2019-03-13T00:00:00Z,4,Wet Mass Movement
Indonesia,2019,Indonesia: Floods - West Sumatra (Padang Pariaman) - 17/10/2019,2019-10-17T00:00:00Z,14,Flood
Indonesia,2019,Indonesia: Storm - Semarang (Central Java) - 17/3/2019,2019-03-17T00:00:00Z,4,Storm
Indonesia,2019,Indonesia: Landslide - Cilacap (Central Java) - 28/3/2019,2019-03-28T00:00:00Z,5,Wet Mass Movement
Indonesia,2019,Indonesia: Landslide - Banyumas (Central Java) - 19/3/2019,2019-03-19T00:00:00Z,4,Wet Mass Movement
Indonesia,2019,Indonesia: Flood - Temanggung (Central Java) - 31/3/2019,2019-03-31T00:00:00Z,6,Flood
Indonesia,2019,Indonesia: Strong Winds - West Java (Cirebon) - 2/10/2019,2019-10-02T00:00:00Z,4,Storm
Indonesia,2019,Indonesia: Storm - Sumenep (East Java) - 10/3/2019,2019-03-10T00:00:00Z,18,Storm
Indonesia,2019,Indonesia: Floods - Bandung Regency (West Java) - 7/2/2019,2019-02-07T00:00:00Z,43,Flood
Indonesia,2019,Indonesia: Storm - Semarang (Central Java) - 20/3/2019,2019-03-20T00:00:00Z,4,Storm
Indonesia,2019,Indonesia: Strong Winds - Riau (Kuantan Sengingi) - 14/10/2019,2019-10-14T00:00:00Z,100,Storm
Indonesia,2019,Indonesia: Storm - Brebes (Central Java) - 21/3/2019,2019-03-21T00:00:00Z,4,Storm
Indonesia,2019,Indonesia: Storm - Jepara (Central Java) - 12/3/2019,2019-03-12T00:00:00Z,4,Storm
Indonesia,2019,Indonesia: Storm - Probolinggo (East Java) - 23/3/2019,2019-03-23T00:00:00Z,7,Storm
Indonesia,2019,Indonesia: Strong Winds - Aceh (Gayo Lues) - 4/10/2019,2019-10-04T00:00:00Z,50,Storm
Indonesia,2019,Indonesia: Storm - Jepara (Central Java) - 23/3/2019,2019-03-23T00:00:00Z,22,Storm
Indonesia,2019,Indonesia: Storm - Dairi (North Sumatra) - 15/3/2019,2019-03-15T00:00:00Z,11,Storm
Indonesia,2019,Indonesia: Storm - Pati (Central Java) - 23/3/2019,2019-03-23T00:00:00Z,4,Storm
Indonesia,2019,Indonesia: Storm - Lima Puluh Kota (West Sumatra) - 28/3/2019,2019-03-28T00:00:00Z,7,Storm
Indonesia,2019,Indonesia: Storm - Bandung Barat (West Java) - 2/3/2019,2019-03-02T00:00:00Z,4,Storm
Indonesia,2019,Indonesia: Landslide - Garut (West Java) - 4/3/2019,2019-03-04T00:00:00Z,4,Wet Mass Movement
Indonesia,2019,Indonesia: Landslide - Gowa (South Sulawesi) - 3/3/2019,2019-03-03T00:00:00Z,7,Wet Mass Movement
Indonesia,2019,Indonesia: Landslide - Sukabumi (West Java) - 4/3/2019,2019-03-04T00:00:00Z,7,Wet Mass Movement
Indonesia,2019,Indonesia: Landslide - Sumedang (West Java) - 5/3/2019,2019-03-05T00:00:00Z,4,Wet Mass Movement
Indonesia,2019,Indonesia: Storm - Sukabumi (West Java) - 5/3/2019,2019-03-05T00:00:00Z,4,Storm
Indonesia,2019,Indonesia: Earthquake - Morotai Island (North Maluku) - 7/2/2019,2019-02-07T00:00:00Z,800,Earthquake
Indonesia,2019,Indonesia: Storm - Wajo (South Sulawesi) - 9/3/2019,2019-03-09T00:00:00Z,14,Storm
Indonesia,2019,Indonesia: Landslide - Bengkayang Regency (West Kalimantan) - 31/1/2019,2019-01-31T00:00:00Z,40,Wet Mass Movement
Indonesia,2019,Indonesia: Storm - Musi Banyuasin (South Sumatra) - 4/3/2019,2019-03-04T00:00:00Z,4,Wet Mass Movement
Indonesia,2019,Indonesia: Storm - Luwu (South Sulawesi) - 13/3/2019,2019-03-13T00:00:00Z,7,Flood
Indonesia,2019,Indonesia: Floods - Kudus (Central Java) - 28/1/2019,2019-01-28T00:00:00Z,24,Flood
Indonesia,2019,Indonesia: Landslide - Bali - 27/1/2019,2019-01-27T00:00:00Z,12,Wet Mass Movement
Indonesia,2019,Indonesia: Storm - Takalar (South Sulawesi) - 18/3/2019,2019-03-18T00:00:00Z,4,Storm
Indonesia,2019,Indonesia: Flood - Tana Toraja (South Sulawesi) - 24/3/2019,2019-03-24T00:00:00Z,4,Flood
Indonesia,2019,Indonesia: Strong Winds - East Java - December 2019,2019-12-02T00:00:00Z,390,Storm
Indonesia,2019,"Indonesia: Strong Winds - Central Java (Banyumas, Magelang) - 25/12/2019",2019-12-25T00:00:00Z,16,Storm
Indonesia,2019,"Indonesia: Strong Winds - Central Java (Pekalongan, Kendal, Blora, Rembang, Cilacap, Klaten, Kebumen, Pemalang, Pati, Tegal, Wonogiri) - 11/12/2019",2019-12-11T00:00:00Z,87,Storm
Indonesia,2019,"Indonesia: Strong Winds - West Nusa Tenggara (Dompu, Sumbawa, Bima, Sumbawa Barat, Lombok Timur) - 11/12/2019",2019-12-11T00:00:00Z,340,Storm
Indonesia,2019,"Indonesia: Strong Winds - Central Java (Kendal, Klaten, Grobogan, Brebes, Cilacap, Sukoharjo) - 2/12/2019",2019-12-02T00:00:00Z,180,Storm
Indonesia,2019,Indonesia: Strong Winds - Banten (Tangerang and Serang) - 12/12/2019,2019-12-12T00:00:00Z,33,Storm
Indonesia,2019,"Indonesia: Strong Winds - West Java (Bogor, Sukabumi, Bandung, Indramayu) - 6/12/2019",2019-12-06T00:00:00Z,110,Storm
Indonesia,2019,Indonesia: Landslide - East Java (Pacitan and Kota Malang) - 23/12/2019,2019-12-23T00:00:00Z,7,Wet Mass Movement
Indonesia,2019,Indonesia: Landslide - Central Java (Cilacap and Karanganyar) - 15/12/2019,2019-12-15T00:00:00Z,20,Wet Mass Movement
Indonesia,2019,Indonesia: Landslide - West Java (Bogor) - 22/12/2019,2019-12-22T00:00:00Z,7,Wet Mass Movement
Indonesia,2019,"Indonesia: Landslide - South Sumatra (Empat Lawang, Musi Banyu Asin) - 21/12/2019",2019-12-21T00:00:00Z,14,Wet Mass Movement
Indonesia,2019,Indonesia: Landslide - Jambi (Kerinci) - 11/12/2019,2019-12-11T00:00:00Z,7,Wet Mass Movement
Indonesia,2019,Indonesia: Floods - Central Sulawesi (Buton Tengah) - 2/12/2019,2019-12-02T00:00:00Z,140,Flood
Indonesia,2019,Indonesia: Floods - Central Sulawesi (Sigi) - 8/12/2019,2019-12-08T00:00:00Z,430,Flood
Indonesia,2019,"Indonesia: Floods - West Kalimantan (Sekadau, Sambas, Melawi, Singkawang) - 6/12/2019",2019-12-06T00:00:00Z,3500,Flood
Indonesia,2019,Indonesia: Floods - Lampung (Lampung Barat) - 31/12/2019,2019-12-31T00:00:00Z,4,Flood
Indonesia,2019,Indonesia: Floods - West Sumatra (Limapuluh Kota) - 19/12/2019,2019-12-19T00:00:00Z,130,Flood
Indonesia,2019,Indonesia: Landslide - West Java (Bogor) - 1/12/2019,2019-12-01T00:00:00Z,76,Wet Mass Movement
Indonesia,2019,Indonesia: Flood - West Sumatra (Limapuluh Kota) - 9/12/2019,2019-12-09T00:00:00Z,490,Flood
Indonesia,2019,Indonesia: Floods - West Sumatra (Agam) - 2/12/2019,2019-12-02T00:00:00Z,5,Flood
Indonesia,2019,"Indonesia: Floods - Riau (Rokan Hulu, Rokan Hilir, and Pelalawan) - 10/12/2019",2019-12-10T00:00:00Z,160,Flood
Indonesia,2019,Indonesia: Floods - Aceh (Singkil) - 2/12/2019,2019-12-02T00:00:00Z,4,Flood
Indonesia,2019,Indonesia: Landslide - South Sumatra (Ogan Komering Ulu Selatan) - 1/12/2019,2019-12-01T00:00:00Z,3,Wet Mass Movement
Indonesia,2019,Indonesia: Floods - Aceh (Gayo Lues and Aceh Timur) - 11/12/2019,2019-12-11T00:00:00Z,280,Flood
Indonesia,2019,Indonesia: Floods - West Papua (Teluk Wondama) - 23/12/2019,2019-12-23T00:00:00Z,50,Flood
Indonesia,2019,Indonesia: Flood - West Java (West Bandung) - 31/12/2019,2019-12-31T00:00:00Z,610,Flood
Indonesia,2019,Indonesia: Floods - West Java (Bogor) - 22/12/2019,2019-12-22T00:00:00Z,4,Flood
Indonesia,2019,Indonesia: Floods - West Java (Bandung) - 17/12/2019,2019-12-17T00:00:00Z,870,Flood
Indonesia,2019,Indonesia: Floods - Banten (Kota Cilegon and Lebak) - 6/12/2019,2019-12-06T00:00:00Z,11,Flood
Indonesia,2019,Indonesia: Floods - Bengkulu (Seluma and Kaur) - 14/12/2019,2019-12-14T00:00:00Z,1800,Flood
Indonesia,2019,Indonesia: Strong Winds - Central Sulawesi (Kolaka Utara) - 12/11/2019,2019-11-12T00:00:00Z,4,Storm
Indonesia,2019,Indonesia: Strong Winds - South Sulawesi - 8/11/2019,2019-11-08T00:00:00Z,80,Storm
Indonesia,2019,Indonesia: Strong Winds - South Kalimantan - 9/11/2019,2019-11-09T00:00:00Z,190,Storm
Indonesia,2019,Indonesia: Strong Winds - East Java - 9/11/2019,2019-11-09T00:00:00Z,550,Storm
Indonesia,2019,Indonesia: Strong Winds - East Kalimantan (Pasir) - 29/11/2019,2019-11-29T00:00:00Z,4,Storm
Indonesia,2019,Indonesia: Strong Winds - Central Java (Temanggung) - 19/11/2019,2019-11-19T00:00:00Z,4,Storm
Indonesia,2019,Indonesia: Strong Winds - Central Java - November 2019,2019-11-01T00:00:00Z,220,Storm
Indonesia,2019,Indonesia: Strong Winds - West Java (Majalengka and Bogor) - 26/11/2019,2019-11-26T00:00:00Z,33,Storm
Indonesia,2019,Indonesia: Strong Winds - Banten (Lebak and Serang) - 13/11/2019,2019-11-13T00:00:00Z,98,Storm
Indonesia,2019,Indonesia: Strong Winds - West Sumatra (Solok Selatan) - 7/11/2019,2019-11-07T00:00:00Z,30,Storm
Indonesia,2019,Indonesia: Strong Winds - West Java (Kota Bogor and Tasikmalaya) - 5/11/2019,2019-11-05T00:00:00Z,14,Storm
Indonesia,2019,Indonesia: Strong Winds - Lampung (Lampung Barat) - 13/11/2019,2019-11-13T00:00:00Z,18,Storm
Indonesia,2019,Indonesia: Strong Winds - South Sumatra (Banyuasin) - 13/11/2019,2019-11-13T00:00:00Z,200,Storm
Indonesia,2019,Indonesia: Strong Winds - Riau (Rokan Hilir) - 7/11/2019,2019-11-07T00:00:00Z,51,Storm
Indonesia,2019,Indonesia: Landslides - Maluku (Maluku Tengah) - 6/11/2019,2019-11-06T00:00:00Z,10,Wet Mass Movement
Indonesia,2019,Indonesia: Landslides - Central Java (Cilacap) - 8/11/2019,2019-11-08T00:00:00Z,1,Wet Mass Movement
Indonesia,2019,Indonesia: Landslides - West Java (Bogor) - 20/11/2019,2019-11-20T00:00:00Z,15,Wet Mass Movement
Indonesia,2019,Indonesia: Landslides - Riau (Batam) - 26/11/2019,2019-11-26T00:00:00Z,4,Wet Mass Movement
Indonesia,2019,Indonesia: Flood - Aceh (Aceh Utara) - 18/11/2019,2019-11-18T00:00:00Z,83,Flood
Indonesia,2019,Indonesia: Landslides - West Java (Sukabumi and Kota Bogor) - 6/11/2019,2019-11-06T00:00:00Z,11,Wet Mass Movement
Indonesia,2019,Indonesia: Landslides - Aceh (Gayo Lues) - 14/11/2019,2019-11-14T00:00:00Z,11,Wet Mass Movement
Indonesia,2019,Indonesia: Landslide - West Sumatra (Agam Regency) - 20/11/2019,2019-11-20T00:00:00Z,54,Wet Mass Movement
Indonesia,2019,Indonesia: Flood - West Sumatra (Solok Selatan) - 20/11/2019,2019-11-20T00:00:00Z,880,Flood
Indonesia,2019,Indonesia: Strong Winds - West Sulawesi (Polewali Mandar) - 31/10/2019,2019-10-31T00:00:00Z,7,Storm
Indonesia,2019,"Indonesia: Strong Winds - South Sulawesi (Sidenreng Rappang, Pangkajne Kepulauan, and Tana Toraja) - 2/10/2019",2019-10-02T00:00:00Z,29,Storm
Indonesia,2019,Indonesia: Strong Winds - Bali (Buleleng)  - 19/10/2019,2019-10-19T00:00:00Z,4,Storm
Indonesia,2019,Indonesia: Strong Winds - Central Java (Wonosobo) - 20/10/2019,2019-10-20T00:00:00Z,160,Storm
Indonesia,2019,"Indonesia: Strong Winds - East Java (Mojokerto, Bondowoso, and Bojonegoro)  - 1/10/2019",2019-10-01T00:00:00Z,11,Storm
Indonesia,2019,"Indonesia: Strong Winds - Central Java (Grobogan, Semarang, Kendal, Magelang, Banjarnegara, Tegal, Brebes, Wonogiri, Sragen, and Pati) - 2/10/2019",2019-10-02T00:00:00Z,1700,Storm
Indonesia,2019,Indonesia: Strong Winds - West Java (Bandung) - 20/10/2019,2019-10-20T00:00:00Z,6300,Storm
Indonesia,2019,Indonesia: Strong Winds - West Sumatra (Solok Selatan) - 2/10/2019,2019-10-02T00:00:00Z,4,Storm
Indonesia,2019,Indonesia: Strong Winds - North Sumatra (Mandailing Natal) - 13/10/2019,2019-10-13T00:00:00Z,4,Storm
Indonesia,2019,Indonesia: Strong Winds - Aceh (Singkil) - 20/10/2019,2019-10-20T00:00:00Z,4,Storm
Indonesia,2019,Indonesia: Landslides - Central Java (Kota Semarang and Banjarnegara) - 1/10/2019,2019-10-01T00:00:00Z,14,Wet Mass Movement
Indonesia,2019,Indonesia: Landslides - West Java (Tasikmalaya) - 30/10/2019,2019-10-30T00:00:00Z,4,Wet Mass Movement
Indonesia,2019,Indonesia: Landslides - West Java (Cianjur) - 8/10/2019,2019-10-08T00:00:00Z,9,Wet Mass Movement
Indonesia,2019,Indonesia: Earthquake - Maluku (Kota Ambon) - 10/10/2019,2019-10-10T00:00:00Z,49,Earthquake
Indonesia,2019,"Indonesia: Strong Winds - South Kalimantan (Barito Kuala, Banjar, and Tapin) - 3/10/2019",2019-10-03T00:00:00Z,25,Storm
Indonesia,2019,Indonesia: Floods - West Sumatra (Pesisir Selatan) - 24/12/2019,2019-12-24T00:00:00Z,500,Flood
Indonesia,2019,Indonesia: Flood - West Sumatra (Agam and Pasaman Regencies) - 19/12/2019,2019-12-19T00:00:00Z,200,Flood
Indonesia,2019,Indonesia: Strong Wind - South Sulawesi (Tana Toraja) - 21/9/2019,2019-09-21T00:00:00Z,4,Storm
Indonesia,2019,Indonesia: Strong Wind - Riau (Natuna) - 25/9/2019,2019-09-25T00:00:00Z,5,Storm
Indonesia,2019,Indonesia: Strong Wind - South Kalimantan (Barito Kuala) - 29/9/2019,2019-09-29T00:00:00Z,15,Storm
Indonesia,2019,Indonesia: Strong Wind - East Java (Situbondo) - 5/9/2019,2019-09-05T00:00:00Z,4,Storm
Indonesia,2019,"Indonesia: Strong Wind - Central Java (Pekalongan, Jepara, Wonosobo) - 10/9/2019",2019-09-10T00:00:00Z,33,Storm
Indonesia,2019,"Indonesia: Strong Wind - West Java (Ciamis, Bogor, Kota Tasikmalaya) - 3/9/2019",2019-09-03T00:00:00Z,120,Storm
Indonesia,2019,Indonesia: Strong Wind - Jambi (Kota Sungai Penuh) - 7/9/2019,2019-09-07T00:00:00Z,33,Storm
Indonesia,2019,"Indonesia: Strong Wind - West Sumatra (Sawahlunto/Sijunjung, Solok Selatan) - 3/9/2019",2019-09-03T00:00:00Z,40,Storm
Indonesia,2019,"Indonesia: Strong Wind - North Sumatra (Langkat, Batu Bara, Asahan, Labuhuan Batu, Padang Lawas Utara) - 2/9/2019",2019-09-02T00:00:00Z,180,Storm
Indonesia,2019,Indonesia: Landslide - Central Java (Cilacap) - 25/9/2019,2019-09-25T00:00:00Z,8,Wet Mass Movement
Indonesia,2019,Indonesia: Landslide - West Java (Kota Bogor) - 20/9/2019,2019-09-20T00:00:00Z,4,Wet Mass Movement
Indonesia,2019,Indonesia: Forest Fire - Bengkulu (Bengkulu Utara) - 13/9/2019,2019-09-13T00:00:00Z,150,Wildfire
Indonesia,2019,Indonesia: Strong Wind - North Sulawesi (Kota Manado and Bolaang Mongondow) - 4/8/2019,2019-08-04T00:00:00Z,11,Storm
Indonesia,2019,Indonesia: Strong Wind - West Java (Sumedang and Bogor) - 2/8/2019,2019-08-02T00:00:00Z,25,Storm
Indonesia,2019,Indonesia: Strong Wind - Aceh (Singkil) - 1/8/2019,2019-08-01T00:00:00Z,18,Storm
Indonesia,2019,Indonesia: Floods - Aceh (Birueuen) - 23/8/2019,2019-08-23T00:00:00Z,5,Flood
Indonesia,2019,Indonesia: Landslide - Maluku (Seram Bagian Timur) - 2/7/2019,2019-07-02T00:00:00Z,36,Wet Mass Movement
Indonesia,2019,Indonesia: Floods - Bengkulu (Kota Bengkulu) - 8/7/2019,2019-07-08T00:00:00Z,7,Flood
Indonesia,2019,"Indonesia: Strong Wind - Aceh (Bireuen, Aceh Utara, Aceh Tengah, Aceh Barat) - 4/9/2019",2019-09-04T00:00:00Z,65,Storm
Indonesia,2019,"Indonesia: Strong Wind - Aceh (Kota Banda Aceh, Pidie Jaya, Aceh Barat, Aceh Timur, Langsa) - 9/8/2019",2019-08-09T00:00:00Z,110,Storm
Indonesia,2019,Indonesia: Landslide - Aceh (Lhokseumawe) - 19/7/2019,2019-07-19T00:00:00Z,5,Wet Mass Movement
Indonesia,2019,Indonesia: Earthquake - Bali (Buleleng) - 16/7/2019,2019-07-16T00:00:00Z,4,Earthquake
Indonesia,2019,Indonesia: Strong Wind - Aceh (Pidie Jaya) - 26/8/2019,2019-08-26T00:00:00Z,4,Storm
Indonesia,2019,"Indonesia: Earthquake - Banten, Lampung, Cianjur, West Bandung  - 2/8/2019",2019-08-02T00:00:00Z,1100,Earthquake
Indonesia,2019,Indonesia: Floods - Sulawesi Tengah (Sigi) - 13/8/2019,2019-08-13T00:00:00Z,80,Flood
Indonesia,2019,Indonesia: Flood - Parigi Moutong (Central Sulawesi) - 30/7/2019,2019-07-30T00:00:00Z,39,Flood
Indonesia,2019,Indonesia: Strong Wind - Sumatera Selatan (Musi Rawas Utara) - 8/7/2019,2019-07-08T00:00:00Z,920,Storm
Indonesia,2019,Indonesia: Strong Wind - Aceh (Aceh Utara) - 24/7/2019,2019-07-24T00:00:00Z,7,Storm
Indonesia,2019,Indonesia: Earthquake - Maluku (Ambon) - 26/9/2019,2019-09-26T00:00:00Z,231000,Earthquake
Indonesia,2019,Indonesia: Flash Flood - West Sumatra (South Solok) - 12/12/2019,2019-12-12T00:00:00Z,120,Flood
Indonesia,2019,Indonesia: Flash Flood - North Sumatra (Labuhanbatu Utara) - 28/12/2019,2019-12-28T00:00:00Z,130,Flood
Indonesia,2019,Indonesia: Earthquake - North Maluku (Jailolo) - 14/11/2019,2019-11-14T00:00:00Z,76,Earthquake
Indonesia,2019,Indonesia: Strong Winds - East Nusa Tenggara (Kupang) - 24/11/2019,2019-11-24T00:00:00Z,520,Storm
Indonesia,2019,Indonesia: Strong Winds - East Nusa Tenggara (Sumba Timur) - 24/11/2019,2019-11-24T00:00:00Z,36,Storm
Indonesia,2019,Indonesia: Strong Winds - East Nusa Tenggara (Manggarai Barat) - 9/11/2019,2019-11-09T00:00:00Z,33,Storm
Indonesia,2019,Indonesia: Storm - East Java (Kota Batu) - 17/11/2019,2019-11-17T00:00:00Z,230,Storm
Indonesia,2019,Indonesia: Strong Winds - West Java (Bandung Barat) - 25/11/2019,2019-11-25T00:00:00Z,10,Storm
Indonesia,2019,Indonesia: Storm - Central Java (Blora) - 11/11/2019,2019-11-11T00:00:00Z,43,Storm
Indonesia,2019,Indonesia: Storm/Tornado/strong winds - East Java (Bojonegoro) - 9/11/2019,2019-11-09T00:00:00Z,120,Storm
Indonesia,2019,Indonesia: Sink Hole / Mass Movement - Maluku (Central Maluku Regency) - 4/11/2019,2019-11-04T00:00:00Z,7,Dry mass movement
Indonesia,2019,Indonesia: Landslides - South Sulawesi (Tana Toraja) - 12/11/2019,2019-11-12T00:00:00Z,4,Wet Mass Movement
Indonesia,2019,Indonesia: Landslides - West Java (Bandung Barat) - 23/11/2019,2019-11-23T00:00:00Z,7,Wet Mass Movement
Indonesia,2019,Indonesia: Flood - North Sumatra (Batubara Regency) - 21/10/2019,2019-10-21T00:00:00Z,2000,Flood
Indonesia,2019,Indonesia: Strong Winds - East Nusa Tenggara (Manggarai Barat) - 11/12/2019,2019-12-11T00:00:00Z,4,Storm
Indonesia,2019,Indonesia: Flood - Aceh (Simeulue Island) - 17/10/2019,2019-10-17T00:00:00Z,170,Flood
Indonesia,2019,Indonesia: Flash Flood - South Sumatra (Lahat) - 30/12/2019,2019-12-30T00:00:00Z,25,Flood
Indonesia,2019,Indonesia: Storm Surge (Wave action) - Maluku (Buru) - 2/12/2019,2019-12-02T00:00:00Z,310,Wet Mass Movement
Indonesia,2019,Indonesia: Strong Winds - South Kalimantan (Banjar Baru) - 9/12/2019,2019-12-09T00:00:00Z,4,Storm
Indonesia,2019,Indonesia: Strong Winds - Central Java (Cilacap) - 10/12/2019,2019-12-10T00:00:00Z,34,Storm
Indonesia,2019,Indonesia: Landslide - West Java (Bandung) - 17/12/2019,2019-12-17T00:00:00Z,10,Wet Mass Movement
Indonesia,2019,Indonesia: Landslide - West Java (Kota Tasikmalaya) - 16/12/2019,2019-12-16T00:00:00Z,7,Wet Mass Movement
Indonesia,2019,Indonesia: Flood - Riau - 20/12/2019,2019-12-20T00:00:00Z,32000,Flood
Indonesia,2019,Indonesia: Strong Winds - Central Java (Pemalang) - 18/11/2019,2019-11-18T00:00:00Z,43,Storm
Indonesia,2019,Indonesia: Strong Winds - West Java (Bogor) - 11/11/2019,2019-11-11T00:00:00Z,6,Storm
Indonesia,2019,Indonesia: Flash Flood - Central Sulawesi (Sigi) - 12/12/2019,2019-12-12T00:00:00Z,710,Flood
Indonesia,2019,Indonesia: Earthquake - North Maluku - 14/07/2019,2019-07-14T00:00:00Z,53000,Earthquake
Indonesia,2019,Indonesia: Volcanic Eruption (Mt. Karangetang) - Sitaro (North Sulawesi) - 12/9/2019,2019-09-12T00:00:00Z,47,Volcanic eruption
Indonesia,2019,Indonesia: Flood - West Java (Bandung) - 6/12/2019,2019-12-06T00:00:00Z,4000,Flood
Indonesia,2019,Indonesia: Flooding - Samarinda; Kutai Kartanegara; Paser  (East Kalimantan) - 8/6/2019,2019-06-08T00:00:00Z,2300,Flood
Indonesia,2019,Indonesia: Forest/Landfire - West Kotawaringin (Central Kalimantan) - 3/7/2019,2019-07-03T00:00:00Z,4,Wildfire
Indonesia,2019,Indonesia: Forest/Landfire - Murung Raya (Central Kalimantan) - 18/7/2019,2019-07-18T00:00:00Z,4,Wildfire
Indonesia,2019,Indonesia: Flood - Simeulue (Aceh) - 3/7/2019,2019-07-03T00:00:00Z,9,Flood
Indonesia,2019,Indonesia: Flood - Nunukan (North Kalimantan) - 13/8/2019,2019-08-13T00:00:00Z,4,Flood
Indonesia,2019,Indonesia: Earthquake - Sarmi (Papua) - 20/6/2019,2019-06-20T00:00:00Z,240,Earthquake
Indonesia,2019,Indonesia: Landslide - North Kayong (West Kalimantan) - 30/5/2019,2019-05-30T00:00:00Z,4,Wet Mass Movement
Indonesia,2019,Indonesia: Flood - Lebak (Banten) - 30/5/2019,2019-05-30T00:00:00Z,220,Flood
Indonesia,2019,Indonesia: Flood - Sinjai (South Sulawesi) - 23/5/2019,2019-05-23T00:00:00Z,4,Storm
Indonesia,2019,Indonesia: Flood - Lebak (Banten) - 22/5/2019,2019-05-22T00:00:00Z,120,Flood
Indonesia,2019,Indonesia: Storm - Padangsidimpuan (North Sumatra) - 15/5/2019,2019-05-15T00:00:00Z,29,Flood
Indonesia,2019,Indonesia: Storm - Dairi (North Sumatra) - 15/5/2019,2019-05-15T00:00:00Z,4,Storm
Indonesia,2019,Indonesia: Landslide - Sukabumi (Banten) - 12/5/2019,2019-05-12T00:00:00Z,4,Wet Mass Movement
Indonesia,2019,Indonesia: Storm - Serang (Banten) - 10/5/2019,2019-05-10T00:00:00Z,4,Storm
Indonesia,2019,Indonesia: Landslide - Bogor (West Java) - 10/5/2019,2019-05-10T00:00:00Z,11,Wet Mass Movement
Indonesia,2019,Indonesia: Storm - Tasikmalaya (West Java) - 7/5/2019,2019-05-07T00:00:00Z,4,Storm
Indonesia,2019,Indonesia: Storm - Cilacap (Central Java) - 02/5/2019,2019-05-02T00:00:00Z,4,Storm
Indonesia,2019,Indonesia: Storm - Kuningan (West Java) - 02/5/2019,2019-05-02T00:00:00Z,4,Storm
Indonesia,2019,Indonesia: Storm - Sumedang (West Java) - 19/5/2019,2019-05-19T00:00:00Z,5,Storm
Indonesia,2019,Indonesia: Landslide - Minahasa (North Sulawesi) - 18/5/2019,2019-05-18T00:00:00Z,5,Wet Mass Movement
Indonesia,2019,Indonesia: Flood - Kerinci (Jambi) - 15/5/2019,2019-05-15T00:00:00Z,410,Flood
Indonesia,2019,Indonesia: Flood - Murung Raya (Central Kalimantan) - 14/5/2019,2019-05-14T00:00:00Z,190,Flood
Indonesia,2019,Indonesia: Flood - Semarang (Central Java) - 14/5/2019,2019-05-14T00:00:00Z,100,Flood
Indonesia,2019,Indonesia: Flood - Kepulauan Sangihe (North Sulawesi) - 11/5/2019,2019-05-11T00:00:00Z,62,Flood
Indonesia,2019,Indonesia: Landslide - West Bandung (West Java) - 12/5/2019,2019-05-12T00:00:00Z,180,Wet Mass Movement
Indonesia,2019,Indonesia: Landslide - Purwakarta (West Java) - 9/5/2019,2019-05-09T00:00:00Z,20,Wet Mass Movement
Indonesia,2019,Indonesia: Flood - Bekasi (West Java) - 5/5/2019,2019-05-05T00:00:00Z,20,Flood
Indonesia,2019,Indonesia: Storm - Indramayu (West Java) - 3/5/2019,2019-05-03T00:00:00Z,15,Storm
Indonesia,2019,Indonesia: Flood - Tanjung Jabung Timur (Jambi) - 2/5/2019,2019-05-02T00:00:00Z,20,Flood
Indonesia,2019,Indonesia: Storm - Temanggung (Central Java) - 1/5/2019,2019-05-01T00:00:00Z,4,Storm
Indonesia,2019,Indonesia: Flash Flood - Samosir (North Sumatra) - 3/5/2019,2019-05-03T00:00:00Z,40,Flood
Indonesia,2019,Indonesia: Landslide - Tasikmalaya (West Java) - 2/5/2019,2019-05-02T00:00:00Z,7,Wet Mass Movement
Indonesia,2019,Indonesia: Flood - Konawe and North Konawe (Southeast Sulawesi) - 3/6/2019,2019-06-02T00:00:00Z,9800,Flood
Indonesia,2019,Indonesia: Flood - Bengkulu Province - 26/4/2019,2019-04-26T00:00:00Z,14000,Flood
Indonesia,2019,Indonesia: Flood - Kuningan (West Java) - 6/1/2019,2019-01-06T00:00:00Z,90,Flood
Indonesia,2019,Indonesia: Storm - Wajo (South Sulawesi) - 5/1/2019,2019-01-05T00:00:00Z,4,Storm
Indonesia,2019,"Indonesia: Storm - Rancaekek District, Bandung (West Java) - 11/1/2019",2019-01-11T00:00:00Z,410,Storm
Indonesia,2019,Indonesia: Storm - PURWOREJO (Central Java) - 10/1/2019,2019-01-10T00:00:00Z,4,Storm
Indonesia,2019,Indonesia: Storm - Lamongan (East Java) - 12/1/2019,2019-01-12T00:00:00Z,130,Storm
Indonesia,2019,Indonesia: Storm - Kapuas (Central Kalimantan) - 2/1/2019,2019-01-02T00:00:00Z,4,Storm
Indonesia,2019,Indonesia: Storm - Banyuwangi (East Java) - 6/1/2019,2019-01-06T00:00:00Z,7,Storm
Indonesia,2019,Indonesia: Storm - Bandung (West Java) - 19/3/2019,2019-03-19T00:00:00Z,7,Storm
Indonesia,2019,Indonesia: Landslide - Wonogiri (Central Java) - 7/1/2019,2019-01-07T00:00:00Z,4,Wet Mass Movement
Indonesia,2019,Indonesia: Landslide - Batu (East Java) - 4/1/2019,2019-01-04T00:00:00Z,4,Wet Mass Movement
Indonesia,2019,Indonesia: Landslide - Banjarnegara (Central Java) - 11/1/2019,2019-01-11T00:00:00Z,4,Wet Mass Movement
Indonesia,2019,Indonesia: Landslide - Bandung (West Java) - 1/2/2019,2019-02-01T00:00:00Z,4,Wet Mass Movement
Indonesia,2019,Indonesia: Flooding - Ponorogo (East Java) - 7/3/2019,2019-03-07T00:00:00Z,84,Flood
Indonesia,2019,Indonesia: Landslide - Batu (East Java) - 6/1/2019,2019-01-06T00:00:00Z,5,Wet Mass Movement
Indonesia,2019,Indonesia: Flood - Indramayu (West Java) - 8/4/2019,2019-04-08T00:00:00Z,11000,Flood
Indonesia,2019,Indonesia: Flood - Garut (West Java) - 11/1/2019,2019-01-11T00:00:00Z,11,Flood
Indonesia,2019,Indonesia: Flood - Flores Timur (Nusa Tenggara Timur) - 7/3/2019,2019-03-07T00:00:00Z,4,Flood
Indonesia,2019,Indonesia: Flood - Banyumas (Central Java) - 10/1/2019,2019-01-10T00:00:00Z,2700,Flood
Indonesia,2019,Indonesia: Flood - Morowali (Central Sulawesi) - 8/6/2019,2019-06-08T00:00:00Z,2000,Flood
Indonesia,2019,Indonesia: Flood - Tegal (Central Java) - 6/3/2019,2019-03-06T00:00:00Z,80,Flood
Indonesia,2019,Indonesia: Flood - Kendari (Central Sulawesi) - 14/4/2019,2019-04-14T00:00:00Z,36,Flood
Indonesia,2019,Indonesia: Storm - Tanah Bumbu (South Kalimantan) - 8/4/2019,2019-04-08T00:00:00Z,4,Storm
Indonesia,2019,Indonesia: Storm - Kapuas (Central Kalimantan) - 9/4/2019,2019-04-09T00:00:00Z,4,Storm
Indonesia,2019,Indonesia: Storm - Ogan ilir (South Sumatra) - 17/4/2019,2019-04-17T00:00:00Z,4,Storm
Indonesia,2019,Indonesia: Storm - Pati (Central Java) - 18/4/2019,2019-04-18T00:00:00Z,7,Storm
Indonesia,2019,Indonesia: Rogue wave - Tanah Bumbu (South Kalimantan) - 22/4/2019,2019-04-22T00:00:00Z,4,Wet Mass Movement
Indonesia,2019,Indonesia: Storm - Kapuas (Central Kalimantan) - 25/4/2019,2019-04-25T00:00:00Z,7,Storm
Indonesia,2019,Indonesia: Landslide - West Bandung (West Java) - 27/4/2019,2019-04-27T00:00:00Z,14,Wet Mass Movement
Indonesia,2019,Indonesia: Storm - Padang; Padang Pariaman (West Sumatra) - 27/4/2019,2019-04-27T00:00:00Z,11,Storm
Indonesia,2019,Indonesia: Cyclone Lili - 8/5/2019,2019-05-08T00:00:00Z,36,Storm
Indonesia,2019,Indonesia: Flash Flood - Sigi (Central Sulawesi) - 28/4/2019,2019-04-28T00:00:00Z,2800,Flood
Indonesia,2019,"Indonesia: Mass movement - Kertaangsana village, Nyalindung district, Sukabumi (West Java) - February 2019",2019-02-01T00:00:00Z,410,Wet Mass Movement
Indonesia,2019,"Indonesia: Storm - Bolaang Mongondow District, East Dumoga (North Sulawesi) - 23/3/2019",2019-03-23T00:00:00Z,180,Storm
Indonesia,2019,Indonesia: Flood - Sorong (West Papua) - 28/4/2019,2019-04-28T00:00:00Z,87,Flood
Indonesia,2019,Indonesia: Flood - Maluku Tenggara Barta; Maluku Barat Daya (Maluku) - 8/5/2019,2019-05-08T00:00:00Z,770,Flood
Indonesia,2019,Indonesia: Flood - Jakarta - 25/4/2019,2019-04-25T00:00:00Z,2400,Flood
Indonesia,2019,Indonesia: Landslide - Garut (West Java) - 8/4/2019,2019-04-08T00:00:00Z,6,Wet Mass Movement
Indonesia,2019,Indonesia: Flood - West Nusa Tenggara - 6/3/2019,2019-03-06T00:00:00Z,680,Flood
Indonesia,2019,Indonesia: Landslide - Garut (West Java) - 12/4/2019,2019-04-12T00:00:00Z,43,Wet Mass Movement
Indonesia,2019,Indonesia: Landslide - Blora Regency (Central Java) - 16/3/2019,2019-03-20T00:00:00Z,7,Wet Mass Movement
Indonesia,2019,Indonesia: Landslide - Banjarnegara (Central Java) - 11/4/2019,2019-04-11T00:00:00Z,4,Wet Mass Movement
Indonesia,2019,Indonesia: Flood - Nabire (Papua) - 21/4/2019,2019-04-21T00:00:00Z,450,Flood
Indonesia,2019,Indonesia: Storm - Semarang (Central Java) - 4/3/2019,2019-03-04T00:00:00Z,4,Storm
Indonesia,2019,Indonesia: Landslide - Cilacap (Central Java) - 21/4/2019,2019-04-21T00:00:00Z,4,Wet Mass Movement
Indonesia,2019,Indonesia: Storm - Enrekang (South Sulawesi) - 25/2/2019,2019-02-25T00:00:00Z,83,Storm
Indonesia,2019,Indonesia: Storm - Kediri (East Java) - 25/2/2019,2019-02-25T00:00:00Z,4,Storm
Indonesia,2019,Indonesia: Storm - Aceh Selatan (Aceh) - 23/2/2019,2019-02-23T00:00:00Z,4,Storm
Indonesia,2019,Indonesia: Wave - Paser (East Kalimantan) - 20/2/2019,2019-02-20T00:00:00Z,18,Wet Mass Movement
Indonesia,2019,Indonesia: Storm - Malang (East Java) - 19/2/2019,2019-02-19T00:00:00Z,7,Storm
Indonesia,2019,Indonesia: Landslide - Banyumas (Central Java) - 19/2/2019,2019-02-19T00:00:00Z,4,Wet Mass Movement
Indonesia,2019,Indonesia: Flood - Bandar Lampung (Lampung) - 16/2/2019,2019-02-16T00:00:00Z,7,Flood
Indonesia,2019,Indonesia: Storm - Semarang (Central Java) - 15/2/2019,2019-02-15T00:00:00Z,4,Storm
Indonesia,2019,Indonesia: Storm - Klungkung (Bali) - 15/2/2019,2019-02-15T00:00:00Z,22,Storm
Indonesia,2019,Indonesia: Storm - Tanah Bumbu (South Kalimantan) - 22/2/2019,2019-02-22T00:00:00Z,7,Storm
Indonesia,2019,Indonesia: Storm - Kediri (East Java) - 17/2/2019,2019-02-17T00:00:00Z,14,Storm
Indonesia,2019,Indonesia: Storm - Jepara (Central Java) - 30/4/2019,2019-04-30T00:00:00Z,4,Storm
Indonesia,2019,Indonesia: Flood - Pulang Pisau (Central Kalimantan) - 29/4/2019,2019-04-29T00:00:00Z,85,Flood
Indonesia,2019,Indonesia: Landslide - Malang (East Java) - 11/2/2019,2019-02-11T00:00:00Z,4,Wet Mass Movement
Indonesia,2019,Indonesia: Storm - Jeneponto (South Sulawesi) - 11/2/2019,2019-02-11T00:00:00Z,14,Storm
Indonesia,2019,Indonesia: Flood - Tasikmalaya (West Java) - 11/2/2019,2019-02-11T00:00:00Z,4,Flood
Indonesia,2019,Indonesia: Landslide - Temanggung (Central Java) - 11/2/2019,2019-02-11T00:00:00Z,7,Wet Mass Movement
Indonesia,2019,Indonesia: Landslide - Kuningan (West Java) - 10/2/2019,2019-02-10T00:00:00Z,4,Wet Mass Movement
Indonesia,2019,Indonesia: Landslide - Buton Utara (Southeast Sulawesi) - 5/3/2019,2019-03-05T00:00:00Z,4,Wet Mass Movement
Indonesia,2019,Indonesia: Storm - Bener Meriah (Aceh) - 9/2/2019,2019-02-09T00:00:00Z,7,Storm
Indonesia,2019,Indonesia: Storm - Bondowoso (East Java) - 10/2/2019,2019-02-10T00:00:00Z,90,Storm
Indonesia,2019,Indonesia: Storm - Demak (Central Java) - 10/2/2019,2019-02-10T00:00:00Z,36,Storm
Indonesia,2019,Indonesia: Flood - Bandung (West Java) - 9/2/2019,2019-02-09T00:00:00Z,7,Flood
Indonesia,2019,Indonesia: Storm - Bone (South Sulawesi) - 9/2/2019,2019-02-09T00:00:00Z,14,Storm
Indonesia,2019,Indonesia: Flood - Jayapura (Papua) - 8/2/2019,2019-02-08T00:00:00Z,4,Flood
Indonesia,2019,Indonesia: Storm - Tasikmalaya (West Java) - 8/2/2019,2019-02-08T00:00:00Z,7,Storm
Indonesia,2019,Indonesia: Storm - Tana Toraja (South Sulawesi) - 7/2/2019,2019-02-07T00:00:00Z,29,Storm
Indonesia,2019,Indonesia: Landslide - Semarang (Central Java) - 7/2/2019,2019-02-07T00:00:00Z,4,Wet Mass Movement
Indonesia,2019,Indonesia: Storm - Pandeglang (Banten) - 6/2/2019,2019-02-06T00:00:00Z,18,Storm
Indonesia,2019,Indonesia: Storm - Tuban (East Java) - 5/2/2019,2019-02-05T00:00:00Z,7,Storm
Indonesia,2019,Indonesia: Storm - Tulangbawang (Lampung) - 5/2/2019,2019-02-05T00:00:00Z,14,Storm
Indonesia,2019,Indonesia: Storm - Tana Toraja (South Sulawesi) - 5/2/2019,2019-02-05T00:00:00Z,7,Storm
Indonesia,2019,Indonesia: Storm - Situbondo (East Java) - 3/2/2019,2019-02-03T00:00:00Z,4,Storm
Indonesia,2019,Indonesia: Flood/Landslide - Brebes (Central Java) - 3/2/2019,2019-02-03T00:00:00Z,4,Flood
Indonesia,2019,Indonesia: Storm - Boyolali (Central Java) - 4/2/2019,2019-02-04T00:00:00Z,4,Storm
Indonesia,2019,Indonesia: Storm - Pangandaran (West Java) - 3/2/2019,2019-02-03T00:00:00Z,4,Storm
Indonesia,2019,Indonesia: Flood - Mamuju (West Sulawesi) - 28/2/2019,2019-02-28T00:00:00Z,170,Flood
Indonesia,2019,Indonesia: Storm - Temanggung (Central Java) - 24/2/2019,2019-02-24T00:00:00Z,5,Storm
Indonesia,2019,Indonesia: Flood - Cirebon (West Java) - 23/2/2019,2019-02-23T00:00:00Z,30,Flood
Indonesia,2019,Indonesia: Flood - Bandung (West Java) - 22/2/2019,2019-02-22T00:00:00Z,910,Flood
Indonesia,2019,Indonesia: Storm - Sukabumi (West Java) - 22/2/2019,2019-02-22T00:00:00Z,120,Storm
Indonesia,2019,Indonesia: Landslide - Kendal (Central Java) - 22/2/2019,2019-02-22T00:00:00Z,13,Wet Mass Movement
Indonesia,2019,Indonesia: Flood - Manokwari (West Papua) - 22/2/2019,2019-02-22T00:00:00Z,160,Flood
Indonesia,2019,Indonesia: Landslide - Banyumas (Central Java) - 21/2/2019,2019-02-21T00:00:00Z,3,Wet Mass Movement
Indonesia,2019,Indonesia: Landslide - Wonogiri (Central Java) - 21/2/2019,2019-02-21T00:00:00Z,70,Wet Mass Movement
Indonesia,2019,Indonesia: Flood - Bekasi (East Java) - 17/2/2019,2019-02-17T00:00:00Z,10,Flood
Indonesia,2019,Indonesia: Landslide - Wonosobo (Central Java) - 16/2/2019,2019-02-16T00:00:00Z,5,Wet Mass Movement
Indonesia,2019,Indonesia: Flood - Musi Rawas Utara (South Sumatra) - 16/2/2019,2019-02-16T00:00:00Z,3000,Flood
Indonesia,2019,Indonesia: Flooding - Bogor (West Java) - 15/2/2019,2019-02-15T00:00:00Z,13,Flood
Indonesia,2019,Indonesia: Landslide - Bandung Barat (West Java) - 13/2/2019,2019-02-13T00:00:00Z,4,Wet Mass Movement
Indonesia,2019,Indonesia: Flood - Tabalong (South Kalimantan) - 13/2/2019,2019-02-13T00:00:00Z,5,Flood
Indonesia,2019,Indonesia: Flood - Murung Raya (Central Kalimantan) - 13/2/2019,2019-02-13T00:00:00Z,89,Flood
Indonesia,2019,Indonesia: Landslide - Temanggung (Central Java) - 12/2/2019,2019-02-12T00:00:00Z,90,Wet Mass Movement
Indonesia,2019,Indonesia: Landslide - Jepara (Central Java) - 12/2/2019,2019-02-12T00:00:00Z,5,Wet Mass Movement
Indonesia,2019,Indonesia: Landslide - Ciamis (West Java) - 11/2/2019,2019-02-11T00:00:00Z,5,Wet Mass Movement
Indonesia,2019,Indonesia: Landslide - Cilacap (Central Java) - 10/2/2019,2019-02-10T00:00:00Z,99,Wet Mass Movement
Indonesia,2019,Indonesia: Landslide - Ciamis (West Java) - 10/2/2019,2019-02-10T00:00:00Z,4,Wet Mass Movement
Indonesia,2019,Indonesia: Landslide - Banjarnegara (Central Java) - 7/2/2019,2019-02-07T00:00:00Z,180,Wet Mass Movement
Indonesia,2019,Indonesia: Landslide - Brebes (Central Java) - 6/2/2019,2019-02-06T00:00:00Z,2,Wet Mass Movement
Indonesia,2019,Indonesia: Storm - Tegal (Central Java) - 6/2/2019,2019-02-06T00:00:00Z,2,Storm
Indonesia,2019,Indonesia: Landslide - Banjarnegara (Central Java) - 6/2/2019,2019-02-06T00:00:00Z,1,Wet Mass Movement
Indonesia,2019,Indonesia: Flood - Lombok Barat (Nusa Tenggara Barat) - 5/2/2019,2019-02-05T00:00:00Z,75,Flood
Indonesia,2019,Indonesia: Storm - Jember (East Java) - 3/2/2019,2019-02-03T00:00:00Z,4,Storm
Indonesia,2019,Indonesia: Flooding/Landslide - Manado (North Sulawesi) - 1/2/2019,2019-02-01T00:00:00Z,510,Flood
Indonesia,2019,Indonesia: Volcanic activity - Karangetan volcano (North Sulawesi) - 2/2/2019,2019-02-02T00:00:00Z,220,Volcanic eruption
Indonesia,2019,Indonesia: Earthquake - South Solok (West Sumatra) - 28/2/2019,2019-02-28T00:00:00Z,200,Earthquake
Indonesia,2019,Indonesia: Storm/Tornado - Padang Pariaman (West Sumatra) - 21/1/2019,2019-01-21T00:00:00Z,4,Storm
Indonesia,2019,Indonesia: Landslide - Sukabumi (West Java) - 21/1/2019,2019-01-21T00:00:00Z,14,Wet Mass Movement
Indonesia,2019,Indonesia: Flood - Garut (West Java) - 19/1/2019,2019-01-19T00:00:00Z,7,Flood
Indonesia,2019,Indonesia: Storm/Tornado - Banjar (West Java) - 19/1/2019,2019-01-19T00:00:00Z,4,Storm
Indonesia,2019,Indonesia: Storm/Tornado - Kendal (Central Java) - 19/1/2019,2019-01-19T00:00:00Z,4,Storm
Indonesia,2019,Indonesia: Landslide - Semarang (Central Java) - 19/1/2019,2019-01-19T00:00:00Z,4,Wet Mass Movement
Indonesia,2019,Indonesia: Storm/Tornado - Probolinggo (East Java) - 18/1/2019,2019-01-18T00:00:00Z,18,Storm
Indonesia,2019,Indonesia: Landslide - Purbalingga (Central Java) - 18/1/2019,2019-01-18T00:00:00Z,4,Wet Mass Movement
Indonesia,2019,Indonesia: Storm/Tornado - Pangkajene Dan Kepul (South Sulawesi) - 17/1/2019,2019-01-17T00:00:00Z,25,Storm
Indonesia,2019,Indonesia: Storm/Tornado - Tegal (Central Java) - 17/1/2019,2019-01-17T00:00:00Z,18,Storm
Indonesia,2019,Indonesia: Landslide - Blitar (East Java) - 17/1/2019,2019-01-17T00:00:00Z,4,Wet Mass Movement
Indonesia,2019,Indonesia: Storm/Tornado - Boyolali (Central Java) - 17/1/2019,2019-01-17T00:00:00Z,7,Storm
Indonesia,2019,Indonesia: Landslide - Pasaman Barat (West Sumatera) - 15/1/2019,2019-01-15T00:00:00Z,4,Wet Mass Movement
Indonesia,2019,Indonesia: Storm/Tornado - East Lampung (Lampung) - 14/1/2019,2019-01-14T00:00:00Z,7,Storm
Indonesia,2019,Indonesia: Storm/Tornado - Sukabumi (West Java) - 14/1/2019,2019-01-14T00:00:00Z,54,Storm
Indonesia,2019,Indonesia: Flood - Sukabumi (West Java) - 13/1/2019,2019-01-13T00:00:00Z,7,Flood
Indonesia,2019,Indonesia: Landslide - Brebes (Central Java) - 13/1/2019,2019-01-13T00:00:00Z,4,Wet Mass Movement
Indonesia,2019,Indonesia: Storm/Tornado - Malang (East Java) - 13/1/2019,2019-01-13T00:00:00Z,11,Storm
Indonesia,2019,Indonesia: Floods - Solok Selatan (West Sumatra) - 17/1/2019,2019-01-17T00:00:00Z,1900,Flood
Indonesia,2019,Indonesia: Floods - Sukabumi (West Java) - 21/1/2019,2019-01-21T00:00:00Z,47,Flood
Indonesia,2019,"Indonesia: Floods - Purworejo, Cilacap (Central Java) - 16/1/2019",2019-01-16T00:00:00Z,37,Flood
Indonesia,2019,Indonesia: Landslide - Majalengka (West Java) - 16/1/2019,2019-01-16T00:00:00Z,5,Wet Mass Movement
Indonesia,2019,Indonesia: Landslides - Jepara (Central Java) - 16/1/2019,2019-01-16T00:00:00Z,18,Wet Mass Movement
Indonesia,2019,Indonesia: Flood - Bolaang Mongondow Utara (Sulawesi Utara) - 15/1/2019,2019-01-15T00:00:00Z,300,Flood
Indonesia,2019,Indonesia: Flood - Aceh Tenggara (Aceh) - 15/1/2019,2019-01-15T00:00:00Z,160,Flood
Indonesia,2019,Indonesia: Landslide - Jepara (Central Java) - 15/1/2019,2019-01-15T00:00:00Z,9,Wet Mass Movement
Indonesia,2019,Indonesia: Floods - Tolikara (Papua) - 14/1/2019,2019-01-14T00:00:00Z,120,Flood
Indonesia,2019,Indonesia: Storm - Karo (North Sumatra) - 7/3/2019,2019-03-07T00:00:00Z,14,Storm
Indonesia,2019,Indonesia: Floods - South Sulawesi - 21/1/2019,2019-01-21T00:00:00Z,9400,Flood
Indonesia,2019,Indonesia: Floods - Bandung (West Java) - 13/1/2019,2019-01-13T00:00:00Z,160,Flood
Indonesia,2019,Indonesia: Strong Wind - West Kalimantan (Kota Pontianak and Kuburaya) - 13/8/2019,2019-08-13T00:00:00Z,380,Storm
Indonesia,2019,Indonesia: Flood - Bima (Nusa Tenggara Barat) - 16/3/2019,2019-03-16T00:00:00Z,54,Flood
Indonesia,2019,Indonesia: Flood - Manokwari (West Papua) - 22/3/2019,2019-03-22T00:00:00Z,11,Flood
Indonesia,2019,Indonesia: Storm - Karawang (West Java) - 11/1/2019,2019-01-11T00:00:00Z,14,Storm
Indonesia,2019,Indonesia: Storm - Purworejo (Central Java) - 11/1/2019,2019-01-11T00:00:00Z,4,Storm
Indonesia,2019,Indonesia: Storm - Sukabumi (West Java) - 10/1/2019,2019-01-10T00:00:00Z,4,Storm
Indonesia,2019,Indonesia: Storm - Banjar (South Kalimantan) - 11/1/2019,2019-01-11T00:00:00Z,4,Storm
Indonesia,2019,Indonesia: Storm - Blora (Central Java) - 8/1/2019,2019-01-08T00:00:00Z,4,Storm
Indonesia,2019,Indonesia: Storm - Serang (Banten) - 8/1/2019,2019-01-08T00:00:00Z,4,Storm
Indonesia,2019,Indonesia: Storm - Bone (South Sulawesi) - 8/1/2019,2019-01-08T00:00:00Z,18,Storm
Indonesia,2019,Indonesia: Storm - East Luwu (South Sulawesi) - 4/1/2019,2019-01-04T00:00:00Z,11,Storm
Indonesia,2019,Indonesia: Storm - Banyumas (Central Java) - 4/1/2019,2019-01-04T00:00:00Z,4,Storm
Indonesia,2019,Indonesia: Storm - Cilacap (Central Java) - 2/1/2019,2019-01-02T00:00:00Z,4,Storm
Indonesia,2019,Indonesia: Storm - Tapin (South Kalimantan Java) - 3/1/2019,2019-01-03T00:00:00Z,4,Storm
Indonesia,2019,Indonesia: Storm - Lampung Tengah (Lampung) - 2/1/2019,2019-01-02T00:00:00Z,14,Storm
Indonesia,2019,Indonesia: Storm - Pati (Central Java) - 2/1/2019,2019-01-02T00:00:00Z,4,Storm
Indonesia,2019,Indonesia: Storm - Tulangbawang (Lampung) - 2/1/2019,2019-01-02T00:00:00Z,43,Storm
Indonesia,2019,Indonesia: Landslide - Kendari (Central Sulawesi) - 9/1/2019,2019-01-09T00:00:00Z,15,Wet Mass Movement
Indonesia,2019,Indonesia: Landslide - Kepulauan Selayar (South Sulawesi) - 9/1/2019,2019-01-09T00:00:00Z,5,Wet Mass Movement
Indonesia,2019,Indonesia: Landslide - Gayo Lues (Aceh) - 2/1/2019,2019-01-02T00:00:00Z,4,Wet Mass Movement
Indonesia,2019,Indonesia: Storm - TANA TORAJA (SULAWESI SELATAN) - 11/1/2019,2019-01-11T00:00:00Z,4,Wet Mass Movement
Indonesia,2019,Indonesia: Storm - Bogor (West Java) - 15/3/2019,2019-03-15T00:00:00Z,4,Storm
Indonesia,2019,Indonesia: Storm - Garut (West Java) - 7/3/2019,2019-03-07T00:00:00Z,5,Storm
Indonesia,2019,Indonesia: Storm - Majalengka (West Java) - 9/3/2019,2019-03-09T00:00:00Z,8,Storm
Indonesia,2019,Indonesia: Storm - Bekasi (West Java) - 28/3/2019,2019-03-28T00:00:00Z,80,Storm
Indonesia,2019,Indonesia: Storm - Pangandaran (West Java) - 12/3/2019,2019-03-12T00:00:00Z,4,Storm
Indonesia,2019,Indonesia: Landslide - West Bandung (West Java) - 13/3/2019,2019-03-13T00:00:00Z,4,Wet Mass Movement
Indonesia,2019,Indonesia: Storm - Bandung (West Java) - 26/3/2019,2019-03-26T00:00:00Z,1700,Flood
Indonesia,2019,Indonesia: Storm - Tasikmalaya (West Java) - 27/3/2019,2019-03-27T00:00:00Z,5,Storm
Indonesia,2019,Indonesia: Storm - Bogor (West Java) - 29/3/2019,2019-03-29T00:00:00Z,19,Storm
Indonesia,2019,Indonesia: Landslide - Gunung Kidul (Yogyakarta) - 17/3/2019,2019-03-17T00:00:00Z,96,Wet Mass Movement
Indonesia,2019,Indonesia: Storm - Bantul; Kulon Progo (Yogyakarta) - 17/3/2019,2019-03-17T00:00:00Z,7800,Storm
Indonesia,2019,Indonesia: Volcanic Eruption - Karang Asem (Bali) - 28/3/2019,2019-03-28T00:00:00Z,20,Volcanic eruption
Indonesia,2019,Indonesia: Earthquake - Lombok (West Nusa Tenggara) - 17/3/2019,2019-03-17T00:00:00Z,3200,Earthquake
Indonesia,2019,Indonesia: Flood - Subulussalam (Aceh) - 9/3/2019,2019-03-09T00:00:00Z,11,Storm
Indonesia,2019,Indonesia: Strong Wind - Sumatera Selatan (Musi Rawas Utara) - 9/8/2019,2019-08-09T00:00:00Z,220,Storm
Indonesia,2019,Indonesia: Strong Wind - Sumatera Barat (Padang Pariaman) - 14/8/2019,2019-08-14T00:00:00Z,4,Storm
Indonesia,2019,Indonesia: Flood - Aceh Selatan (Aceh) - 24/3/2019,2019-03-24T00:00:00Z,50,Flood
Indonesia,2019,Indonesia: Storm - Bandung Barat (West Java) - 29/3/2019,2019-03-29T00:00:00Z,14,Storm
Indonesia,2019,Indonesia: Landslides - Kalimantan Timur (Kutai Kertanegara) - 22/8/2019,2019-08-22T00:00:00Z,22,Flood
Indonesia,2019,Indonesia: Landslide - Majalengka; Garut (West Java) - 6/3/2019,2019-03-06T00:00:00Z,49,Wet Mass Movement
Indonesia,2019,Indonesia: Flood - Magetan (East Java) - 6/3/2019,2019-03-06T00:00:00Z,100,Flood
Indonesia,2019,Indonesia: Storm - Pidie (Aceh) - 5/3/2019,2019-03-05T00:00:00Z,7,Storm
Indonesia,2019,Indonesia: Landslide - West Bandung (West Java) - 6/3/2019,2019-03-06T00:00:00Z,5,Flood
Indonesia,2019,Indonesia: Flood - Klaten (Central Java) - 6/3/2019,2019-03-06T00:00:00Z,30,Wet Mass Movement
Indonesia,2019,Indonesia: Flood - Wonogiri (Central Java) - 6/3/2019,2019-03-06T00:00:00Z,230,Flood
Indonesia,2019,Indonesia: Floods - Papua (Kota Jayapura) - 15/7/2019,2019-07-15T00:00:00Z,4,Flood
Indonesia,2019,Indonesia: Flood - Blitar (East Java) - 6/3/2019,2019-03-06T00:00:00Z,100,Flood
Indonesia,2019,Indonesia: Storm - Lombok Utara (Nusa Tenggara Barat) - 21/3/2019,2019-03-21T00:00:00Z,14,Storm
Indonesia,2019,Indonesia: Flood - Aceh Tenggara (Aceh) - 28/3/2019,2019-03-28T00:00:00Z,14,Flood
Indonesia,2019,Indonesia: Landslide - Situbondo (East Java) - 31/3/2019,2019-03-31T00:00:00Z,4,Wet Mass Movement
Indonesia,2019,Indonesia: Storm - Banjar (Kalimantan Selatan) - 7/3/2019,2019-03-07T00:00:00Z,29,Storm
Indonesia,2019,Indonesia: Storm - Sungai Penuh (Jambi) - 22/2/2019,2019-02-22T00:00:00Z,4,Storm
Indonesia,2019,Indonesia: Storm - Barru (Sulawesi Selatan) - 12/3/2019,2019-03-12T00:00:00Z,4,Storm
Indonesia,2020,Indonesia: Floods - East Kalimantan (Penajam Paser Utara Regency) - 07/09/2020,2020-09-07T00:00:00Z,4,Flood
Indonesia,2020,Indonesia: Flooding - West Java (Cirebon) - 16/2/2020,2020-02-16T00:00:00Z,15,Flood
Indonesia,2020,Indonesia: Floods - North Sumatra (Binjai City) - 29/09/2020,2020-09-29T00:00:00Z,3100,Flood
Indonesia,2020,Indonesia: Flash Flood - South Sumatra (Lubuklinggau) - 20/05/2020,2020-05-20T00:00:00Z,180,Flood
Indonesia,2020,Indonesia: Flash Flood - Aceh (Aceh Tenggara Regency) - 14/11/2020,2020-11-14T00:00:00Z,270,Flood
Indonesia,2020,Indonesia: Flood - West Kalimantan (Landak Regency) - 05/09/2020,2020-09-05T00:00:00Z,11,Flood
Indonesia,2020,Indonesia: Floods - South Sulawesi (Bantaeng Regency) - 12/06/2020,2020-06-12T00:00:00Z,200,Flood
Indonesia,2020,Indonesia: Floods - West Kalimantan (Mempawah Regency) - 02/09/2020,2020-09-02T00:00:00Z,120,Flood
Indonesia,2020,Indonesia: Flood - West Sulawesi (Pasangkayu) - 02/05/2020,2020-05-02T00:00:00Z,400,Flood
Indonesia,2020,Indonesia: Flood - Southeast Sulawesi (North Konawe Regency) - 17/06/2020,2020-06-17T00:00:00Z,2000,Flood
Indonesia,2020,Indonesia: Flash Flood - Central Sulawesi (Toli-Toli Regency) - 15/10/2020,2020-10-15T00:00:00Z,1300,Flood
Indonesia,2020,Indonesia: Floods - East Kalimantan (Samarinda city) - 21/05/2020,2020-05-21T00:00:00Z,610,Flood
Indonesia,2020,Indonesia: Floods - Central Sulawesi (Poso City) - 03/03/2020,2020-03-03T00:00:00Z,900,Flood
Indonesia,2020,"Indonesia: Flash - Central Sulawesi (Kulawi, Sigi Regency) - 08/08/2020",2020-08-08T00:00:00Z,470,Flood
Indonesia,2020,Indonesia: Flash Flood - Gorontalo (Bone Bolango Regency) - 07/09/2020,2020-09-07T00:00:00Z,1500,Flood
Indonesia,2020,Indonesia: Flash Flood - West Java (Sukabumi Regency) - 21/09/2020,2020-09-21T00:00:00Z,210,Flood
Indonesia,2020,"Indonesia: Flood - West Java (Klapanunggal, Bogor) - 01/05/2020",2020-05-01T00:00:00Z,180,Flood
Indonesia,2020,"Indonesia: Floods and Landslides - Central Java (Bandongan, Magelang Regency) - 29/2/2020",2020-02-29T00:00:00Z,170,Flood
Indonesia,2020,Indonesia: Flood - North Sulawesi (South Bolaang Mongondow) - 31/07/2020,2020-07-31T00:00:00Z,530,Flood
Indonesia,2020,Indonesia: Flash Flood - Lampung (Tanggamus Regency) - 04/08/2020,2020-08-04T00:00:00Z,250,Flood
Indonesia,2020,"Indonesia: Flood - Central Sulawesi (Gumbasa, Sigi) - 26/04/2020",2020-04-26T00:00:00Z,64,Flood
Indonesia,2020,Indonesia: Floods - Gorontalo (Gorontalo Regency) - 06/03/2020,2020-03-06T00:00:00Z,5,Flood
Indonesia,2020,Indonesia: Floods - Central Kalimantan (Murung Jaya Regency) - 28/04/2020,2020-04-28T00:00:00Z,1900,Flood
Indonesia,2020,Indonesia: Floods - West Java (Cirebon) - 06/03/2020,2020-03-06T00:00:00Z,280,Flood
Indonesia,2020,Indonesia: Floods - West Papua (Teluk Bintuni Regency) - 07/03/2020,2020-03-07T00:00:00Z,150,Flood
Indonesia,2020,Indonesia: Volcanic activity - East Java (Lumajang Regency/Besuk Kobokan/Mount Semeru) - 05/12/20,2020-12-05T00:00:00Z,170,Volcanic eruption
Indonesia,2020,Indonesia: Volcanic activity - East Java (Lumajang/Lumajang/Mount Semeru) - 01/12/20,2020-12-01T00:00:00Z,550,Volcanic eruption
Indonesia,2020,Indonesia: Flood and landslides - Central Java (Kebumen Regency) - 26/10/2020,2020-10-26T00:00:00Z,2100,Flood
Indonesia,2020,Indonesia: Flooding - West Sumatra (Sijunjung) - 21/1/2020,2020-01-21T00:00:00Z,54,Flood
Indonesia,2020,Indonesia: Flooding - Central Java (Pekalongan) - 19/02/2020,2020-02-19T00:00:00Z,1100,Flood
Indonesia,2020,"Indonesia: Volcanic erruption - East Nusa Tenggara (Lembata Regency, Lembata, Ili Lewotolok Volcano) - 29/11/2020",2020-11-29T00:00:00Z,9000,Volcanic eruption
Indonesia,2020,Indonesia: Flooding - West Java (Bogor) - 17/2/2020,2020-02-17T00:00:00Z,420,Flood
Indonesia,2020,Indonesia: Volcanic activity - Central Java (Mount Merapi) - 05/11/2020,2020-11-05T00:00:00Z,2000,Volcanic eruption
Indonesia,2020,Indonesia: Flood - Central Java (Cilacap Regency) - 16/11/2020,2020-11-16T00:00:00Z,5700,Flood
Indonesia,2020,Indonesia: Flooding - Jakarta - 24/2/2020,2020-02-24T00:00:00Z,400,Flood
Indonesia,2020,Indonesia: Flood - Central Sulawesi (Palu City) - 23/09/2020,2020-09-23T00:00:00Z,27,Flood
Indonesia,2020,Indonesia: Earthquake - West Java (Pangadaran Regency) - 25/10/2020,2020-10-25T00:00:00Z,7,Earthquake
Indonesia,2020,Indonesia: Earthquake - Sumatra (Bengkulu) - 21/11/2020,2020-11-21T00:00:00Z,2,Earthquake
Indonesia,2020,Indonesia: Floods - West Kalimantan (Melawi Regency) - 06/09/2020,2020-09-06T00:00:00Z,720,Flood
Indonesia,2020,"Indonesia: Landslide - West Java (Gunung Putri Sub-District, Bogor) - 23/05/2020",2020-05-23T00:00:00Z,27,Wet Mass Movement
Indonesia,2020,Indonesia: Floods - Central Kalimantan (East Kotawaringin Regency) - 06/09/2020,2020-09-06T00:00:00Z,4,Flood
Indonesia,2020,Indonesia: Floods - Central Kalimantan (Seruyan) - 07/09/2020,2020-09-07T00:00:00Z,16000,Flood
Indonesia,2020,"Indonesia: Landslide - South Sulawesi (Rembon District, Tana Toraja) - 26/03/2020",2020-03-26T00:00:00Z,7,Wet Mass Movement
Indonesia,2020,Indonesia: Flash Floods - West Nusa Tenggara (East Lombok) - 23/2/2020,2020-02-23T00:00:00Z,250,Flood
Indonesia,2020,Indonesia: Earthquake - North Sulawesi (Talaud Islands) - 09/09/2020,2020-09-09T00:00:00Z,100,Earthquake
Indonesia,2020,Indonesia: Floods - West Sumatra (Padang Pariaman Regency) - 20/11/2020,2020-11-20T00:00:00Z,260,Flood
Indonesia,2020,Indonesia: Flood - Maluku (Ambon City) - 03/10/2020,2020-10-03T00:00:00Z,100,Flood
Indonesia,2020,Indonesia: Flood - Bengkulu (Seluma Regency) - 05/10/2020,2020-10-05T00:00:00Z,490,Flood
Indonesia,2020,Indonesia: Floods - Papua (Jayapura City) - 30/09/2020,2020-09-30T00:00:00Z,5,Flood
Indonesia,2020,Indonesia: Flood - Gorontalo - 03/07/2020,2020-07-03T00:00:00Z,9400,Flood
Indonesia,2020,Indonesia: Earthquake - West Java (Sukabumi) - 10/03/2020,2020-03-10T00:00:00Z,330,Earthquake
Indonesia,2020,Indonesia: Earthquake - Central Sulawesi (Sigi District) - 28/03/2020,2020-03-28T00:00:00Z,7,Earthquake
Indonesia,2020,Indonesia: Flooding - DKI Jakarta - 21/09/2020,2020-09-21T00:00:00Z,100,Flood
Indonesia,2020,Indonesia: Earthquake - North Maluku (Morotai Islands Regency) - 04/06/2020,2020-06-04T00:00:00Z,51,Earthquake
Indonesia,2020,Indonesia: Flood - North Maluku (Sula Islands) - 04/07/2020,2020-07-04T00:00:00Z,170,Flood
Indonesia,2020,Indonesia: Flooding - Central Kalimantan (Lamandau Regency) - 06/09/2020,2020-09-06T00:00:00Z,280,Flood
Indonesia,2020,Indonesia: Landslide - West Sumatra (Tanah Datar Regency) - 05/04/2020,2020-04-05T00:00:00Z,14,Wet Mass Movement
Indonesia,2020,"Indonesia: Flood - West Java (Cilegon City, Banten Province) - 30/04/2020",2020-04-30T00:00:00Z,1800,Flood
Indonesia,2020,Indonesia: Flood - West Sumatra (Agam Regency) - 05/04/2020,2020-04-05T00:00:00Z,150,Flood
Indonesia,2020,Indonesia: Flood - South Kalimantan (Tanah Laut and Tanah Bumbu Regencies) - 03/09/2020,2020-09-03T00:00:00Z,660,Flood
Indonesia,2020,Indonesia: Floods - North Sumatra (Serdang Bedagai/ 5 districts) 08/11,2020-11-08T00:00:00Z,400,Flood
Indonesia,2020,Indonesia: Floods - West Kalimantan (Melawi Regency) - 09/07/2020,2020-07-09T00:00:00Z,180,Flood
Indonesia,2020,Indonesia: Flash Floods - Gorontalo (Bone Bolango Regency) - 11/06/2020,2020-06-11T00:00:00Z,400,Flood
Indonesia,2020,"Indonesia: Flood -  Jakarta (Kembangan Utara Village, Kembangan District) - 27/04/2020",2020-04-27T00:00:00Z,65,Flood
Indonesia,2020,Indonesia: Flooding - Central Kalimantan (Kotawaringin Barat Regency) - 16/10/2020,2020-10-16T00:00:00Z,130,Flood
Indonesia,2020,Indonesia: Flooding - East Java (Bondowoso) - 28/1/2020,2020-01-28T00:00:00Z,860,Flood
Indonesia,2020,Indonesia: Flooding - West Java (Sukabumi Regency) - 15/10/2020,2020-10-15T00:00:00Z,100,Flood
Indonesia,2020,Indonesia: Flood - Bengkulu (Rejang Lebong Regency) - 22/04/2020,2020-04-22T00:00:00Z,87,Flood
Indonesia,2020,"Indonesia: Floods - Jabodetabek (Jakarta), Banten, Bekasi - 24/2/2020",2020-02-24T00:00:00Z,46000,Flood
Indonesia,2020,Indonesia: Flooding - West Java (Bandung) - 18/2/2020,2020-02-18T00:00:00Z,420,Flood
Indonesia,2020,Indonesia: Flood -  Central Kalimantan (North Barito Regency) - 29/04/2020,2020-04-29T00:00:00Z,50,Flood
Indonesia,2020,Indonesia: Floods - North Sumatra (South Nias Regency) - 01/09/2020,2020-09-01T00:00:00Z,220,Flood
Indonesia,2020,Indonesia: Flooding - East Kalimantan (Samarinda) - 11/1/2020,2020-01-11T00:00:00Z,7500,Flood
Indonesia,2020,Indonesia: Tornado - North Sumatra (Langkat) - 10/06/2020,2020-06-10T00:00:00Z,33,Storm
Indonesia,2020,"Indonesia: Storm - West Java (Leuwiliang District, Bogor) - 23/05/2020",2020-05-23T00:00:00Z,6,Storm
Indonesia,2020,Indonesia: Flood - Gorontalo (Bone Bolango Regency) - 24/07/2020,2020-07-24T00:00:00Z,2500,Flood
Indonesia,2020,Indonesia: Storm - Bali (Bangli) - 07/02/2020,2020-02-07T00:00:00Z,14,Flood
Indonesia,2020,Indonesia: Riverine Flood - Central Sulawesi (Parigi Moutong Regency) - 07/10/2020,2020-10-07T00:00:00Z,17,Flood
Indonesia,2020,Indonesia: Flash Floods - West Kalimantan (Sanggau Regency) - 08/07/2020,2020-07-08T00:00:00Z,920,Flood
Indonesia,2020,Indonesia: Flood - South Sulawesi (North Luwu Regency) - 12/07/2020,2020-07-13T00:00:00Z,14000,Flood
Indonesia,2020,Indonesia: Flood - Aceh (Aceh Jaya) - 27/07/2020,2020-07-27T00:00:00Z,78,Flood
Indonesia,2020,Indonesia: Flood - Maluku (Seram Island) - 25/08/2020,2020-08-25T00:00:00Z,690,Flood
Indonesia,2020,Indonesia: Flood - Jambi (Bungo District) - 10/04/2020,2020-04-10T00:00:00Z,720,Flood
Indonesia,2020,Indonesia: Flood -  Lampung (Tanggamu Regency) - 30/09/2020,2020-09-30T00:00:00Z,2,Flood
Indonesia,2020,"Indonesia: Flood - North Sulawesi (West Dumoga, Central Dumoga, and North Dumoga - Bolaang Mongondow Regency) - 24/07/2020",2020-07-24T00:00:00Z,910,Flood
Indonesia,2020,Indonesia: Floods - Aceh (Aceh Utara and Bener Meriah Regency) - 16/06/2020,2020-06-16T00:00:00Z,360,Flood
Indonesia,2020,Indonesia: Flood - South Kalimantan Java (Tanah Laut Regency) - 20/06/2020,2020-06-20T00:00:00Z,65,Flood
Indonesia,2020,Indonesia: Flood - South Sulawesi (North Luwu Regency) - 19/06/2020,2020-06-19T00:00:00Z,51,Flood
Indonesia,2020,"Indonesia: Flood - South Kalimantan (Tanah Laut, Kotabaru, Tanah Bumbu Regencies) - 11/07/2020",2020-07-11T00:00:00Z,7200,Flood
Indonesia,2020,Indonesia: Flood - South Sulawesi (North Luwu Regency) - 17/06/2020,2020-06-17T00:00:00Z,24,Flood
Indonesia,2020,"Indonesia: Floods - North Sulawesi (Sangkub, Bintauna, East Bolangitang, West Bolangitang - North Bolaang Mongondow Regency) - 04/03/2020",2020-03-04T00:00:00Z,3700,Flood
Indonesia,2020,"Indonesia: Floods - North Sulawesi (Sang Buttonang, Bolaang Mongondow Regency) - 03/03/2020",2020-03-03T00:00:00Z,250,Flood
Indonesia,2020,"Indonesia: Flood - Special Capital Region of Jakarta, West Java, Banten - 31/12/2019",2019-12-31T00:00:00Z,397000,Flood
Indonesia,2020,Indonesia: Floods - Aceh (North Aceh Regency/23 Sub-districts) - 04/12/2020,2020-12-04T00:00:00Z,75000,Flood
Indonesia,2020,Indonesia: Floods - West Java (Subang) - 24/2/2020,2020-02-24T00:00:00Z,8600,Flood
Indonesia,2020,Indonesia: Floods - Central Java (Banyumas Regency) - 03/12/2020,2020-12-03T00:00:00Z,400,Flood
Indonesia,2020,Indonesia: Flood - Southeast Sulawesi (Konawe Regency) - 15/07/2020,2020-07-15T00:00:00Z,4000,Flood
Indonesia,2020,Indonesia: Flood - Maluku (Buru Regency) - 10/07/2020,2020-07-10T00:00:00Z,55,Flood
Indonesia,2020,Indonesia: Flood - West Java (Bandung) - 30/04/2020,2020-04-30T00:00:00Z,2000,Flood
Indonesia,2020,Indonesia: Floods - North Sumatra (Serdang Bedagai/Tebing Tinggi/ 5 sub-districts) 26/11,2020-11-26T00:00:00Z,3200,Flood
Indonesia,2020,Indonesia: Floods - North Sumatra (Medan City) - 03/12/2020,2020-12-03T00:00:00Z,180,Flood
Indonesia,2020,Indonesia: Floods - Aceh (East Aceh Regency/12 Districts) - 02/12/2020,2020-12-02T00:00:00Z,7200,Flood
Indonesia,2020,Indonesia: Floods - Banten (Pandeglang Regency/5 Districts) - 07/12/2020,2020-12-06T00:00:00Z,1300,Flood
Indonesia,2020,Indonesia: Floods - Aceh (Lhokseumawe City/Blang Mangat) - 08/12/2020,2020-12-08T00:00:00Z,1100,Flood
Indonesia,2020,Indonesia: Flood - West Kalimantan (Sintang Regency) - 12/07/2020,2020-07-12T00:00:00Z,220,Flood
Indonesia,2020,"Indonesia: Flood - Indonesia, Flooding in Rokan Hulu Regency, Riau Province - Riau (Rokan Hulu) - 23/12/2020",2020-12-23T00:00:00Z,80,Flood
Indonesia,2020,Indonesia: Storm - North Sumatra (Batubara Regency) - 01/09/2020,2020-09-01T00:00:00Z,29,Flood
Indonesia,2020,Indonesia: Flash Flood - Central Sulawesi (Parigi Moutong Regency) - 11/07/2020,2020-07-11T00:00:00Z,140,Flood
Indonesia,2020,Indonesia: Floods - Central Java (Semarang) - 07/03/2020,2020-03-07T00:00:00Z,24,Flood
Indonesia,2020,Indonesia: Floods - West Lombok (Gunung Sari) - 1/3/2020,2020-03-01T00:00:00Z,360,Flood
Indonesia,2020,Indonesia: Flood - North Sumatra (Deli Serdang/Sunggal/Tanjung Anom) - 07/12/2020,2020-12-04T00:00:00Z,460,Flood
Indonesia,2020,Indonesia: Flood - West Sumatra (Limapuluh Kota Regency) - 05/09/2020,2020-09-05T00:00:00Z,36,Flood
Indonesia,2020,Indonesia: Flooding - South Sulawesi (Luwu Regency) - 22/05/2020,2020-05-22T00:00:00Z,400,Flood
Indonesia,2020,Indonesia: Flood - South Sulawesi (Makassar) - 18/12/2020,2020-12-18T00:00:00Z,450,Flood
Indonesia,2020,Indonesia: Floods - East Nusa Tenggara (East Sumba) - 20/05/2020,2020-05-20T00:00:00Z,230,Flood
Indonesia,2020,Indonesia: Flood - Southeast Sulawesi (North Konawe Regency) - 08/07/2020,2020-07-08T00:00:00Z,1200,Flood
Indonesia,2020,Indonesia: Storm - North Sumatra (Pakpak Bharat Regency) - 22/09/2020,2020-09-22T00:00:00Z,550,Storm
Indonesia,2020,Indonesia: Landslides - West Java (West Bandung) - 11/2/2020,2020-02-11T00:00:00Z,36,Wet Mass Movement
Indonesia,2020,Indonesia: Storm - Aceh (South Aceh Regency) - 03/08/2020,2020-08-03T00:00:00Z,29,Storm
Indonesia,2020,"Indonesia: Storm - West Java (Rancabungur district, Bogor) - 28/05/2020",2020-05-28T00:00:00Z,2,Storm
Indonesia,2020,Indonesia: Floods - South Sulawesi (Jeneponto Regency) - 12/06/2020,2020-06-12T00:00:00Z,22,Flood
Indonesia,2020,Indonesia: Flooding - Bangka Belitung (Central Bangka Regency) - 18/10/2020,2020-10-18T00:00:00Z,250,Flood
Indonesia,2020,Indonesia: Floods - South Sumatra (South Ogan Komering Ulu Regency) - 08/05/2020,2020-05-08T00:00:00Z,10,Flood
Indonesia,2020,"Indonesia: Storm - West Java (Gunung Sindur district, Bogor) - 02/06/2020",2020-06-02T00:00:00Z,4,Storm
Indonesia,2020,Indonesia: Flood - West Java (Cianjur Regency) - 02/10/2020,2020-10-02T00:00:00Z,540,Flood
Indonesia,2020,"Indonesia: Landslides - West Java (Leuwisadeng, Bogor Regency) - 13/05/2020",2020-05-13T00:00:00Z,240,Wet Mass Movement
Indonesia,2020,Indonesia: Flooding - East Aceh (East Aceh) - 17/05/2020,2020-05-17T00:00:00Z,140,Flood
Indonesia,2020,Indonesia: Flooding - Bogor (Parung Panjang) - 19/05/2020,2020-05-19T00:00:00Z,15,Flood
Indonesia,2020,Indonesia: Flooding - East Nusa Tenggara (Malacca Regency) - 22/05/2020,2020-05-22T00:00:00Z,50,Flood
Indonesia,2020,Indonesia: Flash Floods - Central Aceh (Aceh Tengah) - 13/05/2020,2020-05-13T00:00:00Z,89,Flood
Indonesia,2020,"Indonesia: Storm - West Java (Caringin district, Bogor) - 29/05/2020",2020-05-29T00:00:00Z,5,Storm
Indonesia,2020,"Indonesia: Storm - West Java (Tajurhalang district, Bogor) - 29/05/2020",2020-05-29T00:00:00Z,2,Storm
Indonesia,2020,Indonesia: Floods - Aceh (Aceh Jaya Regency) - 08/05/2020,2020-05-08T00:00:00Z,710,Flood
Indonesia,2020,Indonesia: Flooding - West Java (Bekasi) - 24/10/2020,2020-10-24T00:00:00Z,500,Flood
Indonesia,2020,Indonesia: Flood - West Java (Ciamis Regency) - 27/10/2020,2020-10-27T00:00:00Z,25,Flood
Indonesia,2020,Indonesia: Flooding - North Maluku (Morotai Island) - 15/10/2020,2020-10-15T00:00:00Z,80,Flood
Indonesia,2020,Indonesia: Floods and Landslides - West Sulawesi (Polewali Mandar Regency) - 05/05/2020,2020-05-05T00:00:00Z,3800,Flood
Indonesia,2020,Indonesia: Storm - East Java (Blitar) - 07/02/2020,2020-02-07T00:00:00Z,11,Storm
Indonesia,2020,Indonesia: Storm - South Sulawesi (Pinrang Regency) - 27/10/2020,2020-10-27T00:00:00Z,11,Storm
Indonesia,2020,Indonesia: Storm - Lampung (Tulang Bawang Regency) - 20/05/2020,2020-05-20T00:00:00Z,240,Storm
Indonesia,2020,Indonesia: Storm - West Nusa Tenggara (Sumbawa Regency) - 09/11/2020,2020-11-09T00:00:00Z,350,Storm
Indonesia,2020,Indonesia: Storm - East Java (Bondowoso Regency) - 09/11/2020,2020-11-09T00:00:00Z,22,Storm
Indonesia,2020,Indonesia: Storm - West Java (Bogor Regency) - 06/10/2020,2020-10-06T00:00:00Z,8,Storm
Indonesia,2020,Indonesia: Flooding - West Sumatra (Mentawai Island) - 22/10/2020,2020-10-22T00:00:00Z,60,Flood
Indonesia,2020,Indonesia: Flood - Jakarta - 8/2/2020,2020-02-08T00:00:00Z,2500,Flood
Indonesia,2020,Indonesia: Flood - Central Java (Wonosobo Regency) - 11/10/2020,2020-10-11T00:00:00Z,14,Storm
Indonesia,2020,Indonesia: Flood - West Java (Cirebon) - 07/02/2020,2020-02-07T00:00:00Z,420,Flood
Indonesia,2020,Indonesia: Storm - South Kalimantan (Barito Kuala Regency) - 13/10/2020,2020-10-13T00:00:00Z,7,Storm
Indonesia,2020,Indonesia: Flooding - Central Java (Pekalongan) - 07/02/2020,2020-02-07T00:00:00Z,270,Flood
Indonesia,2020,Indonesia: Flooding - South Sulawesi (Barru Regency) - 12/1/2020,2020-01-12T00:00:00Z,11,Flood
Indonesia,2020,Indonesia: Flooding - Central Java (Blora Regency) - 16/1/2020,2020-01-16T00:00:00Z,250,Flood
Indonesia,2020,Indonesia: Storm - North Sumatra (Deli Serdang Regency) - 15/09/2020,2020-09-15T00:00:00Z,51,Storm
Indonesia,2020,Indonesia: Flooding - West Sumatra (Tanah Datar) - 16/1/2020,2020-01-16T00:00:00Z,36,Flood
Indonesia,2020,Indonesia: Storm - West Kalimantan (Singkawang city) - 20/09/2020,2020-09-20T00:00:00Z,22,Storm
Indonesia,2020,Indonesia: Landslide - North Sumatra (Simalungun Province) - 11/07/2020,2020-07-11T00:00:00Z,25,Wet Mass Movement
Indonesia,2020,Indonesia: Storm -  Banten (Pandeglang Regency) - 01/10/2020,2020-10-01T00:00:00Z,40,Storm
Indonesia,2020,Indonesia: Flooding - DKI Jakarta - 04/10/2020,2020-10-04T00:00:00Z,260,Flood
Indonesia,2020,Indonesia: Landslide -  West Java (Bogor) - 23/04/2020,2020-04-23T00:00:00Z,9,Wet Mass Movement
Indonesia,2020,Indonesia: Landslide - South Sulawesi (Tana Toraja Regency) - 04/04/2020,2020-04-04T00:00:00Z,72,Wet Mass Movement
Indonesia,2020,Indonesia: Floods - Central Sulawesi (Poso Regency) - 30/04/2020,2020-04-30T00:00:00Z,3600,Flood
Indonesia,2020,Indonesia: Floods - West Java (Cianjur Regency) - 28/04/2020,2020-04-28T00:00:00Z,4,Flood
Indonesia,2020,Indonesia: Landslide - North Sumatra (Deli Serdang) - 12/07/2020,2020-07-12T00:00:00Z,11,Wet Mass Movement
Indonesia,2020,Indonesia: Storm -  West Nusa Tenggara (West Lombok Regency) - 30/09/2020,2020-09-30T00:00:00Z,33,Storm
Indonesia,2020,Indonesia: Flood - Aceh (Kota Subulussalam) - 28/07/2020,2020-07-28T00:00:00Z,130,Flood
Indonesia,2020,Indonesia: Landslide - Southeast Aceh (Aceh Province) - 13/07/2020,2020-07-13T00:00:00Z,11,Wet Mass Movement
Indonesia,2020,Indonesia: Flood - Central Java (Cilacap Regency) - 26/10/2020,2020-10-26T00:00:00Z,900,Flood
Indonesia,2020,Indonesia: Flood - West Java (Garut Regency) - 11/10/2020,2020-10-11T00:00:00Z,1000,Flood
Indonesia,2020,Indonesia: Riverine Flood - Central Sulawesi (Donggala Regency) - 15/10/2020,2020-10-15T00:00:00Z,3600,Flood
Indonesia,2020,Indonesia: Riverine Flood - Central Sulawesi (Parigi Moutong) - 24/09/2020,2020-09-24T00:00:00Z,11,Flood
Indonesia,2020,Indonesia: Storm - West Kalimantan (Ketapang Regency) - 25/09/2020,2020-09-25T00:00:00Z,4,Flood
Indonesia,2020,"Indonesia: Flooding - West Java (Baleendah and Dayeuhkolot, Bandung) - 23/1/2020",2020-01-23T00:00:00Z,3900,Flood
Indonesia,2020,Indonesia: Floods - North Kalimantan (Nunukan Regency) - 27/09/2020,2020-09-27T00:00:00Z,200,Flood
Indonesia,2020,Indoniesia: Flood - Riau Islands Province (Anambas Islands) - 21/12/2020,2020-12-21T00:00:00Z,9,Flood
Indonesia,2020,Indonesia: Flood - West Java (Tasikmalaya Regency) - 12/10/2020,2020-10-12T00:00:00Z,1300,Flood
Indonesia,2020,Indonesia: Landslide - West Java (Tasikmalaya Regency) - 19/06/2020,2020-06-19T00:00:00Z,94,Wet Mass Movement
Indonesia,2020,Indonesia: Flooding - Central Kalimantan (Lamandau Regency) - 20/06/2020,2020-06-20T00:00:00Z,1100,Flood
Indonesia,2020,Indonesia: Flood - West Java (Cirebon) - 26/12/20,2020-12-26T00:00:00Z,30,Flood
Indonesia,2020,"Indonesia: Flash Floods - North Sulawesi (Manganitu district, Sangihe Islands) - 3/1/2020",2020-01-03T00:00:00Z,210,Flood
Indonesia,2020,Indonesia: Flood - Jambi (Jambi City) - 31/12/2020,2020-12-31T00:00:00Z,1200,Flood
Indonesia,2020,Indonesia: Floods - Banten (Lebak Regency) - 06/12/2020,2020-12-06T00:00:00Z,2,Flood
Indonesia,2020,Indonesia: Riverine Flood - Central Sulawesi (Parigi Moutong) - 15/09/2020,2020-09-15T00:00:00Z,11,Flood
Indonesia,2020,Indonesia: Riverine Flood - Central Sulawesi (Donggala) - 13/09/2020,2020-09-13T00:00:00Z,900,Flood
Indonesia,2020,Indonesia: Riverine Flooding - North Sumatra (Central Tapanuli) - 28/1/2020,2020-01-28T00:00:00Z,2500,Flood
Indonesia,2020,Indonesia: Flood -  South Sumatra (Banyu Asin Regency) - 18/04/2020,2020-04-18T00:00:00Z,87,Flood
Indonesia,2020,Indonesia: Landslide - South Sulawesi (Palopo City) - 26/06/2020,2020-06-26T00:00:00Z,33,Wet Mass Movement
Indonesia,2020,Indonesia: Landslide - West Java (Kuningan Regency) - 03/10/2020,2020-10-03T00:00:00Z,7,Wet Mass Movement
Indonesia,2020,"Indonesia: Flood - Central Java (Ketanggungan, Brebes) - 8/1/2020",2020-01-08T00:00:00Z,100,Flood
Indonesia,2020,Indonesia: Floods - West Java (Bandung Regency) - 20/03/2020,2020-03-20T00:00:00Z,3400,Flood
Indonesia,2020,Indonesia: Flood - Gorontalo (North Gorontalo/6 Districts) - 21/12/2020,2020-12-21T00:00:00Z,2300,Flood
Indonesia,2020,Indonesia: Landslide - West Java (Garut Regency) - 03/12/2020,2020-12-03T00:00:00Z,100,Wet Mass Movement
Indonesia,2020,Indonesia: Flash Floods - West Sumatra (South Solok Regency) - 30/10/2020,2020-10-30T00:00:00Z,10,Flood
Indonesia,2020,Indonesia: Flood -  Jakarta (Cilandak) - 26/04/2020,2020-04-26T00:00:00Z,10,Flood
Indonesia,2020,Indonesia: Tidal Floods - Central Java (Pekalongan) - 03/06/2020,2020-06-01T00:00:00Z,250,Flood
Indonesia,2020,Indonesia: Flood - North Sulawesi (Bolaang Mongondow Selatan Regency) - 22/06/2020,2020-06-22T00:00:00Z,4,Flood
Indonesia,2020,Indonesia: Flood - Central Java (Demak Regency) - 8/1/2020,2020-01-09T00:00:00Z,2700,Flood
Indonesia,2020,Indonesia: Flood - Central Kalimantan (Kotawaringin Barat Regency) - 22/06/2020,2020-06-22T00:00:00Z,600,Flood
Indonesia,2020,Indonesia: Floods - South Sulawesi (Luwu Regency) - 06/06/2020,2020-06-06T00:00:00Z,20,Flood
Indonesia,2020,Indonesia: Flood - DKI Jakarta - 10/10/2020,2020-10-10T00:00:00Z,2800,Flood
Indonesia,2021,Indonesia: Flood - South Kalimantan - 01/01/2021,2021-01-01T00:00:00Z,197000,Flood
Indonesia,2021,Indonesia: Landslide - East Nusa Tenggara - 01/01/2021,2021-01-01T00:00:00Z,38,Dry mass movement
Indonesia,2021,Indonesia: Flood - Central Java - 01/01/2021,2021-01-01T00:00:00Z,11000,Flood
Indonesia,2021,Indonesia: Earthquake - West Sulawesi - 01/01/2021,2021-01-01T00:00:00Z,95000,Earthquake
Indonesia,2021,Indonesia: Flood - West Sulawesi - 01/01/2021,2021-01-01T00:00:00Z,670,Flood
Indonesia,2021,Indonesia: Storm - Banten - 01/01/2021,2021-01-01T00:00:00Z,15,Storm
Indonesia,2021,Indonesia: Earthquake - Maluku - 01/01/2021,2021-01-01T00:00:00Z,8800,Earthquake
Indonesia,2021,Indonesia: Storm - Papua - 01/01/2021,2021-01-01T00:00:00Z,150,Storm
Indonesia,2021,Indonesia: Flood - Riau - 01/01/2021,2021-01-01T00:00:00Z,920,Flood
Indonesia,2021,Indonesia: Storm - West Sulawesi - 01/01/2021,2021-01-01T00:00:00Z,35,Storm
Indonesia,2021,Indonesia: Tidal Wave - Central Java - 01/01/2021,2021-01-01T00:00:00Z,610,Wet Mass Movement
Indonesia,2021,Indonesia: Flood - Aceh - 01/01/2021,2021-01-01T00:00:00Z,68000,Flood
Indonesia,2021,Indonesia: Tidal Wave - North Sulawesi - 01/01/2021,2021-01-01T00:00:00Z,180,Wet Mass Movement
Indonesia,2021,Indonesia: Earthquake - South Sulawesi - 01/01/2021,2021-01-01T00:00:00Z,4800,Earthquake
Indonesia,2021,Indonesia: Landslide - Central Java - 01/01/2021,2021-01-01T00:00:00Z,130,Dry mass movement
Indonesia,2021,Indonesia: Flood - North Sumatra - 01/01/2021,2021-01-01T00:00:00Z,15000,Flood
Indonesia,2021,Indonesia: Landslide - South Kalimantan - 01/01/2021,2021-01-01T00:00:00Z,130,Dry mass movement
Indonesia,2021,Indonesia: Landslide - North Sumatra - 01/01/2021,2021-01-01T00:00:00Z,810,Dry mass movement
Indonesia,2021,Indonesia: Storm - Riau - 01/01/2021,2021-01-01T00:00:00Z,20,Storm
Indonesia,2021,Indonesia: Storm - West Java - 01/01/2021,2021-01-01T00:00:00Z,170,Storm
Indonesia,2021,Indonesia: Flood - Maluku - 01/01/2021,2021-01-01T00:00:00Z,1200,Flood
Indonesia,2021,Indonesia: Volcanic eruption - East Java - 01/01/2021,2021-01-01T00:00:00Z,11000,Volcanic eruption
Indonesia,2021,Indonesia: Landslide - West Java - 01/01/2021,2021-01-01T00:00:00Z,4500,Dry mass movement
Indonesia,2021,Indonesia: Storm - Bangka Belitung Islands - 01/01/2021,2021-01-01T00:00:00Z,1,Storm
Indonesia,2021,Indonesia: Flood - Jambi - 01/01/2021,2021-01-01T00:00:00Z,150,Flood
Indonesia,2021,Indonesia: Storm - West Nusa Tenggara - 01/01/2021,2021-01-01T00:00:00Z,50,Storm
Indonesia,2021,Indonesia: Flood - Gorontalo - 01/01/2021,2021-01-01T00:00:00Z,390,Flood
Indonesia,2021,Indonesia: Flood - Central Kalimantan - 01/01/2021,2021-01-01T00:00:00Z,13000,Flood
Indonesia,2021,Indonesia: Tidal Wave - Riau - 01/01/2021,2021-01-01T00:00:00Z,150,Wet Mass Movement
Indonesia,2021,Indonesia: Earthquake - North Maluku - 01/01/2021,2021-01-01T00:00:00Z,170,Earthquake
Indonesia,2021,Indonesia: Storm - South Kalimantan - 01/01/2021,2021-01-01T00:00:00Z,3,Storm
Indonesia,2021,Indonesia: Flood - West Sumatra - 01/01/2021,2021-01-01T00:00:00Z,1100,Flood
Indonesia,2021,Indonesia: Earthquake - Central Sulawesi - 01/01/2021,2021-01-01T00:00:00Z,1100,Earthquake
Indonesia,2021,Indonesia: Flood - Southeast Sulawesi - 01/01/2021,2021-01-01T00:00:00Z,330,Flood
Indonesia,2021,Indonesia: Flood - East Nusa Tenggara - 01/01/2021,2021-01-01T00:00:00Z,63000,Flood
Indonesia,2021,Indonesia: Storm - Aceh - 01/01/2021,2021-01-01T00:00:00Z,14,Storm
Indonesia,2021,Indonesia: Earthquake - Bali - 01/01/2021,2021-01-01T00:00:00Z,19,Earthquake
Indonesia,2021,Indonesia: Storm - North Sumatra - 01/01/2021,2021-01-01T00:00:00Z,1,Storm
Indonesia,2021,Indonesia: Flood - East Kalimantan - 01/01/2021,2021-01-01T00:00:00Z,1000,Flood
Indonesia,2021,Indonesia: Flood - Banten - 01/01/2021,2021-01-01T00:00:00Z,8300,Flood
Indonesia,2021,Indonesia: Flood - Riau Islands - 01/01/2021,2021-01-01T00:00:00Z,2000,Flood
Indonesia,2021,Indonesia: Flood - West Nusa Tenggara - 01/01/2021,2021-01-01T00:00:00Z,9100,Flood
Indonesia,2021,Indonesia: Flood - Central Sulawesi - 01/01/2021,2021-01-01T00:00:00Z,1200,Flood
Indonesia,2021,Indonesia: Earthquake - East Java - 01/01/2021,2021-01-01T00:00:00Z,2100,Earthquake
Indonesia,2021,Indonesia: Flood - South Sumatra - 01/01/2021,2021-01-01T00:00:00Z,360,Flood
Indonesia,2021,Indonesia: Storm - East Nusa Tenggara - 01/01/2021,2021-01-01T00:00:00Z,630,Storm
Indonesia,2021,Indonesia: Flood - Lampung - 01/01/2021,2021-01-01T00:00:00Z,15,Flood
Indonesia,2021,Indonesia: Flood - West Java - 01/01/2021,2021-01-01T00:00:00Z,138000,Flood
Indonesia,2021,Indonesia: Storm - East Java - 01/01/2021,2021-01-01T00:00:00Z,2,Storm
Indonesia,2021,Indonesia: Tidal Wave - Papua - 01/01/2021,2021-01-01T00:00:00Z,190,Wet Mass Movement
Indonesia,2021,Indonesia: Storm - West Kalimantan - 01/01/2021,2021-01-01T00:00:00Z,9,Storm
Indonesia,2021,Indonesia: Flood - North Sulawesi - 01/01/2021,2021-01-01T00:00:00Z,4200,Flood
Indonesia,2021,Indonesia: Flood - West Kalimantan - 01/01/2021,2021-01-01T00:00:00Z,49000,Flood
Indonesia,2021,Indonesia: Flood - Papua - 01/01/2021,2021-01-01T00:00:00Z,5500,Flood
Indonesia,2021,Indonesia: Storm - Central Java - 01/01/2021,2021-01-01T00:00:00Z,98,Storm
Indonesia,2021,Indonesia: Wildfire - West Kalimantan - 01/01/2021,2021-01-01T00:00:00Z,1,Wildfire
Indonesia,2021,Indonesia: Flood - Bengkulu - 01/01/2021,2021-01-01T00:00:00Z,2700,Flood
Indonesia,2021,Indonesia: Landslide - West Kalimantan - 01/01/2021,2021-01-01T00:00:00Z,30,Dry mass movement
Indonesia,2021,Indonesia: Flood - Special Capital Region of Jakarta - 01/01/2021,2021-01-01T00:00:00Z,7800,Flood
Indonesia,2021,Indonesia: Earthquake - East Nusa Tenggara - 01/01/2021,2021-01-01T00:00:00Z,1600,Earthquake
Indonesia,2021,Indonesia: Flood - North Maluku - 01/01/2021,2021-01-01T00:00:00Z,3700,Flood
Indonesia,2021,Indonesia: Storm - Southeast Sulawesi - 01/01/2021,2021-01-01T00:00:00Z,5,Storm
Indonesia,2021,Indonesia: Storm - Maluku - 01/01/2021,2021-01-01T00:00:00Z,5,Storm
Indonesia,2021,Indonesia: Storm - South Sulawesi - 01/01/2021,2021-01-01T00:00:00Z,280,Storm
Indonesia,2021,Indonesia: Flood - South Sulawesi - 01/01/2021,2021-01-01T00:00:00Z,6500,Flood
Indonesia,2021,Indonesia: Landslide - East Kalimantan - 01/01/2021,2021-01-01T00:00:00Z,15,Dry mass movement
Indonesia,2021,Indonesia: Storm - North Sulawesi - 01/01/2021,2021-01-01T00:00:00Z,88,Storm
Indonesia,2021,Indonesia: Landslide - East Java - 01/01/2021,2021-01-01T00:00:00Z,380,Dry mass movement
Indonesia,2021,Indonesia: Flood - East Java - 01/01/2021,2021-01-01T00:00:00Z,5200,Flood
India,2008,,2008-09-14T00:00:00Z,2400000,Flood
India,2008,,2008-05-07T00:00:00Z,2800,Flood
India,2008,,2008-08-30T00:00:00Z,2100000,Flood
India,2008,FL-2008-000089-IND,2008-11-06T00:00:00Z,2056000,Flood
India,2008,,2008-08-02T00:00:00Z,1500,Wet Mass Movement
India,2008,TC-2008-000237-IND,2008-11-27T00:00:00Z,102000,Flood
India,2009,,2009-01-01T00:00:00Z,4000,Storm
India,2009,2009-000122,2009-01-01T00:00:00Z,500000,Flood
India,2009,Cyclone 'Aila',2009-01-01T00:00:00Z,2300000,Storm
India,2009,2009-000217,2009-01-01T00:00:00Z,2500000,Flood
India,2010,2010-000243,2010-01-01T00:00:00Z,300000,Flood
India,2010,,2010-01-01T00:00:00Z,455000,Storm
India,2010,,2010-01-01T00:00:00Z,50000,Flood
India,2010,,2010-01-01T00:00:00Z,5000,Storm
India,2010,Cyclone 'Laila',2010-01-01T00:00:00Z,78000,Storm
India,2010,2010-000205-PHL,2010-01-01T00:00:00Z,523000,Flood
India,2011,Could be Odisha Floods,2011-01-01T00:00:00Z,280000,Flood
India,2011,Cyclone Thane,2011-01-01T00:00:00Z,250000,Storm
India,2011,Could be Odisha Floods,2011-01-01T00:00:00Z,130000,Flood
India,2011,Could be related to Assam,2011-01-01T00:00:00Z,8000,Flood
India,2011,EQ-2011-000136-IND,2011-01-01T00:00:00Z,75000,Earthquake
India,2011,Assam floods,2011-01-01T00:00:00Z,570000,Flood
India,2011,Odisha Floods,2011-01-01T00:00:00Z,190000,Flood
India,2012,,2012-01-01T00:00:00Z,210000,Storm
India,2012,,2012-01-01T00:00:00Z,2000000,Flood
India,2012,,2012-01-01T00:00:00Z,6900000,Flood
India,2013,Monsoon Floods,2013-06-01T00:00:00Z,1042000,Flood
India,2013,Cyclone Phailin,2013-10-12T00:00:00Z,1000000,Storm
India,2013,Storm Helen,2013-11-21T00:00:00Z,20000,Storm
India,2013,Cyclone Lehar,2013-11-27T00:00:00Z,26000,Storm
India,2013,Jammu and Kashmir Earthquake,2013-05-01T00:00:00Z,56000,Earthquake
India,2014,Madhya Pradesh flood,2014-07-21T00:00:00Z,2000,Flood
India,2014,Uttar Pradesh floods,2014-08-16T00:00:00Z,62000,Flood
India,2014,Kangra,2014-08-16T00:00:00Z,70,Flood
India,2014,Odisha floods,2014-07-22T00:00:00Z,1074000,Flood
India,2014,Assam floods (July-August),2014-08-17T00:00:00Z,163000,Flood
India,2014,Flood risk evacuations in Bihar (landslide in Nepal),2014-08-02T00:00:00Z,130000,Flood
India,2014,Cyclone Hudhud,2014-10-12T00:00:00Z,639000,Storm
India,2014,Assam and Meghalaya floods (Sept-Oct),2014-09-21T00:00:00Z,367000,Flood
India,2014,Bihar floods,2014-08-19T00:00:00Z,116000,Flood
India,2014,Tropical cyclone Nilofar,2014-10-27T00:00:00Z,30000,Storm
India,2014,Jammu and Kashmir floods,2014-09-02T00:00:00Z,812000,Flood
India,2014,Assam floods (June),2014-06-25T00:00:00Z,9500,Flood
India,2014,Chhattisgarh flood,2014-07-21T00:00:00Z,200,Flood
India,2014,Vadodara flood,2014-09-10T00:00:00Z,22000,Flood
India,2015,Gorkha earthquake - repercussions in India,2015-04-25T00:00:00Z,25000,Earthquake
India,2015,Andhra Pradesh and Tamil Nadu floods,2015-11-08T00:00:00Z,1801000,Flood
India,2015,Bihar nor'wester,2015-04-21T00:00:00Z,118000,Storm
India,2015,Assam floods (June),2015-06-05T00:00:00Z,9000,Flood
India,2015,Assam floods (Jun-Jul),2015-06-29T00:00:00Z,75,Flood
India,2015,Assam floods (late August-September),2015-08-29T00:00:00Z,267000,Flood
India,2015,Andhra Pradesh flood,2015-11-21T00:00:00Z,34000,Flood
India,2015,Northern Afghanistan earthquake - repercussions in India,2015-10-26T00:00:00Z,10,Earthquake
India,2015,Joumol village landslide,2015-08-01T00:00:00Z,56,Mass movement
India,2015,Darjeeling landslide,2015-06-23T00:00:00Z,1000,Wet Mass Movement
India,2015,Gujarat flood,2015-06-23T00:00:00Z,10000,Flood
India,2015,Jammu and Kashmir flood,2015-03-30T00:00:00Z,9400,Flood
India,2015,Monsoon floods/Cyclone Komen,2015-07-26T00:00:00Z,1200000,Flood
India,2015,Dust storm in Chara Panchla Badamtala,2015-07-01T00:00:00Z,200,Storm
India,2015,Assam floods (mid-August),2015-08-17T00:00:00Z,180000,Flood
India,2015,Tamil Nadu flash flood (May),2015-05-17T00:00:00Z,200,Flood
India,2016,Earthquake in Manipur,2016-01-04T00:00:00Z,10000,Earthquake
India,2016,Floods in Odisha,2016-08-13T00:00:00Z,3500,Flood
India,2016,Uttarakhand floods (July-August),2016-07-17T00:00:00Z,850,Flood
India,2016,Tropical Cyclone Vardah,2016-12-06T00:00:00Z,17000,Storm
India,2016,Floods in Arunachal Pradesh,2016-07-23T00:00:00Z,7200,Flood
India,2016,Madhya Pradesh floods,2016-07-07T00:00:00Z,55000,Flood
India,2016,Floods in Maharasthra,2016-07-18T00:00:00Z,8400,Flood
India,2016,Uttar Pradesh floods,2016-07-16T00:00:00Z,128000,Flood
India,2016,Floods in North Bengal,2016-07-24T00:00:00Z,200,Flood
India,2016,Uttarakhand floods (June),2016-06-07T00:00:00Z,1500,Flood
India,2016,Floods in Nagaland,2016-04-25T00:00:00Z,240,Flood
India,2016,Assam floods,2016-07-03T00:00:00Z,495000,Flood
India,2016,Bihar floods,2016-07-01T00:00:00Z,1670000,Flood
India,2016,Roanu-related floods in Manipur,2016-05-21T00:00:00Z,2500,Flood
India,2016,Floods in Sikkin,2016-08-25T00:00:00Z,150,Flood
India,2017,India: flash flood -  Manipur - 13/06/2017,2017-06-13T00:00:00Z,1900,Flood
India,2017,India: monsoon floods - 8 states - 01/06/2017 - 15/10/2017,2017-06-01T00:00:00Z,1344000,Flood
India,2017,Bangladesh; India; Myanmar : Tropical cyclone Mora  - 28/05/2017,2017-05-28T00:00:00Z,240,Storm
India,2018,India: Landslide risk - Shamsabri; Jammu and Kashmir - November 2018,2018-11-01T00:00:00Z,140,Wet Mass Movement
India,2018,India: Storm - Uttar Pradesh; Andhra Pradesh; West Bengal; Delhi; Uttarakhand - 13/05/2018,2018-05-13T00:00:00Z,200,Storm
India,2018,India: Forest fire - Dangeni village; Kullu district - 23/02/2018,2018-02-23T00:00:00Z,80,Wildfire
India,2018,India: Southwest monsoon - 29/05/2018,2018-05-29T00:00:00Z,1967000,Flood
India,2018,India: Forest fire - Kangra - May 2018,2018-05-31T00:00:00Z,9,Wildfire
India,2018,India; Sri Lanka: Tropical Cyclone Gaja - 15/11/2018,2018-11-15T00:00:00Z,249000,Storm
India,2018,India: Flood - Tripura - 06/05/2018,2018-05-06T00:00:00Z,23000,Flood
India,2018,India: Tropical Cyclone Daye - Odisha - 21/09/2018,2018-09-21T00:00:00Z,3700,Storm
India,2018,India: Tropical Cyclone Phethai - Andhra Pradesh; Odisha; West Bengal - 17/12/2018,2018-12-17T00:00:00Z,32000,Storm
India,2018,India: Cyclone Titli - Odisha; Andhra Pradesh - 10/10/2018,2018-10-10T00:00:00Z,400000,Storm
India,2019,India: Northeast monsoon - 16/10/2019,2019-10-16T00:00:00Z,23000,Flood
India,2019,India: Storms - Maharashtra; Manipur - 14/04/2019,2019-04-14T00:00:00Z,710,Storm
India,2019,"India: Floods - North Tripura, Unakoti; Dhalai districts; Tripura - 25/05/2019",2019-05-25T00:00:00Z,740,Flood
India,2019,India; Bangladesh: Severe cyclonic storm Bulbul - 05/11/2019,2019-11-05T00:00:00Z,186000,Storm
India,2019,India: Hailstorm - Delhi; Uttar Pradesh - 07/02/2019,2019-02-07T00:00:00Z,1100,Storm
India,2019,India; Bangladesh: Cyclone Fani - 02/05/2019 ,2019-05-02T00:00:00Z,1821000,Storm
India,2019,"India: Tropical Cyclone Vayu - Gujarat, Diu - 12/06/2019",2019-06-12T00:00:00Z,289000,Storm
India,2019,India: Southwest monsoon - June 2019,2019-06-08T00:00:00Z,2623000,Flood
India,2019,India: Avalanches and landslides - Kashmir - February 2019,2019-02-07T00:00:00Z,170,Wet Mass Movement
India,2019,India: Drought - 19 states - 01/01/2019,2019-01-01T00:00:00Z,63000,Drought
India,2019,"India: Cyclone Maha - Kerala, Lakshadweep islands - 31/10/2019",2019-10-31T00:00:00Z,2800,Storm
India,2019,"India: Thunderstorm - Dhalai, Unakoti, Tripura districts - 01/04/2019 ",2019-04-01T00:00:00Z,5900,Storm
India,2020,India: Landslide - Assam (Cachar) - 02/06/2020,2020-06-02T00:00:00Z,8,Wet Mass Movement
India,2020,India: Flood [monsoon] - Kerala - June 2020,2020-06-01T00:00:00Z,25000,Flood
India,2020,India: Flood [monsoon] - Madhya Pradesh - 15/06/2020,2020-06-15T00:00:00Z,9300,Flood
India,2020,India: Flood [monsoon] - Arunachal Pradesh - 01/05/2020,2020-05-01T00:00:00Z,680,Flood
India,2020,India: Flood [monsoon] - Uttarakhand - 15/06/2020,2020-06-15T00:00:00Z,470,Flood
India,2020,India: Riverbank erosion - West Bengal (Malda) - 30/08/2020,2020-08-30T00:00:00Z,1300,Wet Mass Movement
India,2020,India: River erosion - West Bengal (Murshidabad) - 12/08/2020,2020-08-12T00:00:00Z,3000,Wet Mass Movement
India,2020,India: Flood [monsoon] - Karnataka - June 2020,2020-06-01T00:00:00Z,6800,Flood
India,2020,India: Flood [monsoon] - Assam - 16/06/2020,2020-06-16T00:00:00Z,135000,Flood
India,2020,India: Flood [monsoon] - Haryana (Gurgaon) -  19/08/2020,2020-08-19T00:00:00Z,2,Flood
India,2020,India: Flash flood [monsoon] - Sikkim (West Sikkim) - 27/06/2020,2020-06-27T00:00:00Z,14,Wet Mass Movement
India,2020,India: Landslide - Arunachal Pradesh - 26/05/2020,2020-05-26T00:00:00Z,9,Wet Mass Movement
India,2020,India: Erosion - Bihar (Madhubani) - September 2020,2020-09-01T00:00:00Z,33,Wet Mass Movement
India,2020,India: Flood [monsoon] - Bihar - June 2020,2020-06-01T00:00:00Z,32000,Flood
India,2020,India: Flood [monsoon] - Kerala - 01/10/2020,2020-10-01T00:00:00Z,5,Flood
India,2020,India: Landslide [monsoon] - Sikkim (South Sikkim) - 05/08/2020,2020-08-05T00:00:00Z,9,Wet Mass Movement
India,2020,India: Flood [monsoon] - Uttar Pradesh - 01/06/2020,2020-06-01T00:00:00Z,5900,Flood
India,2020,India: Flash flood - Telangana (Hyderabad) - 17/10/2020,2020-10-17T00:00:00Z,9900,Flood
India,2020,India: Flash flood - Telangana - 13/10/2020,2020-10-13T00:00:00Z,3800,Flood
India,2020,"India: Flash flood - Karnataka (Kalaburagi, Bidar) - 13/10/2020",2020-10-13T00:00:00Z,39000,Flood
India,2020,India: Riverine flood - Assam - 23/05/2020,2020-05-23T00:00:00Z,22000,Flood
India,2020,India: Flash flood - Maharashtra (Mumbai) - 22/09/2020,2020-09-22T00:00:00Z,50,Flood
India,2020,India: Flash flood [monsoon] - Rajasthan - 15/08/2020,2020-08-15T00:00:00Z,240,Flood
India,2020,India: Flash flood - Meghalaya (West Garo Hills) - 24/05/2020,2020-05-24T00:00:00Z,1600,Flood
India,2020,"India: Tropical Cyclone NIVAR - Tamil Nadu, Andhra Pradesh, Puducherry - 23/11/2020",2020-11-23T00:00:00Z,272000,Storm
India,2020,India: Landslide [monsoon] - Sikkim (North Sikkim) - 27/06/2020,2020-06-27T00:00:00Z,170,Wet Mass Movement
India,2020,"Sri Lanka, India: Tropical Cyclone Burevi - 30/11/2020",2020-11-30T00:00:00Z,73000,Storm
India,2020,India: Landslides - Sikkim (North Sikkim) [monsoon] - 24/05/2020,2020-05-24T00:00:00Z,60,Wet Mass Movement
India,2020,India: Storm [monsoon] - Maharashtra (Mumbai) - 18/06/2020,2020-06-18T00:00:00Z,5,Storm
India,2020,India: Landslides - Jammu - 27/03/2020,2020-03-27T00:00:00Z,190,Wet Mass Movement
India,2020,India: Landslide [monsoon] - Assam (Kamrup) - 25/06/2020,2020-06-25T00:00:00Z,1,Wet Mass Movement
India,2020,India: Flood - Jammu and Kashmir - June 2020,2020-06-01T00:00:00Z,14,Flood
India,2020,India: Landslide - Assam (Kamrup) - 12/07/2020,2020-07-12T00:00:00Z,24,Wet Mass Movement
India,2020,India: Cyclone Nisarga - Countrywide - 02/06/2020,2020-06-01T00:00:00Z,170000,Storm
India,2020,India: Flood [monsoon] - Telangana - 10/08/2020,2020-08-10T00:00:00Z,35000,Flood
India,2020,India: Tornado [monsoon] - Odisha (Kendrapara) - 15/06/2020,2020-06-15T00:00:00Z,100,Storm
India,2020,India: Landslide - Assam (Cachar) - 01/06/2020,2020-06-01T00:00:00Z,8,Wet Mass Movement
India,2020,India: Landslide [monsoon] - Assam (Dima-Hasao) - 26/06/2020,2020-06-26T00:00:00Z,14,Wet Mass Movement
India,2020,India: Hailstorm - Mizoram - 23/04/2020,2020-04-23T00:00:00Z,220,Storm
India,2020,India: Hailstorm - Tripura - 21/04/2020,2020-04-21T00:00:00Z,4200,Storm
India,2020,India: Flood [monsoon] - Tamil Nadu - August 2020,2020-08-03T00:00:00Z,1400,Flood
India,2020,India: Flood [monsoon] - Himachal Pradesh - 24/06/2020,2020-06-24T00:00:00Z,640,Flood
India,2020,India: Flood [monsoon] - Maharashtra - August 2020,2020-08-17T00:00:00Z,14000,Flood
India,2020,India: Flood - Andhra Pradesh - 11/10/2020,2020-10-11T00:00:00Z,52000,Flood
India,2020,India: Flood [monsoon] - West Bengal - 26/06/2020,2020-06-26T00:00:00Z,14000,Flood
India,2020,"India, Bangladesh, Myanmar, Bhutan: Cyclone Amphan - Countrywide - 11/05/2020",2020-05-16T00:00:00Z,2441000,Storm
India,2020,India: Flood [monsoon] - Gujarat - June 2020,2020-06-01T00:00:00Z,34000,Flood
India,2020,India: Landslide - Assam (Karimganj) - 01/06/2020,2020-06-01T00:00:00Z,5,Wet Mass Movement
India,2020,India: Landslide - Assam (Karimganj) - 02/06/2020,2020-06-02T00:00:00Z,5,Wet Mass Movement
India,2020,India: Landslide - Assam (Dima-Hasao) - 03/06/2020,2020-06-03T00:00:00Z,71,Wet Mass Movement
India,2020,India: Landslide - Assam ( Hailakandi) - 02/06/2020,2020-06-02T00:00:00Z,11,Wet Mass Movement
India,2020,India: Landslide [monsoon] - Assam (Kamrup) - 18/06/2020,2020-06-18T00:00:00Z,5,Wet Mass Movement
India,2020,India: Flood [monsoon] - Chhattisgarh - June 2020,2020-06-01T00:00:00Z,23000,Flood
India,2020,India: Landslide - Assam (Hailakandi) - 01/06/2020,2020-06-01T00:00:00Z,11,Wet Mass Movement
India,2020,India: Flood - Assam (Nagaon) - 28/09/2020,2020-09-28T00:00:00Z,430,Flood
India,2020,India: Flood [monsoon] - Odisha - 13/08/2020,2020-08-13T00:00:00Z,334000,Flood
India,2020,India: Flood [monsoon] - Andhra Pradesh - 01/06/2020,2020-06-01T00:00:00Z,86000,Flood
India,2020,India: Flood [monsoon] - Punjab - June 2020,2020-06-01T00:00:00Z,1300,Flood
India,2020,India: Flood [monsoon] - Nagaland - 01/04/2020,2020-04-01T00:00:00Z,2900,Flood
India,2020,India: Flood [monsoon] - Meghalaya - 01/04/2020,2020-04-01T00:00:00Z,990,Flood
India,2021,India: Flood [monsoon] - Uttarakhand - 01/06/2021,2021-06-01T00:00:00Z,5,Flood
India,2021,India: Flood [monsoon] - Bihar - 01/06/2021,2021-06-01T00:00:00Z,26000,Flood
India,2021,India: Flood [monsoon] - Himachal Pradesh - 01/06/2021,2021-06-01T00:00:00Z,47,Flood
India,2021,India: Flood [monsoon] - Madhya Pradesh - 01/06/2021,2021-06-01T00:00:00Z,33000,Flood
India,2021,India: Flood [monsoon] - Himachal Pradesh - 01/06/2021,2021-06-01T00:00:00Z,24,Flood
India,2021,India: Flood [monsoon] - Uttar Pradesh - 01/06/2021,2021-06-01T00:00:00Z,7500,Flood
India,2021,India: Flood [monsoon] - Uttar Pradesh - 01/06/2021,2021-06-01T00:00:00Z,30000,Flood
India,2021,India: Flood [monsoon] - Gujarat - 01/06/2021,2021-06-01T00:00:00Z,9700,Flood
India,2021,India: Flood [monsoon] - Uttarakhand - 01/06/2021,2021-06-01T00:00:00Z,9,Flood
India,2021,India: Flood [monsoon] - Gujarat - 01/06/2021,2021-06-01T00:00:00Z,33,Flood
India,2021,India: Flood [monsoon] - Gujarat - 01/06/2021,2021-06-01T00:00:00Z,80,Flood
India,2021,India: Flood [monsoon] - Gujarat - 01/06/2021,2021-06-01T00:00:00Z,100,Flood
India,2021,India: Flood - Kerala - 08/11/2021,2021-11-08T00:00:00Z,14000,Flood
India,2021,India: Flood [monsoon] - Andhra Pradesh - 01/06/2021,2021-06-01T00:00:00Z,100,Flood
India,2021,India: Flood [monsoon] - Madhya Pradesh - 01/06/2021,2021-06-01T00:00:00Z,5,Flood
India,2021,India: Flood [monsoon] - Jammu and Kashmir - 01/06/2021,2021-06-01T00:00:00Z,89,Flood
India,2021,India: Flood [monsoon] - Gujarat - 01/06/2021,2021-06-01T00:00:00Z,50,Flood
India,2021,India: Flood [monsoon] - Gujarat - 01/06/2021,2021-06-01T00:00:00Z,3300,Flood
India,2021,India: Flood [monsoon] - Gujarat - 01/06/2021,2021-06-01T00:00:00Z,5,Flood
India,2021,India: Flood [monsoon] - Madhya Pradesh - 01/06/2021,2021-06-01T00:00:00Z,85,Flood
India,2021,India: Flood [monsoon] - Karnataka - 01/06/2021,2021-06-01T00:00:00Z,350,Flood
India,2021,India: Flood [monsoon] - Punjab - 01/06/2021,2021-06-01T00:00:00Z,24,Flood
India,2021,India: Flood [monsoon] - Karnataka - 01/06/2021,2021-06-01T00:00:00Z,60,Flood
India,2021,India: Flood [monsoon] - Punjab - 01/06/2021,2021-06-01T00:00:00Z,45,Flood
India,2021,India: Flood [monsoon] - Uttarakhand - 01/06/2021,2021-06-01T00:00:00Z,1400,Flood
India,2021,India: Tropical Storm Jawad - 4 States - 02/12/2021,2021-12-02T00:00:00Z,5000,Storm
India,2021,India: Tropical Storm Jawad - 4 States - 02/12/2021,2021-12-02T00:00:00Z,4200,Storm
India,2021,India: Flood [monsoon] - Uttarakhand - 01/06/2021,2021-06-01T00:00:00Z,56,Flood
India,2021,India: Flood [monsoon] - Madhya Pradesh - 01/06/2021,2021-06-01T00:00:00Z,9,Flood
India,2021,"India: Cyclone Gulab - Odisha, Andhra Pradesh - 24/09/2021",2021-09-24T00:00:00Z,3900,Storm
India,2021,"India: Flooding - Andhra Pradesh, Karnataka, Puducherry - 18/11/2021",2021-11-18T00:00:00Z,2300,Flood
India,2021,India: Avalanche - J&K (Kulgam) - 06/01/2021,2021-01-06T00:00:00Z,100,Wet Mass Movement
India,2021,India: Flood - Kerala - 28/11/2021,2021-11-28T00:00:00Z,1200,Flood
India,2021,"India, Bangladesh: Tropical Cyclone Yaas - 23/05/2021",2021-05-23T00:00:00Z,17000,Storm
India,2021,"India, Bangladesh: Tropical Cyclone Yaas - 23/05/2021",2021-05-23T00:00:00Z,703000,Storm
India,2021,India: Flood [monsoon] - Assam -  01/06/2021,2021-06-01T00:00:00Z,10000,Flood
India,2021,"India, Bangladesh: Tropical Cyclone Yaas - 23/05/2021",2021-05-23T00:00:00Z,1505000,Storm
India,2021,"India, Bangladesh: Tropical Cyclone Yaas - 23/05/2021",2021-05-23T00:00:00Z,610,Storm
India,2021,India: Dam release floods - Tamil Nadu - 13/01/2021,2021-01-13T00:00:00Z,840,Flood
India,2021,India: Flood [monsoon] - Uttarakhand - 01/06/2021,2021-06-01T00:00:00Z,19,Flood
India,2021,India: Flood [monsoon] - Himachal Pradesh - 01/06/2021,2021-06-01T00:00:00Z,19,Flood
India,2021,India: Storm - Uttarakhand (Chamoli) - 04/05/2021,2021-05-04T00:00:00Z,150,Storm
India,2021,India: Flood [monsoon] - Andhra Pradesh - 01/06/2021,2021-06-01T00:00:00Z,5700,Flood
India,2021,India: Flood [monsoon] - Bihar - 01/06/2021,2021-06-01T00:00:00Z,208000,Flood
India,2021,India: Flood [monsoon] - Bihar - 01/06/2021,2021-06-01T00:00:00Z,125000,Flood
India,2021,"India: Flooding - Andhra Pradesh, Karnataka, Puducherry - 18/11/2021",2021-11-18T00:00:00Z,80000,Flood
India,2021,India: Flood [monsoon] - Tamil Nadu - 01/06/2021,2021-06-01T00:00:00Z,19,Flood
India,2021,India: GLOF - Uttarakhand (Chamoli) - 07/02/2021,2021-02-07T00:00:00Z,230,Mass movement
India,2021,India: Flood [monsoon] - Karnataka - 01/06/2021,2021-06-01T00:00:00Z,340,Flood
India,2021,India: Flood [monsoon] - Karnataka - 01/06/2021,2021-06-01T00:00:00Z,189000,Flood
India,2021,India: Flood [monsoon] - Karnataka - 01/06/2021,2021-06-01T00:00:00Z,1000,Flood
India,2021,India: Flood [monsoon] - Karnataka - 01/06/2021,2021-06-01T00:00:00Z,60,Flood
India,2021,India: Flood - Tamil Nadu - 26/11/2021,2021-11-26T00:00:00Z,78000,Flood
India,2021,India: Flood [monsoon] - Karnataka - 01/06/2021,2021-06-01T00:00:00Z,10,Flood
India,2021,India: Flood [monsoon] - Bihar - 01/06/2021,2021-06-01T00:00:00Z,1000,Flood
India,2021,India: Flood [monsoon] - Maharashtra - 01/06/2021,2021-06-01T00:00:00Z,436000,Flood
India,2021,India: Flood [monsoon] - Kerala - 01/06/2021,2021-06-01T00:00:00Z,36000,Flood
India,2021,India: Flood [monsoon] - Tripura - 01/06/2021,2021-06-01T00:00:00Z,730,Flood
India,2021,India: Flood [monsoon] - Odisha - 01/06/2021,2021-06-01T00:00:00Z,62000,Flood
India,2021,India: Flood [monsoon] - Bihar - 01/06/2021,2021-06-01T00:00:00Z,4000,Flood
India,2021,India: Flood [monsoon] - Bihar - 01/06/2021,2021-06-01T00:00:00Z,140,Flood
India,2021,India: Flood [monsoon] - Andhra Pradesh - 01/06/2021,2021-06-01T00:00:00Z,6200,Flood
India,2021,India: Cyclone Tauktae - 14/05/2021,2021-05-14T00:00:00Z,258000,Storm
India,2021,India: Flood - Puducherry - 30/11/2021,2021-11-30T00:00:00Z,220,Flood
India,2021,India: Flood [monsoon] - Himachal Pradesh - 01/06/2021,2021-06-01T00:00:00Z,66,Flood
India,2021,India: Flood [monsoon] - Nagaland - 01/06/2021,2021-06-01T00:00:00Z,9,Flood
India,2021,"India: Cyclone Gulab - Odisha, Andhra Pradesh - 24/09/2021",2021-09-24T00:00:00Z,46000,Storm
India,2021,India: Flood [monsoon] - Himachal Pradesh - 01/06/2021,2021-06-01T00:00:00Z,42,Flood
India,2021,India: Flood [monsoon] - Himachal Pradesh - 01/06/2021,2021-06-01T00:00:00Z,28,Flood
India,2021,"India: Flooding - Andhra Pradesh, Karnataka, Puducherry - 18/11/2021",2021-11-18T00:00:00Z,1500,Flood
India,2021,India: Flood [monsoon] - Himachal Pradesh - 01/06/2021,2021-06-01T00:00:00Z,28,Flood
India,2021,India: Flood [monsoon] - Himachal Pradesh - 01/06/2021,2021-06-01T00:00:00Z,80,Flood
India,2021,India: Flood [monsoon] - Chhattisgarh - 01/06/2021,2021-06-01T00:00:00Z,250,Flood
India,2021,India: Flood [monsoon] - Chhattisgarh - 01/06/2021,2021-06-01T00:00:00Z,230,Flood
India,2021,India: Flood - Tamil Nadu - 07/11/2021,2021-11-07T00:00:00Z,80000,Flood
India,2021,India: Flood - Tamil Nadu - 07/11/2021,2021-11-07T00:00:00Z,114000,Flood
India,2021,India: Flood - Tamil Nadu - 26/11/2021,2021-11-26T00:00:00Z,40000,Flood
India,2021,India: Flood - Puducherry - 10/11/2021,2021-11-10T00:00:00Z,480,Flood
India,2021,India: Flood [monsoon] - West Bengal - 01/06/2021,2021-06-01T00:00:00Z,500000,Flood
India,2021,India: Flood [monsoon] - West Bengal - 01/06/2021,2021-06-01T00:00:00Z,250000,Flood
Ireland,2015,Storm Desmond and Frank,2015-12-04T00:00:00Z,1600,Storm
Ireland,2017,United Kingdom and Ireland: Flash floods (22/08/2017),2017-08-22T00:00:00Z,5,Flood
Ireland,2017,"United Kingdom and Ireland: Flash flooding- North-west England, Wales and Ireland- 22.11.2017",2017-11-22T00:00:00Z,57,Flood
Ireland,2020,Ireland: Floods - County Galway (Connemara) - 02/09/2020,2020-09-02T00:00:00Z,46,Flood
Ireland,2020,Ireland: Floods - Springfield - 23/02/2020,2020-02-23T00:00:00Z,5,Flood
Ireland,2021,"Ireland: Flooding - Leinster (County Wexford - Bridgetown, Killurin) - 25/12/2021",2021-12-25T00:00:00Z,25,Flood
Iran,2010,2010-000176,2010-01-01T00:00:00Z,3500,Earthquake
Iran,2012,,2012-01-01T00:00:00Z,50000,Earthquake
Iran,2013,Bushehr April Earthquake,2013-04-09T00:00:00Z,1000,Earthquake
Iran,2013,Bushehr September Earthquake,2013-11-28T00:00:00Z,1500,Earthquake
Iran,2013,,2013-08-01T00:00:00Z,2200,Flood
Iran,2014,Mormori earthquake,2014-08-18T00:00:00Z,12000,Earthquake
Iran,2015,Floods in the South and South-east,2015-03-10T00:00:00Z,3200,Flood
Iran,2015,Flash floods in northern Iran,2015-07-19T00:00:00Z,800,Flood
Iran,2015,"Flash floods in  Ilam, Lorestan and Kerman",2015-10-29T00:00:00Z,1400,Flood
Iran,2016,Floods in seven provinces,2016-07-25T00:00:00Z,21,Flood
Iran,2016,Flash floods in Western and South-western provinces ,2016-04-13T00:00:00Z,57,Flood
Iran,2017,Iran: Earthquake - North Khorasan - 13/05/2017,2017-05-13T00:00:00Z,8000,Earthquake
Iran,2017,"Iran: Flood - Sistan, Balouchestan - 13/07/2017",2017-07-13T00:00:00Z,92,Flood
Iran,2017,Iran: Earthquake - Kerman - 12/12/2017,2017-12-12T00:00:00Z,1000,Earthquake
Iran,2017,Iran: Storms - 29 provinces - 31/01/2017,2017-01-31T00:00:00Z,10000,Storm
Iran,2017,Iran: Earthquake - Kerman - 01/12/2017,2017-12-01T00:00:00Z,1000,Earthquake
Iran,2017,Iran: Flood - Fars - 18/02/2017,2017-02-17T00:00:00Z,2400,Flood
Iran,2017,Iran: Flood - Sistan-and-Baluchestan - 27/01/2017,2017-01-27T00:00:00Z,8100,Flood
Iran,2017,Iraq; Iran: Earthquake - 12/11/2017,2017-11-12T00:00:00Z,170000,Earthquake
Iran,2017,Iran: Flood - 6 provinces - 15/04/2017,2017-04-15T00:00:00Z,290,Flood
Iran,2017,Iran: Earthquake - Khorasan-Razavi -05/04/2017,2017-04-05T00:00:00Z,360,Earthquake
Iran,2017,Iran: Earthquake - Fars - 06/07/2017,2017-01-06T00:00:00Z,910,Earthquake
Iran,2017,Iran: Earthquake - Teheran - 20/12/2017,2017-12-20T00:00:00Z,2000,Earthquake
Iran,2017,Iran: Earthquake - Kerman - 21/12/2017,2017-12-21T00:00:00Z,20000,Earthquake
Iran,2017,Iran: Flood - 5 provinces - 10/08/2017,2017-08-10T00:00:00Z,130,Flood
Iran,2018,Iran: snow storm - 8 provinces - 23/02/2018,2018-02-23T00:00:00Z,30,Storm
Iran,2018,"Iran: Flood - Sistan, Baluchestan - 25/02/2018",2018-02-25T00:00:00Z,580,Flood
Iran,2018,Iran: earthquake - Kohgiluyeh; Boyerahmad - 02/05/2018,2018-05-02T00:00:00Z,92,Earthquake
Iran,2018,Iran: storms - 12 provinces - 05/01/2018,2018-01-05T00:00:00Z,74,Storm
Iran,2018,Iran: flash flood - 12 provinces - 19/09/2018,2018-09-19T00:00:00Z,92,Flood
